comment_id,author,date,old_text,expected_label,cid,text,model_pred,vectors
LZQPQhLyRh80UYxNuaDWhIGQYNQ96IuCg-AYWqNPjpU,Julius NM,2013-11-07T06:20:48,"Huh, anyway check out this you[tube] channel: kobyoshi02",1,1,huh  anyway check out this you tube  channel  kobyoshi  ,1,"1,1,1,1,0,1,1,1,1,-1,-1,1,1,-1,-1,1,-1,-1,-1,-1,0,-1,-1,-1,-1,-1,-1,-1,-1,-1,-1,-1,-1,-1,-1,-1,-1,-1,-1,-1"
LZQPQhLyRh_C2cTtd9MvFRJedxydaVW-2sNg5Diuo4A,adam riyati,2013-11-07T12:37:15,"Hey guys check out my new channel and our first vid THIS IS US THE  MONKEYS!!! I'm the monkey in the white shirt,please leave a like comment  and please subscribe!!!!",1,2,hey guys check out my new channel and our first vid this is us the  monkeys    i m the monkey in the white shirt please leave a like comment  and please subscribe    ,1,"-1,-1,1,1,0,-1,-1,1,-1,1,1,1,1,1,1,1,1,1,1,1,0,0,1,1,1,1,1,1,1,1,1,1,1,1,1,1,1,1,1,1"
LZQPQhLyRh9MSZYnf8djyk0gEF9BHDPYrrK-qCczIY8,Evgeny Murashkin,2013-11-08T17:34:21,just for test I have to say murdev.com,1,3,just for test i have to say murdev com,0,"-1,-1,-1,-1,-1,-1,-1,-1,-1,-1,-1,-1,-1,-1,-1,-1,-1,-1,-1,-1,-1,-1,-1,-1,-1,1,-1,-1,-1,-1,-1,-1,-1,-1,-1,-1,-1,-1,-1,-1"
z13jhp0bxqncu512g22wvzkasxmvvzjaz04,ElNino Melendez,2013-11-09T08:28:43,me shaking my sexy ass on my channel enjoy ^_^ ﻿,1,4,me shaking my sexy ass on my channel enjoy     ,1,"-1,-1,-1,-1,-1,-1,-1,1,-1,-1,-1,-1,-1,1,-1,1,-1,-1,-1,-1,-1,-1,-1,-1,-1,-1,-1,-1,-1,-1,-1,-1,-1,-1,-1,-1,-1,-1,-1,-1"
z13fwbwp1oujthgqj04chlngpvzmtt3r3dw,GsMega,2013-11-10T16:05:38,watch?v=vtaRGgvGtWQ   Check this out .﻿,1,5,watch v vtarggvgtwq   check this out  ,1,"-1,-1,1,1,0,-1,-1,-1,-1,-1,-1,1,1,-1,-1,-1,-1,-1,-1,-1,0,-1,-1,-1,-1,-1,-1,-1,-1,-1,-1,-1,-1,-1,-1,-1,-1,-1,-1,-1"
LZQPQhLyRh9-wNRtlZDM90f1k0BrdVdJyN_YsaSwfxc,Jason Haddad,2013-11-26T02:55:11,"Hey, check out my new website!! This site is about kids stuff. kidsmediausa  . com",1,6,hey  check out my new website   this site is about kids stuff  kidsmediausa    com,1,"-1,-1,1,1,0,-1,-1,-1,-1,1,-1,1,1,0,1,-1,-1,-1,-1,-1,0,0,-1,-1,-1,-1,-1,-1,-1,-1,-1,-1,-1,-1,-1,-1,-1,-1,-1,-1"
z13lfzdo5vmdi1cm123te5uz2mqig1brz04,ferleck ferles,2013-11-27T21:39:24,Subscribe to my channel ﻿,1,7,subscribe to my channel ,1,"-1,-1,-1,-1,-1,-1,-1,1,-1,-1,-1,-1,-1,1,-1,1,-1,-1,-1,-1,-1,-1,-1,-1,-1,-1,-1,-1,-1,-1,-1,-1,-1,-1,-1,-1,-1,-1,-1,-1"
z122wfnzgt30fhubn04cdn3xfx2mxzngsl40k,Bob Kanowski,2013-11-28T12:33:27,i turned it on mute as soon is i came on i just wanted to check the  views...﻿,0,8,i turned it on mute as soon is i came on i just wanted to check the  views   ,1,"-1,-1,1,-1,-1,-1,-1,-1,-1,-1,-1,1,-1,-1,-1,-1,-1,-1,-1,-1,-1,0,-1,1,-1,1,-1,1,-1,-1,1,-1,-1,-1,-1,-1,-1,-1,-1,-1"
z13ttt1jcraqexk2o234ghbgzxymz1zzi04,Cony,2013-11-28T16:01:47,You should check my channel for Funny VIDEOS!!﻿,1,9,you should check my channel for funny videos  ,1,"-1,-1,1,-1,-1,1,-1,1,-1,-1,-1,1,-1,1,-1,1,-1,-1,-1,-1,-1,-1,-1,-1,-1,-1,-1,-1,-1,-1,-1,-1,-1,-1,-1,-1,-1,-1,-1,-1"
z12avveb4xqiirsix04chxviiljryduwxg0,BeBe Burkey,2013-11-28T16:30:13,and u should.d check my channel and tell me what I should do next!﻿,1,10,and u should d check my channel and tell me what i should do next ,1,"-1,-1,1,-1,-1,-1,-1,1,-1,-1,-1,1,-1,1,-1,1,1,-1,-1,-1,-1,-1,-1,-1,-1,1,-1,-1,-1,-1,-1,-1,-1,-1,-1,-1,-1,-1,1,-1"
z13auhww3oufjn1qo04ci3grqqjmfjexxuo0k,Huckyduck,2013-11-28T17:06:17,Hey subscribe to me﻿,1,11,hey subscribe to me,1,"-1,-1,-1,-1,-1,-1,-1,-1,-1,1,-1,-1,-1,-1,-1,-1,-1,-1,-1,-1,-1,-1,-1,-1,-1,-1,-1,-1,-1,-1,-1,-1,-1,-1,-1,-1,-1,-1,-1,-1"
z13xit5agm2zyh4f523rst2gowmbx5bml,Lone Twistt,2013-11-28T17:34:55, Once you have started reading do not stop. If you do not subscribe to me  within one day you and you're entire family will die so if you want to stay  alive subscribe right now.﻿,1,12, once you have started reading do not stop  if you do not subscribe to me  within one day you and you re entire family will die so if you want to stay  alive subscribe right now ,0,"-1,-1,-1,-1,-1,1,-1,-1,-1,-1,-1,-1,-1,-1,-1,-1,1,-1,-1,-1,-1,-1,-1,-1,-1,-1,-1,-1,-1,-1,-1,-1,-1,-1,-1,-1,-1,-1,1,-1"
z121zxaxsq25z5k5o04ch1o5jqqfij3gtm40k,TheUploadaddict,2013-11-28T18:12:12,subscribe like comment﻿,1,14,subscribe like comment,0,"-1,-1,-1,-1,-1,-1,-1,-1,-1,-1,-1,-1,-1,-1,-1,-1,-1,-1,-1,-1,-1,-1,-1,-1,-1,-1,-1,-1,-1,-1,-1,-1,-1,-1,-1,-1,1,1,-1,-1"
z12oglnpoq3gjh4om04cfdlbgp2uepyytpw0k,Francisco Nora,2013-11-28T19:52:35,please like :D https://premium.easypromosapp.com/voteme/19924/616375350﻿,1,15,please like  d https   premium easypromosapp com voteme                ,0,"-1,-1,-1,-1,-1,-1,-1,-1,-1,-1,-1,-1,-1,-1,-1,-1,-1,-1,-1,-1,-1,-1,-1,-1,-1,-1,-1,-1,-1,-1,-1,-1,-1,1,-1,-1,1,-1,-1,1"
z13phrmwrkfisn5er22eyrbpbvaiwfvwf04,Gaming and Stuff PRO,2013-11-28T21:14:13,"Hello! Do you like gaming, art videos, scientific experiments, tutorials,  lyrics videos, and much, much more of that? If you do please check out our  channel and subscribe to it, we've just started, but soon we hope we will  be able to cover all of our expectations... You can also check out what  we've got so far!﻿",1,16,hello  do you like gaming  art videos  scientific experiments  tutorials   lyrics videos  and much  much more of that  if you do please check out our  channel and subscribe to it  we ve just started  but soon we hope we will  be able to cover all of our expectations    you can also check out what  we ve got so far ,1,"-1,-1,1,1,-1,1,-1,1,-1,-1,-1,1,1,-1,-1,1,1,1,-1,-1,-1,-1,-1,-1,-1,-1,-1,-1,-1,-1,-1,-1,-1,1,-1,-1,1,-1,1,1"
z13bgdvyluihfv11i22rgxwhuvabzz1os04,Zielimeek21,2013-11-28T21:49:00,I'm only checking the views﻿,0,17,i m only checking the views,0,"-1,-1,-1,-1,-1,-1,-1,-1,-1,-1,-1,-1,-1,-1,-1,-1,-1,-1,-1,-1,-1,-1,-1,1,-1,1,1,1,-1,-1,1,-1,-1,-1,-1,-1,-1,-1,-1,-1"
z13vxpnoxsyeuv2jr04cctprprb1slnxdf4,OutrightIgnite,2013-11-28T21:55:02,http://www.ebay.com/itm/171183229277?ssPageName=STRK:MESELX:IT&amp;_trksid=p3984.m1555.l2649 ﻿,1,18,http   www ebay com itm              sspagename strk meselx it amp  trksid p     m     l     ,0,"-1,-1,-1,-1,-1,-1,-1,-1,-1,-1,-1,-1,-1,-1,-1,-1,-1,-1,-1,-1,-1,-1,-1,-1,-1,-1,1,-1,-1,-1,-1,-1,-1,-1,-1,-1,-1,-1,-1,-1"
z13etj0bclzfztuwc04cgfvrgmf3fvjor1g,Jose Renteria,2013-11-29T00:22:01,"We are an EDM apparel company dedicated to bringing you music inspired  designs. Our clothing is perfect for any rave or music festival. We have  NEON crop tops, tank tops, t-shirts, v-necks and accessories! follow us on  Facebook or on instagraml for free giveaways news and more!! visit our site  at OnCueApparel﻿",1,20,we are an edm apparel company dedicated to bringing you music inspired  designs  our clothing is perfect for any rave or music festival  we have  neon crop tops  tank tops  t shirts  v necks and accessories  follow us on  facebook or on instagraml for free giveaways news and more   visit our site  at oncueapparel,0,"-1,-1,-1,-1,-1,1,-1,-1,-1,-1,-1,-1,-1,-1,-1,-1,1,1,-1,-1,-1,0,1,-1,-1,-1,-1,-1,-1,-1,-1,-1,-1,-1,-1,-1,-1,-1,1,-1"
z12axnji5w2axxht522thb3bktvqjdlbp04,zhichao wang,2013-11-29T02:13:56,i think about 100 millions of the views come from people who only wanted to  check the views﻿,0,21,i think about     millions of the views come from people who only wanted to  check the views,1,"-1,-1,1,-1,-1,-1,-1,-1,-1,-1,-1,1,-1,-1,-1,-1,-1,-1,-1,-1,-1,-1,-1,1,-1,1,-1,1,-1,-1,1,-1,-1,-1,-1,-1,-1,-1,-1,-1"
z13ozdmr4lf3uzc5z04cix2zkyjzgvcyemw0k,Carlos Thegamer,2013-12-01T01:20:21,subscribe to my channel people :D﻿,1,22,subscribe to my channel people  d,1,"-1,-1,-1,-1,-1,-1,-1,1,-1,-1,-1,-1,-1,1,-1,1,-1,-1,-1,-1,-1,-1,-1,-1,-1,-1,-1,-1,-1,-1,-1,-1,-1,-1,-1,-1,-1,-1,-1,-1"
z12ntlcqht2bvjewi04cf1up0xjvs5lq3mc0k,Owen Lai,2013-12-01T04:51:52,just checking the views﻿,0,24,just checking the views,0,"-1,-1,-1,-1,-1,-1,-1,-1,-1,-1,-1,-1,-1,-1,-1,-1,-1,-1,-1,-1,-1,-1,-1,1,-1,-1,-1,1,-1,-1,1,-1,-1,-1,-1,-1,-1,-1,-1,-1"
LZQPQhLyRh9EXArr4ZnVcDonSbvSMHKYOT24e_qR6fE,||GuitarZ||,2013-12-23T12:54:38,CHECK OUT MY CHANNEL,1,25,check out my channel,1,"-1,-1,1,1,-1,-1,-1,1,-1,-1,-1,1,1,1,-1,1,-1,-1,-1,-1,-1,-1,-1,-1,-1,-1,-1,-1,-1,-1,-1,-1,-1,-1,-1,-1,-1,-1,-1,-1"
LZQPQhLyRh9vw01Xvvw5yWzZEUOPG1hSgRMHep55-Yw,8-BitMusic,2013-12-27T23:07:50,Hey guys! Im a 12 yr old music producer. I make chiptunes and 8bit music.  It would be wonderful if you checked out some of my 8bit remixes! I even  have a gangnamstyle 8bit remix if you would like to check that out ;)  Thanks!!,1,27,hey guys  im a    yr old music producer  i make chiptunes and  bit music   it would be wonderful if you checked out some of my  bit remixes  i even  have a gangnamstyle  bit remix if you would like to check that out     thanks  ,1,"-1,-1,1,1,-1,1,-1,-1,-1,1,1,1,1,0,-1,-1,1,-1,-1,-1,-1,-1,-1,-1,-1,1,-1,-1,-1,-1,-1,-1,-1,-1,-1,1,1,-1,1,-1"
z13kszcinpnvc34v2234fnpxkpmlw3nhc04,Kyle Jaber,2014-01-19T00:21:29,Check me out! I'm kyle. I rap so yeah ﻿,1,28,check me out  i m kyle  i rap so yeah ,1,"-1,-1,1,1,-1,-1,-1,-1,-1,-1,-1,1,1,-1,-1,-1,-1,-1,-1,-1,-1,-1,-1,-1,-1,1,1,-1,-1,-1,-1,-1,-1,-1,-1,-1,-1,-1,-1,-1"
z13tj514otzlurfbc04ccjwhrnmej1iihqw0k,Brandon Pryor,2014-01-19T00:36:25,I dont even watch it anymore i just come here to check on 2 Billion or not﻿,0,29,i dont even watch it anymore i just come here to check on   billion or not,1,"-1,-1,1,-1,-1,-1,-1,-1,-1,-1,-1,1,-1,-1,-1,-1,-1,-1,-1,-1,-1,-1,-1,-1,-1,1,-1,-1,-1,-1,-1,-1,-1,-1,-1,-1,-1,-1,-1,-1"
z120y3ribybzdf3fj23sf1rpgq3cex0sh,Young Hittaz,2014-01-19T04:21:11,everyone please come check our newest song in memories of Martin Luther  King Jr.﻿,1,31,everyone please come check our newest song in memories of martin luther  king jr ,1,"-1,-1,1,-1,-1,-1,-1,-1,-1,-1,-1,1,-1,-1,-1,-1,-1,1,-1,-1,-1,-1,-1,-1,-1,-1,-1,-1,-1,1,-1,-1,-1,1,-1,-1,-1,-1,-1,1"
z13autsqgzblcx3w104chr4r2kexd10rxc0,DropShotSk8r,2014-01-19T04:27:18,"Came here to check the views, goodbye.﻿",0,32,came here to check the views  goodbye ,1,"-1,-1,1,-1,-1,-1,-1,-1,-1,-1,-1,1,-1,-1,-1,-1,-1,-1,-1,-1,-1,-1,-1,1,-1,-1,-1,1,-1,-1,1,-1,-1,-1,-1,-1,-1,-1,-1,-1"
z12wvpxppxz3ifk3j224cbsgqraherzrg04,ElepticRage,2014-01-19T08:55:53,sub my channel for no reason -_-﻿,1,33,sub my channel for no reason    ,1,"-1,-1,-1,-1,-1,-1,-1,1,-1,-1,-1,-1,-1,1,-1,1,-1,-1,-1,-1,-1,-1,-1,-1,-1,-1,-1,-1,-1,-1,-1,-1,-1,-1,-1,-1,-1,-1,-1,-1"
z121e3zq5kj3ip2ch22ks3vwekuaibrgc04,Joengz,2014-01-19T10:31:10,"Check out my dubstep song ""Fireball"", made with Fruity Loops. I really took  time in it.  /watch?v=telOA6RIO8o﻿",1,34,check out my dubstep song  fireball   made with fruity loops  i really took  time in it    watch v teloa rio o,1,"-1,-1,1,1,-1,-1,-1,-1,-1,-1,-1,1,1,0,-1,-1,-1,-1,-1,-1,-1,-1,-1,-1,-1,0,-1,-1,-1,0,-1,-1,-1,-1,-1,-1,-1,-1,-1,-1"
z13iuzxwamqhzppyp04cdz1amyzpfdnpdns0k,Jason Provencal,2014-01-19T16:15:54,Why dafuq is a Korean song so big in the USA. Does that mean we support  Koreans? Last time I checked they wanted to bomb us. ﻿,0,36,why dafuq is a korean song so big in the usa  does that mean we support  koreans  last time i checked they wanted to bomb us  ,0,"-1,-1,-1,-1,-1,-1,-1,-1,-1,-1,-1,-1,-1,-1,-1,-1,-1,-1,-1,-1,-1,0,1,1,-1,0,-1,1,-1,0,1,-1,-1,-1,-1,1,-1,-1,-1,-1"
z12txle43yfhvt0f323eghbxivmuytieq,Kiddy Kidso,2014-01-19T16:49:52,Check my channel please! And listen to the best music ever :P﻿,1,37,check my channel please  and listen to the best music ever  p,1,"-1,-1,1,-1,-1,-1,-1,1,-1,-1,-1,1,-1,1,-1,1,1,-1,-1,-1,-1,-1,-1,1,-1,-1,-1,1,-1,-1,1,-1,-1,1,-1,-1,-1,-1,1,1"
z13zj1grjzqhhxzlj23gdpzaovunwnn0f,HamzaMurt | Advanced Warefare | Lets Play!,2014-01-19T17:20:58,SUB 4 SUB PLEASE LIKE THIS COMMENT I WANT A SUCCESFULL YOUTUBE SO PPLEASE LIKE THIS  COMMENT AND SUBSCRIBE IT ONLY TAKES 10 SECONDS PLEASE IF YOU SUBSCRIBE ILL  SUBSCRIBE BACK THANKS﻿,1,38,sub   sub please like this comment i want a succesfull youtube so pplease like this  comment and subscribe it only takes    seconds please if you subscribe ill  subscribe back thanks,0,"-1,-1,-1,-1,0,1,-1,-1,-1,-1,-1,-1,-1,-1,-1,-1,1,-1,-1,-1,0,-1,-1,-1,-1,1,-1,-1,-1,-1,-1,-1,-1,1,-1,1,1,1,1,1"
z13csdop4venytrru04cf11q1wmbdvkrfpo0k,ii Trollercopter,2014-01-19T17:25:23," Hey everyone!! I have just started my first YT channel i would be grateful  if some of you peoples could check out my first clip in BF4! and give me  some advice on how my video was and how i could improve it. ALSO be sure to  go check out the about to see what Im all about. Thanks for your time :) .  and to haters... You Hate, I WIN﻿",1,39, hey everyone   i have just started my first yt channel i would be grateful  if some of you peoples could check out my first clip in bf   and give me  some advice on how my video was and how i could improve it  also be sure to  go check out the about to see what im all about  thanks for your time       and to haters    you hate  i win,1,"-1,-1,1,1,-1,1,-1,1,-1,1,-1,1,1,1,-1,1,1,-1,1,-1,-1,-1,-1,1,-1,1,-1,1,-1,0,1,-1,-1,-1,-1,-1,-1,-1,1,-1"
z13ce52jzwfitrkup23din4ojputijen3,Eugene Kalinin,2014-01-19T19:21:04,"The projects After Effects, Music, Foto, Web sites and another you can find  and buy here  http://audiojungle.net/user/EugeneKalinin/portfolio?ref=EugeneKalinin﻿",1,40,the projects after effects  music  foto  web sites and another you can find  and buy here  http   audiojungle net user eugenekalinin portfolio ref eugenekalinin,0,"-1,-1,-1,-1,-1,1,-1,-1,-1,-1,-1,-1,-1,-1,-1,-1,1,-1,-1,-1,-1,-1,-1,1,-1,-1,-1,1,-1,-1,1,-1,-1,-1,-1,-1,-1,-1,1,-1"
z13phfyxhovav1hl122bf5iidumufzbel,Cody Tolleson,2014-01-20T02:50:44,YouTube/codytolleson for awesome videos I'll subscribe back ﻿,1,41,youtube codytolleson for awesome videos i ll subscribe back ,0,"-1,-1,-1,-1,-1,-1,-1,-1,-1,-1,-1,-1,-1,-1,-1,-1,-1,-1,-1,-1,-1,-1,-1,-1,-1,1,-1,-1,-1,-1,-1,-1,-1,-1,-1,-1,-1,-1,-1,-1"
z13xytyybsypw34yv04cc33xkke1grugh2w,cake cat,2014-01-20T04:45:34,if you like roblox minecraft world of warcraft gta5 mario suscribe to my  channel﻿,1,42,if you like roblox minecraft world of warcraft gta  mario suscribe to my  channel,1,"-1,-1,-1,-1,-1,1,-1,1,-1,-1,-1,-1,-1,1,-1,1,-1,-1,-1,-1,-1,-1,-1,-1,-1,-1,-1,-1,-1,-1,-1,-1,-1,-1,-1,-1,1,-1,-1,-1"
z13vsbcjwrybe3hsf23sgvnxfr3zxnion04,World327RS,2014-01-20T06:16:28,SUBSCRIBE TO ME AND I'LL SUBSCRIBE TO YOU! (Must like - cZFcxsn0jnQ) ﻿,1,43,subscribe to me and i ll subscribe to you   must like   czfcxsn jnq  ,0,"-1,-1,-1,-1,-1,1,-1,-1,-1,-1,-1,-1,-1,-1,-1,-1,1,-1,-1,-1,-1,-1,-1,-1,-1,1,-1,-1,-1,-1,-1,-1,-1,-1,-1,-1,1,-1,1,-1"
z12jvnua2tifirkvk23cfjtpxwmgxfch004,Didier Drogba,2014-01-20T06:57:25,http://www.twitch.tv/jaroadc come follow and watch my stream!﻿,1,44,http   www twitch tv jaroadc come follow and watch my stream ,0,"-1,-1,-1,-1,-1,-1,-1,-1,-1,-1,-1,-1,-1,0,-1,-1,1,-1,-1,-1,-1,-1,-1,-1,-1,-1,-1,-1,-1,-1,-1,-1,-1,-1,-1,-1,-1,-1,1,-1"
z13stv3brxe1snv2i225fnvganneudej004,MFkin PRXPHETZ,2014-01-20T09:08:39,"if you like raw talent, raw lyrics, straight real hip hop Everyone check my newest sound  Dizzy X - Got the Juice (Prod by. Drugs the Model Citizen)   COMMENT TELL ME WHAT YOU THINK  DONT BE LAZY!!!!  - 1/7 Prophetz﻿",1,45,if you like raw talent  raw lyrics  straight real hip hop everyone check my newest sound  dizzy x   got the juice  prod by  drugs the model citizen    comment tell me what you think  dont be lazy            prophetz,1,"-1,-1,1,-1,-1,1,-1,-1,-1,-1,-1,1,-1,0,-1,-1,-1,-1,-1,-1,-1,-1,-1,1,-1,-1,-1,1,-1,-1,1,-1,-1,-1,-1,-1,1,1,-1,-1"
z12ktfsarrv0wdj3p22ifbxz3zn2fthhw04,Dave X,2014-01-20T10:12:07,....subscribe......  ......to my........  .....channel.......﻿,1,46,    subscribe              to my               channel       ,1,"-1,-1,-1,-1,-1,-1,-1,1,-1,-1,-1,-1,-1,1,-1,1,-1,-1,-1,-1,-1,-1,-1,-1,-1,-1,-1,-1,-1,-1,-1,-1,-1,-1,-1,-1,-1,-1,-1,-1"
z121znjjloycwtjf2233dfo5esfggn3lj,crestpee,2014-01-20T13:03:12,"now its 1,884,034,783 views! pls. comment the view count the next hour :P﻿",0,47,now its               views  pls  comment the view count the next hour  p,0,"-1,-1,-1,-1,-1,-1,-1,-1,-1,-1,-1,-1,-1,-1,-1,-1,-1,-1,-1,-1,-1,-1,-1,1,-1,-1,-1,1,-1,-1,1,-1,-1,-1,-1,-1,-1,1,-1,-1"
z12stpyqaonsercxw04cjbr4dlnrxd34soo0k,Phuc Ly,2014-01-20T15:27:47,go here to check the views :3﻿,0,49,go here to check the views   ,1,"-1,-1,1,-1,-1,-1,-1,-1,-1,-1,-1,1,-1,-1,-1,-1,-1,-1,-1,-1,-1,-1,-1,1,-1,-1,-1,1,-1,-1,1,-1,-1,-1,-1,-1,-1,-1,-1,-1"
z13nvr2xayrwffsio04cj3zwyuf3vb1imdg,Milan George,2014-01-20T16:15:09,thumbs up if u checked this video to see hw views it got﻿,0,50,thumbs up if u checked this video to see hw views it got,0,"-1,-1,-1,-1,1,-1,-1,-1,-1,-1,-1,-1,-1,-1,-1,-1,-1,-1,-1,-1,1,-1,-1,-1,-1,-1,-1,-1,-1,-1,-1,-1,-1,-1,-1,-1,-1,-1,-1,-1"
z13uzhdomzvbffvwa04cgplq2zewfz2hm2k,Kirsty Brown,2014-01-20T16:41:27,Plz subscribe to my channel and I will subscribe back xx﻿,1,51,plz subscribe to my channel and i will subscribe back xx,1,"-1,-1,-1,-1,-1,-1,-1,1,-1,-1,-1,-1,-1,1,-1,1,1,-1,-1,-1,-1,-1,-1,-1,-1,1,-1,-1,-1,-1,-1,-1,-1,-1,-1,-1,-1,-1,1,-1"
z13ucxa51rnftvu2j22if5oihq2qipjlp,Kochos,2014-01-20T17:08:37,i check back often to help reach 2x10^9 views and I avoid watching Baby﻿,0,52,i check back often to help reach  x     views and i avoid watching baby,1,"-1,-1,1,-1,-1,-1,-1,-1,-1,-1,-1,1,-1,-1,-1,-1,1,-1,-1,-1,-1,-1,-1,-1,-1,0,-1,-1,-1,-1,-1,-1,-1,-1,-1,-1,-1,-1,1,-1"
z120grixiomvyvbga04cfl24csz5jf4zzuc0k,eSkiip,2014-01-20T17:22:53,This video will get to 2 billion just because of people checking if it has  hit 2 billion yet.﻿,0,53,this video will get to   billion just because of people checking if it has  hit   billion yet ,1,"-1,-1,-1,-1,0,-1,-1,-1,-1,-1,-1,-1,-1,-1,-1,-1,-1,-1,-1,-1,0,-1,-1,-1,-1,-1,-1,-1,-1,-1,-1,-1,-1,-1,-1,-1,-1,-1,-1,-1"
z13gevgohyzktbztz22mcrcpntfxvpvan04,Wumrogue lite,2014-01-20T17:29:52,https://www.facebook.com/pages/Brew-Crew-2014/134470083389909 Like this  facebook-page! Chance to win an Iphone 5S!﻿,1,54,https   www facebook com pages brew crew                      like this  facebook page  chance to win an iphone  s ,0,"-1,-1,-1,-1,1,-1,-1,-1,-1,-1,-1,-1,-1,-1,-1,-1,-1,-1,-1,-1,1,-1,-1,-1,-1,-1,-1,-1,-1,-1,-1,-1,-1,-1,-1,-1,1,-1,-1,-1"
z12gy5tb2kase1nix04cipry3mf1wh5grko0k,Ruddy Tapia,2014-01-20T17:58:46,get GWAR to play 2015 superbowl  http://www.change.org/petitions/the-national-football-league-allow-gwar-to-perform-the-2015-super-bowl-halftime-show#share ﻿,1,55,get gwar to play      superbowl  http   www change org petitions the national football league allow gwar to perform the      super bowl halftime show share ,0,"-1,-1,-1,-1,-1,-1,-1,-1,-1,-1,-1,-1,-1,-1,-1,-1,-1,-1,-1,-1,-1,-1,-1,1,-1,-1,-1,1,-1,-1,1,-1,-1,-1,-1,-1,-1,-1,-1,-1"
z13hxl3yoqmlvdlnu23atlqgsoyevlsse,Artsi,2014-01-20T18:52:12,Pls follow this channel!! http://www.twitch.tv/sevadus﻿,1,56,pls follow this channel   http   www twitch tv sevadus,1,"-1,-1,-1,-1,1,-1,-1,1,-1,-1,-1,-1,-1,-1,-1,1,-1,-1,-1,-1,1,-1,-1,-1,-1,-1,-1,-1,-1,-1,-1,-1,-1,-1,-1,-1,-1,-1,-1,-1"
z12gv5qoconqsbe0h221wljgmwe4v1nmu,ProsGamerOnly,2014-01-20T20:00:55,hi guys check my youtube channel﻿,1,57,hi guys check my youtube channel,1,"-1,-1,1,-1,-1,-1,-1,1,-1,-1,1,1,-1,1,-1,1,-1,-1,-1,-1,-1,-1,-1,-1,-1,-1,-1,-1,-1,-1,-1,-1,-1,-1,-1,-1,-1,-1,-1,-1"
z13eepr4dyjet34pt04cgr1rctvwsvqwqso0k,JP Jochem,2014-01-20T20:23:35,Subscribe and like to me for more how to videos on minecraft!﻿,1,58,subscribe and like to me for more how to videos on minecraft ,0,"-1,-1,-1,-1,-1,-1,-1,-1,-1,-1,-1,-1,-1,-1,-1,-1,1,-1,-1,-1,-1,-1,-1,-1,-1,-1,-1,-1,-1,-1,-1,-1,-1,-1,-1,-1,1,-1,1,-1"
z121st5w5k3ui1veg22zirn4gkr5tby2v,Jdidk Loma,2014-01-20T20:35:56,http://tankionline.com#friend=cd92db3f4 great game check it out!﻿,1,59,http   tankionline com friend cd  db f  great game check it out ,1,"-1,-1,1,1,-1,-1,-1,-1,-1,-1,-1,1,1,-1,-1,-1,-1,-1,-1,-1,-1,-1,-1,-1,-1,-1,-1,-1,-1,-1,-1,-1,-1,-1,-1,-1,-1,-1,-1,-1"
z12rgllzmwnfuba4h04ch3njgy2fg3ryerg0k,Eanna Cusack,2014-01-20T22:20:59,Im just to check how much views it has﻿,0,61,im just to check how much views it has,1,"-1,-1,1,-1,-1,-1,-1,-1,-1,-1,-1,1,-1,-1,-1,-1,-1,-1,-1,-1,-1,-1,-1,-1,-1,-1,-1,-1,-1,-1,-1,-1,-1,-1,-1,-1,-1,-1,-1,-1"
z12rc1ebfvrmufz5w04ccl2pmt3ih5dymq40k,fastestghost,2014-01-21T02:09:22,The first comment is chuck norrus ovbiously :D﻿,0,62,the first comment is chuck norrus ovbiously  d,0,"-1,-1,-1,-1,-1,-1,-1,-1,-1,-1,-1,-1,-1,-1,-1,-1,-1,-1,1,-1,-1,0,-1,1,-1,-1,-1,1,-1,-1,1,-1,-1,-1,-1,-1,-1,1,-1,-1"
z13mcpkzpoz1hj3o304cfd3oouf2tj1rnk40k,StuntmanGaming,2014-01-21T02:29:43,Behold the most viewed youtube video in the history of ever﻿,0,63,behold the most viewed youtube video in the history of ever,0,"-1,-1,-1,-1,-1,-1,-1,-1,-1,-1,-1,-1,-1,-1,-1,-1,-1,-1,-1,-1,-1,-1,-1,1,-1,-1,-1,1,-1,0,1,-1,-1,-1,-1,-1,-1,-1,-1,-1"
z121cnnzhsybzjkt122nsviacsekvvt1r,Master Chief,2014-01-21T03:16:46,when is this gonna hit 2 billion?﻿,0,64,when is this gonna hit   billion ,1,"-1,-1,-1,-1,0,-1,-1,-1,-1,-1,-1,-1,-1,-1,-1,-1,-1,-1,-1,-1,0,0,-1,-1,-1,-1,-1,-1,-1,-1,-1,-1,-1,-1,-1,-1,-1,-1,-1,-1"
z125gx4g5wemgtyvr23ryvlrbxjvwl2mi,David Bell,2014-01-21T03:18:31,the most viewed youtube video of all time?﻿,0,65,the most viewed youtube video of all time ,0,"-1,-1,-1,-1,-1,-1,-1,-1,-1,-1,-1,-1,-1,-1,-1,-1,-1,-1,-1,-1,-1,-1,-1,1,-1,-1,-1,1,-1,-1,1,-1,-1,-1,-1,-1,-1,-1,-1,-1"
z12lzbu4iymmvjgj004cdjaonunljbjwwo00k,virgie natividad,2014-01-21T07:33:30,"969,210 dislikes like dislike themselves﻿",0,66,        dislikes like dislike themselves,0,"-1,-1,-1,-1,-1,-1,-1,-1,-1,-1,-1,-1,-1,-1,-1,-1,-1,-1,-1,-1,-1,-1,-1,-1,-1,-1,-1,-1,-1,-1,-1,-1,-1,-1,-1,-1,1,-1,-1,-1"
z13zz3cjwmztcni0p23ug3vb0pasfvzqc04,Dymetex,2014-01-21T09:03:36,"OMG this oldspice spraytan party commercial omg....i'm sitting here ""NO  this isn't a real thing is it? OMG"" ﻿",0,68,omg this oldspice spraytan party commercial omg    i m sitting here  no  this isn t a real thing is it  omg  ,0,"-1,-1,-1,-1,0,-1,-1,-1,-1,-1,-1,-1,-1,-1,-1,-1,-1,-1,-1,-1,0,0,-1,-1,-1,1,1,-1,-1,-1,-1,-1,-1,-1,-1,1,-1,-1,-1,-1"
z12ifxrbkmaechwtt22jwryqmoaefhipf04,MrTuizentfloot,2014-01-21T13:39:13,"This is the only video on youtube that get so much views just because we  want to see how much views it has. 1.000.000 every day, I mean, Most people  think a video is popular when it actually gets 1.000.000 views.﻿",0,69,this is the only video on youtube that get so much views just because we  want to see how much views it has            every day  i mean  most people  think a video is popular when it actually gets           views ,0,"-1,-1,-1,-1,0,-1,-1,-1,-1,-1,-1,-1,-1,-1,-1,-1,-1,-1,-1,-1,0,0,-1,1,-1,1,-1,1,-1,-1,1,-1,-1,-1,-1,1,-1,-1,-1,-1"
LZQPQhLyRh_hbykd_Xw4oDROJbJTFrs-UbSB2xk8gRk,OREOGAM3R,2014-01-25T19:36:25,It's been back for quite a while now.,0,70,it s been back for quite a while now ,0,"-1,-1,-1,-1,-1,-1,-1,-1,-1,-1,-1,-1,-1,-1,-1,-1,-1,-1,-1,-1,-1,-1,-1,-1,-1,-1,-1,-1,-1,-1,-1,-1,-1,-1,-1,1,-1,-1,-1,-1"
z12eexphzo2uslizg04cirmywyzjdnm5gqc0k,fab life,2014-11-02T00:48:57,plz check out fablife / welcome to fablife for diys and challenges so plz  subscribe thx!﻿,1,72,plz check out fablife   welcome to fablife for diys and challenges so plz  subscribe thx ,1,"-1,-1,1,1,-1,-1,-1,-1,-1,-1,-1,1,1,-1,-1,-1,1,-1,-1,-1,-1,-1,-1,-1,-1,-1,-1,-1,-1,-1,-1,-1,-1,-1,-1,-1,-1,-1,1,-1"
z124fn5ahqnfdbxtg23ihlijyqjqtr1lk,Oh 1080s,2014-11-02T01:08:10,Sub my channel!﻿,1,73,sub my channel ,1,"-1,-1,-1,-1,-1,-1,-1,1,-1,-1,-1,-1,-1,1,-1,1,-1,-1,-1,-1,-1,-1,-1,-1,-1,-1,-1,-1,-1,-1,-1,-1,-1,-1,-1,-1,-1,-1,-1,-1"
z12lubwrvv35zpzub23ywxbbiuawjbalc,Ariel Baptista,2014-11-02T05:06:46,http://www.ebay.com/itm/131338190916?ssPageName=STRK:MESELX:IT&amp;_trksid=p3984.m1555.l2649 ﻿,1,74,http   www ebay com itm              sspagename strk meselx it amp  trksid p     m     l     ,0,"-1,-1,-1,-1,-1,-1,-1,-1,-1,-1,-1,-1,-1,-1,-1,-1,-1,-1,-1,-1,-1,-1,-1,-1,-1,-1,1,-1,-1,-1,-1,-1,-1,-1,-1,-1,-1,-1,-1,-1"
z12tcdxa5k3bsvtqh04ccnaqusj1vvfju3s,Salim Tayara,2014-11-02T14:33:30,"if your like drones, plz subscribe to Kamal Tayara. He takes videos with  his drone that are absolutely beautiful.﻿",1,76,if your like drones  plz subscribe to kamal tayara  he takes videos with  his drone that are absolutely beautiful ,0,"-1,-1,-1,-1,-1,-1,-1,-1,-1,-1,-1,-1,-1,-1,-1,-1,-1,-1,-1,-1,-1,-1,-1,-1,-1,-1,-1,-1,-1,-1,-1,-1,-1,-1,-1,-1,1,-1,-1,-1"
z123e1gg3zyuf30ox04cdtbzgmaby3ehjc0,Lucas Trigo,2014-11-02T15:52:22,"WHATS UP EVERYONE!? :-) I Trying To Showcase My Talent To The World! I Have Over 3000 SUBSCRIBERS! I PROMISE! I Dont Suck! Please Spread My Covers Around, SUBSCRIBE &amp; Share! Thanks so much for all your support! Lucas Trigo -Stay Awesome! ﻿",1,78,whats up everyone       i trying to showcase my talent to the world  i have over      subscribers  i promise  i dont suck  please spread my covers around  subscribe  amp  share  thanks so much for all your support  lucas trigo  stay awesome  ,0,"-1,-1,-1,-1,-1,-1,-1,-1,-1,-1,-1,-1,-1,1,-1,-1,-1,-1,-1,-1,-1,-1,-1,1,-1,1,-1,1,-1,-1,1,-1,-1,1,-1,-1,-1,-1,-1,1"
