comment_id,author,date,old_text,expected_label,cid,text,model_pred,vectors
z12uefkbwv2md3dbz04cg3yoqp2ngfgibqg0k,Ashley Jsade,2015-05-21T14:36:34.512000,If you are a person that loves real music you should listen to &quot;Cruz Supat&quot;<br />He is awesome as fuck!!! Just as eminem used to be.﻿,0,1500,if you are a person that loves real music you should listen to  quot cruz supat quot  br   he is awesome as fuck    just as eminem used to be ,0,"-1,-1,-1,-1,-1,1,-1,-1,-1,-1,-1,-1,-1,-1,-1,-1,-1,-1,-1,-1,-1,0,-1,-1,-1,-1,-1,-1,-1,-1,-1,-1,-1,-1,-1,1,-1,-1,-1,-1"
LneaDw26bFvxJlVsbYMPkvV3LnT9JOJjEg5OsTN9pMo,Josh Dummett,,Also check out D.j.j where do i go now and road to recovery,1,1501,also check out d j j where do i go now and road to recovery,1,"-1,-1,1,1,-1,-1,-1,-1,-1,-1,-1,1,1,-1,-1,-1,1,-1,-1,-1,-1,-1,-1,-1,-1,1,-1,-1,-1,-1,-1,-1,-1,-1,-1,-1,-1,-1,1,-1"
z121z5mziy20ybch504cdziq1rvcev5apg4,Furashious,2015-05-21T12:41:55.505000,Charlie got off the island and dated Megan Fox? b-but what about claire?﻿,0,1502,charlie got off the island and dated megan fox  b but what about claire ,0,"-1,-1,-1,-1,-1,-1,-1,-1,-1,-1,-1,-1,-1,-1,-1,-1,1,-1,-1,-1,-1,-1,-1,1,-1,-1,-1,1,-1,-1,1,-1,-1,-1,-1,-1,-1,-1,1,-1"
LneaDw26bFtl5IRz0aJhyk-Id8DQ1p28SKectuNzbmE,Davide Puzzanghera,,Hi guys ! !  Check Out My Remixes ! !  Thanx You&#39;re Great ! ! SWAG ! !,1,1503,hi guys      check out my remixes      thanx you     re great     swag    ,1,"-1,-1,1,1,-1,1,-1,-1,-1,-1,1,1,1,0,-1,-1,-1,-1,-1,-1,-1,-1,-1,-1,-1,-1,-1,-1,-1,-1,-1,-1,-1,-1,-1,-1,-1,-1,-1,-1"
LneaDw26bFuk1aaBCiVITRxuEwAmzBtVcQi3QZSFkYY,AvidorFilms,,"Please check out my youtube channel! Just uploaded my first youtube video please check it out, you will not regret it!",1,1504,please check out my youtube channel  just uploaded my first youtube video please check it out  you will not regret it ,1,"-1,-1,1,1,-1,1,-1,1,-1,-1,-1,1,1,1,-1,1,-1,-1,1,-1,-1,-1,-1,-1,-1,-1,-1,-1,-1,-1,-1,-1,-1,1,-1,-1,-1,-1,-1,1"
z12qy53q0kfzxby4304cflvpxnr1gxjrlrg0k,nepart maxx,2015-05-21T11:46:27.413000,Eminem best rapper all the time﻿,0,1505,eminem best rapper all the time,0,"-1,-1,-1,-1,-1,-1,-1,-1,-1,-1,-1,-1,-1,-1,-1,-1,-1,-1,-1,-1,-1,-1,-1,1,-1,-1,-1,1,-1,-1,1,-1,-1,-1,-1,-1,-1,-1,-1,-1"
z12rdtlarmrzxhuba04cibjomsiqi3ij00g,Paul Buxton,2015-05-21T11:12:22.066000,Omg! This guy sounds like an american professor green﻿,0,1506,omg  this guy sounds like an american professor green,1,"-1,-1,-1,-1,0,-1,-1,-1,-1,-1,-1,-1,-1,-1,-1,-1,-1,-1,-1,-1,0,-1,-1,-1,-1,-1,-1,-1,-1,-1,-1,-1,-1,-1,-1,-1,1,-1,-1,-1"
z123wdtwhmnngjhat04cgtu5oyibstyopnw0k,vZoqwa,2015-05-21T09:48:06.926000,thumbs up if you think this should have 1 billion views﻿,0,1507,thumbs up if you think this should have   billion views,0,"-1,-1,-1,-1,1,1,-1,-1,-1,-1,-1,-1,-1,-1,-1,-1,-1,-1,-1,-1,1,-1,-1,-1,-1,-1,-1,-1,-1,-1,-1,-1,-1,-1,-1,-1,-1,-1,-1,-1"
z13eznubuwixt3aae04cgb150t2nup2ba3o,Vence Cerbo,2015-05-21T09:19:36.091000,Lemme Top Comments Please!!﻿,0,1508,lemme top comments please  ,1,"-1,-1,-1,-1,-1,-1,-1,-1,-1,-1,-1,-1,-1,-1,-1,-1,-1,-1,-1,-1,-1,-1,-1,-1,-1,-1,-1,-1,-1,-1,-1,-1,-1,1,-1,-1,-1,-1,-1,1"
z12kf5dyltrijhepb04ccltibzijd5wa1mc0k,liu hui (dukegod),2015-05-21T05:12:43.987000,i love this song﻿,0,1509,i love this song,1,"-1,-1,-1,-1,0,-1,-1,-1,-1,-1,-1,-1,-1,-1,-1,-1,-1,-1,-1,-1,0,-1,-1,-1,-1,0,-1,-1,-1,-1,-1,-1,-1,-1,-1,-1,-1,-1,-1,-1"
z13ihhrakmndxblzo04chpp53nn2xbja1fc,Emma Halbrook,2015-05-21T04:46:05.790000,My favorite song 💗💗💗💗﻿,0,1510,my favorite song ,1,"-1,-1,-1,-1,-1,-1,-1,-1,-1,-1,-1,-1,-1,0,-1,-1,-1,-1,-1,-1,-1,-1,-1,-1,-1,-1,-1,-1,-1,-1,-1,-1,-1,-1,-1,-1,-1,-1,-1,-1"
LneaDw26bFuYnpb0cG3d_koRWn2FHQ6OFrPiqjFHeEs,Beats ProdByATHS,,tryna work with some rappers check out the ones i already have on my channel,1,1511,tryna work with some rappers check out the ones i already have on my channel,1,"-1,-1,1,1,-1,-1,-1,1,-1,-1,-1,1,1,1,-1,1,-1,-1,-1,-1,-1,-1,-1,1,-1,1,-1,1,-1,-1,1,-1,-1,-1,-1,-1,-1,-1,-1,-1"
LneaDw26bFt75QYI94b9j7RqQCUgwrDwiHbnb1uwpxo,RaMpAgE420,,Check out Berzerk video on my channel ! :D,1,1512,check out berzerk video on my channel    d,1,"-1,-1,1,1,-1,-1,-1,1,-1,-1,-1,1,1,1,-1,1,-1,-1,-1,-1,-1,-1,-1,-1,-1,-1,-1,-1,-1,-1,-1,-1,-1,-1,-1,-1,-1,-1,-1,-1"
LneaDw26bFuisc-qZu0BerSXLLjgKlxUD59lcMA8W_E,Stricker Stric,,eminem new song check out my videos,1,1514,eminem new song check out my videos,1,"-1,-1,1,1,-1,-1,-1,-1,-1,-1,-1,1,1,0,1,-1,-1,-1,-1,-1,-1,-1,-1,-1,-1,-1,-1,-1,-1,-1,-1,-1,-1,-1,-1,-1,-1,-1,-1,-1"
z12jt1dbdpbvzzyi304cdxr4cwqkgrild,Susan Ambs,,Check out this video on YouTube:﻿,1,1515,check out this video on youtube ,1,"-1,-1,1,1,0,-1,-1,-1,-1,-1,-1,1,1,-1,-1,-1,-1,-1,-1,-1,0,-1,-1,-1,-1,-1,-1,-1,-1,-1,-1,-1,-1,-1,-1,-1,-1,-1,-1,-1"
LneaDw26bFsNko3TEEPMTxWPlFophSSKkSqvjRsENU8,arrgh garry,,"My friends wife earns 4000DOLLARS a month ,you can do it do if you want to be a wwhore ,you can not get these type of wages for working from home on a PC taking surveys ...dont believe that shit,just because yahoo and other are taking their money does not mean they are LEGIT ..Please like this so the MSG gets thru to vulnerable  people Like eminem used to be ",1,1516,my friends wife earns     dollars a month  you can do it do if you want to be a wwhore  you can not get these type of wages for working from home on a pc taking surveys    dont believe that shit just because yahoo and other are taking their money does not mean they are legit   please like this so the msg gets thru to vulnerable  people like eminem used to be ,0,"-1,-1,-1,-1,0,1,-1,-1,-1,-1,-1,-1,-1,1,-1,-1,0,-1,-1,-1,0,-1,-1,1,-1,-1,-1,1,-1,-1,1,-1,-1,1,-1,1,1,-1,0,1"
LneaDw26bFvRgBzOd9MQ1jh0Cmt8vuPTQvOZboi-s24,Nicholas Reed,,"this is the 4th most watched video on youtube. and hes the 21 most subscribed channel on youtube, just recentley surpassing justing bieber and is less then 1,00 subs away from beating taylor swift",1,1517,this is the  th most watched video on youtube  and hes the    most subscribed channel on youtube  just recentley surpassing justing bieber and is less then      subs away from beating taylor swift,0,"-1,-1,-1,-1,0,-1,-1,1,-1,-1,-1,-1,-1,-1,-1,1,1,-1,-1,-1,0,0,-1,1,-1,-1,-1,1,-1,-1,1,-1,-1,-1,-1,-1,-1,-1,1,-1"
LneaDw26bFsMrQMk1vC-RxTxjmpFlt5sKz8Vo1_wIas,M.E.S,,hey its M.E.S here I&#39;m a young up and coming rapper and i wanna get my music heard i know spam wont get me fame. but at the moment i got no way of getting a little attention so please do me a favour and check out my channel and drop a sub if you enjoy yourself. im just getting started so i really appreciate those who take time to leave constructive criticism i already got 200 subscribers and 4000 views on my first vid ive been told i have potential,1,1518,hey its m e s here i     m a young up and coming rapper and i wanna get my music heard i know spam wont get me fame  but at the moment i got no way of getting a little attention so please do me a favour and check out my channel and drop a sub if you enjoy yourself  im just getting started so i really appreciate those who take time to leave constructive criticism i already got     subscribers and      views on my first vid ive been told i have potential,1,"-1,-1,1,1,-1,1,-1,1,-1,1,-1,1,1,1,-1,1,1,-1,1,1,-1,-1,-1,1,-1,1,1,1,-1,-1,1,-1,-1,1,1,1,-1,-1,1,1"
LneaDw26bFtHv3jHn8C0y5MliNA2oqkPogUL4HmsZPQ,Lil M,,Lil m !!!!! Check hi out!!!!! Does live the way you lie and many more ! Check it out!!! And subscribe,1,1520,lil m       check hi out      does live the way you lie and many more   check it out    and subscribe,1,"-1,-1,1,1,-1,1,-1,-1,-1,-1,-1,1,1,-1,-1,-1,1,-1,-1,-1,-1,-1,-1,1,-1,-1,1,1,-1,-1,1,-1,-1,-1,-1,-1,-1,-1,1,-1"
LneaDw26bFt-gGO-C3czQDS4cqE7xJfKoKqWmMIlSWc,HOTFUZZOFFICIAL,,"Hello to everyone! Please check out my video: /watch?v=2b4WyWpHi8c It takes just 2 minutes, hope I don&#39;t ask too much. If you can&#39;t help me just Like &amp; Share the video please, so more people will see it. Thumbs UP, it would mean so much to me, maybe will make my dream come true. Thanks to everyone, GOD BLESS YOU ALL!",1,1521,hello to everyone  please check out my video   watch v  b wywphi c it takes just   minutes  hope i don     t ask too much  if you can     t help me just like  amp  share the video please  so more people will see it  thumbs up  it would mean so much to me  maybe will make my dream come true  thanks to everyone  god bless you all ,1,"-1,-1,1,1,-1,1,-1,-1,-1,-1,-1,1,1,1,-1,-1,-1,-1,-1,-1,-1,-1,-1,1,-1,1,-1,1,-1,-1,1,-1,-1,1,-1,-1,1,-1,-1,1"
LneaDw26bFuFgDF5yE6Udiuv2lqie4iaimFPdN7rvYk,Nikola Vejionvic,,/watch?v=aImbWbfQbzg watch and subscrible,1,1522, watch v aimbwbfqbzg watch and subscrible,0,"-1,-1,-1,-1,-1,-1,-1,-1,-1,-1,-1,-1,-1,-1,-1,-1,1,-1,-1,-1,-1,-1,-1,-1,-1,-1,-1,-1,-1,-1,-1,-1,-1,-1,-1,-1,-1,-1,1,-1"
z12qg5voponpgxwot04ci3txdw24ejr431g,Jp Galeanoo,2015-05-21T01:05:43.761000,I  love you Eminem﻿,0,1523,i love you eminem,0,"-1,-1,-1,-1,-1,1,-1,-1,-1,-1,-1,-1,-1,-1,-1,-1,-1,-1,-1,-1,-1,-1,-1,-1,-1,1,-1,-1,-1,-1,-1,-1,-1,-1,-1,-1,-1,-1,-1,-1"
z13pup2w2k3rz1lxl04cf1a5qzavgvv51vg0k,geraldine lopez,2015-05-20T23:44:25.920000,love the you lie the good﻿,0,1524,love the you lie the good,0,"-1,-1,-1,-1,-1,1,-1,-1,-1,-1,-1,-1,-1,-1,-1,-1,-1,-1,-1,-1,-1,-1,-1,1,-1,-1,-1,1,-1,-1,1,-1,-1,-1,-1,-1,-1,-1,-1,-1"
z121hftrpqicztwq404cjvvzknqoupxxsxw0k,Daniel Tabatabai,2015-05-20T22:58:46.199000,still listening in 2015﻿,0,1525,still listening in     ,0,"-1,-1,-1,-1,-1,-1,-1,-1,-1,-1,-1,-1,-1,-1,-1,-1,-1,-1,-1,-1,-1,-1,-1,-1,-1,-1,-1,-1,-1,0,-1,-1,-1,-1,-1,-1,-1,-1,-1,-1"
LneaDw26bFuADByLeh7RnEltROTIUCqeYYXmt51DT2g,M.E.S,,hey its M.E.S here I&#39;m a young up and coming rapper and i wanna get my music heard i know spam wont get me fame. but at the moment i got no way of getting a little attention so please do me a favour and check out my channel and drop a sub if you enjoy yourself. im just getting started so i really appreciate those who take time to leave constructive criticism i already got 200 subscribers and 4000 views on my first vid ive been told i have potential,1,1526,hey its m e s here i     m a young up and coming rapper and i wanna get my music heard i know spam wont get me fame  but at the moment i got no way of getting a little attention so please do me a favour and check out my channel and drop a sub if you enjoy yourself  im just getting started so i really appreciate those who take time to leave constructive criticism i already got     subscribers and      views on my first vid ive been told i have potential,1,"-1,-1,1,1,-1,1,-1,1,-1,1,-1,1,1,1,-1,1,1,-1,1,1,-1,-1,-1,1,-1,1,1,1,-1,-1,1,-1,-1,1,1,1,-1,-1,1,1"
LneaDw26bFsw47hS3RAHCBj_uNPFQNZVbUVyx5Rh9zk,KOZZI RAP,,CHECK OUT MY YOUTUBE VIDEOS FOR FUNNY AND COOL RAP,1,1528,check out my youtube videos for funny and cool rap,1,"-1,-1,1,1,-1,-1,-1,-1,-1,-1,-1,1,1,0,-1,-1,1,-1,-1,-1,-1,-1,-1,-1,-1,-1,-1,-1,-1,-1,-1,-1,-1,-1,-1,-1,-1,-1,1,-1"
z13mxl3zavzfc55as04ccf4ifo2textrofs,Honesty Wright,2015-05-20T19:58:06.997000,hay my is honesty wright i am 12year old  i love your song thank you for makeing this song i love this song so much sometime harts can get breaken  people kill  they self or go cazzy i  love you so much thanks 😱👏keep on go  make  sure you doing your   dream is comeing rule  good luck﻿,0,1529,hay my is honesty wright i am   year old  i love your song thank you for makeing this song i love this song so much sometime harts can get breaken  people kill  they self or go cazzy i  love you so much thanks keep on go  make  sure you doing your   dream is comeing rule  good luck,1,"-1,-1,-1,-1,0,0,-1,-1,-1,-1,-1,-1,-1,0,-1,-1,-1,-1,-1,-1,0,0,-1,-1,-1,0,-1,-1,-1,-1,-1,-1,-1,-1,-1,-1,-1,-1,-1,-1"
LneaDw26bFv9y-1cf9oawnpCocMFtK6HXTRuoffJR2k,Complete Pranks,, Subscribe and like my video please,1,1532, subscribe and like my video please,0,"-1,-1,-1,-1,-1,-1,-1,-1,-1,-1,-1,-1,-1,1,-1,-1,1,-1,-1,-1,-1,-1,-1,-1,-1,-1,-1,-1,-1,-1,-1,-1,-1,1,-1,-1,1,-1,1,1"
LneaDw26bFs2GO5DvyLUXUhG7rNJ-Gb4pMhtnYgCRmY,ryan cooper,,subscribed :) btw you have a good style keep it up brother :)),1,1533,subscribed    btw you have a good style keep it up brother    ,0,"-1,-1,-1,-1,-1,1,-1,-1,-1,-1,-1,-1,-1,-1,-1,-1,-1,-1,-1,-1,-1,-1,-1,-1,-1,-1,-1,-1,-1,-1,-1,-1,-1,-1,-1,1,-1,-1,-1,-1"
LneaDw26bFvwhMGEs3mKR9qcJjIwC7L04F9DEGkLQfY,Drake Gagne,,I KNOW YOU MAY NOT WANT TO READ THIS BUT please do  I&#39;m 87 Cypher an 11 year old rapper I have skill people said .my stuff isn&#39;t as good as my new stuff but its good please check out my current songs comment and like thank you for reading rap is my life,1,1534,i know you may not want to read this but please do  i     m    cypher an    year old rapper i have skill people said  my stuff isn     t as good as my new stuff but its good please check out my current songs comment and like thank you for reading rap is my life,1,"-1,-1,1,1,0,1,-1,-1,-1,-1,-1,1,1,1,1,-1,1,-1,-1,-1,0,0,-1,-1,-1,0,1,-1,-1,-1,-1,-1,-1,1,-1,-1,0,1,1,1"
z12mwbgxhxvjez3xb04cg1wxrvnytzrq5kk0k,Mortal 2,2015-05-20T16:32:56.261000,Eminem THE BEST !﻿,0,1536,eminem the best  ,0,"-1,-1,-1,-1,-1,-1,-1,-1,-1,-1,-1,-1,-1,-1,-1,-1,-1,-1,-1,-1,-1,-1,-1,1,-1,-1,-1,1,-1,-1,1,-1,-1,-1,-1,-1,-1,-1,-1,-1"
LneaDw26bFtxoMQMT4RjErJZWpjMtHBcA7QsnHKvXRI,jacobvine2000 .,,"Usually guys I would vote people like this down but actually check out his channel, it reminds me of a smaller version of 8 mile. Give this guy a chance since everyone has to start somewhere!",1,1537,usually guys i would vote people like this down but actually check out his channel  it reminds me of a smaller version of   mile  give this guy a chance since everyone has to start somewhere ,1,"-1,-1,1,1,0,-1,-1,1,-1,-1,1,1,1,-1,-1,1,-1,-1,-1,-1,0,-1,-1,-1,-1,1,-1,-1,-1,-1,-1,-1,-1,-1,-1,1,1,-1,-1,-1"
LneaDw26bFt3FLe7NEx2Gc7jToE3LwT1LrpIpyY48E8,KOZZI RAP,,hello friends. i am a young 15 year old rapper trying to make something out of nothing..Please can you take a second of your life and check out my videos and help me reach my Dreams! GoD Bless YOU,1,1539,hello friends  i am a young    year old rapper trying to make something out of nothing  please can you take a second of your life and check out my videos and help me reach my dreams  god bless you,1,"-1,-1,1,1,-1,1,-1,-1,-1,-1,-1,1,1,1,-1,-1,1,-1,-1,-1,-1,-1,-1,-1,-1,1,-1,-1,-1,-1,-1,-1,-1,1,-1,1,-1,-1,1,1"
LneaDw26bFsYJ3OzV2q22gR6I5MvSlIF8ve1WpZHnqg,KOZZI RAP,,CHECK OUT MY CHANNEL BOYS AND GIRLS ;),1,1541,check out my channel boys and girls   ,1,"-1,-1,1,1,-1,-1,-1,1,-1,-1,-1,1,1,1,-1,1,1,-1,-1,-1,-1,-1,-1,-1,-1,-1,-1,-1,-1,-1,-1,-1,-1,-1,-1,-1,-1,-1,1,-1"
LneaDw26bFtlox7jDN60_ys-XolAIlgwwc5y6aEKR68,M.E.S,,hey guys i know its annoying getting spammed sorry bout that but please take a moment to check out my channel  IM A RAPPER with DECENT skills. i want to share my music with more people so take a listen   THUMBS UP SO MORE CAN SEE THIS,1,1542,hey guys i know its annoying getting spammed sorry bout that but please take a moment to check out my channel  im a rapper with decent skills  i want to share my music with more people so take a listen   thumbs up so more can see this,1,"-1,-1,1,1,1,-1,-1,1,-1,1,1,1,1,1,-1,1,-1,-1,-1,-1,1,-1,-1,-1,-1,1,-1,-1,-1,-1,-1,-1,-1,1,-1,1,-1,-1,-1,1"
z13gcjvh2naxyvshh04cjldgtpnyfrdylq40k,Aubone LeMieux ,2015-05-20T03:15:39.925000,I lover this song,0,1544,i lover this song,1,"-1,-1,-1,-1,0,-1,-1,-1,-1,-1,-1,-1,-1,-1,-1,-1,-1,-1,-1,-1,0,-1,-1,-1,-1,0,-1,-1,-1,-1,-1,-1,-1,-1,-1,-1,-1,-1,-1,-1"
LneaDw26bFuDsbyypF_jwmq7b6BqQPB7BdLbhfqBU5c,M.E.S,,hey guys i know you wanna skip over this but please take a chance and check out my music I&#39;m a young up and coming rapper with a big dream and i appreciate constructive critisism. so please have a look thank you for your time,1,1545,hey guys i know you wanna skip over this but please take a chance and check out my music i     m a young up and coming rapper with a big dream and i appreciate constructive critisism  so please have a look thank you for your time,1,"-1,-1,1,1,0,1,-1,-1,-1,1,1,1,1,1,-1,-1,1,-1,-1,-1,0,-1,-1,-1,-1,1,1,-1,-1,-1,-1,-1,-1,1,-1,1,-1,-1,1,1"
z13osfmj5m2kj1cb504cjrdbyvzijtu4gtk0k,Harl Bever,2015-05-19T23:23:30.286000,I like the music...but is anyone listening to the lyrics?﻿,0,1547,i like the music   but is anyone listening to the lyrics ,0,"-1,-1,-1,-1,-1,-1,-1,-1,-1,-1,-1,-1,-1,-1,-1,-1,-1,-1,-1,-1,-1,0,-1,1,-1,1,-1,1,-1,-1,1,-1,-1,-1,-1,-1,1,-1,-1,-1"
LneaDw26bFs2eQd05L_J9wVmiBlCClqLnM0JUQsB-3Q,YungDreams,,Maybe no one will probably read this. But just in case you do Can You Put A &quot;Thumbs Up &quot;So Others Can See. I Just started rapping seriously (Type in Lunden- 1990 Video) just a simple button? can help my dreams come true. people will ignore this but if you don&#39;t can you listen and subscribe Thank you all God Bless.,1,1548,maybe no one will probably read this  but just in case you do can you put a  quot thumbs up  quot so others can see  i just started rapping seriously  type in lunden       video  just a simple button  can help my dreams come true  people will ignore this but if you don     t can you listen and subscribe thank you all god bless ,0,"-1,-1,-1,-1,1,1,-1,-1,-1,-1,-1,-1,-1,0,-1,-1,1,-1,-1,-1,1,-1,-1,-1,-1,1,-1,-1,-1,0,-1,-1,-1,-1,-1,1,-1,-1,1,-1"
LneaDw26bFtvkPwGL4MxnAUFaIznH1ZWx7z_qBOoe5Q,Trey Curling,,Check out my channel for some lyricism.....,1,1550,check out my channel for some lyricism     ,1,"-1,-1,1,1,-1,-1,-1,1,-1,-1,-1,1,1,1,-1,1,-1,-1,-1,-1,-1,-1,-1,-1,-1,-1,-1,-1,-1,-1,-1,-1,-1,-1,-1,-1,-1,-1,-1,-1"
z13tjzdqhsmvvh2kr22isbsg1nmydd51v,Earline Craver,2015-05-19T22:35:44.690000,Me and my big sister like you﻿,0,1551,me and my big sister like you,0,"-1,-1,-1,-1,-1,1,-1,-1,-1,-1,-1,-1,-1,0,-1,-1,1,-1,-1,-1,-1,-1,-1,-1,-1,-1,-1,-1,-1,-1,-1,-1,-1,-1,-1,-1,1,-1,1,-1"
z132ebdhkwbauzogm04cfzm5oqigzzlxznc0k,cristina virrueta,2015-05-19T21:51:44.586000,I love eminem  &lt;3﻿,0,1553,i love eminem   lt  ,0,"-1,-1,-1,-1,-1,-1,-1,-1,-1,-1,-1,-1,-1,-1,-1,-1,-1,-1,-1,-1,-1,-1,-1,-1,-1,1,-1,-1,-1,-1,-1,-1,-1,-1,-1,-1,-1,-1,-1,-1"
z12aczswnozdwrfnj22usfnxymiaylupi04,nataly gonzález,2015-05-19T21:49:18.833000,She looks like Megan Fox 😂 xD!!﻿,0,1554,she looks like megan fox xd  ,0,"-1,-1,-1,-1,-1,-1,-1,-1,-1,-1,-1,-1,-1,-1,-1,-1,-1,-1,-1,-1,-1,-1,-1,-1,-1,-1,-1,-1,-1,-1,-1,-1,-1,-1,-1,-1,1,-1,-1,-1"
LneaDw26bFs4Mo3Kr9O93YAlCksPNemAPve_W-ivuMc,RapStarz Coleman,,Hey Go To My Channel Check Out My Dongs Thanks YouTuber&#39;s,1,1555,hey go to my channel check out my dongs thanks youtuber     s,1,"-1,-1,1,1,-1,-1,-1,1,-1,1,-1,1,1,1,-1,1,-1,-1,-1,-1,-1,-1,-1,-1,-1,-1,-1,-1,-1,-1,-1,-1,-1,-1,-1,-1,-1,-1,-1,-1"
z12xc1aydoauenbgx04cgfkazxrpur2i52o,Nicky G,2015-05-19T20:56:00.184000,is that megan fox?﻿,0,1556,is that megan fox ,0,"-1,-1,-1,-1,-1,-1,-1,-1,-1,-1,-1,-1,-1,-1,-1,-1,-1,-1,-1,-1,-1,0,-1,-1,-1,-1,-1,-1,-1,-1,-1,-1,-1,-1,-1,-1,-1,-1,-1,-1"
z125dnzbqpyqxlghe04cdxsgaxnovjvbxq00k,Uday Kanwar,2015-05-19T19:30:58.135000,You can not hate eminem and nirvana...trust me﻿,0,1557,you can not hate eminem and nirvana   trust me,0,"-1,-1,-1,-1,-1,1,-1,-1,-1,-1,-1,-1,-1,-1,-1,-1,0,-1,-1,-1,-1,-1,-1,-1,-1,-1,-1,-1,-1,-1,-1,-1,-1,-1,-1,-1,-1,-1,0,-1"
LneaDw26bFsZrH_q8nAlrNCOT1Zadc4j8zPu-ZPpwIE,Stacy,,check out my playlist,1,1559,check out my playlist,1,"-1,-1,1,1,-1,-1,-1,-1,-1,-1,-1,1,1,0,-1,-1,-1,-1,-1,-1,-1,-1,-1,-1,-1,-1,-1,-1,-1,-1,-1,-1,-1,-1,-1,-1,-1,-1,-1,-1"
LneaDw26bFv1lZ_yx4_HlVx6xNa0xuiUmgoIsxkWJ3E,seven4justice,,Media is Evil! Please see and share: W W W. THE FARRELL REPORT. NET  Top Ex UK Police Intelligence Analyst turned Whistleblower Tony Farrell exposes a horrific monstrous cover-up perpetrated by criminals operating crimes from inside Mainstream Entertainment and Media Law firms. Beware protect your children!! These devils brutally target innocent people. These are the real criminals linked to London&#39;s 7/7 attacks 2005.  MUST SEE AND MAKE VIRAL!!! Also see UK Column video on 31st January 2013.,1,1560,media is evil  please see and share  w w w  the farrell report  net  top ex uk police intelligence analyst turned whistleblower tony farrell exposes a horrific monstrous cover up perpetrated by criminals operating crimes from inside mainstream entertainment and media law firms  beware protect your children   these devils brutally target innocent people  these are the real criminals linked to london     s     attacks        must see and make viral    also see uk column video on   st january      ,0,"-1,-1,-1,-1,-1,-1,-1,-1,-1,-1,-1,-1,-1,-1,-1,-1,1,-1,-1,-1,-1,0,-1,1,-1,-1,-1,1,-1,-1,1,-1,-1,1,-1,1,-1,-1,1,1"
LneaDw26bFsnP4vz8waC3hOcYwvM83aoMLyetymm5Io,McCostaOficial,,subscribe to my channel who can,1,1561,subscribe to my channel who can,1,"-1,-1,-1,-1,-1,-1,-1,1,-1,-1,-1,-1,-1,1,-1,1,-1,-1,-1,-1,-1,-1,-1,-1,-1,-1,-1,-1,-1,-1,-1,-1,-1,-1,-1,-1,-1,-1,-1,-1"
z13auv44szqpddlcz22qgthjakq4jvnbw04,clirim99,2015-05-19T12:13:44.952000,is that megan fox x:D?﻿,0,1563,is that megan fox x d ,0,"-1,-1,-1,-1,-1,-1,-1,-1,-1,-1,-1,-1,-1,-1,-1,-1,-1,-1,-1,-1,-1,0,-1,-1,-1,-1,-1,-1,-1,-1,-1,-1,-1,-1,-1,-1,-1,-1,-1,-1"
z13gut3rexalj5q5c04ciln54nynvjwyinw0k,Sonny Carter,2015-05-19T11:11:27.740000,I love this song﻿,0,1564,i love this song,1,"-1,-1,-1,-1,0,-1,-1,-1,-1,-1,-1,-1,-1,-1,-1,-1,-1,-1,-1,-1,0,-1,-1,-1,-1,0,-1,-1,-1,-1,-1,-1,-1,-1,-1,-1,-1,-1,-1,-1"
LneaDw26bFtn6YS8GRfHBxoaZZI5newNd0njNOSeF84,canku alkan,,check out my new EM cover video trailer,1,1565,check out my new em cover video trailer,1,"-1,-1,1,1,-1,-1,-1,-1,-1,-1,-1,1,1,0,1,-1,-1,-1,-1,-1,-1,-1,-1,-1,-1,-1,-1,-1,-1,-1,-1,-1,-1,-1,-1,-1,-1,-1,-1,-1"
z12eilv44ynefj2ys04cj5vhynakxbnwrdk,BAT MAN,2015-05-19T10:33:12.247000,Really good song .<br />you know love song song.﻿,0,1566,really good song   br   you know love song song ,0,"-1,-1,-1,-1,-1,0,-1,-1,-1,-1,-1,-1,-1,-1,-1,-1,-1,-1,-1,-1,-1,-1,-1,-1,-1,-1,-1,-1,-1,-1,-1,-1,-1,-1,-1,-1,-1,-1,-1,-1"
z12vx3kz4lq3cnsiu04cejd5bne1gxnjbqo0k,Str8 Royalty,2015-05-19T09:46:37.599000,Eminem is the greatest artist to ever touch the mic.﻿,0,1567,eminem is the greatest artist to ever touch the mic ,0,"-1,-1,-1,-1,-1,-1,-1,-1,-1,-1,-1,-1,-1,-1,-1,-1,-1,-1,-1,-1,-1,0,-1,1,-1,-1,-1,1,-1,-1,1,-1,-1,-1,-1,-1,-1,-1,-1,-1"
z12lhvxwjyzperfrk04cg13yoyjefnv5hy40k,BEER BEER,2015-05-19T09:42:56.560000,i love Rihanna 😍😍😍😍[♧from Thailand♧]﻿,0,1568,i love rihanna  from thailand ,0,"-1,-1,-1,-1,-1,-1,-1,-1,-1,-1,-1,-1,-1,-1,-1,-1,-1,-1,-1,-1,-1,-1,-1,-1,-1,1,-1,-1,-1,-1,-1,-1,-1,-1,-1,-1,-1,-1,-1,-1"
LneaDw26bFvEGhYWZTzIRiff9BXME_JsdLXh4hiJEqo,Daniel Ebrey,,sorry for the spam yall I know it’s annoying. But if you can spare a min please check out the new track on my channel i&#39;m a upcoming uk rapper.please come check out my songs u might like em. If not no worries I’m sorry for wastin your time. Even thumbs up to get more noticed will really help. peace yall,1,1570,sorry for the spam yall i know its annoying  but if you can spare a min please check out the new track on my channel i     m a upcoming uk rapper please come check out my songs u might like em  if not no worries im sorry for wastin your time  even thumbs up to get more noticed will really help  peace yall,1,"-1,-1,1,1,-1,1,-1,1,-1,-1,-1,1,1,1,1,1,-1,-1,-1,-1,-1,-1,-1,1,-1,1,1,1,-1,-1,1,-1,-1,1,-1,1,1,-1,-1,1"
z13vxnwwdxjqtlp5v04chjpw1waps5rrbqo0k,Punk 0utlaw,2015-05-19T06:14:30.089000,"This song is like an oreo, the black part is good but the white part is better﻿",0,1571,this song is like an oreo  the black part is good but the white part is better,0,"-1,-1,-1,-1,0,-1,-1,-1,-1,-1,-1,-1,-1,-1,-1,-1,-1,-1,-1,-1,0,0,-1,1,-1,-1,-1,1,-1,-1,1,1,-1,-1,-1,-1,0,-1,-1,-1"
LneaDw26bFvJWycbUHAiKy7i7L14RqXWenvvcJhwbQE,David Bottenberg,,subscribe to my channel  /watch?v=NxK32i0HkDs,1,1573,subscribe to my channel   watch v nxk  i hkds,1,"-1,-1,-1,-1,-1,-1,-1,1,-1,-1,-1,-1,-1,1,-1,1,-1,-1,-1,-1,-1,-1,-1,-1,-1,1,-1,-1,-1,-1,-1,-1,-1,-1,-1,-1,-1,-1,-1,-1"
LneaDw26bFsFwQBcbaeKWWcSsBB7EA1zRf2nBgT9NyY,Ashim Limbu,, HI IM 14 YEAR RAPPER SUPPORT ME GUY AND CHECK OUT MY CHANNEL AND CHECK OUT MY SONG YOU MIGHT LIKE IT ALSO FOLLOW ME IN TWITTER @McAshim for follow back.,1,1574, hi im    year rapper support me guy and check out my channel and check out my song you might like it also follow me in twitter  mcashim for follow back ,1,"-1,-1,1,1,-1,0,-1,1,-1,-1,-1,1,1,1,-1,1,1,-1,-1,-1,-1,-1,-1,-1,-1,-1,-1,-1,-1,0,-1,-1,-1,-1,-1,-1,0,-1,1,-1"
z12msjqximryxdfz104cjhbhtw2ld5ipsh4,SIR JOHN,2015-05-07T02:28:12.704000,EMINEM the best EVER.﻿,0,1576,eminem the best ever ,0,"-1,-1,-1,-1,-1,-1,-1,-1,-1,-1,-1,-1,-1,-1,-1,-1,-1,-1,-1,-1,-1,-1,-1,1,-1,-1,-1,1,-1,-1,1,-1,-1,-1,-1,-1,-1,-1,-1,-1"
LneaDw26bFvn1m3oQLlCgsaxLcEy_eMQzcK9NAbyaew,M.E.S,,hey guys look im aware im spamming and it pisses people off but please take a moment to check out my music.  im a young rapper and i love to do it and i just wanna share my music with more people  just click my picture and then see if you like my stuff,1,1577,hey guys look im aware im spamming and it pisses people off but please take a moment to check out my music   im a young rapper and i love to do it and i just wanna share my music with more people  just click my picture and then see if you like my stuff,1,"-1,-1,1,1,-1,1,-1,-1,-1,1,1,1,1,1,-1,-1,1,-1,-1,-1,-1,-1,-1,-1,-1,1,-1,-1,-1,-1,-1,-1,-1,1,-1,1,1,-1,1,1"
LneaDw26bFv4NFg1m91sL1Aq1p-2N06VweQT4vOwTqc,Ando Nesia - | MC | Music Producer,,DO YOU KNOW HOW SEAN KINGSTON GOT FAMOUS WHY DON&#39;T YOU LOOK IT UP KID BEFORE YOUR SO HARD ON YOURSELF!!  IF YOU HIT ME UP WITH A MESSAGE IN MY INBOX AND SUBSCRIBE I WILL CHECK OUT YOUR CHANNEL....SOUNDS FAIR TO ME.,1,1578,do you know how sean kingston got famous why don     t you look it up kid before your so hard on yourself    if you hit me up with a message in my inbox and subscribe i will check out your channel    sounds fair to me ,1,"-1,-1,1,1,-1,1,-1,1,-1,-1,-1,1,1,1,-1,1,1,-1,-1,-1,-1,-1,-1,-1,-1,1,-1,-1,-1,0,-1,-1,-1,-1,-1,1,-1,-1,1,-1"
