comment_id,author,date,old_text,expected_label,cid,text,model_pred,vectors
z12wc1vj2mytepiki22lf5bggrynfloa304,Rolando Viray,2014-09-16T07:11:53,This Song Was Good Until It Got Overplayed The Hell Out Of On Radio﻿,0,472,this song was good until it got overplayed the hell out of on radio,1,"-1,-1,-1,1,0,-1,-1,-1,-1,-1,-1,-1,1,-1,-1,-1,-1,-1,-1,-1,0,-1,-1,1,-1,-1,-1,1,-1,-1,1,-1,-1,-1,-1,-1,-1,-1,-1,-1"
z13gsbt40s25vre2q23rdtmxepytftaei,Jana Trpevska,2014-09-16T10:46:47,Great.This is a song﻿,0,474,great this is a song,1,"-1,-1,-1,-1,0,-1,-1,-1,-1,-1,-1,-1,-1,-1,-1,-1,-1,-1,-1,-1,0,0,-1,-1,-1,-1,-1,-1,-1,-1,-1,-1,-1,-1,-1,1,-1,-1,-1,-1"
z13mjtpierebfrgvv22dch3o2sm3jnnp304,Marieke Sp33lma,2014-09-16T12:53:43,Watch my videos xx﻿,1,476,watch my videos xx,1,"-1,-1,-1,-1,-1,-1,-1,-1,-1,-1,-1,-1,-1,0,-1,-1,-1,-1,-1,-1,-1,-1,-1,-1,-1,-1,-1,-1,-1,-1,-1,-1,-1,-1,-1,-1,-1,-1,-1,-1"
z12vibnqjrygfn0p404cc1loanvyw54pcmw0k,Nathan Waterhouse,2014-09-16T14:21:04,Please check out my acoustic cover channel :) thanks ﻿,1,477,please check out my acoustic cover channel    thanks ,1,"-1,-1,1,1,-1,-1,-1,1,-1,-1,-1,1,1,1,-1,1,-1,-1,-1,-1,-1,-1,-1,-1,-1,-1,-1,-1,-1,-1,-1,-1,-1,1,-1,-1,-1,-1,-1,1"
z13ithgi0zjwz15rn04cclkgxpafydzocrs0k,Harrison Lloyd,2014-09-16T20:32:46,Imagine this in the news crazy woman found acting like a tiger and bit jims  ear off﻿,0,478,imagine this in the news crazy woman found acting like a tiger and bit jims  ear off,0,"-1,-1,-1,-1,0,-1,-1,-1,-1,-1,-1,-1,-1,-1,-1,-1,1,-1,-1,-1,0,-1,-1,1,-1,-1,-1,1,-1,0,1,-1,-1,-1,-1,1,1,-1,1,-1"
z13wthrbisjqg5cm423qxnpopsrowzvzg04,DatoJason Jason,2014-09-17T19:52:54,It is a shit﻿,0,481,it is a shit,0,"-1,-1,-1,-1,-1,-1,-1,-1,-1,-1,-1,-1,-1,-1,-1,-1,-1,-1,-1,-1,-1,0,-1,-1,-1,-1,-1,-1,-1,-1,-1,-1,-1,-1,-1,1,-1,-1,-1,-1"
z13cyrkatpfnixkis04cinqqhmbuvhspvqk0k,Pettrus Ortega,2014-09-18T11:35:49,"THIS IS A COMPETITION TO MEET MY IDOLS, IT WOULD MEAN SO MUCH IF YOU GUYS  WILL LIKE THIS PIC ON IG! http://instagram.com/p/smZdivopxb/﻿",1,483,this is a competition to meet my idols  it would mean so much if you guys  will like this pic on ig  http   instagram com p smzdivopxb ,0,"-1,-1,-1,-1,1,1,-1,-1,-1,-1,1,-1,-1,0,-1,-1,-1,-1,-1,-1,1,0,-1,-1,-1,-1,-1,-1,-1,-1,-1,-1,-1,-1,-1,1,1,-1,-1,-1"
z12ijdi5kuimjphgy04cjzxxzyusg3xjoyc0k,Ari4Cortez5Ortiz 9Uria,2014-09-18T15:57:36,Katty perry please say in one of your new videoes that they follow the  Girls Girls please﻿,1,484,katty perry please say in one of your new videoes that they follow the  girls girls please,0,"-1,-1,-1,-1,-1,-1,-1,-1,-1,-1,-1,-1,-1,-1,1,-1,-1,-1,-1,-1,-1,-1,-1,1,-1,-1,-1,1,-1,1,1,-1,-1,1,-1,-1,-1,-1,-1,1"
z12iwnkoukqythvf022xx1ii4xisfn2dd,Emma C,2014-09-18T22:27:19,i am a big fan of you and i love you﻿,0,485,i am a big fan of you and i love you,0,"-1,-1,-1,-1,-1,1,-1,-1,-1,-1,-1,-1,-1,-1,-1,-1,1,-1,-1,-1,-1,-1,-1,-1,-1,1,-1,-1,-1,-1,-1,-1,-1,-1,-1,1,-1,-1,1,-1"
z13jffkgavyhv5tkq22lyboo2subj1vu0,Tushti Chakraborty,2014-09-19T15:30:47,I &lt;3 Katy Perry!﻿,0,487,i  lt   katy perry ,0,"-1,-1,-1,-1,-1,-1,-1,-1,-1,-1,-1,-1,-1,-1,-1,-1,-1,-1,-1,-1,-1,-1,-1,-1,-1,1,-1,-1,-1,-1,-1,-1,-1,-1,-1,-1,-1,-1,-1,-1"
z12zyrnp1unbczz0v23mhr3wwoa0vfcak04,Kaida Tong,2014-09-19T19:25:33,"Since she is a feminist champion, why would she want to reinforce the  stereotype of girls being girly by painting the nails of an elephant that  probably wouldn't even appreciate it?﻿",0,488,since she is a feminist champion  why would she want to reinforce the  stereotype of girls being girly by painting the nails of an elephant that  probably wouldn t even appreciate it ,0,"-1,-1,-1,-1,-1,-1,-1,-1,-1,-1,-1,-1,-1,-1,-1,-1,-1,-1,-1,-1,-1,0,-1,1,-1,-1,-1,1,-1,-1,1,-1,-1,-1,-1,1,-1,-1,-1,-1"
z13jcrsplozwthwj204cdpspeobusp3ie54,roflcopter2110,2014-09-19T23:15:14,http://thepiratebay.se/torrent/10626835/The.Expendables.3.2014.DVDSCR.Xvid-DiNGO ﻿,1,489,http   thepiratebay se torrent          the expendables        dvdscr xvid dingo ,0,"-1,-1,-1,-1,-1,-1,-1,-1,-1,-1,-1,-1,-1,-1,-1,-1,-1,-1,-1,-1,-1,-1,-1,1,-1,-1,-1,1,-1,-1,1,-1,-1,-1,-1,-1,-1,-1,-1,-1"
z12vzxcymvqtyrx3s22hi5ep1yq5cvmld,roflcopter2110,2014-09-19T23:18:41,http://thepiratebay.se/torrent/10626048/The.Expendables.3.2014.DVDScr.LEAKED.CLEAN.XviD.MP3-RARBG ﻿,1,490,http   thepiratebay se torrent          the expendables        dvdscr leaked clean xvid mp  rarbg ,0,"-1,-1,-1,-1,-1,-1,-1,-1,-1,-1,-1,-1,-1,-1,-1,-1,-1,-1,-1,-1,-1,-1,-1,1,-1,-1,-1,1,-1,-1,1,-1,-1,-1,-1,-1,-1,-1,-1,-1"
z12pgx55amraefo3423kchdy1tmeu1avo,Darth Vaderbro,2014-09-20T00:05:45,If interested in making extra money by internet use the next link www.swagbucks.com/refer/Nonturtle02﻿,1,491,if interested in making extra money by internet use the next link www swagbucks com refer nonturtle  ,0,"-1,-1,-1,-1,-1,-1,-1,-1,-1,-1,-1,-1,-1,-1,-1,-1,-1,-1,-1,-1,-1,-1,-1,1,-1,-1,-1,1,-1,0,1,-1,-1,-1,-1,-1,-1,-1,-1,-1"
z12twzjoszz0xxuo304civmjxyjiv3hg5rw0k,MrCollinGabriel,2014-09-20T00:50:13,"This is fucking shit. From the first notes, that becomes clear. Complete  and utter shit. May God come and cleanse the earth of the complete and  utter idiocy which is humankind.﻿",0,492,this is fucking shit  from the first notes  that becomes clear  complete  and utter shit  may god come and cleanse the earth of the complete and  utter idiocy which is humankind ,0,"-1,-1,-1,-1,0,-1,-1,-1,-1,-1,-1,-1,-1,-1,-1,-1,1,-1,1,-1,0,0,-1,1,-1,-1,-1,1,-1,-1,1,-1,-1,-1,-1,-1,-1,-1,1,-1"
z13gy5vi3kzfzbtyu04cctyzpuz3vfqgw1w,citywok68,2014-09-20T03:45:12,Hey guys plz check out my youtube channel to c funny 2 girls 1 cup reaction  thanks and plz subscribe! Thanks﻿,1,493,hey guys plz check out my youtube channel to c funny   girls   cup reaction  thanks and plz subscribe  thanks,1,"-1,-1,1,1,-1,-1,-1,1,-1,1,1,1,1,1,-1,1,1,-1,-1,-1,-1,-1,-1,-1,-1,-1,-1,-1,-1,-1,-1,-1,-1,-1,-1,-1,-1,-1,1,-1"
z12xtzhzyr2lx53oo04cexm5vlrvxptiywo0k,sarah fitzgerald,2014-09-20T07:43:50,Please subscribe every sub gets a shout out tell me what type of videos u  want and I will try make it happen﻿,1,494,please subscribe every sub gets a shout out tell me what type of videos u  want and i will try make it happen,1,"-1,-1,-1,1,-1,-1,-1,-1,-1,-1,-1,-1,1,-1,-1,-1,1,-1,-1,-1,-1,-1,-1,-1,-1,1,-1,-1,-1,-1,-1,-1,-1,1,-1,1,-1,-1,1,1"
z12ltv24dmert1m1k23ajhgo4kydixwnf,Mohammad Abdelhafez,2014-09-20T12:33:21,Hey guys subscribe to my channel for no reason! Please!..﻿,1,495,hey guys subscribe to my channel for no reason  please   ,1,"-1,-1,-1,-1,-1,-1,-1,1,-1,1,1,-1,-1,1,-1,1,-1,-1,-1,-1,-1,-1,-1,-1,-1,-1,-1,-1,-1,-1,-1,-1,-1,1,-1,-1,-1,-1,-1,1"
z13bttm5gxecfvrqq04cevkpuxj5s1u5ys40k,Vane Cavazos,2014-09-20T15:39:44,Katycat! https://m.facebook.com/profile.php?id=1461302180794905﻿,1,496,katycat  https   m facebook com profile php id                 ,0,"-1,-1,-1,-1,-1,-1,-1,-1,-1,-1,-1,-1,-1,-1,-1,-1,-1,-1,-1,-1,-1,-1,-1,-1,-1,-1,1,-1,-1,-1,-1,-1,-1,-1,-1,-1,-1,-1,-1,-1"
z12zzvtjxkn1tvdpy04cgvcrxprhypz5oek,The Technology Zoo,2014-09-21T14:48:53,I love roar and Katy Perry. She is my favorite singer and sometimes I just  mute the volume and look at her!﻿,0,498,i love roar and katy perry  she is my favorite singer and sometimes i just  mute the volume and look at her ,0,"-1,-1,-1,-1,-1,-1,-1,-1,-1,-1,-1,-1,-1,0,-1,-1,1,-1,-1,-1,-1,0,-1,1,-1,1,-1,1,-1,-1,1,-1,-1,-1,-1,-1,-1,-1,1,-1"
z13byjoiuqvhctxc423ahhxafrizwhfto,tonya parker,2014-09-21T23:01:03,This is the best of the best video in world!!!!!!!!!!!!!!!!!!!!!!!!!!!!!﻿,0,499,this is the best of the best video in world                             ,0,"-1,-1,-1,-1,0,-1,-1,-1,-1,-1,-1,-1,-1,-1,-1,-1,-1,-1,-1,-1,0,0,-1,1,-1,-1,-1,1,-1,0,1,-1,-1,-1,-1,-1,-1,-1,-1,-1"
z132zl1rupqcylbep23jgfig3um3ct5vv,KatyPerry TheQueenOfPop,2014-09-22T06:50:24,--&gt;ATTENTION KATYCATS! Katy leads with 7 noms at this year MTV EMA! do vote daily for her: tv.  mtvema. com/vote (delete spaces) thumbs up and share on fb﻿,1,501,   gt attention katycats  katy leads with   noms at this year mtv ema  do vote daily for her  tv   mtvema  com vote  delete spaces  thumbs up and share on fb,0,"-1,-1,-1,-1,1,-1,-1,-1,-1,-1,-1,-1,-1,-1,-1,-1,1,-1,-1,-1,1,-1,-1,-1,-1,-1,-1,-1,-1,-1,-1,-1,-1,-1,-1,-1,-1,-1,1,-1"
z133unbosvyetbf4n04ccboqbqnydzhrtg4,tomo fr,2014-09-22T08:36:36,I really like this song.﻿,0,502,i really like this song ,1,"-1,-1,-1,-1,0,-1,-1,-1,-1,-1,-1,-1,-1,-1,-1,-1,-1,-1,-1,-1,0,-1,-1,-1,-1,0,-1,-1,-1,-1,-1,-1,-1,-1,-1,-1,0,-1,-1,-1"
z12pi3wbqljkwjher23stftwykbzid1fv,Hany Faisal,2014-09-22T10:08:17,my son love so much﻿,0,503,my son love so much,1,"-1,-1,-1,-1,-1,-1,-1,-1,-1,-1,-1,-1,-1,0,-1,-1,-1,-1,-1,-1,-1,-1,-1,-1,-1,-1,-1,-1,-1,-1,-1,-1,-1,-1,-1,-1,-1,-1,-1,-1"
z13iijhzqwz4gxek122ugd3bllbks1011,Alef Paulo,2014-09-22T14:33:15,Y LOVE YOU﻿,0,504,y love you,0,"-1,-1,-1,-1,-1,1,-1,-1,-1,-1,-1,-1,-1,-1,-1,-1,-1,-1,-1,-1,-1,-1,-1,-1,-1,-1,-1,-1,-1,-1,-1,-1,-1,-1,-1,-1,-1,-1,-1,-1"
z13ighawfwy5y5t5a04ccnp5dozetzfpq0g,Snipe Last,2014-09-22T19:34:46,why the elephant have a broken horn﻿,0,506,why the elephant have a broken horn,0,"-1,-1,-1,-1,-1,-1,-1,-1,-1,-1,-1,-1,-1,-1,-1,-1,-1,-1,-1,-1,-1,-1,-1,1,-1,-1,-1,1,-1,-1,1,-1,-1,-1,-1,1,-1,-1,-1,-1"
z12sfnzallq5t5iki23gfbjb0ynxgxjyc04,Vincent Lenzi,2014-09-22T23:23:33,Free itunes $25 giftcard codes: http://shhort.com/a?r=OOCnjqU2b﻿,1,507,free itunes     giftcard codes  http   shhort com a r oocnjqu b,0,"-1,-1,-1,-1,-1,-1,-1,-1,-1,-1,-1,-1,-1,-1,-1,-1,-1,-1,-1,-1,-1,-1,-1,-1,-1,-1,-1,-1,-1,-1,-1,-1,-1,-1,-1,1,-1,-1,-1,-1"
z13zyrkanyf2y3cxw04chznrcxmefpkpf3s,Shane Lumsden,2014-09-23T10:42:34,Where did she find all that make up in a freakin jungle?!﻿,0,508,where did she find all that make up in a freakin jungle  ,0,"-1,-1,-1,-1,-1,-1,-1,-1,-1,-1,-1,-1,-1,-1,-1,-1,-1,-1,-1,-1,-1,-1,-1,-1,-1,-1,-1,-1,-1,0,-1,-1,-1,-1,-1,1,-1,-1,-1,-1"
z134hvcalzjkd11w304ccxlhipnqudd5hkw0k,Danuchi zuuzu,2014-09-23T14:55:49,so cute that monkey *-*! ﻿,0,509,so cute that monkey      ,0,"-1,-1,-1,-1,-1,-1,-1,-1,-1,-1,-1,-1,-1,-1,-1,-1,-1,-1,-1,-1,-1,-1,-1,-1,-1,-1,-1,-1,1,-1,-1,-1,-1,-1,-1,-1,-1,-1,-1,-1"
z12xe1uw2sv3i1dm322nhrcazuitt3cjv04,Ronnie Cromer,2014-09-24T14:45:16,"You are all sheep, period. This is terrible music.﻿",0,512,you are all sheep  period  this is terrible music ,1,"-1,-1,-1,-1,0,1,-1,-1,-1,-1,-1,-1,-1,-1,-1,-1,-1,-1,-1,-1,0,0,-1,-1,-1,-1,-1,-1,-1,-1,-1,-1,-1,-1,-1,-1,-1,-1,-1,-1"
z13wzf2p0vmxyxgpq04cj1qaqvn3j5uigwg0k,Edouard Reyes,2014-09-24T19:31:10,"A  friend of mine has invented a big dick formula. He had a small dick (4  inches) and he did some research about this topic. During the research, he  found out the secret knowledge of penis enlargement. He applied what he  had learned and now he has a 7 inch dick. He was absolutely amazed by his  results. Of course, it took a few months. Therefore, he has written a book  about this issue in order to help guys. He asked me to promote his book :)  So, guys if you are interested and for more info check this out  https://payhip.com/b/oTIb  . He is selling it for symbolic £1. Thank you ;)﻿",1,513,a  friend of mine has invented a big dick formula  he had a small dick     inches  and he did some research about this topic  during the research  he  found out the secret knowledge of penis enlargement  he applied what he  had learned and now he has a   inch dick  he was absolutely amazed by his  results  of course  it took a few months  therefore  he has written a book  about this issue in order to help guys  he asked me to promote his book     so  guys if you are interested and for more info check this out  https   payhip com b otib    he is selling it for symbolic    thank you   ,1,"-1,-1,1,1,0,1,-1,-1,-1,-1,1,1,1,-1,-1,-1,1,-1,-1,-1,0,0,-1,1,-1,-1,-1,1,-1,0,1,-1,-1,-1,-1,1,-1,-1,1,-1"
z12yj3cwwqf4vlb2d23au5zhhvjpjth2o,The Technology Zoo,2014-09-25T02:20:26,In the beginning she was scared off everything and next thing you know she  is out in a leopard bikini!﻿,0,514,in the beginning she was scared off everything and next thing you know she  is out in a leopard bikini ,1,"-1,-1,-1,1,-1,1,-1,-1,-1,-1,-1,-1,1,-1,-1,-1,1,-1,-1,-1,-1,0,-1,1,-1,-1,-1,1,-1,0,1,-1,-1,-1,-1,1,-1,-1,1,-1"
z13gu5abbqrhtz3sd235fbfysyemhzwb304,MR magic man,2014-09-25T10:42:47,Please look at my channel﻿,1,515,please look at my channel,1,"-1,-1,-1,-1,-1,-1,-1,1,-1,-1,-1,-1,-1,1,-1,1,-1,-1,-1,-1,-1,-1,-1,-1,-1,-1,-1,-1,-1,-1,-1,-1,-1,1,-1,-1,-1,-1,-1,1"
z13zwvkqmnr0sxbte230szzgpzudspu5l04,Sam Banfield,2014-09-25T19:32:29,My three bigger secrets are: I don't think I'm good enough for me skinny  size. I'm bisexual and I sweat really freaking bad when I'm nervous. -  check out Secret by Austin Mahone's NEW Single!﻿,1,516,my three bigger secrets are  i don t think i m good enough for me skinny  size  i m bisexual and i sweat really freaking bad when i m nervous     check out secret by austin mahone s new single ,1,"-1,-1,1,1,-1,-1,-1,-1,-1,-1,-1,1,1,0,1,-1,1,-1,-1,-1,-1,-1,-1,-1,-1,0,1,-1,-1,-1,-1,-1,-1,-1,-1,-1,-1,-1,1,-1"
z13lj1oyrkmrery5o04cjfuitwyagldauxs0k,nailey nicool,2014-09-25T20:24:40,https://www.facebook.com/pages/Nailey-nicool/629410220489046?ref=hl like  mee﻿,1,517,https   www facebook com pages nailey nicool                 ref hl like  mee,0,"-1,-1,-1,-1,-1,-1,-1,-1,-1,-1,-1,-1,-1,-1,-1,-1,-1,-1,-1,-1,-1,-1,-1,-1,-1,-1,-1,-1,-1,-1,-1,-1,-1,-1,-1,-1,1,-1,-1,-1"
z12jj5kyfrjjhbq4e04cenuj1yyifhxq3hw,LuckyMusiqLive,2014-09-25T22:54:00,katy is beautiful. and this song is catchy. I'm a rapper with 25000  subscribers.. thumbs up if you hate when you take a shit and the water  splashes your balls﻿,1,518,katy is beautiful  and this song is catchy  i m a rapper with        subscribers   thumbs up if you hate when you take a shit and the water  splashes your balls,0,"-1,-1,-1,-1,0,0,-1,-1,-1,-1,-1,-1,-1,-1,-1,-1,1,-1,-1,-1,0,0,-1,1,-1,0,1,1,-1,-1,1,-1,-1,-1,-1,1,-1,-1,1,-1"
z13yjbgh1qzmxly5o04cfxm5vumeibdgq1w,Wonderfulkid,2014-09-27T01:46:14,I love her green eyes﻿,0,519,i love her green eyes,0,"-1,-1,-1,-1,-1,-1,-1,-1,-1,-1,-1,-1,-1,-1,-1,-1,-1,-1,-1,-1,-1,-1,-1,-1,-1,1,-1,-1,-1,-1,-1,-1,-1,-1,-1,-1,-1,-1,-1,-1"
z12iwthq2zn5xtxcc23hw1jjxmzddt3ft,Radiovarietyshow,2014-09-27T20:00:52,"I hear this all the time on radio and its really irritating. That being  said, i like the video﻿",0,520,i hear this all the time on radio and its really irritating  that being  said  i like the video,0,"-1,-1,-1,-1,0,-1,-1,-1,-1,-1,-1,-1,-1,-1,-1,-1,1,-1,-1,-1,0,-1,-1,1,-1,1,-1,1,-1,-1,1,-1,-1,-1,-1,-1,1,-1,1,-1"
z13vdlhzymiuvvd2h224yxwomxrhczqdw,Beryllium,2014-09-27T21:21:50,Hi everyone! My dream is to have passionate sex with Katy Perry. Some people do not believe in me…but maybe you will. Sex is a giant part of my life and it pushes me to be a better person! Please give me a chance by giving me a thumbs up! If you love my ambition please SUBSCRIBE!﻿,1,521,hi everyone  my dream is to have passionate sex with katy perry  some people do not believe in mebut maybe you will  sex is a giant part of my life and it pushes me to be a better person  please give me a chance by giving me a thumbs up  if you love my ambition please subscribe ,0,"-1,-1,-1,-1,-1,1,-1,-1,-1,-1,-1,-1,-1,1,-1,-1,1,-1,-1,-1,-1,0,-1,-1,-1,-1,-1,-1,-1,1,-1,-1,-1,1,-1,1,-1,-1,1,1"
z123tffrdqzbcd5ft234gznazwrhv1pl3,Nadeen Efein,2014-10-01T21:15:49,hi beaties! i made a new channel please go check it out and subscribe and  enjoy!﻿,1,527,hi beaties  i made a new channel please go check it out and subscribe and  enjoy ,1,"-1,-1,1,1,-1,-1,-1,1,-1,-1,-1,1,1,-1,1,1,1,-1,-1,-1,-1,-1,-1,-1,-1,1,-1,-1,-1,-1,-1,-1,-1,1,-1,1,-1,-1,1,1"
z13ugh0owyazefisp23pftph1mubdxozc04,Priyanshu Panta,2014-10-02T13:17:36,https://www.facebook.com/pages/Hiphop-Express/704682339621282                 like this page yo﻿,1,528,https   www facebook com pages hiphop express                                 like this page yo,0,"-1,-1,-1,-1,1,-1,-1,-1,-1,-1,-1,-1,-1,-1,-1,-1,-1,-1,-1,-1,1,-1,-1,-1,-1,-1,-1,-1,-1,-1,-1,-1,-1,-1,-1,-1,1,-1,-1,-1"
z125cdgp4qvxtpcj204cgbjjllbsj3zxdfo,Tiffany Isaiz,2014-10-02T22:53:52,Our Beautiful Bella has been diagnosed with Wobbler's Syndrome. There is no  way we could afford to do her MRI or surgery. She is not just a dog she is  a very special member of our family. Without the surgery we fear we will  lose her. Please help!  http://www.gofundme.com/f7ekgw﻿,1,529,our beautiful bella has been diagnosed with wobbler s syndrome  there is no  way we could afford to do her mri or surgery  she is not just a dog she is  a very special member of our family  without the surgery we fear we will  lose her  please help   http   www gofundme com f ekgw,0,"-1,-1,-1,-1,-1,-1,-1,-1,-1,-1,-1,-1,-1,-1,-1,-1,-1,1,-1,-1,-1,1,-1,1,-1,-1,-1,1,-1,-1,1,-1,-1,1,-1,1,-1,-1,-1,1"
z13gwfnb3pqgzhgmi221epogwszbhdcg104,alin silviu lazar,2014-10-05T15:13:27,http://www.googleadservices.com/pagead/aclk?sa=L&amp;ai=CSyOEB1wxVPCfL7D27AbGpYDgBJDPm6IH6MHu05wBgJXbv8sBEAEgkN7lJVCF7byH_f____8BYIOFgICAHKABsKG31wPIAQKpAh_KmC0hBpM-qAMByAPBBKoEkwFP0KullxqI1MG6o43HVzE-eFMqRG4Tu5LLBU_fsZ8gn0HBkJhBX-m83W1TS3_3Dx_HwPdX1Kazsj8o7SIEcVJjmBNsWyiJEcqvHXLbdzStUBOFaloYInWm0_rOOCppS2AuAT6zguICKm0lI83duwMAbzqvenE8TRfAzOrltBb037VzYv_XI4hBNQ2nvh19MrBgE0SIBgGgBgKAB7jeyCg&amp;num=1&amp;cid=5Ggs_m_9mA3TI40fS6mVPICS&amp;sig=AOD64_1OFC7Seh_1pOp-jYrbS7X6-heeNQ&amp;client=ca-pub-8252267209931889&amp;adurl=http://blog.2parale.ro/2014/10/challenge-pentru-afiliati-aplica-la-noile-programe-de-afiliere-si-fii-business-boomerul-lunii/&amp;nm=2&amp;mb=2&amp;bg=!A0QoUc7Q48v3_QIAAABpUgAAACsqAR0_VgOQWQxjmPUyvKoSf3K-q1BvKf9ZE4jhNC3ovckKxCbAFzZpAJiBXWBvVq4jrDgZ8q3rInlwgaBy_bXlfw7ma6dk0RJG14ZkRyizwqdi7HxgGE9tNDD9abflTFkBMbFfcJixNtHwbwkJ6N2onLH2D9EvEagPhoEwXOgBnu5ibgtRkgnAcQ1OIbgMzgAFNSc0lsaRiqj8HQR8T12dWv_7biY4k6I3y4yubloTdE_4XVKlnVeADZzF1L_xRYQkE6Wsur3EdLJWGk8fLq_QALdI-wAzNuysgqjNRDY6VucKLplZONyiSdKc9ebX-0dbHjZdW0LbsJBi40gXm0D0p5KRhv8XInQlI53__wQBaHS8zX4MJHw5vWrkPXFOeKs ﻿,1,533,http   www googleadservices com pagead aclk sa l amp ai csyoeb wxvpcfl d  abgpydgbjdpm ih mhu  wbgjxbv sbeaegkn ljvcf byh f     byiofgicahkabskg  wpiaqkpah kmc hbpm qambyapbbkoekwfp kullxqi mg o  hvze efmqrg tu llbu fsz gn hbkjhbx m  w ts   dx hwpdx kazsj o siecvjjmbnswyijecqvhxlbdzstubofaloyinwm  roocpps auat zguickm li  duwmabzqvene trfazorltbb   vzyv xi hbnq nvh  mrbge sibgggbgkab jeycg amp num   amp cid  ggs m  ma ti  fs mvpics amp sig aod    ofc seh  pop jyrbs x  heenq amp client ca pub                  amp adurl http   blog  parale ro         challenge pentru afiliati aplica la noile programe de afiliere si fii business boomerul lunii  amp nm   amp mb   amp bg  a qouc q  v  qiaaabpugaaacsqar  vgoqwqxjmpuyvkosf k q bvkf ze jhnc ovckkxcbafzzpajibxwbvvq jrdgz q rinlwgaby bxlfw ma dk rjg  zkryizwqdi hxgge tndd abfltfkbmbffcjixnthwbwkj n onlh d eveagphoewxogbnu ibgtrkgnacq oibgmzgafnsc lsariqj hqr t  dwv  biy k i y yublotde  xvklnveadzzf l xryqke wsur edljwgk flq qaldi waznuysgqjnrdy vucklplzonyisdkc ebx  dbhjzdw lbsjbi  gxm d p krhv xinqli    wqbahs zx mjhw vwrkpxfoeks ,0,"-1,-1,-1,-1,-1,-1,-1,-1,-1,-1,-1,-1,-1,-1,-1,-1,-1,-1,-1,-1,-1,-1,-1,-1,-1,1,1,-1,-1,-1,-1,-1,-1,-1,-1,1,-1,-1,-1,-1"
z13ccdhqkujfe3i3s221tj5h1wmrfjibe04,Amanda C,2014-10-05T23:21:13,Awesome video this is one of my favorite  songs😀😀😀😀😀😀😀❤️❤️❤️❤️❤️❤️❤️❤️💎💎💎💎💎💄💄💄💄💋💋💋💋﻿,0,534,awesome video this is one of my favorite  songs,1,"-1,-1,-1,-1,0,-1,-1,-1,-1,-1,-1,-1,-1,0,-1,-1,-1,-1,-1,-1,0,0,-1,-1,-1,-1,-1,-1,-1,-1,-1,-1,-1,-1,-1,-1,-1,-1,-1,-1"
z12zer0p2uaowfzqu04ccnczoyyryjj5u1s,Annie Trace,2014-10-06T16:13:36,If only I had the body like Katy Perry :)). She looks so hot. I love her  ^^!﻿,0,535,if only i had the body like katy perry      she looks so hot  i love her     ,0,"-1,-1,-1,-1,-1,-1,-1,-1,-1,-1,-1,-1,-1,-1,-1,-1,-1,-1,-1,-1,-1,-1,-1,1,-1,1,-1,1,-1,-1,1,-1,-1,-1,-1,-1,1,-1,-1,-1"
z12ih1iyqojdhlxgu04cdhsb1ofdtll5a3g,Deepty Awasthy,2014-10-07T03:41:31,"The song is very good ...but the video makes no sense...just a nonsense  video...I mean she is telling her story of being stuck on an island, but  the song doesn't fit in the situation...but nvm...The song is good﻿",0,537,the song is very good    but the video makes no sense   just a nonsense  video   i mean she is telling her story of being stuck on an island  but  the song doesn t fit in the situation   but nvm   the song is good,0,"-1,-1,-1,-1,-1,-1,-1,-1,-1,-1,-1,-1,-1,-1,-1,-1,-1,-1,-1,-1,-1,0,-1,1,-1,0,-1,1,-1,0,1,-1,-1,-1,-1,1,-1,-1,-1,-1"
z121gzyrrsm4jlvid04cjj0zzpyxwv3qocc,desing,2014-10-08T07:19:15,Who else would give Katy perry a good old mighty roar? ;)﻿,0,538,who else would give katy perry a good old mighty roar    ,0,"-1,-1,-1,-1,-1,-1,-1,-1,-1,-1,-1,-1,-1,-1,-1,-1,-1,-1,-1,-1,-1,-1,-1,-1,-1,-1,-1,-1,-1,-1,-1,-1,-1,-1,-1,1,-1,-1,-1,-1"
z12pdlwxuwmktfmoq04civd5ypmzv5np0os0k,Maryam Yassine,2014-10-08T12:39:49,OMG I LOVE YOU KATY PARRY YOUR SONGS ROCK!!!!!!!!!!!!!!!!! THATS A TOTAL  SUBSCRIBE﻿,0,539,omg i love you katy parry your songs rock                  thats a total  subscribe,0,"-1,-1,-1,-1,-1,1,-1,-1,-1,-1,-1,-1,-1,-1,-1,-1,-1,-1,-1,-1,-1,-1,-1,-1,-1,1,-1,-1,-1,-1,-1,-1,-1,-1,-1,1,-1,-1,-1,-1"
z13iyvl5vzqledtym04cirookpa1edwpvuw0k,Tomas Adomaitis,2014-10-08T18:24:05,https://www.paidverts.com/ref/tomuciux99 esyest money ever. join to our  team!!!!﻿,1,540,https   www paidverts com ref tomuciux   esyest money ever  join to our  team    ,1,"-1,-1,-1,-1,-1,-1,-1,-1,-1,-1,-1,-1,-1,-1,-1,-1,-1,1,-1,-1,-1,-1,-1,-1,-1,-1,-1,-1,-1,-1,-1,-1,-1,-1,-1,-1,-1,-1,-1,-1"
z12ohzkgtoreyzoqw04ccxgzxmnag3nhq5s,Danny Ly,2014-10-09T00:37:48,FREe ITunes Gift card http://shhort.com/a?r=x6J4gBrne﻿,1,542,free itunes gift card http   shhort com a r x j gbrne,0,"-1,-1,-1,-1,-1,-1,-1,-1,-1,-1,-1,-1,-1,-1,-1,-1,-1,-1,-1,-1,-1,-1,-1,-1,-1,-1,-1,-1,-1,-1,-1,-1,-1,-1,-1,1,-1,-1,-1,-1"
z12pf3tjfnmkhfcca223xlp5ayb3yfosc,Miss.Farrell Wall,2014-10-09T13:28:49,"i was playing this song and the baby in my belly started to dance to  it.....sooooo cute, but had to take the song out cause of copy right and  add in a youtube made song....still sooo cute the baby danced to this song  LMFAO!!! https://plus.google.com/111982027348137311818/posts/g2JVinPueMo﻿",1,543,i was playing this song and the baby in my belly started to dance to  it     sooooo cute  but had to take the song out cause of copy right and  add in a youtube made song    still sooo cute the baby danced to this song  lmfao    https   plus google com                       posts g jvinpuemo,1,"-1,-1,-1,1,0,-1,-1,-1,-1,-1,-1,-1,1,0,-1,-1,1,-1,-1,-1,0,-1,-1,1,-1,0,-1,1,-1,0,1,-1,-1,-1,-1,1,-1,-1,1,-1"
z13osblxvrj0ibtcn22cjjzguw31d5534,Dana Nipper,2014-10-09T23:17:15,katy perry is awesome﻿,0,544,katy perry is awesome,0,"-1,-1,-1,-1,-1,-1,-1,-1,-1,-1,-1,-1,-1,-1,-1,-1,-1,-1,-1,-1,-1,0,-1,-1,-1,-1,-1,-1,-1,-1,-1,-1,-1,-1,-1,-1,-1,-1,-1,-1"
z13ahnbavmbgi50bv04cenuj1yyifhxq3hw,LuckyMusiqLive,2014-10-09T23:22:50,this song is so addicting. the hook is dope and catchy. love the video too.  I'm getting popular fast because i rap real.. thumbs up if you piss next to  the water in the toilet so its quiet................................﻿,1,545,this song is so addicting  the hook is dope and catchy  love the video too   i m getting popular fast because i rap real   thumbs up if you piss next to  the water in the toilet so its quiet                                ,0,"-1,-1,-1,-1,0,0,-1,-1,-1,-1,-1,-1,-1,-1,-1,-1,1,-1,-1,-1,0,0,-1,1,-1,0,1,1,-1,0,1,-1,-1,-1,-1,-1,-1,-1,1,-1"
z134htdz0kjvgbd5w04cebardrm5zp15mw40k,Matt Twine,2014-10-10T16:24:57,Nice song .See my new track.﻿,1,546,nice song  see my new track ,1,"-1,-1,-1,-1,-1,-1,-1,-1,-1,-1,-1,-1,-1,0,1,-1,-1,-1,-1,-1,-1,-1,-1,-1,-1,-1,-1,-1,-1,-1,-1,-1,-1,-1,-1,-1,-1,-1,-1,-1"
z12lhtpotlygylwcj23idphbpsjih0e0,Kane Bradford,2014-10-10T18:09:13,I love this sooooooooooooong I love katy perry﻿,0,547,i love this sooooooooooooong i love katy perry,1,"-1,-1,-1,-1,0,-1,-1,-1,-1,-1,-1,-1,-1,-1,-1,-1,-1,-1,-1,-1,0,-1,-1,-1,-1,1,-1,-1,-1,-1,-1,-1,-1,-1,-1,-1,-1,-1,-1,-1"
z12auh0b1vajetih404cfbl5uyfehpi4kb4,fortune kitty52,2014-10-11T11:26:00,Since when has Katy Perry had her own YouTube channel?﻿,0,549,since when has katy perry had her own youtube channel ,1,"-1,-1,-1,-1,-1,-1,-1,1,-1,-1,-1,-1,-1,-1,-1,1,-1,-1,-1,-1,-1,-1,-1,-1,-1,-1,-1,-1,-1,-1,-1,-1,-1,-1,-1,-1,-1,-1,-1,-1"
z13myxsrskidhjt5u04cfb3hpqn4vb1q5ts0k,imscarlet,2014-10-11T17:16:36,"Every time I watch this mv I just so so so glad that I live in a world that  don't have to worry about running from a real, human eating tiger.﻿",0,550,every time i watch this mv i just so so so glad that i live in a world that  don t have to worry about running from a real  human eating tiger ,0,"-1,-1,-1,-1,0,-1,-1,-1,-1,-1,-1,-1,-1,-1,-1,-1,-1,-1,-1,-1,0,-1,-1,-1,-1,1,-1,-1,-1,0,-1,-1,-1,-1,-1,1,-1,-1,-1,-1"
z13vz1qqzlq5flz2k223znxpkmvgutlei,b0b1t.48058475,2014-10-12T03:45:07,i rekt ur mum last nite. cuz da haterz were 2 much 4 meh lik dis if u cri evertim and sponswer mi robox vidz https://www.indiegogo.com/projects/gimme-dem-moneyz-4-roblox/x/8851222#home﻿,1,551,i rekt ur mum last nite  cuz da haterz were   much   meh lik dis if u cri evertim and sponswer mi robox vidz https   www indiegogo com projects gimme dem moneyz   roblox x         home,0,"-1,-1,-1,-1,-1,-1,-1,-1,-1,-1,-1,-1,-1,-1,-1,-1,1,-1,-1,-1,-1,-1,-1,-1,-1,1,-1,-1,-1,-1,-1,-1,-1,-1,-1,-1,-1,-1,1,-1"
z13gw3uz2kfkcf3np22nsvz4zkr0u5xzl04,ambareesh nimkar,2014-10-12T05:09:56,"""eye of the tiger"" ""i am the champion"" seems like katy perry is using  titles of old rock songs for lyrics..﻿",0,552, eye of the tiger   i am the champion  seems like katy perry is using  titles of old rock songs for lyrics  ,0,"-1,-1,-1,-1,-1,-1,-1,-1,-1,-1,-1,-1,-1,-1,-1,-1,-1,-1,-1,-1,-1,0,-1,1,-1,1,-1,1,-1,-1,1,-1,-1,-1,-1,-1,1,-1,-1,-1"
