comment_id,author,date,old_text,expected_label,cid,text,model_pred,vectors,id
z13jffkgavyhv5tkq22lyboo2subj1vu0,Tushti Chakraborty,2014-09-19T15:30:47,I &lt;3 Katy Perry!﻿,0,487,i  lt   katy perry ,0,"-1,-1,-1,-1,-1,-1,-1,-1,0,-1",173
LneaDw26bFvA7_ot-Z3kQHP4GTE3g_Zc2fsfdZ4COpI,Adam B,,adam b beats check out my page 2013,1,1474,adam b beats check out my page     ,1,"-1,1,-1,-1,-1,-1,-1,-1,-1,-1",174
z125zruy3pfweniga04celt52kjjjxvgik40k,Klaudia Marysol,,Check out this video on YouTube:﻿,1,1177,check out this video on youtube ,1,"-1,1,-1,-1,-1,-1,-1,-1,-1,-1",175
z12qidxykke3jnmm522nj3noypyaedja504,Destiny Boatley,2015-05-25T15:08:58.329000,I like this song very much﻿,0,1315,i like this song very much,0,"0,-1,-1,-1,-1,-1,-1,-1,-1,-1",176
z12msjqximryxdfz104cjhbhtw2ld5ipsh4,SIR JOHN,2015-05-07T02:28:12.704000,EMINEM the best EVER.﻿,0,1576,eminem the best ever ,0,"-1,-1,-1,-1,-1,-1,-1,-1,0,-1",177
z12iix3puuj5wxufw23fzrnybxqdy3v4s04,Josh Snow,2015-04-25T00:37:34.423000,Check out this video on YouTube:﻿,1,933,check out this video on youtube ,1,"-1,1,-1,-1,-1,-1,-1,-1,-1,-1",178
LZQPQhLyRh9vw01Xvvw5yWzZEUOPG1hSgRMHep55-Yw,8-BitMusic,2013-12-27T23:07:50,Hey guys! Im a 12 yr old music producer. I make chiptunes and 8bit music.  It would be wonderful if you checked out some of my 8bit remixes! I even  have a gangnamstyle 8bit remix if you would like to check that out ;)  Thanks!!,1,27,hey guys  im a    yr old music producer  i make chiptunes and  bit music   it would be wonderful if you checked out some of my  bit remixes  i even  have a gangnamstyle  bit remix if you would like to check that out     thanks  ,1,"-1,1,-1,-1,-1,-1,-1,1,-1,-1",179
z135ihwjrofccvbzu04cehzp3prte5jyccg,marko kacar,2015-05-26T09:54:10.695000,best song in world﻿,0,1619,best song in world,0,"0,-1,-1,-1,-1,-1,-1,-1,0,-1",180
LneaDw26bFtHv3jHn8C0y5MliNA2oqkPogUL4HmsZPQ,Lil M,,Lil m !!!!! Check hi out!!!!! Does live the way you lie and many more ! Check it out!!! And subscribe,1,1520,lil m       check hi out      does live the way you lie and many more   check it out    and subscribe,1,"-1,1,-1,-1,-1,-1,-1,1,-1,1",181
z12kcx2ahwmpupnw004cdt3rwqfes3xgbns0k,Mehmet Demirel,2014-11-05T21:25:27,http://www.gcmforex.com/partners/aw.aspx?Task=JoinT2&amp;AffiliateID=9107﻿,1,141,http   www gcmforex com partners aw aspx task joint  amp affiliateid     ,1,"-1,-1,-1,-1,-1,1,-1,-1,-1,-1",182
z12mvbxwqoz1hlhay04cfnuzfxuwdx1pj54,Charles Baptist,2014-08-20T20:18:13,Help Please!!  http://www.gofundme.com/RJanimalcare﻿,1,381,help please    http   www gofundme com rjanimalcare,1,"-1,-1,-1,-1,-1,1,-1,-1,-1,-1",183
z13uhpnygtntxr1q104cdb441oz0c5lz3yk0k,melissa delaney,,Check out this playlist on YouTube: ﻿,1,1182,check out this playlist on youtube  ,1,"-1,1,-1,-1,-1,-1,-1,-1,-1,-1",184
z13kvddrenfhxjeod04cg11pkk2sg1vbr0c,Buffo hrdfjiu,2014-09-13T17:48:14,"I really don't understand how this has 600 million views lol. I'm not  hating or anything, it's just confusing. ﻿",0,457,i really don t understand how this has     million views lol  i m not  hating or anything  it s just confusing  ,0,"-1,-1,-1,-1,-1,-1,-1,1,-1,-1",185
z12cydggrzyesrklw23qwzexerqavj11e,monkey moments,2015-05-27T09:24:10.239000,i love this song thumsb up to you﻿,0,1605,i love this song thumsb up to you,0,"0,-1,0,-1,-1,-1,0,-1,-1,-1",186
z13nw3lhgt2nf5wwe04cdlx5iyaydznrve0,Wert Walleet,2014-11-08T09:15:22,"This song is great there are 2,127,315,950 views wow﻿",0,279,this song is great there are               views wow,0,"0,-1,-1,-1,-1,-1,0,-1,-1,-1",187
z13rv5wieu2fdnogl04cdl0bdmjuunpwcnk0k,C Williams,2015-05-18T21:51:36.079000,Check out this playlist on YouTube<br />﻿,1,1733,check out this playlist on youtube br   ,1,"-1,1,-1,-1,-1,-1,-1,-1,-1,-1",188
z12avxpx4t3xib0fq225jvlbdnqfh320y,Eliana Guzman,2015-05-24T15:47:50.071000,Wow I love it ﻿,0,781,wow i love it ,0,"-1,-1,0,-1,-1,-1,0,-1,0,-1",189
z12zdj5ptyzpurkan04chtsqjszjxfmrk2w,Gloria Garcia,2014-11-04T11:38:51,subscribe to itz recaps and above diddle﻿,1,103,subscribe to itz recaps and above diddle,1,"-1,-1,-1,-1,-1,-1,-1,-1,-1,1",190
z13wxrja2ny2jfq0r22ojhwwdpimt5ogu04,Chloe Steiner,2014-09-16T04:11:05,"Katy Perry is part of me Katy Perry is my firework Katy Perry, I love you﻿",0,471,katy perry is part of me katy perry is my firework katy perry  i love you,0,"-1,-1,0,-1,-1,-1,0,-1,-1,-1",191
z12uvzpw4tufgf2qw04chd5abu3uvf4rw5o,Eric Gonzalez,2015-05-24T15:35:03.844000,"To help shakira become the first female to hit 1billiom views, I&#39;ve decided to watch this Video at least one a day. Everyday! Shakifans we r so close just hit the replay button !!!﻿",0,1648,to help shakira become the first female to hit  billiom views  i     ve decided to watch this video at least one a day  everyday  shakifans we r so close just hit the replay button    ,0,"-1,-1,-1,1,-1,-1,-1,1,-1,-1",192
z13iijhzqwz4gxek122ugd3bllbks1011,Alef Paulo,2014-09-22T14:33:15,Y LOVE YOU﻿,0,504,y love you,0,"-1,-1,0,-1,-1,-1,0,-1,0,-1",193
z13qf1qgcyigy14mx223iv2yqxb5ebze4,Pugnsuit,2015-05-28T21:32:08.714000,This song is about Rape and Cheating     <br /><br /><br /><br /><br /><br /><br /><br /><br /><br />Basically.....﻿,0,1163,this song is about rape and cheating   br    br    br    br    br    br    br    br    br    br   basically     ,0,"0,-1,-1,-1,-1,-1,-1,-1,-1,-1",194
z13chhog1nbldb2xp04cgtkxcx35z1djpf0,Free Video Tv,2015-05-21T21:15:41.869000,subscribe to me and I wil subscribe to you back﻿,1,1696,subscribe to me and i wil subscribe to you back,1,"-1,-1,-1,-1,-1,-1,-1,-1,-1,1",195
LneaDw26bFsTytWDcS_4DFWlbxAlCfw2c_9PIcArNdw,chantel toledo,,Tell us the title so i can like and subscribe your music fgw please,1,1302,tell us the title so i can like and subscribe your music fgw please,1,"-1,-1,-1,-1,-1,-1,-1,-1,-1,1",196
z122djvavnibdrr1j23pjbm4szvfuzlzd04,RandomFuntime,2014-08-04T13:27:47.451000,"Hey I&#39;m a British youtuber!!<br />I upload Weekly!! <br />It would mean the world if you could subscribe!!<br />Thanks,Joyce!!<br />﻿",1,1114,hey i     m a british youtuber   br   i upload weekly    br   it would mean the world if you could subscribe   br   thanks joyce   br   ,1,"-1,-1,-1,-1,-1,-1,-1,-1,-1,1",197
LneaDw26bFvnMp5q__XiHBvyky8sw2uF9b-ZfDZi2to,WeTheDopeSquad,,WATCH MY VIDEOS AND SUBSCRIBE,1,1260,watch my videos and subscribe,1,"-1,-1,-1,-1,-1,-1,-1,-1,-1,1",198
z13yydnzzta0frsum23rx31imxmdfn4t3,Baptiste Blomme,2015-05-24T11:35:58.714000,Why did they stop their career in music? This music rocks !﻿,0,783,why did they stop their career in music  this music rocks  ,0,"-1,-1,-1,-1,-1,-1,-1,1,-1,-1",199
z12odl0g1lv2sny2a23mxtijuvftznai404,Alex Lynch,2014-10-14T17:27:28,"C'mon Katy you are so close to 14,000,000 subscribers...come up with  another hit like this and it will happen﻿",0,563,c mon katy you are so close to            subscribers   come up with  another hit like this and it will happen,0,"-1,-1,-1,-1,-1,-1,-1,1,-1,-1",200
z12wvru4rzf5jx0wj04cgx5q1qi1w554ba0,Erin Williams,2015-05-06T17:19:21.193000,Best. Song. EVER 🙌﻿,0,1579,best  song  ever ,0,"0,-1,-1,-1,-1,-1,-1,-1,0,-1",201
z12mznwahnvyz3mjm04cfnizwzmijtjhsp40k,Those two boys,2015-06-05T03:15:10,Please subscribe to us and thank you﻿,1,692,please subscribe to us and thank you,1,"-1,-1,-1,-1,-1,-1,-1,-1,-1,1",202
LneaDw26bFsZ8_-MJ2YdPL4dt9_QKyP6RI_K_Gt7jIM,LaMusician,,could you guys please check out my channel for hiphop beats?,1,1445,could you guys please check out my channel for hiphop beats ,1,"-1,1,-1,-1,-1,-1,-1,1,-1,-1",203
_2viQ_Qnc6_IouTIqS8ontdQofcZwF4O6cG0-rFPXvo,lauren sophie,2013-10-02T15:30:38.020000,her voice is so wow!,0,1817,her voice is so wow ,0,"-1,-1,-1,-1,-1,-1,0,-1,-1,-1",204
_2viQ_Qnc69uhVbXr8SjkhLHu7T1HOxqrEF1f6h8vUA,Finuccsi Aka csincsilla3M,2013-09-21T15:43:40.171000,/watch?v=Dtqcftr1Fac JUSTIEN BIEBER CAR 2013. LIKE&amp;SUBSCRIBE,1,1839, watch v dtqcftr fac justien bieber car       like amp subscribe,1,"-1,-1,-1,-1,-1,-1,-1,-1,-1,1",205
z12zujgautikhxpn122mixwjkwavuldmd,alejandro rojas,2015-05-23T03:50:04.006000,Oh my god go to 1 billion of replay i love shakira﻿,0,1680,oh my god go to   billion of replay i love shakira,0,"-1,-1,0,1,-1,-1,0,-1,-1,-1",206
_2viQ_Qnc68WY7dYEqu0Gx6d1pRcC1S2JCkyKwPxBEE,timemastro1,2013-09-05T19:31:01.424000,god she is so sexy! drives me crazy!,0,1865,god she is so sexy  drives me crazy ,0,"-1,-1,-1,-1,-1,-1,0,1,-1,-1",207
z12csjyqqru3tvlcb22hz3vrrn3jzfzyg04,Thiago Andrade,2015-05-25T08:08:49.121000,Nice vídeo shakira good﻿,0,1637,nice vdeo shakira good,0,"-1,-1,-1,1,-1,-1,0,-1,0,-1",208
_2viQ_Qnc6_QPhRwA4ZFbviXqXHvKyKJb7UivUZFUH0,TheEpicMixx':)x,2013-08-08T14:54:45.831000,Please.. Check my channel out:) I subscribe back..;),1,1906,please   check my channel out   i subscribe back    ,1,"-1,1,-1,-1,-1,-1,-1,-1,-1,1",209
z13txnfjov2tgle5z04cfd4jlyflx52ysbk,tchangkou,2014-12-04T01:31:02.296000,Check out this video on YouTube:﻿,1,984,check out this video on youtube ,1,"-1,1,-1,-1,-1,-1,-1,-1,-1,-1",210
z12bwhjbwl3twfayl04cjl0bfriocdkauk40k,Adan E,2015-05-24T10:33:48.659000,Rihanna is so beautiful and amazing ♥♥♥♥♥love her so much♥♥♥♥ forever RiRi fan ♥ ♥ ♥ ♥ ♥ ♥ ﻿,0,1347,rihanna is so beautiful and amazing love her so much forever riri fan       ,0,"-1,-1,0,-1,-1,-1,0,-1,-1,-1",211
z124w1aolk2tvpifc23fzxuy1v20ghkfp,Devin Thornton,2014-07-23T08:37:48.377000,i love this song so much!!!!!!!!!!!!!!!!!!!!!!!!!!!!!!!!!!!!!!!!!!!!!!!!!!!!!!!!!!!!!!!!!!!!!!!!!!!!!!﻿,0,1123,i love this song so much                                                                              ,0,"0,-1,0,-1,-1,-1,-1,-1,-1,-1",212
z12wgp0z4oj1sxqqf04cgfuwczfsvnjw3ew,sunny leone,2015-06-05T15:11:28,https://binbox.io/DNCkM#qT4Q1JB1﻿,1,695,https   binbox io dnckm qt q jb ,1,"-1,-1,-1,-1,-1,1,-1,-1,-1,-1",213
z12psnvzpybbshnrc04citbzwpfmfnb5jws0k,ann anne,2015-01-28T16:29:16.993000,Check out this video on YouTube:﻿,1,1022,check out this video on youtube ,1,"-1,1,-1,-1,-1,-1,-1,-1,-1,-1",214
z133ibkihkmaj3bfq22rilaxmp2yt54nb,Debora Favacho (Debora Sparkle),2015-05-21T14:08:41.338000,BEST SONG EVER X3333333333﻿,0,1702,best song ever x          ,0,"0,-1,-1,-1,-1,-1,-1,-1,0,-1",215
z12iwthq2zn5xtxcc23hw1jjxmzddt3ft,Radiovarietyshow,2014-09-27T20:00:52,"I hear this all the time on radio and its really irritating. That being  said, i like the video﻿",0,520,i hear this all the time on radio and its really irritating  that being  said  i like the video,0,"-1,-1,-1,-1,-1,-1,0,-1,-1,-1",216
z13vz1qqzlq5flz2k223znxpkmvgutlei,b0b1t.48058475,2014-10-12T03:45:07,i rekt ur mum last nite. cuz da haterz were 2 much 4 meh lik dis if u cri evertim and sponswer mi robox vidz https://www.indiegogo.com/projects/gimme-dem-moneyz-4-roblox/x/8851222#home﻿,1,551,i rekt ur mum last nite  cuz da haterz were   much   meh lik dis if u cri evertim and sponswer mi robox vidz https   www indiegogo com projects gimme dem moneyz   roblox x         home,1,"-1,-1,-1,-1,-1,1,-1,-1,-1,-1",217
z12qzr1q3vqdghaln23asbvwhrmftzrox04,Robin Delwiche,2014-11-12T01:37:07,I still to this day wonder why this video is so popular ?? illuminati  confirmed ??﻿,0,314,i still to this day wonder why this video is so popular    illuminati  confirmed   ,0,"-1,-1,-1,-1,-1,-1,0,-1,-1,-1",218
z13mxjrbuyv5slha204cjdwg0wauylyap3w,Peter Wilkes,2014-09-15T15:48:57,"really want this video to get 1 billion views, would be amazing!﻿",0,465,really want this video to get   billion views  would be amazing ,0,"-1,-1,-1,-1,-1,-1,0,-1,-1,-1",219
z12hvvki4xite3sjl04cfp34wxy0fr0qjgs,latisha garcia,2015-03-09T00:33:08.463000,Check out this playlist on YouTube: I tried﻿,1,982,check out this playlist on youtube  i tried,1,"-1,1,-1,-1,-1,-1,-1,-1,-1,-1",220
_2viQ_Qnc6-PfOjDtTwbTalW_5TRtvBKMcHZdDrcI2o,laura elliott,2013-07-16T05:48:01.795000,i watched this because of the large amount of views and now i am convinced it is because that girl is so hot,0,1936,i watched this because of the large amount of views and now i am convinced it is because that girl is so hot,0,"-1,-1,-1,-1,-1,-1,0,1,-1,-1",221
z13qdpxqiziasxzsv234hhqoeretuhabc04,Merenguette,2014-10-21T04:52:03,this video is great .....!!! I love this........and like much katy perry﻿,0,587,this video is great          i love this        and like much katy perry,0,"-1,-1,0,-1,-1,-1,0,-1,-1,-1",222
LneaDw26bFuKSv_W4OOCnX-bIBR37W0G13MKHZrFVzI,Terry-Lee Mackenney,,everyone come and check out the new GTA 5 Gameplay right Here : /watch?v=6_H0m5sAYho,1,1447,everyone come and check out the new gta   gameplay right here    watch v   h m sayho,1,"-1,1,-1,-1,-1,-1,-1,-1,-1,-1",223
z13psdarpuzbjp1hh04cjfwgzonextlhf1w,bilal bilo,2015-05-22T20:36:36.926000,I liked<br />﻿,0,1684,i liked br   ,0,"-1,-1,-1,-1,-1,-1,0,-1,0,-1",224
z13zwvkqmnr0sxbte230szzgpzudspu5l04,Sam Banfield,2014-09-25T19:32:29,My three bigger secrets are: I don't think I'm good enough for me skinny  size. I'm bisexual and I sweat really freaking bad when I'm nervous. -  check out Secret by Austin Mahone's NEW Single!﻿,1,516,my three bigger secrets are  i don t think i m good enough for me skinny  size  i m bisexual and i sweat really freaking bad when i m nervous     check out secret by austin mahone s new single ,1,"-1,1,-1,-1,-1,-1,-1,-1,-1,-1",225
z13mf1fz1mmrdr4hf04cdnhxmmqtulfgchc,Nossnevs SWEDEN,2014-08-12T15:44:16.615000,"Check out: My Hood Doh, by Flixter Nossnevs﻿",1,1112,check out  my hood doh  by flixter nossnevs,1,"-1,1,-1,-1,-1,-1,-1,-1,-1,-1",226
z120g3vajzzyvndvs23xdzh41ufmy3lvj,Kiarna Burke,2015-04-11T08:36:04.370000,Check out this video on YouTube:﻿,1,949,check out this video on youtube ,1,"-1,1,-1,-1,-1,-1,-1,-1,-1,-1",227
z13ly1xqgu2isv5vg23cdl5g3tuyu11gy04,Tammy Floyd,2015-04-09T06:07:26.158000,Check out this video on YouTube:﻿,1,952,check out this video on youtube ,1,"-1,1,-1,-1,-1,-1,-1,-1,-1,-1",228
z13mgxsztmn1hpam223tcxbglvi2wpx4o04,Steven Sachel,2015-05-21T01:24:34.058000,never gets old﻿,0,823,never gets old,0,"-1,-1,-1,-1,-1,-1,-1,-1,0,-1",229
z12nejhigtr0tdvy504cgfcrhzvycxzin0k,Detroit Red Wings,2014-11-06T20:55:09,http://www.gofundme.com/gvr7xg﻿,1,174,http   www gofundme com gvr xg,1,"-1,-1,-1,-1,-1,1,-1,-1,-1,-1",230
z13ywdzqsnmjhts2v22qzrhpxzn5frizg04,Eidya Pal,2015-05-25T14:43:55.353000,i totally love this song. absolutely fantastic! i love ya shakira!﻿,0,1632,i totally love this song  absolutely fantastic  i love ya shakira ,0,"0,-1,0,1,-1,-1,0,-1,-1,-1",231
z12jenlhyre0eheyx04ch1aquxfdsvgpd44,Special Pentrutine,2014-08-22T04:50:50,"&lt;script&gt;document.write('&lt;a target=""_self"" href="" http://rover.ebay.com/rover/1/710-53481-19255-0/1?icep_ff3=1&amp;pub=5575096797&amp;toolid=10001&amp;campid=5337555197&amp;customid=bogdan+grigore&amp;ipn=psmain&amp;icep_vectorid=229508&amp;kwid=902099&amp;mtid=824&amp;kw=lg""&gt;check  this out new arive on ebay&lt;/a&gt;&lt;img  style=""text-decoration:none;border:0;padding:0;margin:0;"" src="" http://rover.ebay.com/roverimp/1/710-53481-19255-0/1?ff3=1&amp;pub=5575096797&amp;toolid=10001&amp;campid=5337555197&amp;customid=bogdan+grigore&amp;mpt='+Math.floor(Math.random()*999999999)+'""&gt;');&lt;/script&gt;&lt;noscript&gt;&lt;a  target=""_self"" href="" http://rover.ebay.com/rover/1/710-53481-19255-0/1?icep_ff3=1&amp;pub=5575096797&amp;toolid=10001&amp;campid=5337555197&amp;customid=bogdan+grigore&amp;ipn=psmain&amp;icep_vectorid=229508&amp;kwid=902099&amp;mtid=824&amp;kw=lg""&gt;check  this out new arive on ebay&lt;/a&gt;&lt;img  style=""text-decoration:none;border:0;padding:0;margin:0;"" src="" http://rover.ebay.com/roverimp/1/710-53481-19255-0/1?ff3=1&amp;pub=5575096797&amp;toolid=10001&amp;campid=5337555197&amp;customid=bogdan+grigore&amp;mpt=[CACHEBUSTER] ""&gt;&lt;/noscript&gt;﻿",1,384, lt script gt document write   lt a target   self  href   http   rover ebay com rover                       icep ff    amp pub            amp toolid       amp campid            amp customid bogdan grigore amp ipn psmain amp icep vectorid        amp kwid        amp mtid     amp kw lg  gt check  this out new arive on ebay lt  a gt  lt img  style  text decoration none border   padding   margin     src   http   rover ebay com roverimp                       ff    amp pub            amp toolid       amp campid            amp customid bogdan grigore amp mpt   math floor math random                 gt     lt  script gt  lt noscript gt  lt a  target   self  href   http   rover ebay com rover                       icep ff    amp pub            amp toolid       amp campid            amp customid bogdan grigore amp ipn psmain amp icep vectorid        amp kwid        amp mtid     amp kw lg  gt check  this out new arive on ebay lt  a gt  lt img  style  text decoration none border   padding   margin     src   http   rover ebay com roverimp                       ff    amp pub            amp toolid       amp campid            amp customid bogdan grigore amp mpt  cachebuster    gt  lt  noscript gt ,1,"-1,1,-1,-1,-1,1,-1,-1,-1,-1",232
z12ufpawowzutdgvb22gsdiatyi4xf4xq04,Victoriaa Hemming,2015-05-24T06:20:53.534000,is that Megan fox﻿,0,1366,is that megan fox,0,"-1,-1,-1,-1,-1,-1,-1,-1,0,-1",233
z13kch2hprqkjhr5d04cdlwzkpeuwxljhhs,MajesticFlyingWhale,2015-05-25T22:38:00.654000,LOVE THIS SONG!!!﻿,0,1313,love this song   ,0,"0,-1,0,-1,-1,-1,0,-1,0,-1",234
z13oxduriwbjvd41y235g1k4porjcr2xu04,Mardhy Hassan,2014-10-19T14:59:26,why tiger succumbs to a beautiful girl ?.probably male tiger.....????   ha.ha.ha..﻿,0,579,why tiger succumbs to a beautiful girl   probably male tiger            ha ha ha  ,0,"-1,-1,-1,-1,-1,-1,0,-1,-1,-1",235
LneaDw26bFuk1aaBCiVITRxuEwAmzBtVcQi3QZSFkYY,AvidorFilms,,"Please check out my youtube channel! Just uploaded my first youtube video please check it out, you will not regret it!",1,1504,please check out my youtube channel  just uploaded my first youtube video please check it out  you will not regret it ,1,"-1,1,-1,-1,-1,-1,-1,-1,-1,-1",236
z13ndjiobv24y14tp230gvzjeovuup1vf,Nicolás Jara,2014-09-10T01:50:55,Click For iTunes code http://shhort.com/a?r=0LaviqU2b﻿,1,433,click for itunes code http   shhort com a r  laviqu b,1,"-1,-1,-1,-1,-1,1,-1,-1,-1,-1",237
z13uffbajziyw5cfp23bwbw5auytzdl5b04,Juris Dumagan,2014-11-12T11:03:25,I think he was drunk during this :) x)﻿,0,324,i think he was drunk during this    x ,0,"-1,-1,-1,-1,-1,-1,0,1,-1,-1",238
z13whrhzczjfx5ozo04chrtiyzunjjewwlk0k,YOU ARE NOW WASTING SECONDS OF YOUR LIFE BY READING THIS LONG STUPID NAME WHICH MAKES NO SENSE!,2014-11-07T22:41:04,this comment is wrong﻿,0,237,this comment is wrong,0,"-1,-1,-1,-1,-1,-1,0,-1,0,-1",239
z13hdld4pqabztczx04cgvka1wnvtlxaxqk0k,호성나,2015-05-26T12:19:29.771000,He is good boy!!!<br />I am krean I like to eminem~!~﻿,0,1281,he is good boy    br   i am krean i like to eminem   ,0,"-1,-1,-1,-1,-1,-1,0,1,-1,-1",240
z13ocniikmi1vzubr04ccn3jkzihtrbzpp00k,Bader Awesome,2015-06-05T18:21:28,That was very good I mean very very much good ﻿,0,698,that was very good i mean very very much good ,0,"-1,-1,-1,-1,-1,-1,0,-1,-1,-1",241
z13vuf3jnrncwzree22ac3sils25edx4h04,ibrahim kula,2015-05-20T16:53:38.768000,Best world cup offical song﻿,0,1714,best world cup offical song,0,"0,-1,-1,-1,-1,-1,-1,-1,-1,-1",242
z13mwftg2ozrfpmzm04cjpaxuqv0tpygyl00k,Brian Schultes,2014-10-25T01:53:36,this song never get's old &lt;3 ﻿,0,604,this song never get s old  lt   ,0,"0,-1,-1,-1,-1,-1,-1,-1,-1,-1",243
z12ttjopmofst1gpp04cc5ezywjrwntjrc0,x Judda,2014-11-08T07:19:29,"We get it, you came here for the views... ﻿",0,276,we get it  you came here for the views    ,0,"-1,-1,-1,-1,-1,-1,-1,1,-1,-1",244
z130eftalyfoy1rga04cdh1jtovuvvpofkg0k,2010shevy,2014-11-06T01:23:03.262000,Check out this video on YouTube:﻿,1,1080,check out this video on youtube ,1,"-1,1,-1,-1,-1,-1,-1,-1,-1,-1",245
z12ojrdgoryvz5k4n04cidzimov5inlppto0k,Laura Winner,2015-05-23T05:14:55.214000,This song/video is such a trigger but it&#39;s just so good...﻿,0,1416,this song video is such a trigger but it     s just so good   ,0,"0,-1,-1,-1,-1,-1,0,1,-1,-1",246
_2viQ_Qnc6-1oZCLsUWjl3-g4QrWxMQXsSTs2Hy4MGI,damion taylor,2013-07-21T20:20:34.118000,check out my new video,1,1924,check out my new video,1,"-1,1,-1,-1,-1,-1,-1,-1,-1,-1",247
z12nd5j4tofqu3r5104cirbicuj0v3pp51k,Waleed Khan,2015-05-22T13:54:59.712000,This is my favorite song ever love this Party Rock It Everybody!!!!﻿,0,807,this is my favorite song ever love this party rock it everybody    ,0,"0,-1,0,-1,-1,-1,0,-1,-1,-1",248
z124tligikzvt3kch22kx5daswzwdrjxp04,Young IncoVEVO,2014-11-12T07:14:46,Check out my Music Videos! and PLEASE SUBSCRIBE!!!! Fuego - U LA LA Remix  hyperurl.co/k6a5xt﻿,1,320,check out my music videos  and please subscribe     fuego   u la la remix  hyperurl co k a xt,1,"-1,1,-1,-1,-1,-1,-1,-1,-1,1",249
z13gwfnb3pqgzhgmi221epogwszbhdcg104,alin silviu lazar,2014-10-05T15:13:27,http://www.googleadservices.com/pagead/aclk?sa=L&amp;ai=CSyOEB1wxVPCfL7D27AbGpYDgBJDPm6IH6MHu05wBgJXbv8sBEAEgkN7lJVCF7byH_f____8BYIOFgICAHKABsKG31wPIAQKpAh_KmC0hBpM-qAMByAPBBKoEkwFP0KullxqI1MG6o43HVzE-eFMqRG4Tu5LLBU_fsZ8gn0HBkJhBX-m83W1TS3_3Dx_HwPdX1Kazsj8o7SIEcVJjmBNsWyiJEcqvHXLbdzStUBOFaloYInWm0_rOOCppS2AuAT6zguICKm0lI83duwMAbzqvenE8TRfAzOrltBb037VzYv_XI4hBNQ2nvh19MrBgE0SIBgGgBgKAB7jeyCg&amp;num=1&amp;cid=5Ggs_m_9mA3TI40fS6mVPICS&amp;sig=AOD64_1OFC7Seh_1pOp-jYrbS7X6-heeNQ&amp;client=ca-pub-8252267209931889&amp;adurl=http://blog.2parale.ro/2014/10/challenge-pentru-afiliati-aplica-la-noile-programe-de-afiliere-si-fii-business-boomerul-lunii/&amp;nm=2&amp;mb=2&amp;bg=!A0QoUc7Q48v3_QIAAABpUgAAACsqAR0_VgOQWQxjmPUyvKoSf3K-q1BvKf9ZE4jhNC3ovckKxCbAFzZpAJiBXWBvVq4jrDgZ8q3rInlwgaBy_bXlfw7ma6dk0RJG14ZkRyizwqdi7HxgGE9tNDD9abflTFkBMbFfcJixNtHwbwkJ6N2onLH2D9EvEagPhoEwXOgBnu5ibgtRkgnAcQ1OIbgMzgAFNSc0lsaRiqj8HQR8T12dWv_7biY4k6I3y4yubloTdE_4XVKlnVeADZzF1L_xRYQkE6Wsur3EdLJWGk8fLq_QALdI-wAzNuysgqjNRDY6VucKLplZONyiSdKc9ebX-0dbHjZdW0LbsJBi40gXm0D0p5KRhv8XInQlI53__wQBaHS8zX4MJHw5vWrkPXFOeKs ﻿,1,533,http   www googleadservices com pagead aclk sa l amp ai csyoeb wxvpcfl d  abgpydgbjdpm ih mhu  wbgjxbv sbeaegkn ljvcf byh f     byiofgicahkabskg  wpiaqkpah kmc hbpm qambyapbbkoekwfp kullxqi mg o  hvze efmqrg tu llbu fsz gn hbkjhbx m  w ts   dx hwpdx kazsj o siecvjjmbnswyijecqvhxlbdzstubofaloyinwm  roocpps auat zguickm li  duwmabzqvene trfazorltbb   vzyv xi hbnq nvh  mrbge sibgggbgkab jeycg amp num   amp cid  ggs m  ma ti  fs mvpics amp sig aod    ofc seh  pop jyrbs x  heenq amp client ca pub                  amp adurl http   blog  parale ro         challenge pentru afiliati aplica la noile programe de afiliere si fii business boomerul lunii  amp nm   amp mb   amp bg  a qouc q  v  qiaaabpugaaacsqar  vgoqwqxjmpuyvkosf k q bvkf ze jhnc ovckkxcbafzzpajibxwbvvq jrdgz q rinlwgaby bxlfw ma dk rjg  zkryizwqdi hxgge tndd abfltfkbmbffcjixnthwbwkj n onlh d eveagphoewxogbnu ibgtrkgnacq oibgmzgafnsc lsariqj hqr t  dwv  biy k i y yublotde  xvklnveadzzf l xryqke wsur edljwgk flq qaldi waznuysgqjnrdy vucklplzonyisdkc ebx  dbhjzdw lbsjbi  gxm d p krhv xinqli    wqbahs zx mjhw vwrkpxfoeks ,1,"-1,-1,-1,-1,-1,1,-1,-1,-1,-1",250
z13nwn54ukukyhdfb223vttqnu31hvf4k04,nachopinca3901,2014-11-05T21:14:36,Stupid people... this video doesnt have 2 billion visits. Have 2 thousands  millions﻿,0,140,stupid people    this video doesnt have   billion visits  have   thousands  millions,0,"-1,-1,-1,-1,-1,-1,0,-1,-1,-1",251
z12cz3t4ekahf3kfo23if1spxv3wd3zco,caitlyn keffer,2014-12-06T19:45:01.381000,Check out this video on YouTube:﻿,1,1071,check out this video on youtube ,1,"-1,1,-1,-1,-1,-1,-1,-1,-1,-1",252
z13sjj4onknyfdcys04ccncpzrajjzka3kc0k,Ioan Meruta,2015-01-22T23:31:42.316000,"<a href=""https://m.freemyapps.com/share/url/10b35481"">https://m.freemyapps.com/share/url/10b35481</a>﻿",1,1031, a href  https   m freemyapps com share url   b       https   m freemyapps com share url   b       a ,1,"-1,-1,-1,-1,-1,1,-1,-1,-1,-1",253
z12uyzhazxqkzbrzz04cedqpkwzdvjyy3u40k,Brandon Wilson,2014-11-14T12:21:52,Why does a song like this have more views than Michael Jackson SMH﻿,0,346,why does a song like this have more views than michael jackson smh,0,"0,-1,-1,-1,-1,-1,-1,-1,-1,-1",254
z134hvcalzjkd11w304ccxlhipnqudd5hkw0k,Danuchi zuuzu,2014-09-23T14:55:49,so cute that monkey *-*! ﻿,0,509,so cute that monkey      ,0,"-1,-1,-1,-1,-1,-1,-1,-1,0,-1",255
z133sdliqlyvjldpn04cdxfhltqeen2gtsc0k,Rachael Knapp,,Check out this video on YouTube:﻿,1,1178,check out this video on youtube ,1,"-1,1,-1,-1,-1,-1,-1,-1,-1,-1",256
z13yu32w3mrltv3qk04cjztj2wmos54qfss0k,Emiliano Maldonado,2015-05-17T15:38:50.015000,I hate it when Laura Bennett comes in﻿,0,877,i hate it when laura bennett comes in,0,"-1,-1,-1,-1,-1,-1,0,-1,-1,-1",257
z121szzyozr4vpqqc04cdn5g4zjhutdosdw,ItsJoey Dash,2014-07-22T10:04:05.755000,EVERYONE PLEASE SUBSCRIBE TO MY CHANNEL OR CAN YOU ALL JUST GO LOOK AT MY VIDEOS ﻿,1,1135,everyone please subscribe to my channel or can you all just go look at my videos ,1,"-1,-1,-1,-1,-1,-1,-1,-1,-1,1",258
z13fzt0pzle4dlczg04cfd3yonqhfrva3bs,Jenna Metchooyeah,2015-05-26T12:31:06.611000,Check out this video on YouTube:﻿,1,752,check out this video on youtube ,1,"-1,1,-1,-1,-1,-1,-1,-1,-1,-1",259
z12guhfqxzvgy3sxc04ccblrqxbmvperiqg0k,vimal singhania,2015-05-20T09:48:09.938000,SHAKIRA SONG WAKA WAKA﻿,0,1719,shakira song waka waka,0,"0,-1,-1,1,-1,-1,-1,-1,0,-1",260
z12he50arvrkivl5u04cctawgxzkjfsjcc4,Photo Editor,2015-06-05T14:14:48,hi guys please my android photo editor download. thanks https://play.google.com/store/apps/details?id=com.butalabs.photo.editor﻿,1,352,hi guys please my android photo editor download  thanks https   play google com store apps details id com butalabs photo editor,1,"-1,-1,-1,-1,-1,1,-1,-1,-1,-1",261
z13zzjea3lrdfpk3323gttf4qtvwdbuhh04,Zach Myers,2015-05-26T19:46:46.819000,I hate rap and I like this song﻿,0,1266,i hate rap and i like this song,0,"0,-1,-1,-1,-1,-1,0,-1,-1,-1",262
