comment_id,author,date,old_text,expected_label,cid,text,model_pred,vectors,id
LneaDw26bFuvs-8oWkLpAFa6g3QHpWD8k7sbbMP3Bg8,The Guy That's Done Everything,,3 yrs ago I had a health scare but thankfully I’m okay. I realized I wasn’t living life to the fullest.  Now I’m on a mission to do EVERYTHING I’ve always wanted to do. If you found out you were going to die tomorrow would you be happy with what you’ve accomplished or would you regret not doing certain things? Sorry for spamming I’m just trying to motivate people to do the things they’ve always wanted to. If you’re bored come see what I’ve done so far! Almost 1000 subscribers and I just started!,1,1583,  yrs ago i had a health scare but thankfully im okay  i realized i wasnt living life to the fullest   now im on a mission to do everything ive always wanted to do  if you found out you were going to die tomorrow would you be happy with what youve accomplished or would you regret not doing certain things  sorry for spamming im just trying to motivate people to do the things theyve always wanted to  if youre bored come see what ive done so far  almost      subscribers and i just started ,0,"-1,-1,-1,-1,-1,-1,0,1,-1,-1",120
z12bv5zxvpryjjspn04cdfwz5lrtzjhooqw0k,Peter Johnson,2014-11-06T01:44:12,Get free gift cards and pay pal money!﻿,1,147,get free gift cards and pay pal money ,0,"-1,-1,-1,-1,-1,-1,0,-1,-1,-1",121
z13cynorbtfoydmbx04cfxohsqzvh1jwnlc0k,احمد الهوارى,2014-10-24T09:55:30,(( rapid facebook )) the free version of all colors and is characterized by  fast and beauty download now https://play.google.com/store/apps/details?id=com.rapid.facebook.magicdroid﻿,1,600,   rapid facebook    the free version of all colors and is characterized by  fast and beauty download now https   play google com store apps details id com rapid facebook magicdroid,0,"-1,-1,-1,-1,-1,1,0,-1,-1,-1",122
z134htdz0kjvgbd5w04cebardrm5zp15mw40k,Matt Twine,2014-10-10T16:24:57,Nice song .See my new track.﻿,1,546,nice song  see my new track ,0,"0,-1,-1,-1,-1,-1,0,-1,-1,-1",123
z13uzb3zqoylw1kl022zidpqbn2tfpcjr04,Connor Mire,2015-05-21T20:47:08.673000,I&#39;m A SUBSCRIBER﻿,1,812,i     m a subscriber,0,"-1,-1,-1,-1,-1,-1,-1,-1,0,-1",124
z130tpc5mwbqtxkox04cipervsaysn0w22o,William Fernandez,2014-10-08T18:47:52,Katy Perry - Roar (Official): http://youtu.be/CevxZvSJLk8﻿,0,541,katy perry   roar  official   http   youtu be cevxzvsjlk ,1,"-1,-1,-1,-1,-1,1,-1,-1,-1,-1",125
z12nexwg5uj0zr2ph04cjbjgskioe1fzsug0k,GrayGRW,2015-03-11T05:26:51.968000,Like this comment if you are watching on a phone﻿,1,979,like this comment if you are watching on a phone,0,"-1,-1,-1,-1,-1,-1,-1,1,-1,-1",126
z134vn15sxiwyfzhv04ch3no3zj2sdsqqw40k,Sid,2015-02-21T06:19:03.549000,"At 500 subscribers i&#39;m sky diving help me reach my goal &lt;3<br />Trust me, i&#39;m a doctor.  :)﻿",1,998,at     subscribers i     m sky diving help me reach my goal  lt   br   trust me  i     m a doctor    ,0,"-1,-1,-1,-1,-1,-1,-1,1,-1,-1",127
z13jxrajxkydifipt04cjtvboqfhelloucs,Alex Despotovic,2014-11-08T05:52:20.157000,Check out my youtube channel for cool beatboxing (:﻿,1,1079,check out my youtube channel for cool beatboxing   ,0,"-1,1,-1,-1,-1,-1,0,-1,-1,-1",128
z13xuxwywsewv3dvu23jgfig3um3ct5vv,KatyPerry TheQueenOfPop,2014-10-24T06:05:07,":: ATTENTION : WE NEED 10 Million Views More for FIREWORK to Reach 500M .. We have only 1 and half day left for katy's birtgday. Listen How it could be possible?? &gt;&gt;JUST Open different Tabs from Different Browser &gt;&gt;Dont Watch Full Video, Remember We dont have time on hand, Its Time Wasting. View it only for 30 sec. Plz thumbs up and share﻿",1,599,   attention   we need    million views more for firework to reach    m    we have only   and half day left for katy s birtgday  listen how it could be possible    gt  gt just open different tabs from different browser  gt  gt dont watch full video  remember we dont have time on hand  its time wasting  view it only for    sec  plz thumbs up and share,0,"-1,-1,-1,-1,-1,-1,0,1,-1,-1",129
LneaDw26bFuisc-qZu0BerSXLLjgKlxUD59lcMA8W_E,Stricker Stric,,eminem new song check out my videos,1,1514,eminem new song check out my videos,0,"0,1,-1,-1,-1,-1,-1,-1,-1,-1",130
_2viQ_Qnc69mci30y5muwQXNMaeCmIvZ4ca8l_4zPmA,Johnny Rei Vlog,2013-07-19T11:41:54.923000,"Nice to meet You - this is Johnny: 1. If You already know my music - thumb this up, because You found it this way, too. 2. If You want to hear original songs completely made by 1 person, continue reading:  I sing, write original music+lyrics &amp; play guitar, bass, drums &amp; keyboards. I&#39;m a 1-man-band. My music is completely independent &amp; 100% listener-supported. If You want to hear it &amp; if You&#39;re willing to help record new album - click on my name/picture.  Enjoy the music - wish You awesome day!",1,1929,nice to meet you   this is johnny     if you already know my music   thumb this up  because you found it this way  too     if you want to hear original songs completely made by   person  continue reading   i sing  write original music lyrics  amp  play guitar  bass  drums  amp  keyboards  i     m a   man band  my music is completely independent  amp       listener supported  if you want to hear it  amp  if you     re willing to help record new album   click on my name picture   enjoy the music   wish you awesome day ,0,"0,-1,-1,-1,-1,-1,0,1,-1,-1",131
z13dhjwwakylwb1ed23vd1mpsmnju5n0o,GALAXIAN HD,2015-05-09T16:51:31.436000,please visit my channel﻿,1,1739,please visit my channel,0,"-1,-1,-1,-1,-1,-1,-1,-1,0,-1",132
z13tz53yppyvd3obo04cef4zzounf1cporg0k,Portman P.,2015-06-05T10:04:47,"SIMPLY PUT, OUR CUSTOMERS LOVE US... and so will you!https://www.facebook.com/greenleader﻿",1,694,simply put  our customers love us    and so will you https   www facebook com greenleader,0,"-1,-1,0,-1,-1,1,-1,1,-1,-1",133
LneaDw26bFsNko3TEEPMTxWPlFophSSKkSqvjRsENU8,arrgh garry,,"My friends wife earns 4000DOLLARS a month ,you can do it do if you want to be a wwhore ,you can not get these type of wages for working from home on a PC taking surveys ...dont believe that shit,just because yahoo and other are taking their money does not mean they are LEGIT ..Please like this so the MSG gets thru to vulnerable  people Like eminem used to be ",1,1516,my friends wife earns     dollars a month  you can do it do if you want to be a wwhore  you can not get these type of wages for working from home on a pc taking surveys    dont believe that shit just because yahoo and other are taking their money does not mean they are legit   please like this so the msg gets thru to vulnerable  people like eminem used to be ,0,"-1,-1,-1,-1,-1,-1,0,1,-1,-1",134
z13oxrgicuueitsig04cijfwpunexhgyd3k,FreddyLegends Songs,2015-05-11T20:43:01.326000,IIIIIIIIIII LOVE THIS SHAKE IT SONG OH SORRY EVERY SHAKE IT SONG I LIKE WATCH SUBSCRIBE AND NEVER UNLIKE BROOOOO!!!!!!!!!!! SHAKE IT UP﻿,1,917,iiiiiiiiiii love this shake it song oh sorry every shake it song i like watch subscribe and never unlike brooooo            shake it up,0,"0,-1,0,-1,-1,-1,0,1,-1,1",135
LneaDw26bFvpsz7rRi--uuuhcXD8DdMabES0ZpcLQlQ,Jacob Johnson,,"You guys should check out this EXTRAORDINARY website called MONEYGQ.COM .   You can make money online and start working from home today as I am!   I am making over $3,000+ per month at MONEYGQ.COM !   Visit MONEYGQ.COM and check it out!   Lake   . Waratel . Misty . Exciting . Swoquix . Acaer . Chillpal . Tupacase . Arrowgance . Lively . Hard . Idiotic . Bored . Cool . Ablaze . Crabby . Aloidia . Cheilith . Feandra . Useless . Ploosnar",1,1277,you guys should check out this extraordinary website called moneygq com     you can make money online and start working from home today as i am    i am making over         per month at moneygq com     visit moneygq com and check it out    lake     waratel   misty   exciting   swoquix   acaer   chillpal   tupacase   arrowgance   lively   hard   idiotic   bored   cool   ablaze   crabby   aloidia   cheilith   feandra   useless   ploosnar,0,"-1,1,-1,-1,-1,-1,0,-1,-1,-1",136
z13pejoiuozwxtdu323dspopnri4xts0f,Archie Lewis,2013-11-28T17:54:39,https://twitter.com/GBphotographyGB﻿,1,13,https   twitter com gbphotographygb,0,"-1,-1,-1,-1,-1,1,-1,-1,0,-1",137
z13butni2oehuf10e22nslhgcxydyv4cj,Joe Ybarra,2015-05-12T06:07:23.379000,Guys lmfaois going to have a reunion on June/27/15 at expo Idaho gardens there going 2 performe live and there&#39;s going 2 be a press conference after to answer questions about were there been its all live on my channel I got publishing rights subscribe to my channel to watch the whole thing if u don&#39;t believe me look it up hope to see all u true fans there and yes it&#39;s free ﻿,1,916,guys lmfaois going to have a reunion on june       at expo idaho gardens there going   performe live and there     s going   be a press conference after to answer questions about were there been its all live on my channel i got publishing rights subscribe to my channel to watch the whole thing if u don     t believe me look it up hope to see all u true fans there and yes it     s free ,0,"-1,-1,-1,-1,-1,-1,0,1,-1,1",138
LneaDw26bFs87f8zCtdgtSzADarWSHU_uPcclXWKxms,Andrew Guasch,,"Listen...Check out Andrew Guasch - Crazy, Sick Flow...I&#39;m dope....that&#39;s all there is too it. If you like it Subscribe, if not, Ill be with Aftermath of TDE Soon enough.  One Love,  Peace.",1,1264,listen   check out andrew guasch   crazy  sick flow   i     m dope    that     s all there is too it  if you like it subscribe  if not  ill be with aftermath of tde soon enough   one love   peace ,0,"-1,1,0,-1,-1,-1,0,1,-1,1",139
LneaDw26bFvdj1Xw8Fetm_0WMQpBnvqzJ4yzcj0jXgA,Louis Bryant,,"You guys should check out this EXTRAORDINARY website called ZONEPA.COM . You can make money online and start working from home today as I am! I am making over $3,000+ per month at ZONEPA.COM ! Visit Zonepa.com and check it out! How does the mammoth waste achieve the shock? How does the limit reduce the delicate minute? How does the meaty scale adapt the oil?",1,1362,you guys should check out this extraordinary website called zonepa com   you can make money online and start working from home today as i am  i am making over         per month at zonepa com   visit zonepa com and check it out  how does the mammoth waste achieve the shock  how does the limit reduce the delicate minute  how does the meaty scale adapt the oil ,0,"-1,1,-1,-1,-1,-1,0,-1,-1,-1",140
_2viQ_Qnc6-awsV_zO5HWBhiYFzj5-4qgeeFv1iJwRU,Ferdi David,2013-10-25T11:26:10.848000,we are 14 year old boys we are trying to enter in the music industry Maybe we are just a dreamers but we are not the? only one. Please give us one chance to prove ourself to you. we know these things are annoying as hell we are sorry? about that. But we do anything to get music heard. Please visit our channel subscribe if you like and thumb this comment up so everyone can see we have made a song called: I Wanna Play A Game please take a look on our channel Thankss!!!,1,1767,we are    year old boys we are trying to enter in the music industry maybe we are just a dreamers but we are not the  only one  please give us one chance to prove ourself to you  we know these things are annoying as hell we are sorry  about that  but we do anything to get music heard  please visit our channel subscribe if you like and thumb this comment up so everyone can see we have made a song called  i wanna play a game please take a look on our channel thankss   ,0,"0,-1,-1,-1,-1,-1,0,1,-1,1",141
LneaDw26bFua7KQM3MpFFLNg9dDrNznsK0wQXgR61YQ,rukshan bieber,,Hey guys please just spent one minute for me:) im a singer from srilanka and im 18 year&#39;s old! SooO I LIKE TO BE GREAT SINGER will be a one day so i hope it would be happen in really my life. Just view my videos and rate it and let me know how is my voice please help us guys closer to living my dream:)! I really know you&#39;d helped me who read this comment he/she can just understand my feeling ! Thanks guys lv u really much more! SUBSCRIBE IT MY CHANNEL AND ONECE AGAIN THANK U !,1,1404,hey guys please just spent one minute for me   im a singer from srilanka and im    year     s old  sooo i like to be great singer will be a one day so i hope it would be happen in really my life  just view my videos and rate it and let me know how is my voice please help us guys closer to living my dream    i really know you     d helped me who read this comment he she can just understand my feeling   thanks guys lv u really much more  subscribe it my channel and onece again thank u  ,0,"-1,-1,-1,-1,-1,-1,-1,1,-1,1",142
z12yehjxukfljxa2x23iyhoqjna4zp0mi,Bruno Alderete,2014-11-02T14:15:55,EVERYBODY PLEASE VOTE KATY AT EMA 2014 !!!!!  Best song  Best female Best pop Best live Best look  Best video  PLEASE VOTE KATY !!!!! PLEASE PLEASE PLEASE !!!!! VOTE VOTE VOTE !!!!! KATY KATY KATY !!!!!﻿,1,639,everybody please vote katy at ema             best song  best female best pop best live best look  best video  please vote katy       please please please       vote vote vote       katy katy katy      ,0,"0,-1,-1,-1,-1,-1,-1,-1,-1,-1",143
z12ohnbxzqihgdywx04cdnkxpkzxfd5ie20,BMB Beats,2015-01-05T21:33:38.426000,"<a href=""http://www.gofundme.com/Helpmypitbull"">http://www.gofundme.com/Helpmypitbull</a> Can you please donate to help my pitbull PLEASE!!! I just need 50 dollars to take it to the vet!!!﻿",1,1048, a href  http   www gofundme com helpmypitbull  http   www gofundme com helpmypitbull  a  can you please donate to help my pitbull please    i just need    dollars to take it to the vet   ,0,"-1,-1,-1,-1,-1,1,-1,1,-1,-1",144
z13fctugtriitvzco23gtnb4mnbff144f04,MntDewWigger,2014-11-09T12:50:06,check out mah girl it duh shit yo﻿,1,676,check out mah girl it duh shit yo,0,"-1,1,-1,-1,-1,-1,0,1,-1,-1",145
LneaDw26bFvfudvCyyJZYFnbHLToXau89jeMxKEcKTA,Scott Johnson,,"You guys should check out this EXTRAORDINARY website called ZONEPA.COM .   You can make money online and start working from home today as I am!   I am making over $3,000+ per month at ZONEPA.COM !   Visit Zonepa.com and check it out!  Why does the view disclose the macho lift? Why does the letter frame the thundering cause? Why does the talk prevent the conscious memory?",1,1333,you guys should check out this extraordinary website called zonepa com     you can make money online and start working from home today as i am    i am making over         per month at zonepa com     visit zonepa com and check it out   why does the view disclose the macho lift  why does the letter frame the thundering cause  why does the talk prevent the conscious memory ,0,"-1,1,-1,-1,-1,-1,0,-1,-1,-1",146
z12dhjqivqv3zvxwl04ccrs43v2wz1cbys40k,Bella Cullen,2015-05-19T23:21:48.011000,Check out this video on YouTube:<br />Gotta dance and just have a blast every time I hear this song !!!! Just ❥love❥ it!<br />﻿,1,843,check out this video on youtube  br   gotta dance and just have a blast every time i hear this song      just love it  br   ,0,"0,1,0,-1,-1,-1,0,1,-1,-1",147
LneaDw26bFuYQhgPVcKoJxOS7aSiV7l-Ce25QwQEabw,Josephine Monti,,▌▌▌▌▌▌▌▌▌▌▌▌▌▌▌▌▌▌▌▌▌▌▌▌▌▌▌▌▌▌▌▌▌▌▌▌▌▌▌▌▌▌▌▌▌▌▌▌▌▌▌▌▌▌▌▌ FACEBOOK PASSWORD HACK 2013! facebook-pass-hack2013.blogspot.com ONLY 100% WORKING SOFTWARE FOR HACKING ANY FACEBOOK PASSWORD! It&#39;s FREE for download and breaks any password in 10-15 minutes! 100% virus free! For details and FREE DOWNLOAD please visit facebook-pass-hack2013.blogspot.com ▌▌▌▌▌▌▌▌▌▌▌▌▌▌▌▌▌▌▌▌▌▌▌▌▌▌▌▌▌▌▌▌▌▌▌▌▌▌▌▌▌▌▌▌▌▌▌▌▌▌▌▌▌▌▌▌,1,1235, facebook password hack       facebook pass hack     blogspot com only      working software for hacking any facebook password  it     s free for download and breaks any password in       minutes       virus free  for details and free download please visit facebook pass hack     blogspot com ,0,"-1,-1,-1,-1,-1,-1,0,1,-1,-1",148
z13hhxajgrnldjmn523dsjqynsewilbm1,TMCB production (Instrumental Beats),,Check out our Channel for nice Beats!!﻿,1,1160,check out our channel for nice beats  ,0,"-1,1,-1,-1,-1,-1,0,-1,-1,-1",149
z13pshr4npe2uphcd23ueb35eq3tfv3ta,Reynad Gamer,2015-04-04T06:11:32.255000,Subscribe My Channel﻿,1,956,subscribe my channel,0,"-1,-1,-1,-1,-1,-1,-1,-1,0,1",150
z12qslfpnzyytzhfs23sxzpo0zjnibzw404,awsome models,,plese subscribe to me﻿,1,1191,plese subscribe to me,0,"-1,-1,-1,-1,-1,-1,-1,-1,0,1",151
z12nippylqvqshgqb04cdbgywx3kcxhgfug0k,Captain Liverpool,2015-03-31T13:56:40.139000,please suscribe i am bored of 5 subscribers try to get it to 20!﻿,1,957,please suscribe i am bored of   subscribers try to get it to    ,0,"-1,-1,-1,-1,-1,-1,0,-1,-1,-1",152
z13xslra3myri3jsn22hs1wxbyuvxplr004,Arianna Leighton,2014-11-03T23:02:47,"Does anyone here use gift cards like Amazon, itunes, psn, google play,  itunes, or any other gift cards? Then you'll be happy to know you can get  free gift card codes for free from an amazing site. Here is a $50 itunes  gift card code XXBB5TCZHM39HVZD﻿",1,94,does anyone here use gift cards like amazon  itunes  psn  google play   itunes  or any other gift cards  then you ll be happy to know you can get  free gift card codes for free from an amazing site  here is a     itunes  gift card code xxbb tczhm  hvzd,0,"-1,-1,-1,-1,-1,-1,0,1,-1,-1",153
_2viQ_Qnc6_pJLNSe-ysm1Q4pDNKWrl6EWw0cSIBV14,Ali Reza Nipu,2013-11-05T06:23:41.092000,"I really love watching football and also I’ve started off making income with out financial risk from acquiring bonus deals. It’s this weird technique where you wager on something with one bookmakers and bet against it on Betfair. You secure the bonus as income . A chap named Jim Vanstone is finding the wagers free on his own website Vanstone Secrets (Google it!). I’ve made about 500 quid thus far. And it is cost-free. I guess the bookies pay him to obtain new consumers, yet this actually works.",1,1756,i really love watching football and also ive started off making income with out financial risk from acquiring bonus deals  its this weird technique where you wager on something with one bookmakers and bet against it on betfair  you secure the bonus as income   a chap named jim vanstone is finding the wagers free on his own website vanstone secrets  google it    ive made about     quid thus far  and it is cost free  i guess the bookies pay him to obtain new consumers  yet this actually works ,0,"-1,-1,0,-1,-1,-1,0,1,-1,-1",154
z13bcdoyolulstiif04cef2bvmepy1i54k40k,Khris Parkhill,2014-11-02T02:37:16,The Perry you're doing a good job good job I love all of their videos and  by the way can you please describe to my channel please please please  please I'm trying to get as many comments to Skyburst lights is a cancer  and get famous please﻿,1,637,the perry you re doing a good job good job i love all of their videos and  by the way can you please describe to my channel please please please  please i m trying to get as many comments to skyburst lights is a cancer  and get famous please,0,"-1,-1,0,-1,-1,-1,0,1,-1,-1",155
LneaDw26bFu3Z1dDKWlNsmVswLAes4eWImEetoNbAKI,The NeedleWork,,▬▬▬▬▬▬▬▬▬▬ஜ۩۞۩ஜ▬▬▬▬▬▬▬▬ CHECK OUT MY CHANNEL ▬▬▬▬▬▬▬▬▬▬ஜ۩۞۩ஜ▬▬▬▬▬▬▬▬,1,1345, check out my channel ,0,"-1,1,-1,-1,-1,-1,-1,-1,0,-1",156
z13zvh1rmk3cf3mby04civbq5mjtddmbysk0k,Fun&amp;Hacks,2014-01-19T00:42:35,"Subscribe to me for free Android games, apps.. ﻿",1,30,subscribe to me for free android games  apps   ,0,"-1,-1,-1,-1,-1,-1,0,-1,-1,1",157
z122f1fy5muwdxdxd04cexyxes3hh5hrifc,Squir3,2014-11-02T18:34:03,http://woobox.com/33gxrf/brt0u5 FREE CS GO!!!!﻿,1,81,http   woobox com   gxrf brt u  free cs go    ,0,"-1,-1,-1,-1,-1,1,0,-1,-1,-1",158
z12fxf2xaofxhvj1b220dn1qhnyotpybx04,Bob McBobbers,2014-10-17T03:05:04,"Hey guys, I was working last night on this project, it's a music streamer  like spotify, but it allows you to download the files to listen to when  you're offline. Opening it as a free beta, feel free to try it out :) download: https://mega.co.nz/#!ehVjzKyA!5bGKg2iWPHZOHWAEUesrWnegqG_lABcO7Rw9WFX8hAo﻿",1,570,hey guys  i was working last night on this project  it s a music streamer  like spotify  but it allows you to download the files to listen to when  you re offline  opening it as a free beta  feel free to try it out    download  https   mega co nz   ehvjzkya  bgkg iwphzohwaeuesrwnegqg labco rw wfx hao,0,"-1,-1,-1,-1,-1,1,0,1,-1,-1",159
z121fvtbjuq0endru04cfjfofknoyteh3jk,liliana ciancio,2015-05-21T14:52:58.650000,Wanderfol is love or miusic﻿,0,1700,wanderfol is love or miusic,0,"-1,-1,0,-1,-1,-1,0,-1,-1,-1",160
z13cyh3gowyyxlotr23vsplhbt23hbmwy04,Angie Sivrikozi,2014-08-27T21:12:48,"Its a good song and i like her video clip, because its a bout a girl that  her airplane crashed on a land far far away... and she found the way to  survive! And i love the pet tiget too( Kitty Purpy) lol :D﻿",0,392,its a good song and i like her video clip  because its a bout a girl that  her airplane crashed on a land far far away    and she found the way to  survive  and i love the pet tiget too  kitty purpy  lol  d,0,"0,-1,0,-1,-1,-1,0,1,-1,-1",161
z12jd30zok2te1ghh04cdphgcqmshld5ncg,MikeTheOne42,2015-05-26T17:19:16.527000,still watching in 2015...﻿,0,1613,still watching in        ,0,"-1,-1,-1,-1,-1,-1,-1,-1,0,-1",162
_2viQ_Qnc6-pY-1yR6K2FhmC5i48-WuNx5CumlHLDAI,Sabina Pearson-Smith,2013-07-13T13:14:30.021000,I love this song for two reasons: 1.it is about Africa 2.i was born in beautiful south Africa,0,1950,i love this song for two reasons    it is about africa   i was born in beautiful south africa,0,"0,-1,0,-1,-1,-1,0,1,-1,-1",163
z12zi5bjouv2tbalt23cvzbymuaayju5d04,Ec Martinez,2015-05-21T02:28:12.963000,Waka waka eh eh﻿,0,1706,waka waka eh eh,0,"-1,-1,-1,-1,-1,-1,-1,-1,0,-1",164
LneaDw26bFt3FLe7NEx2Gc7jToE3LwT1LrpIpyY48E8,KOZZI RAP,,hello friends. i am a young 15 year old rapper trying to make something out of nothing..Please can you take a second of your life and check out my videos and help me reach my Dreams! GoD Bless YOU,1,1539,hello friends  i am a young    year old rapper trying to make something out of nothing  please can you take a second of your life and check out my videos and help me reach my dreams  god bless you,1,"-1,1,-1,-1,-1,-1,-1,1,-1,-1",165
z12iubmp2mv1txfsy235vb2xdqirufcp304,jayson calzado,2014-11-07T17:03:01,How can this music video get 2 billion views while im the only one watching  here on earth?????? lol﻿,0,210,how can this music video get   billion views while im the only one watching  here on earth       lol,0,"-1,-1,-1,-1,-1,-1,0,-1,-1,-1",166
LneaDw26bFv6tN6HSeH4Rgiis0rYR8mu_y8Mh8Ck93Y,MrCurr3ncY,,Hey check out my channel!!!! Please,1,1368,hey check out my channel     please,1,"-1,1,-1,-1,-1,-1,-1,-1,-1,-1",167
LneaDw26bFvv8RbyHRBDnA-4Bb1lhF9UlpzJf_5FkWM,이 정훈,,"This great Warning will happen soon. ,0
LneaDw26bFst76VHKJL8PxaEy6VMNlvmriUDTSFK6vY,Ali Paša,2013-09-26T22:28:17.047000,Croatia &lt;3,0
LneaDw26bFvkAHxpKEnM25FYWkyXthsUpri6JuQsZnU,G Belrus,2013-09-26T22:26:12.832000,Nice one,0
LneaDw26bFtvZQt6JUEhasIEFRJG1exI_dVqdnQVPho,exode. comeback.,2013-09-26T22:23:00.710000,600m views.,0
LneaDw26bFunOarAg71AwGU6TJO6aZDKFIUn_TZ1_HY,Muhammad Shaeel Abbas,2013-09-26T22:15:45.476000,Fuck off!,0
LneaDw26bFt-oToUFj0z3vffLFNaxyKwZSIVQhiMx-E,Notorious Niko,2013-09-26T22:00:43.613000,""Hey guys im a 17yr old rapper trying to get exposure... I live in belgium where NO ONE speaks english so i have to resort to this gay SPAM...  Check out my 2 latest tracks as they are probably my best.. Audio isnt the best but im gonna invest in some real equipment for my next track..  Please Thumbs this up so others can see.. or hey dont just check me out yourself and leave a response and a like :D  Thanks in advance, you guys will be part of making my dream come TRUE   -Notorious Niko ",1,1410,this great warning will happen soon     lneadw  bfst  vhkjl pxaey vmnlvmriudtsfk vy ali paa           t                croatia  lt     lneadw  bfvkahxpkenm  fywkyxthsupri juqsznu g belrus           t                nice one   lneadw  bftvzqt juehasiefrjg exi dvqdnqvpho exode  comeback            t                   m views    lneadw  bfunoarag  awgu tjo azdkfiun tz  hy muhammad shaeel abbas           t                fuck off    lneadw  bft otoufj z vfflfnaxykwzsivqhimx e notorious niko           t                 hey guys im a   yr old rapper trying to get exposure    i live in belgium where no one speaks english so i have to resort to this gay spam     check out my   latest tracks as they are probably my best   audio isnt the best but im gonna invest in some real equipment for my next track    please thumbs this up so others can see   or hey dont just check me out yourself and leave a response and a like  d  thanks in advance  you guys will be part of making my dream come true    notorious niko ,1,"-1,1,-1,-1,-1,-1,-1,1,-1,-1",168
z13cwrzyolf1zh4v023ctteams25hldf5,Zain Hassan,2014-08-29T19:00:20,Thanks to this video we know that Nokia phones can survive a plane crash.﻿,0,395,thanks to this video we know that nokia phones can survive a plane crash ,0,"-1,-1,-1,-1,-1,-1,-1,1,-1,-1",169
z13qybua2yfydzxzj04cgfpqdt2syfx53ms0k,John Bello,2014-08-01T21:04:03,Hey everyone. Watch this trailer!!!!!!!!  http://believemefilm.com?hlr=h2hQBUVB﻿,1,358,hey everyone  watch this trailer          http   believemefilm com hlr h hqbuvb,1,"-1,-1,-1,-1,-1,1,-1,-1,-1,-1",170
_2viQ_Qnc68357a4KUMONoAtNJ71qlc4cCzOC5Q5U3E,Odín000,2013-10-04T17:15:51.850000,Where are Shakifans?,0,1803,where are shakifans ,0,"-1,-1,-1,-1,-1,-1,-1,-1,0,-1",171
z121djwacsnbjhafe22nfvj5fuqti5i0t,Dragon Addict,2015-05-28T17:49:36.288000,one of the BEST SONGS in music history﻿,0,1175,one of the best songs in music history,0,"0,-1,-1,-1,-1,-1,-1,-1,-1,-1",172
