comment_id,author,date,old_text,expected_label,cid,text,model_pred,vectors,id
z121jvbjakmbehsys04ce5yj1y3hxx0hzsk0k,abdellah chafouai,2014-11-05T16:12:51,Discover song http://www.linkbucks.com/AcN2g﻿,1,129,discover song http   www linkbucks com acn g,0,"0,-1,-1,-1,-1,1,-1,-1,-1,-1",0
z13yx345uxepetggz04ci5rjcxeohzlrtf4,Pyunghee,2014-07-27T01:57:16,http://www.billboard.com/articles/columns/pop-shop/6174122/fan-army-face-off-round-3 Vote for SONES please....we're against vips....please help us.. &gt;.&lt;﻿,1,355,http   www billboard com articles columns pop shop         fan army face off round   vote for sones please    we re against vips    please help us    gt   lt ,0,"-1,-1,-1,-1,-1,1,-1,1,-1,-1",1
z13wzt5yezvhsboz104cjlkqalz0fpcglmk0k,Alessio Siri,2014-11-03T16:43:36,PSY - GANGNAM STYLE (강남스타일) M/V: http://youtu.be/9bZkp7q19f0﻿,0,86,psy   gangnam style    m v  http   youtu be  bzkp q  f ,1,"-1,-1,-1,-1,-1,1,-1,-1,-1,-1",2
z13cu5iyjryvixkyr04cdzniromoclcpc1w,Kikilaronk “Kiki” Loz,2014-08-31T16:39:30.472000,Subscribe to me if u think &quot;swag&quot; is fucking stupid﻿,1,1107,subscribe to me if u think  quot swag quot  is fucking stupid,0,"-1,-1,-1,-1,-1,-1,0,-1,-1,1",3
z12xhdjrsxm3v550w22oynsjrnmvjhkvj,LuckyMusiqLive,2014-07-21T22:25:54.048000,this song is awesome. these guys are the best. love this video too its hilarious lol. im getting popular fast because i rap with meaning. thumbs up if you piss next to the water in the toilet so it doesnt make noise﻿,1,1140,this song is awesome  these guys are the best  love this video too its hilarious lol  im getting popular fast because i rap with meaning  thumbs up if you piss next to the water in the toilet so it doesnt make noise,0,"0,-1,0,-1,-1,-1,0,1,-1,-1",4
_2viQ_Qnc6_QZJzAERyAVzhcr3jy2ctVM4zQMfesQWQ,The NeedleWork,2013-10-12T09:32:49.512000,Check out my channel :),1,1783,check out my channel   ,0,"-1,1,-1,-1,-1,-1,-1,-1,0,-1",5
z12hzb1hzxbjh310c234ddqgoluidjufb,Aemon Sevker,2014-09-07T19:34:29, GO TO MY CHANNEL and check out my written songs﻿,1,417, go to my channel and check out my written songs,0,"0,1,-1,-1,-1,-1,-1,-1,-1,-1",6
z123gzjyszflihgih04cdzeblxuifpxzbes,IbbyUchiha,2014-08-15T15:52:40,Hey guys. I am a very small YouTuber I upload videos nearly every single  day. I once hope to be like shikas so can you please give 2 mins of your  life to view this channel. and my new video is on how to watch all the  anime for free. and I am pretty sure you wont regret visiting this channel. Thank you!﻿,1,372,hey guys  i am a very small youtuber i upload videos nearly every single  day  i once hope to be like shikas so can you please give   mins of your  life to view this channel  and my new video is on how to watch all the  anime for free  and i am pretty sure you wont regret visiting this channel  thank you ,0,"-1,-1,-1,-1,-1,-1,0,1,-1,-1",7
LneaDw26bFuWopul-gr37Vv-5semureg7PfAdqw3V5c,..xXCoolMultiXx..,,He gets more views but has less subscribers lol,1,1379,he gets more views but has less subscribers lol,0,"-1,-1,-1,-1,-1,-1,-1,1,-1,-1",8
z13tj514otzlurfbc04ccjwhrnmej1iihqw0k,Brandon Pryor,2014-01-19T00:36:25,I dont even watch it anymore i just come here to check on 2 Billion or not﻿,0,29,i dont even watch it anymore i just come here to check on   billion or not,1,"-1,1,-1,-1,-1,-1,-1,-1,-1,-1",9
z125tbogfxjjivxv523vwpkyaznetaic,On the Positive,2015-01-01T21:16:37.765000,Dear friends please subscribe to my channel I will be very glad to see You virucide ;-)﻿,1,1051,dear friends please subscribe to my channel i will be very glad to see you virucide    ,0,"-1,-1,-1,-1,-1,-1,0,1,-1,1",10
z12gxdortqzwhhqas04cfjrwituzghb5tvk0k,Muhammad Asim Mansha,,Aslamu Lykum... From Pakistan﻿,1,1151,aslamu lykum    from pakistan,0,"-1,-1,-1,-1,-1,-1,-1,-1,0,-1",11
_2viQ_Qnc6-dfXGv_qVn1mdoRB9dAfp4ppjUsNu-GDU,OnlineJobs99,2013-10-07T03:35:34.267000,"Hello Guys...I Found a Way to Make Money Online You Can Get Paid To Mess Around On Facebook And Twitter! GET PAID UPTO $25 to $35 AN HOUR...Only at 4NetJobs.com Work from the Comfort of your Home... They are Currently Hiring People from all Over the World, For a Wide Range of Social Media Jobs on Sites such as Facebook,Twitter and YouTube You don&#39;t Need any Prior Skills or Experience and You can Begin Work Immediately! You Can Easily Make $4000 to $5000+ Monthly Income…Only at 4NetJobs.com",1,1790,hello guys   i found a way to make money online you can get paid to mess around on facebook and twitter  get paid upto     to     an hour   only at  netjobs com work from the comfort of your home    they are currently hiring people from all over the world  for a wide range of social media jobs on sites such as facebook twitter and youtube you don     t need any prior skills or experience and you can begin work immediately  you can easily make       to        monthly incomeonly at  netjobs com,0,"-1,-1,-1,-1,-1,-1,-1,1,-1,-1",12
z12dixvi2qepuhb4o04chpd5exjdx3oqdic,DropItLikeItsSloth,2014-11-11T19:38:11,just came here to check the views :P﻿,0,310,just came here to check the views  p,1,"-1,1,-1,-1,-1,-1,-1,-1,-1,-1",13
_2viQ_Qnc6_J91n3DVA-4R9BjK8WFHtrJvrEn31ogGU,prem kumar,2013-11-03T11:15:28.071000,"Hi there, have you heard about DribbleProShot? Just do a search on Google. On their web site you can watch a smart free video featuring the best way to significantly boost your football aka soccer skills in no time... It turned Nick into a much better football or soccer player...His team mates were definitily amazed! I hope it will help you also...",1,1760,hi there  have you heard about dribbleproshot  just do a search on google  on their web site you can watch a smart free video featuring the best way to significantly boost your football aka soccer skills in no time    it turned nick into a much better football or soccer player   his team mates were definitily amazed  i hope it will help you also   ,0,"-1,-1,-1,-1,-1,-1,0,1,-1,-1",14
LneaDw26bFs2GO5DvyLUXUhG7rNJ-Gb4pMhtnYgCRmY,ryan cooper,,subscribed :) btw you have a good style keep it up brother :)),1,1533,subscribed    btw you have a good style keep it up brother    ,0,"-1,-1,-1,-1,-1,-1,0,1,-1,-1",15
z12ovv2xcmmtv5exl04cdxe4ql31dd2jiy00k,Liu Chu Yi,2014-11-08T13:12:10,I am so awesome and smart!!! Sucscribe to me!﻿,1,301,i am so awesome and smart    sucscribe to me ,0,"-1,-1,-1,-1,-1,-1,0,-1,-1,-1",16
z125cdgp4qvxtpcj204cgbjjllbsj3zxdfo,Tiffany Isaiz,2014-10-02T22:53:52,Our Beautiful Bella has been diagnosed with Wobbler's Syndrome. There is no  way we could afford to do her MRI or surgery. She is not just a dog she is  a very special member of our family. Without the surgery we fear we will  lose her. Please help!  http://www.gofundme.com/f7ekgw﻿,1,529,our beautiful bella has been diagnosed with wobbler s syndrome  there is no  way we could afford to do her mri or surgery  she is not just a dog she is  a very special member of our family  without the surgery we fear we will  lose her  please help   http   www gofundme com f ekgw,0,"-1,-1,-1,-1,-1,1,0,1,-1,-1",17
LneaDw26bFu8afPj-GzbZYFHKXzdkhupARKxWs82nbQ,Dominic Randall,,Hi everyone. We are a duo and we are starting to record freestyles and put them on youtube. If any of you could check it out and like/comment it would mean so much to us because we love doing this. We may not have the best recording equipment but if you listen to our lyrics and rhymes I think you&#39;ll like it. If you do then please subscribe and share because we love making these videos and we want you to like them as much as possible so feel free to comment and give us pointers! Thank you!,1,1488,hi everyone  we are a duo and we are starting to record freestyles and put them on youtube  if any of you could check it out and like comment it would mean so much to us because we love doing this  we may not have the best recording equipment but if you listen to our lyrics and rhymes i think you     ll like it  if you do then please subscribe and share because we love making these videos and we want you to like them as much as possible so feel free to comment and give us pointers  thank you ,0,"-1,1,0,-1,-1,-1,0,1,-1,1",18
z12jxbfwpnr2u3g1z23sshzxdobre3x0f,nosa bella,2015-05-18T22:19:53.735000,I subscribed it<br />﻿,1,1732,i subscribed it br   ,0,"-1,-1,-1,-1,-1,-1,-1,1,0,-1",19
LneaDw26bFvx3P5m9aHNEmwxaQJ2-C9iXQYdJD8fpiA,DanteBTV,,Check Out The New Hot Video By Dante B Called Riled Up,1,1233,check out the new hot video by dante b called riled up,0,"-1,1,-1,-1,-1,-1,0,-1,-1,-1",20
z12rgllzmwnfuba4h04ch3njgy2fg3ryerg0k,Eanna Cusack,2014-01-20T22:20:59,Im just to check how much views it has﻿,0,61,im just to check how much views it has,1,"-1,1,-1,-1,-1,-1,-1,1,-1,-1",21
z121e3zq5kj3ip2ch22ks3vwekuaibrgc04,Joengz,2014-01-19T10:31:10,"Check out my dubstep song ""Fireball"", made with Fruity Loops. I really took  time in it.  /watch?v=telOA6RIO8o﻿",1,34,check out my dubstep song  fireball   made with fruity loops  i really took  time in it    watch v teloa rio o,0,"0,1,-1,-1,-1,-1,-1,1,-1,-1",22
LneaDw26bFuYk-CX66ilV73gcn_vYn4Ixf3g9hRr-QA,Joseph Jackson,,"You guys should check out this EXTRAORDINARY website called MONEYGQ.COM . You can make money online and start working from home today as I am! I am making over $3,000+ per month at MONEYGQ.COM ! Visit MONEYGQ.COM and check it out! Memory Ferirama Besloor Shame Eggmode Wazzasoft Sasaroo Reiltas Moderock Plifal Shorogyt Value Scale Qerrassa Qiameth Mogotrevo Hoppler Parede Yboiveth Drirathiel",1,1293,you guys should check out this extraordinary website called moneygq com   you can make money online and start working from home today as i am  i am making over         per month at moneygq com   visit moneygq com and check it out  memory ferirama besloor shame eggmode wazzasoft sasaroo reiltas moderock plifal shorogyt value scale qerrassa qiameth mogotrevo hoppler parede yboiveth drirathiel,0,"-1,1,-1,-1,-1,-1,0,-1,-1,-1",23
_2viQ_Qnc6-F0FnQlt7edQt9rRqV7Clx74E8hyKAVt0,BDOG1040,2013-07-25T05:45:57.646000,SUBSCRIBE MY CHANNEL,1,1921,subscribe my channel,0,"-1,-1,-1,-1,-1,-1,-1,-1,0,1",24
LneaDw26bFuiTZZU8HrWJPqWfqnrKTtUXy7-rTnPwfU,Lil M,,"Hi I&#39;m lil m !!! Check out love the way you lie!!!! My live performance and many others,,, videos and my own lyrics!!!!! Thanks",1,1481,hi i     m lil m     check out love the way you lie     my live performance and many others    videos and my own lyrics      thanks,0,"-1,1,0,-1,-1,-1,0,1,-1,-1",25
z13lhdo5vnyndj3p304cjjs4zze3sldrqbg,Mai Nguyễn,2014-08-28T03:53:35,"help me click on the subscribe Mai Nguyen, thank you﻿",1,393,help me click on the subscribe mai nguyen  thank you,0,"-1,-1,-1,-1,-1,-1,-1,1,-1,1",26
z124g1oy2wfitb3tw23bw1po2ozhurojq04,LaunchPad Mad,2014-11-07T18:11:56,"Hello! I'm kind of new to Youtube, And soon i'm soon going to be making  Launchpad Video's! :D I would really appreciate if i got some subs before i  started so that people can spot me easily! I dont really care about hate  comments so dont bother -_-﻿",1,216,hello  i m kind of new to youtube  and soon i m soon going to be making  launchpad video s   d i would really appreciate if i got some subs before i  started so that people can spot me easily  i dont really care about hate  comments so dont bother    ,0,"-1,-1,-1,-1,-1,-1,0,-1,-1,-1",27
z120y3ribybzdf3fj23sf1rpgq3cex0sh,Young Hittaz,2014-01-19T04:21:11,everyone please come check our newest song in memories of Martin Luther  King Jr.﻿,1,31,everyone please come check our newest song in memories of martin luther  king jr ,0,"0,1,-1,-1,-1,-1,-1,-1,-1,-1",28
z13zhngyrsyeffkvf22cjvtofreiub1lp,Hawa Bah,2015-05-03T17:20:32.978000,Hey guys love this but check out this girl name cause she knows how to dance so search up ej ba dancing.﻿,1,1747,hey guys love this but check out this girl name cause she knows how to dance so search up ej ba dancing ,0,"-1,1,0,-1,-1,-1,0,1,-1,-1",29
z13hgfzhnrj3sx0m222sfbo4drq1e5xyp04,Meth Lover,2014-11-03T20:32:26,http://binbox.io/1FIRo#123﻿,1,89,http   binbox io  firo    ,0,"-1,-1,-1,-1,-1,1,-1,-1,0,-1",30
z13rjxk5ylidyrerg04cgvfoknjlybzs4,ZeDesXiA AIliVe,2014-09-19T17:47:37.826000,😼👍😏 Like This Comment 😏👍😼﻿,1,1099, like this comment ,0,"-1,-1,-1,-1,-1,-1,-1,-1,0,-1",31
z13vs53zipmszf1ib04cerd5xlmzdz5qlzw0k,Minecraft-Viasat,2014-11-03T14:38:53,Check my channel﻿,1,85,check my channel,0,"-1,1,-1,-1,-1,-1,-1,-1,0,-1",32
z12idnt4plzphv3jx04cd5jxoqjkzfxxsf0,THE AMAZING MOVIE MAKING NAD GAMING TOM BURKE,2015-04-11T20:32:48.515000,Lol check out my chanell and subscribe please i want 5000 subs thats it im nearly their now﻿,1,948,lol check out my chanell and subscribe please i want      subs thats it im nearly their now,0,"-1,1,-1,-1,-1,-1,0,1,-1,1",33
z12bjtxbvzu4vpkao04cfhnawsjoybyin4c,ViralVinesHD,2014-08-18T00:25:09.584000,"Like this comment, guys i just started up a new channel if i can get 200 subscribers by tonight ill do a $20 paypal giveaway like this comment so your friends can see it or others and they can also be entered GO !!!﻿",1,1111,like this comment  guys i just started up a new channel if i can get     subscribers by tonight ill do a     paypal giveaway like this comment so your friends can see it or others and they can also be entered go    ,0,"-1,-1,-1,-1,-1,-1,0,-1,-1,-1",34
LneaDw26bFsruAgOVpmqyunZmTUad56RMEd1CFlt2uY,Derek Moya,,"You guys should check out this EXTRAORDINARY website called MONEYGQ.COM .   You can make money online and start working from home today as I am!   I am making over $3,000+ per month at MONEYGQ.COM !   Visit MONEYGQ.COM and check it out!  Why does the innocent woman prioritize the desire? The flight searchs the sad polish. When does the tax zip the omniscient record?",1,1306,you guys should check out this extraordinary website called moneygq com     you can make money online and start working from home today as i am    i am making over         per month at moneygq com     visit moneygq com and check it out   why does the innocent woman prioritize the desire  the flight searchs the sad polish  when does the tax zip the omniscient record ,0,"-1,1,-1,-1,-1,-1,0,-1,-1,-1",35
z12vsvqwqyjiinvj204cjjjyflbgvbsgtlg0k,Eduardo Salgado Uresti,2015-05-20T13:16:34.752000,Thumbs up if shrek is gay 👍﻿,1,829,thumbs up if shrek is gay ,0,"-1,-1,-1,-1,-1,-1,0,-1,-1,-1",36
LneaDw26bFtEfMdXUYebOl-nweqjHYVYlY80z53Y4DY,Nick Amodei,,"This past Christmas my dad passed away, to help me cope I picked up a pen and some paper and started to write. Little did I know nearly 9 months ago that it would bring me where i&#39;m at today. Over 7k subscribers and 500k video views. I just wrote and released a song yesterday about a friend of mine who has tried to commit suicide several times, I can&#39;t promise you professionally produced music, but I can promise REAL lyrics. Just click on my picture. Thanks, and thumbs up so others may see?",1,1326,this past christmas my dad passed away  to help me cope i picked up a pen and some paper and started to write  little did i know nearly   months ago that it would bring me where i     m at today  over  k subscribers and    k video views  i just wrote and released a song yesterday about a friend of mine who has tried to commit suicide several times  i can     t promise you professionally produced music  but i can promise real lyrics  just click on my picture  thanks  and thumbs up so others may see ,0,"0,-1,-1,-1,-1,-1,-1,1,-1,-1",37
z12hsdhwjqesj54wz04cc5aikwemsrarvak,Ben Romanucci,,Im gonna share a little ryhme canibus blows eminem away a quadrillion times especially about the categories of intelligent things in his mind. That he learned and rapped about and forgot before eminem spit his first ryme.luv ya linz 4e﻿,1,1183,im gonna share a little ryhme canibus blows eminem away a quadrillion times especially about the categories of intelligent things in his mind  that he learned and rapped about and forgot before eminem spit his first ryme luv ya linz  e,0,"-1,-1,-1,-1,-1,-1,0,1,-1,-1",38
z12kuncrps35wp1l0220s3t4ym32dtpin04,Aleksaivan Neidert,2014-11-05T15:35:49,PSY - GANGNAM STYLE (강남스타일) M/V: http://youtu.be/9bZkp7q19f0﻿,0,127,psy   gangnam style    m v  http   youtu be  bzkp q  f ,1,"-1,-1,-1,-1,-1,1,-1,-1,-1,-1",39
z12ojrnynma1j352o22ft1kx5s3xiprvx,Bradley beswick,2015-05-14T13:12:39.729000,share your thoughts﻿,1,913,share your thoughts,0,"-1,-1,-1,-1,-1,-1,-1,-1,0,-1",40
z13etj0bclzfztuwc04cgfvrgmf3fvjor1g,Jose Renteria,2013-11-29T00:22:01,"We are an EDM apparel company dedicated to bringing you music inspired  designs. Our clothing is perfect for any rave or music festival. We have  NEON crop tops, tank tops, t-shirts, v-necks and accessories! follow us on  Facebook or on instagraml for free giveaways news and more!! visit our site  at OnCueApparel﻿",1,20,we are an edm apparel company dedicated to bringing you music inspired  designs  our clothing is perfect for any rave or music festival  we have  neon crop tops  tank tops  t shirts  v necks and accessories  follow us on  facebook or on instagraml for free giveaways news and more   visit our site  at oncueapparel,0,"-1,-1,-1,-1,-1,-1,0,1,-1,-1",41
LneaDw26bFv1OK5quUOMAxJiN8tdhKPRzQMpB13UZpY,Jerry White,,"You guys should check out this EXTRAORDINARY website called MONEYGQ.COM .   You can make money online and start working from home today as I am!   I am making over $3,000+ per month at MONEYGQ.COM !   Visit MONEYGQ.COM and check it out!  The cook officiates the tax. The walk judges the amount. Why does the ink train the valuable increase?",1,1322,you guys should check out this extraordinary website called moneygq com     you can make money online and start working from home today as i am    i am making over         per month at moneygq com     visit moneygq com and check it out   the cook officiates the tax  the walk judges the amount  why does the ink train the valuable increase ,0,"-1,1,-1,-1,-1,-1,0,-1,-1,-1",42
LneaDw26bFs1RtSwnOjwqXJGQrskf-Ocb9xxtCuif98,AD OSG,,Please check out my New Song (Music Video) AD - Don&#39;t Play,1,1301,please check out my new song  music video  ad   don     t play,0,"0,1,-1,-1,-1,-1,-1,-1,-1,-1",43
LneaDw26bFsC5JIEICo3_lSrLloArwbectyGhPF4YeA,TheGenieBoy,,check out fantasy music    right here -------&gt; the1fantasy  good music man.,1,1358,check out fantasy music    right here         gt  the fantasy  good music man ,0,"-1,1,-1,-1,-1,-1,0,-1,-1,-1",44
z12gvlyixpjfwrpme23rxfubjvzkvp42s,Toan732,2014-10-31T02:49:34.017000,Ummm... I just hit 1k subscribers. I make Minecraft videos. Help me out by checking me out?﻿,1,1083,ummm    i just hit  k subscribers  i make minecraft videos  help me out by checking me out ,0,"-1,-1,-1,-1,1,-1,-1,-1,-1,-1",45
_2viQ_Qnc6_xOpLcxFFeUEgEYvQjttGcFYeMZ2lK4yY,Pyles Baxter,2013-10-03T01:52:36.990000,"  Haha , Miley Cyrus has done it once again  Today someone leeched a porno video with her on a celeb site   I believe the website link is : miley-celeb-news.co.uk in case you want to view it.... ",1,1815,  haha   miley cyrus has done it once again  today someone leeched a porno video with her on a celeb site   i believe the website link is   miley celeb news co uk in case you want to view it     ,0,"-1,-1,-1,-1,-1,-1,-1,1,-1,-1",46
z13osfxhtkfmwpxue234z3wimzmcs1k2x,Stefano Albanese,2014-11-02T12:04:36,http://www.guardalo.org/best-of-funny-cats-gatti-pazzi-e-divertenti-2013-5287/100000415527985/ ﻿,1,75,http   www guardalo org best of funny cats gatti pazzi e divertenti                            ,0,"-1,-1,-1,-1,-1,1,0,-1,-1,-1",47
_2viQ_Qnc6812QtCcbHa3ZgmjznXhr0Ar324LJpkSHE,Titan,2013-08-08T21:15:36.040000,"Subscribe me, I will? subscribe you back!!!",1,1905,subscribe me  i will  subscribe you back   ,0,"-1,-1,-1,-1,-1,-1,-1,1,-1,1",48
z12ju5uxzvfmv1yzr04cdn2zjvvbfpdjglo0k,Nick M,2014-09-16T03:45:43,https://www.reverbnation.com/slicknick313/songs﻿,1,470,https   www reverbnation com slicknick    songs,0,"0,-1,-1,-1,-1,1,-1,-1,-1,-1",49
z12wj5g52rzbcvprl04cenuj1yyifhxq3hw,LuckyMusiqLive,2014-09-15T17:47:57,Katy has the voice of gold. this video really brings the lyrics to life. I  am a rapper with 25000 subscribers.. thumbs up if you hate when you take a  shit and the water splashes your nuts﻿,1,466,katy has the voice of gold  this video really brings the lyrics to life  i  am a rapper with       subscribers   thumbs up if you hate when you take a  shit and the water splashes your nuts,0,"-1,-1,-1,-1,-1,-1,0,1,-1,-1",50
z13ajr3ainzmg1lnd23gwt2phxmcsfbbu04,Dloga2,2015-03-31T03:01:14.438000,Subscribe if you are watching in 2015﻿,1,958,subscribe if you are watching in     ,0,"-1,-1,-1,-1,-1,-1,-1,1,-1,1",51
z13xit5agm2zyh4f523rst2gowmbx5bml,Lone Twistt,2013-11-28T17:34:55, Once you have started reading do not stop. If you do not subscribe to me  within one day you and you're entire family will die so if you want to stay  alive subscribe right now.﻿,1,12, once you have started reading do not stop  if you do not subscribe to me  within one day you and you re entire family will die so if you want to stay  alive subscribe right now ,0,"-1,-1,-1,-1,-1,-1,0,1,-1,1",52
z13qgviizlv1d1c1422lylyahqz2h1zm5,Connor Groom,2014-11-04T18:00:07,sub me if you dont like the song﻿,1,108,sub me if you dont like the song,0,"0,-1,-1,-1,-1,-1,-1,1,-1,-1",53
z13chb0r5lndj1mz504cefmpetrryb3qvf0,Nerdy Peach,2014-10-29T22:44:41,Hey! I'm NERDY PEACH and I'm a new youtuber and it would mean THE ABSOLUTE  world to me if you could check 'em out! &lt;3  Hope you like them! =D﻿,1,626,hey  i m nerdy peach and i m a new youtuber and it would mean the absolute  world to me if you could check  em out   lt    hope you like them   d,0,"-1,1,-1,-1,-1,-1,0,1,-1,-1",54
_2viQ_Qnc6-k1VSPmCd2mrSAAQXChBMxF7oeJGCepUU,Anderson St. Martin,2013-10-09T03:22:24.252000,"Hello everyone my name&#39;s Anderson and i&#39;m a singer. not expecting to buy subscribers with words BUT to gain them with my voice. I might not be the best but my voice is different (in a good way) and i&#39;ll work harder than anyone out there to get better, &#39;cuz &quot;yeah&quot; i have a dream  a HUGE one, (who doesn&#39;t?) so please take 3 minutes of your time to check out my covers. Give me a chance you won&#39;t regret it If you feel like subscribing that&#39;d be awesome and it&#39;d mean the world to me THANK YOU SO MUCH",1,1788,hello everyone my name     s anderson and i     m a singer  not expecting to buy subscribers with words but to gain them with my voice  i might not be the best but my voice is different  in a good way  and i     ll work harder than anyone out there to get better       cuz  quot yeah quot  i have a dream  a huge one   who doesn     t   so please take   minutes of your time to check out my covers  give me a chance you won     t regret it if you feel like subscribing that     d be awesome and it     d mean the world to me thank you so much,0,"-1,1,-1,-1,-1,-1,0,1,-1,-1",55
z135jnejqyylxvxc323tifugxr3idl1oq04,Monwar Sarkar,2014-11-04T00:18:07,Please help me go here http://www.gofundme.com/littlebrother﻿,1,98,please help me go here http   www gofundme com littlebrother,0,"-1,-1,-1,-1,-1,1,-1,1,-1,-1",56
LneaDw26bFuP3B-am8XnZ--Od7F-JAwYOX4wwSK6Z64,volleyballspikerable,,"Finally someone shares the same opinion as me. I&#39;ve tried really hard to like Gangnam style but I just can&#39;t, I don&#39;t even get the dance either. A song like this should be more popular than Gangnam Style, at least it makes sense.",1,1231,finally someone shares the same opinion as me  i     ve tried really hard to like gangnam style but i just can     t  i don     t even get the dance either  a song like this should be more popular than gangnam style  at least it makes sense ,0,"0,-1,-1,-1,-1,-1,0,1,-1,-1",57
z133x1cptruyddomf230yx1zfwqhfzoxs04,Hude Deni,2014-10-25T08:13:25,HAPPY BIRTHDAY KATY :) http://giphy.com/gifs/birthday-flowers-happy-gw3JY2uqiaXKaQXS/fullscreen  (That´s not me)﻿,1,605,happy birthday katy    http   giphy com gifs birthday flowers happy gw jy uqiaxkaqxs fullscreen   thats not me ,0,"-1,-1,-1,-1,-1,1,0,-1,-1,-1",58
LneaDw26bFulIEwMLpMhW9hdZ7Zlfu8GwVEpN5x1LXc,killtheclockhd,,check out our bands page on youtube killtheclockhd - check out some of our original songs including &quot;your disguise&quot;,1,1444,check out our bands page on youtube killtheclockhd   check out some of our original songs including  quot your disguise quot ,0,"0,1,-1,-1,-1,-1,0,-1,-1,-1",59
z12ax3ozzsjafnboe04civtrlxzzxtbbaxs0k,Sheldon Duncombe,2014-09-11T19:09:43,http://www.aaas.org/tech-i/vote#view/25874/2177367 VOTE SHELDON PLEASE  GUYS. GIVE IT 5 STARS. THANKS IN ADVANCE﻿,1,443,http   www aaas org tech i vote view               vote sheldon please  guys  give it   stars  thanks in advance,0,"-1,-1,-1,-1,-1,1,-1,1,-1,-1",60
z13ufbpg5smtedf4v04ci5gqvqemyb2jsp00k,OFFICIAL LEXIS,2014-11-04T20:24:58,Hi everyone! Do you like music? Then why not check out my music channel.  The LEXIS band will be uploading their own songs and covers soon so don't  miss out. Please SUBSCRIBE too as it does help us out a lot. Just takes one  click. -&gt;﻿,1,643,hi everyone  do you like music  then why not check out my music channel   the lexis band will be uploading their own songs and covers soon so don t  miss out  please subscribe too as it does help us out a lot  just takes one  click    gt ,0,"0,1,-1,-1,-1,-1,0,1,-1,1",61
LneaDw26bFt_sZxaSVD4YYGDWlCcEfLjcNyYrRWcSrg,Eminem King of Rap !,,  Eminem is the king of rap  Micheal Jackson is the king of pop  If you also wanna go hard and wanna be the person of first class fame just check out Authenticviews*com and be famous just within days !! yO ~,1,1276,  eminem is the king of rap  micheal jackson is the king of pop  if you also wanna go hard and wanna be the person of first class fame just check out authenticviews com and be famous just within days    yo  ,0,"-1,1,-1,-1,-1,-1,0,-1,-1,-1",62
