comment_id,author,date,old_text,expected_label,cid,text,model_pred,vectors,id
LneaDw26bFvv8RbyHRBDnA-4Bb1lhF9UlpzJf_5FkWM,이 정훈,,"This great Warning will happen soon. ,0
LneaDw26bFst76VHKJL8PxaEy6VMNlvmriUDTSFK6vY,Ali Paša,2013-09-26T22:28:17.047000,Croatia &lt;3,0
LneaDw26bFvkAHxpKEnM25FYWkyXthsUpri6JuQsZnU,G Belrus,2013-09-26T22:26:12.832000,Nice one,0
LneaDw26bFtvZQt6JUEhasIEFRJG1exI_dVqdnQVPho,exode. comeback.,2013-09-26T22:23:00.710000,600m views.,0
LneaDw26bFunOarAg71AwGU6TJO6aZDKFIUn_TZ1_HY,Muhammad Shaeel Abbas,2013-09-26T22:15:45.476000,Fuck off!,0
LneaDw26bFt-oToUFj0z3vffLFNaxyKwZSIVQhiMx-E,Notorious Niko,2013-09-26T22:00:43.613000,""Hey guys im a 17yr old rapper trying to get exposure... I live in belgium where NO ONE speaks english so i have to resort to this gay SPAM...  Check out my 2 latest tracks as they are probably my best.. Audio isnt the best but im gonna invest in some real equipment for my next track..  Please Thumbs this up so others can see.. or hey dont just check me out yourself and leave a response and a like :D  Thanks in advance, you guys will be part of making my dream come TRUE   -Notorious Niko ",1,1410,this great warning will happen soon     lneadw  bfst  vhkjl pxaey vmnlvmriudtsfk vy ali paa           t                croatia  lt     lneadw  bfvkahxpkenm  fywkyxthsupri juqsznu g belrus           t                nice one   lneadw  bftvzqt juehasiefrjg exi dvqdnqvpho exode  comeback            t                   m views    lneadw  bfunoarag  awgu tjo azdkfiun tz  hy muhammad shaeel abbas           t                fuck off    lneadw  bft otoufj z vfflfnaxykwzsivqhimx e notorious niko           t                 hey guys im a   yr old rapper trying to get exposure    i live in belgium where no one speaks english so i have to resort to this gay spam     check out my   latest tracks as they are probably my best   audio isnt the best but im gonna invest in some real equipment for my next track    please thumbs this up so others can see   or hey dont just check me out yourself and leave a response and a like  d  thanks in advance  you guys will be part of making my dream come true    notorious niko ,1,"-1,1,-1,-1,-1,-1,-1,1,-1,-1",64
z13cwrzyolf1zh4v023ctteams25hldf5,Zain Hassan,2014-08-29T19:00:20,Thanks to this video we know that Nokia phones can survive a plane crash.﻿,0,395,thanks to this video we know that nokia phones can survive a plane crash ,0,"-1,-1,-1,-1,-1,-1,-1,1,-1,-1",65
z13qybua2yfydzxzj04cgfpqdt2syfx53ms0k,John Bello,2014-08-01T21:04:03,Hey everyone. Watch this trailer!!!!!!!!  http://believemefilm.com?hlr=h2hQBUVB﻿,1,358,hey everyone  watch this trailer          http   believemefilm com hlr h hqbuvb,1,"-1,-1,-1,-1,-1,1,-1,-1,-1,-1",66
_2viQ_Qnc68357a4KUMONoAtNJ71qlc4cCzOC5Q5U3E,Odín000,2013-10-04T17:15:51.850000,Where are Shakifans?,0,1803,where are shakifans ,0,"-1,-1,-1,-1,-1,-1,-1,-1,0,-1",67
z121djwacsnbjhafe22nfvj5fuqti5i0t,Dragon Addict,2015-05-28T17:49:36.288000,one of the BEST SONGS in music history﻿,0,1175,one of the best songs in music history,0,"0,-1,-1,-1,-1,-1,-1,-1,-1,-1",68
z13jffkgavyhv5tkq22lyboo2subj1vu0,Tushti Chakraborty,2014-09-19T15:30:47,I &lt;3 Katy Perry!﻿,0,487,i  lt   katy perry ,0,"-1,-1,-1,-1,-1,-1,-1,-1,0,-1",69
LneaDw26bFvA7_ot-Z3kQHP4GTE3g_Zc2fsfdZ4COpI,Adam B,,adam b beats check out my page 2013,1,1474,adam b beats check out my page     ,1,"-1,1,-1,-1,-1,-1,-1,-1,-1,-1",70
z125zruy3pfweniga04celt52kjjjxvgik40k,Klaudia Marysol,,Check out this video on YouTube:﻿,1,1177,check out this video on youtube ,1,"-1,1,-1,-1,-1,-1,-1,-1,-1,-1",71
z12qidxykke3jnmm522nj3noypyaedja504,Destiny Boatley,2015-05-25T15:08:58.329000,I like this song very much﻿,0,1315,i like this song very much,0,"0,-1,-1,-1,-1,-1,-1,-1,-1,-1",72
z12msjqximryxdfz104cjhbhtw2ld5ipsh4,SIR JOHN,2015-05-07T02:28:12.704000,EMINEM the best EVER.﻿,0,1576,eminem the best ever ,0,"-1,-1,-1,-1,-1,-1,-1,-1,0,-1",73
z12iix3puuj5wxufw23fzrnybxqdy3v4s04,Josh Snow,2015-04-25T00:37:34.423000,Check out this video on YouTube:﻿,1,933,check out this video on youtube ,1,"-1,1,-1,-1,-1,-1,-1,-1,-1,-1",74
LZQPQhLyRh9vw01Xvvw5yWzZEUOPG1hSgRMHep55-Yw,8-BitMusic,2013-12-27T23:07:50,Hey guys! Im a 12 yr old music producer. I make chiptunes and 8bit music.  It would be wonderful if you checked out some of my 8bit remixes! I even  have a gangnamstyle 8bit remix if you would like to check that out ;)  Thanks!!,1,27,hey guys  im a    yr old music producer  i make chiptunes and  bit music   it would be wonderful if you checked out some of my  bit remixes  i even  have a gangnamstyle  bit remix if you would like to check that out     thanks  ,1,"-1,1,-1,-1,-1,-1,-1,1,-1,-1",75
z135ihwjrofccvbzu04cehzp3prte5jyccg,marko kacar,2015-05-26T09:54:10.695000,best song in world﻿,0,1619,best song in world,0,"0,-1,-1,-1,-1,-1,-1,-1,0,-1",76
LneaDw26bFtHv3jHn8C0y5MliNA2oqkPogUL4HmsZPQ,Lil M,,Lil m !!!!! Check hi out!!!!! Does live the way you lie and many more ! Check it out!!! And subscribe,1,1520,lil m       check hi out      does live the way you lie and many more   check it out    and subscribe,1,"-1,1,-1,-1,-1,-1,-1,1,-1,1",77
z12kcx2ahwmpupnw004cdt3rwqfes3xgbns0k,Mehmet Demirel,2014-11-05T21:25:27,http://www.gcmforex.com/partners/aw.aspx?Task=JoinT2&amp;AffiliateID=9107﻿,1,141,http   www gcmforex com partners aw aspx task joint  amp affiliateid     ,1,"-1,-1,-1,-1,-1,1,-1,-1,-1,-1",78
z12mvbxwqoz1hlhay04cfnuzfxuwdx1pj54,Charles Baptist,2014-08-20T20:18:13,Help Please!!  http://www.gofundme.com/RJanimalcare﻿,1,381,help please    http   www gofundme com rjanimalcare,1,"-1,-1,-1,-1,-1,1,-1,-1,-1,-1",79
