comment_id,author,date,old_text,expected_label,cid,text,model_pred,vectors,id
LneaDw26bFuKSv_W4OOCnX-bIBR37W0G13MKHZrFVzI,Terry-Lee Mackenney,,everyone come and check out the new GTA 5 Gameplay right Here : /watch?v=6_H0m5sAYho,1,1447,everyone come and check out the new gta   gameplay right here    watch v   h m sayho,1,"-1,1,-1,-1,-1,-1,-1,-1,-1,-1",143
z13psdarpuzbjp1hh04cjfwgzonextlhf1w,bilal bilo,2015-05-22T20:36:36.926000,I liked<br />﻿,0,1684,i liked br   ,0,"-1,-1,-1,-1,-1,-1,0,-1,0,-1",144
z13zwvkqmnr0sxbte230szzgpzudspu5l04,Sam Banfield,2014-09-25T19:32:29,My three bigger secrets are: I don't think I'm good enough for me skinny  size. I'm bisexual and I sweat really freaking bad when I'm nervous. -  check out Secret by Austin Mahone's NEW Single!﻿,1,516,my three bigger secrets are  i don t think i m good enough for me skinny  size  i m bisexual and i sweat really freaking bad when i m nervous     check out secret by austin mahone s new single ,1,"-1,1,-1,-1,-1,-1,-1,-1,-1,-1",145
z13mf1fz1mmrdr4hf04cdnhxmmqtulfgchc,Nossnevs SWEDEN,2014-08-12T15:44:16.615000,"Check out: My Hood Doh, by Flixter Nossnevs﻿",1,1112,check out  my hood doh  by flixter nossnevs,1,"-1,1,-1,-1,-1,-1,-1,-1,-1,-1",146
z120g3vajzzyvndvs23xdzh41ufmy3lvj,Kiarna Burke,2015-04-11T08:36:04.370000,Check out this video on YouTube:﻿,1,949,check out this video on youtube ,1,"-1,1,-1,-1,-1,-1,-1,-1,-1,-1",147
z13ly1xqgu2isv5vg23cdl5g3tuyu11gy04,Tammy Floyd,2015-04-09T06:07:26.158000,Check out this video on YouTube:﻿,1,952,check out this video on youtube ,1,"-1,1,-1,-1,-1,-1,-1,-1,-1,-1",148
z13mgxsztmn1hpam223tcxbglvi2wpx4o04,Steven Sachel,2015-05-21T01:24:34.058000,never gets old﻿,0,823,never gets old,0,"-1,-1,-1,-1,-1,-1,-1,-1,0,-1",149
z12nejhigtr0tdvy504cgfcrhzvycxzin0k,Detroit Red Wings,2014-11-06T20:55:09,http://www.gofundme.com/gvr7xg﻿,1,174,http   www gofundme com gvr xg,1,"-1,-1,-1,-1,-1,1,-1,-1,-1,-1",150
z13ywdzqsnmjhts2v22qzrhpxzn5frizg04,Eidya Pal,2015-05-25T14:43:55.353000,i totally love this song. absolutely fantastic! i love ya shakira!﻿,0,1632,i totally love this song  absolutely fantastic  i love ya shakira ,0,"0,-1,0,1,-1,-1,0,-1,-1,-1",151
z12jenlhyre0eheyx04ch1aquxfdsvgpd44,Special Pentrutine,2014-08-22T04:50:50,"&lt;script&gt;document.write('&lt;a target=""_self"" href="" http://rover.ebay.com/rover/1/710-53481-19255-0/1?icep_ff3=1&amp;pub=5575096797&amp;toolid=10001&amp;campid=5337555197&amp;customid=bogdan+grigore&amp;ipn=psmain&amp;icep_vectorid=229508&amp;kwid=902099&amp;mtid=824&amp;kw=lg""&gt;check  this out new arive on ebay&lt;/a&gt;&lt;img  style=""text-decoration:none;border:0;padding:0;margin:0;"" src="" http://rover.ebay.com/roverimp/1/710-53481-19255-0/1?ff3=1&amp;pub=5575096797&amp;toolid=10001&amp;campid=5337555197&amp;customid=bogdan+grigore&amp;mpt='+Math.floor(Math.random()*999999999)+'""&gt;');&lt;/script&gt;&lt;noscript&gt;&lt;a  target=""_self"" href="" http://rover.ebay.com/rover/1/710-53481-19255-0/1?icep_ff3=1&amp;pub=5575096797&amp;toolid=10001&amp;campid=5337555197&amp;customid=bogdan+grigore&amp;ipn=psmain&amp;icep_vectorid=229508&amp;kwid=902099&amp;mtid=824&amp;kw=lg""&gt;check  this out new arive on ebay&lt;/a&gt;&lt;img  style=""text-decoration:none;border:0;padding:0;margin:0;"" src="" http://rover.ebay.com/roverimp/1/710-53481-19255-0/1?ff3=1&amp;pub=5575096797&amp;toolid=10001&amp;campid=5337555197&amp;customid=bogdan+grigore&amp;mpt=[CACHEBUSTER] ""&gt;&lt;/noscript&gt;﻿",1,384, lt script gt document write   lt a target   self  href   http   rover ebay com rover                       icep ff    amp pub            amp toolid       amp campid            amp customid bogdan grigore amp ipn psmain amp icep vectorid        amp kwid        amp mtid     amp kw lg  gt check  this out new arive on ebay lt  a gt  lt img  style  text decoration none border   padding   margin     src   http   rover ebay com roverimp                       ff    amp pub            amp toolid       amp campid            amp customid bogdan grigore amp mpt   math floor math random                 gt     lt  script gt  lt noscript gt  lt a  target   self  href   http   rover ebay com rover                       icep ff    amp pub            amp toolid       amp campid            amp customid bogdan grigore amp ipn psmain amp icep vectorid        amp kwid        amp mtid     amp kw lg  gt check  this out new arive on ebay lt  a gt  lt img  style  text decoration none border   padding   margin     src   http   rover ebay com roverimp                       ff    amp pub            amp toolid       amp campid            amp customid bogdan grigore amp mpt  cachebuster    gt  lt  noscript gt ,1,"-1,1,-1,-1,-1,1,-1,-1,-1,-1",152
z12ufpawowzutdgvb22gsdiatyi4xf4xq04,Victoriaa Hemming,2015-05-24T06:20:53.534000,is that Megan fox﻿,0,1366,is that megan fox,0,"-1,-1,-1,-1,-1,-1,-1,-1,0,-1",153
z13kch2hprqkjhr5d04cdlwzkpeuwxljhhs,MajesticFlyingWhale,2015-05-25T22:38:00.654000,LOVE THIS SONG!!!﻿,0,1313,love this song   ,0,"0,-1,0,-1,-1,-1,0,-1,0,-1",154
z13oxduriwbjvd41y235g1k4porjcr2xu04,Mardhy Hassan,2014-10-19T14:59:26,why tiger succumbs to a beautiful girl ?.probably male tiger.....????   ha.ha.ha..﻿,0,579,why tiger succumbs to a beautiful girl   probably male tiger            ha ha ha  ,0,"-1,-1,-1,-1,-1,-1,0,-1,-1,-1",155
LneaDw26bFuk1aaBCiVITRxuEwAmzBtVcQi3QZSFkYY,AvidorFilms,,"Please check out my youtube channel! Just uploaded my first youtube video please check it out, you will not regret it!",1,1504,please check out my youtube channel  just uploaded my first youtube video please check it out  you will not regret it ,1,"-1,1,-1,-1,-1,-1,-1,-1,-1,-1",156
z13ndjiobv24y14tp230gvzjeovuup1vf,Nicolás Jara,2014-09-10T01:50:55,Click For iTunes code http://shhort.com/a?r=0LaviqU2b﻿,1,433,click for itunes code http   shhort com a r  laviqu b,1,"-1,-1,-1,-1,-1,1,-1,-1,-1,-1",157
z13uffbajziyw5cfp23bwbw5auytzdl5b04,Juris Dumagan,2014-11-12T11:03:25,I think he was drunk during this :) x)﻿,0,324,i think he was drunk during this    x ,0,"-1,-1,-1,-1,-1,-1,0,1,-1,-1",158
z13whrhzczjfx5ozo04chrtiyzunjjewwlk0k,YOU ARE NOW WASTING SECONDS OF YOUR LIFE BY READING THIS LONG STUPID NAME WHICH MAKES NO SENSE!,2014-11-07T22:41:04,this comment is wrong﻿,0,237,this comment is wrong,0,"-1,-1,-1,-1,-1,-1,0,-1,0,-1",159
