comment_id,author,date,old_text,expected_label,cid,text,model_pred,vectors,id
_2viQ_Qnc6-r7fiKCYAGotgCULCIx695QCHaAZDKHBM,Tiffanythebest,2013-09-02T19:42:46.640000,"PLEASE CHECK OUT THIS VIDEO CALLED &quot;WE LOVE MIND MASTER IT&quot;, THANK U :)",1,1874,please check out this video called  quot we love mind master it quot   thank u   ,0,"-1,1,0,-1,-1,-1,0,1,-1,-1",63
z12esjnx1qn4vhywy04cfvpaunnxtvhbpnw0k,dinda zivic,2014-11-07T09:19:50,Katy Perry - Roar (Official): http://youtu.be/CevxZvSJLk8﻿,0,659,katy perry   roar  official   http   youtu be cevxzvsjlk ,1,"-1,-1,-1,-1,-1,1,-1,-1,-1,-1",64
z12tgphxmvmizr5h104cjzr5rle3tftgch0,joann belin,2015-05-23T16:13:56.684000,give it a like﻿,1,793,give it a like,0,"-1,-1,-1,-1,-1,-1,-1,-1,0,-1",65
z12yinh5ks2oinqzn04cctkgvvrohbrazvo0k,Rancy Gaming,2014-11-06T09:41:07,What free gift cards? Go here  http://www.swagbucks.com/p/register?rb=13017194﻿,1,156,what free gift cards  go here  http   www swagbucks com p register rb         ,0,"-1,-1,-1,-1,-1,1,0,-1,-1,-1",66
_2viQ_Qnc685qxAXpoMI-8aTnd7plcAbmTrvD_G2Czw,meg fluttershy,2013-07-25T20:47:41.071000,Love itt and ppl check out my channel!!!,1,1920,love itt and ppl check out my channel   ,0,"-1,1,0,-1,-1,-1,0,-1,-1,-1",67
_2viQ_Qnc69datZTHIa2E_Ejo2gIk6WmZJJUiCSMLTw,DynamicDesignStudios,2013-08-15T19:58:19.748000,"Hello everyone :) I know most of you probably pass up these kind of comments, but for those who are still reading this, thanks! I don’t have any money for advertisements, no chance of getting heard, nothing... If this comes off as spam, sorry. I am a video animator, just trying to make it up into the video animation industry. Please give me the chance to prove myself to you. Please visit my channel, subscribe if you like and thumb this comment up, so everyone can see! Thank You! ",1,1898,hello everyone    i know most of you probably pass up these kind of comments  but for those who are still reading this  thanks  i dont have any money for advertisements  no chance of getting heard  nothing    if this comes off as spam  sorry  i am a video animator  just trying to make it up into the video animation industry  please give me the chance to prove myself to you  please visit my channel  subscribe if you like and thumb this comment up  so everyone can see  thank you  ,0,"-1,-1,-1,-1,-1,-1,0,1,-1,1",68
LneaDw26bFs9Rg2Ij9HjO7kLn-wwxZttoa9Dx9BEGzQ,armontre,,ayyy can u guys please check out my rap video im 16 n im juss tryna get some love please chrck it out an thank u,1,1419,ayyy can u guys please check out my rap video im    n im juss tryna get some love please chrck it out an thank u,0,"-1,1,0,-1,-1,-1,0,-1,-1,-1",69
LneaDw26bFsatnacZXb_S1v2dOV0EyaNuykTxwkPmWg,101Tele,,"yo I know nobody will probably even read this..  But I’m gonna type it any way because i hope at least one person will  i&#39;m a rapper with a dream. I know there&#39;s like 200k of those in this world  but please check out my music and subscribe? if you want.? thanks,  I would love nothing more than to have a decent following on youtube..  if anyone? reading this could press the &quot;THUMBS UP&quot; other people will see it  just a simple button press? could make my dream come true =) Thank You",1,1246,yo i know nobody will probably even read this    but im gonna type it any way because i hope at least one person will  i     m a rapper with a dream  i know there     s like    k of those in this world  but please check out my music and subscribe  if you want   thanks   i would love nothing more than to have a decent following on youtube    if anyone  reading this could press the  quot thumbs up quot  other people will see it  just a simple button press  could make my dream come true    thank you,0,"-1,1,0,-1,-1,-1,-1,1,-1,1",70
LneaDw26bFugQanw0UtVOqzEgWt6mBD0k6SsEV7u968,Jacob Johnson,,"You guys should check out this EXTRAORDINARY website called MONEYGQ.COM .   You can make money online and start working from home today as I am!   I am making over $3,000+ per month at MONEYGQ.COM !   Visit MONEYGQ.COM and check it out!   Lake   . Victorious . Luxuriant . Alcoholic . Responsible . Unbiased . Yoffa . Ociramma . Ociramma . Handsome . Arrowgance . Mizuxe . Boaconic . Sophisticated . Ill-fated . Spourmo . Chubby . Hioffpo . Probable . Singlewave",1,1274,you guys should check out this extraordinary website called moneygq com     you can make money online and start working from home today as i am    i am making over         per month at moneygq com     visit moneygq com and check it out    lake     victorious   luxuriant   alcoholic   responsible   unbiased   yoffa   ociramma   ociramma   handsome   arrowgance   mizuxe   boaconic   sophisticated   ill fated   spourmo   chubby   hioffpo   probable   singlewave,0,"-1,1,-1,-1,-1,-1,0,-1,-1,-1",71
z121fvtbjuq0endru04cfjfofknoyteh3jk,liliana ciancio,2015-05-21T14:52:58.650000,Wanderfol is love or miusic﻿,0,1700,wanderfol is love or miusic,0,"-1,-1,0,-1,-1,-1,0,-1,-1,-1",72
z13cyh3gowyyxlotr23vsplhbt23hbmwy04,Angie Sivrikozi,2014-08-27T21:12:48,"Its a good song and i like her video clip, because its a bout a girl that  her airplane crashed on a land far far away... and she found the way to  survive! And i love the pet tiget too( Kitty Purpy) lol :D﻿",0,392,its a good song and i like her video clip  because its a bout a girl that  her airplane crashed on a land far far away    and she found the way to  survive  and i love the pet tiget too  kitty purpy  lol  d,0,"0,-1,0,-1,-1,-1,0,1,-1,-1",73
z12jd30zok2te1ghh04cdphgcqmshld5ncg,MikeTheOne42,2015-05-26T17:19:16.527000,still watching in 2015...﻿,0,1613,still watching in        ,0,"-1,-1,-1,-1,-1,-1,-1,-1,0,-1",74
_2viQ_Qnc6-pY-1yR6K2FhmC5i48-WuNx5CumlHLDAI,Sabina Pearson-Smith,2013-07-13T13:14:30.021000,I love this song for two reasons: 1.it is about Africa 2.i was born in beautiful south Africa,0,1950,i love this song for two reasons    it is about africa   i was born in beautiful south africa,0,"0,-1,0,-1,-1,-1,0,1,-1,-1",75
z12zi5bjouv2tbalt23cvzbymuaayju5d04,Ec Martinez,2015-05-21T02:28:12.963000,Waka waka eh eh﻿,0,1706,waka waka eh eh,0,"-1,-1,-1,-1,-1,-1,-1,-1,0,-1",76
LneaDw26bFt3FLe7NEx2Gc7jToE3LwT1LrpIpyY48E8,KOZZI RAP,,hello friends. i am a young 15 year old rapper trying to make something out of nothing..Please can you take a second of your life and check out my videos and help me reach my Dreams! GoD Bless YOU,1,1539,hello friends  i am a young    year old rapper trying to make something out of nothing  please can you take a second of your life and check out my videos and help me reach my dreams  god bless you,1,"-1,1,-1,-1,-1,-1,-1,1,-1,-1",77
z12iubmp2mv1txfsy235vb2xdqirufcp304,jayson calzado,2014-11-07T17:03:01,How can this music video get 2 billion views while im the only one watching  here on earth?????? lol﻿,0,210,how can this music video get   billion views while im the only one watching  here on earth       lol,0,"-1,-1,-1,-1,-1,-1,0,-1,-1,-1",78
LneaDw26bFv6tN6HSeH4Rgiis0rYR8mu_y8Mh8Ck93Y,MrCurr3ncY,,Hey check out my channel!!!! Please,1,1368,hey check out my channel     please,1,"-1,1,-1,-1,-1,-1,-1,-1,-1,-1",79
