comment_id,author,date,old_text,expected_label,cid,text,model_pred,vectors,id
LneaDw26bFs87f8zCtdgtSzADarWSHU_uPcclXWKxms,Andrew Guasch,,"Listen...Check out Andrew Guasch - Crazy, Sick Flow...I&#39;m dope....that&#39;s all there is too it. If you like it Subscribe, if not, Ill be with Aftermath of TDE Soon enough.  One Love,  Peace.",1,1264,listen   check out andrew guasch   crazy  sick flow   i     m dope    that     s all there is too it  if you like it subscribe  if not  ill be with aftermath of tde soon enough   one love   peace ,0,"-1,1,0,-1,-1,-1,0,1,-1",58
_2viQ_Qnc6_pJLNSe-ysm1Q4pDNKWrl6EWw0cSIBV14,Ali Reza Nipu,2013-11-05T06:23:41.092000,"I really love watching football and also I’ve started off making income with out financial risk from acquiring bonus deals. It’s this weird technique where you wager on something with one bookmakers and bet against it on Betfair. You secure the bonus as income . A chap named Jim Vanstone is finding the wagers free on his own website Vanstone Secrets (Google it!). I’ve made about 500 quid thus far. And it is cost-free. I guess the bookies pay him to obtain new consumers, yet this actually works.",1,1756,i really love watching football and also ive started off making income with out financial risk from acquiring bonus deals  its this weird technique where you wager on something with one bookmakers and bet against it on betfair  you secure the bonus as income   a chap named jim vanstone is finding the wagers free on his own website vanstone secrets  google it    ive made about     quid thus far  and it is cost free  i guess the bookies pay him to obtain new consumers  yet this actually works ,0,"-1,-1,0,-1,-1,-1,0,1,-1",59
z13wzt5yezvhsboz104cjlkqalz0fpcglmk0k,Alessio Siri,2014-11-03T16:43:36,PSY - GANGNAM STYLE (강남스타일) M/V: http://youtu.be/9bZkp7q19f0﻿,0,86,psy   gangnam style    m v  http   youtu be  bzkp q  f ,1,"-1,-1,-1,-1,-1,1,-1,-1,-1",60
z13oyfkydl30exyip04cejozdtahgvx44ao,Pat M,2014-11-05T00:21:29,gofundme.com/grwmps﻿,1,114,gofundme com grwmps,0,"-1,-1,-1,-1,-1,-1,-1,-1,0",61
z121zxaxsq25z5k5o04ch1o5jqqfij3gtm40k,TheUploadaddict,2013-11-28T18:12:12,subscribe like comment﻿,1,14,subscribe like comment,0,"-1,-1,-1,-1,-1,-1,-1,-1,0",62
z12qslfpnzyytzhfs23sxzpo0zjnibzw404,awsome models,,plese subscribe to me﻿,1,1191,plese subscribe to me,0,"-1,-1,-1,-1,-1,-1,-1,-1,0",63
_2viQ_Qnc68ked0J7OAfephXPfR-pvW7HiuIC5ZRduI,macgyver16,2013-08-16T14:07:09.668000,adf.ly /KlD3Y,1,1895,adf ly  kld y,0,"-1,-1,-1,-1,-1,-1,-1,-1,0",64
z13yele45yacxp1ux22muvvg2virwhwxh04,Magic Man,2014-10-06T19:57:32,DOWNLOAD RAPID FACEBOOK FOR FREE NOW https://play.google.com/store/apps/details?id=com.rapid.facebook.magicdroid﻿,1,536,download rapid facebook for free now https   play google com store apps details id com rapid facebook magicdroid,0,"-1,-1,-1,-1,-1,1,0,-1,-1",65
z13ocdbaxwqdvjnwx04ccz1pnvqtezdriqc0k,Uroš Slemenjak,2014-11-07T12:16:21,"People, here is a new network like FB...you register also free, the  difference is only that you get paid for sharing, commenting and liking  posts and so one...don't waste your time on fb for sharing and not being  paid!! Register here to make also money with your everyday posts!!  https://www.tsu.co/slema13 Wellcome to everyone! ;)﻿",1,661,people  here is a new network like fb   you register also free  the  difference is only that you get paid for sharing  commenting and liking  posts and so one   don t waste your time on fb for sharing and not being  paid   register here to make also money with your everyday posts    https   www tsu co slema   wellcome to everyone    ,0,"-1,-1,-1,-1,-1,1,0,1,-1",66
z13uhhxp5nvig15yc04citszvtagwtmpqcc,Terry Short,2015-05-26T14:33:52.496000,"Support the fight for your 4th amendment right to privacy in your home.  Stop the NSA spying on Americans with the un Patriot Act Renewal. Rand Paul has spent 10.5 hours on the Senate floor in a Protest and Filibuster fighting for our  Constitution that this Nation is founded on. Join the fight at Rand Paul dot com. Spread The Word. We Have Someone That Cares About Our Nation.  Email your Senators, Congress men and women, tell them to support Rand. Tell the news to support Rand too Senator Rand Paul was up until <a href=""http://www.youtube.com/watch?v=pRpeEdMmmQ0&amp;t=1m00s"">1:00</a> am this passed Saturday morning fighting for our Constitution buy postponing the vote until this week. Our Constitution Matters join Rand in the fight to protect <a href=""http://it.ht"">it.ht</a> to privacy in your home and business.. Senator Rand Paul was up until <a href=""http://www.youtube.com/watch?v=pRpeEdMmmQ0&amp;t=1m00s"">1:00</a> am this passed Saturday  morning fighting for our Constitution buy postponing the vote until this week. Our Constitution Matters To All Of US, Help Rand Protect It by joining the fright for it.﻿",1,1618,support the fight for your  th amendment right to privacy in your home  stop the nsa spying on americans with the un patriot act renewal  rand paul has spent      hours on the senate floor in a protest and filibuster fighting for our constitution that this nation is founded on  join the fight at rand paul dot com  spread the word  we have someone that cares about our nation  email your senators  congress men and women  tell them to support rand  tell the news to support rand too senator rand paul was up until  a href  http   www youtube com watch v prpeedmmmq  amp t  m  s        a  am this passed saturday morning fighting for our constitution buy postponing the vote until this week  our constitution matters join rand in the fight to protect  a href  http   it ht  it ht  a  to privacy in your home and business   senator rand paul was up until  a href  http   www youtube com watch v prpeedmmmq  amp t  m  s        a  am this passed saturday morning fighting for our constitution buy postponing the vote until this week  our constitution matters to all of us  help rand protect it by joining the fright for it ,0,"-1,-1,-1,-1,-1,1,-1,1,-1",67
LneaDw26bFsNko3TEEPMTxWPlFophSSKkSqvjRsENU8,arrgh garry,,"My friends wife earns 4000DOLLARS a month ,you can do it do if you want to be a wwhore ,you can not get these type of wages for working from home on a PC taking surveys ...dont believe that shit,just because yahoo and other are taking their money does not mean they are LEGIT ..Please like this so the MSG gets thru to vulnerable  people Like eminem used to be ",1,1516,my friends wife earns     dollars a month  you can do it do if you want to be a wwhore  you can not get these type of wages for working from home on a pc taking surveys    dont believe that shit just because yahoo and other are taking their money does not mean they are legit   please like this so the msg gets thru to vulnerable  people like eminem used to be ,0,"-1,-1,-1,-1,-1,-1,0,1,-1",68
z13uwn2heqndtr5g304ccv5j5kqqzxjadmc0k,Corey Wilson,2015-05-28T21:39:52.376000,"<a href=""http://www.youtube.com/watch?v=KQ6zr6kCPj8&amp;t=2m19s"">2:19</a> best part﻿",0,704, a href  http   www youtube com watch v kq zr kcpj  amp t  m  s        a  best part,1,"-1,-1,-1,-1,-1,1,-1,-1,-1",69
_2viQ_Qnc6-adCzTDLAhqNVQ5hFYcjPyPI5m7pHY4BY,Lizzy Molly,2013-09-09T17:34:07.052000,PLEASE CHECK OUT MY VIDEO CALLED &quot;WE LOVE MIND MASTER IT&quot; THANKS,1,1844,please check out my video called  quot we love mind master it quot  thanks,0,"-1,1,0,-1,-1,-1,-1,1,-1",70
z12lsjvi3wa5x1vwh04cibeaqnzrevxajw00k,Erica Ross,2014-07-27T02:51:43,"Hey guys! Please join me in my fight to help abused/mistreated animals! All  fund will go to helping pay for vet bills/and or helping them find homes! I  will place an extra emphasis on helping disabled animals, ones otherwise  would just be put to sleep by other animal organizations. Donate please. http://www.gofundme.com/Angels-n-Wingz﻿",1,356,hey guys  please join me in my fight to help abused mistreated animals  all  fund will go to helping pay for vet bills and or helping them find homes  i  will place an extra emphasis on helping disabled animals  ones otherwise  would just be put to sleep by other animal organizations  donate please  http   www gofundme com angels n wingz,0,"-1,-1,-1,-1,-1,1,-1,1,-1",71
_2viQ_Qnc6_FlLJN0izQaKVQNe6LGDmPZMmkVDjjymE,Neeru bala,2013-09-05T23:07:09.056000,Hi.. Everyone.. If anyone after real online work. I can help u. Earn lots of money. It&#39;s fun. It&#39;s real and affiliated company.. U not think u r working. It&#39;s easy and enjoyable. For more info contact me .. Neeru105@ gmail.com,1,1863,hi   everyone   if anyone after real online work  i can help u  earn lots of money  it     s fun  it     s real and affiliated company   u not think u r working  it     s easy and enjoyable  for more info contact me    neeru     gmail com,0,"-1,-1,-1,-1,-1,-1,-1,1,-1",72
z12wj5g52rzbcvprl04cenuj1yyifhxq3hw,LuckyMusiqLive,2014-09-15T17:47:57,Katy has the voice of gold. this video really brings the lyrics to life. I  am a rapper with 25000 subscribers.. thumbs up if you hate when you take a  shit and the water splashes your nuts﻿,1,466,katy has the voice of gold  this video really brings the lyrics to life  i  am a rapper with       subscribers   thumbs up if you hate when you take a  shit and the water splashes your nuts,0,"-1,-1,-1,-1,-1,-1,0,1,-1",73
z12uujnj2sifvzvav04chpypvofvexpoggg,Sudheer Yadav,2015-05-28T10:28:25.133000,SEE SOME MORE SONG OPEN GOOGLE AND TYPE Shakira GuruOfMovie﻿,1,1593,see some more song open google and type shakira guruofmovie,0,"0,-1,-1,1,-1,-1,-1,-1,-1",74
_2viQ_Qnc69AVbPU2gXuoLiAOr6muFqsr7sm17CjhX4,Maika Kate Mish Linn,2013-08-31T08:56:12.507000,:) I&#39;ll subscribe to you. You look Nice :),1,1878,   i     ll subscribe to you  you look nice   ,0,"-1,-1,-1,-1,-1,-1,0,1,-1",75
z13rs3fimnydzjdu423qudibdzm0sbyjh04,johnlord joaquino,2014-10-10T11:31:33.153000,3m subscribers but look at the views its 700 million wtf :P﻿,1,1089, m subscribers but look at the views its     million wtf  p,0,"-1,-1,-1,-1,-1,-1,0,-1,-1",76
z13nsd141x24yjh2m224xvlhisrqet4pj04,TheJohnRage,,"Alright ladies, if you like this song, then check out John Rage.  He&#39;s a smoking hot rapper coming into the game.  He&#39;s not better than Eminem lyrically, but he&#39;s hotter. Hear some of his songs on my channel.﻿",1,1155,alright ladies  if you like this song  then check out john rage  he     s a smoking hot rapper coming into the game  he     s not better than eminem lyrically  but he     s hotter  hear some of his songs on my channel ,0,"0,1,-1,-1,-1,-1,0,1,-1",77
_2viQ_Qnc6-oktCjZuAEscq8DxT2RHFY1nfSS_hCWf0,Wafence,2013-09-04T19:16:44.109000,"Hey Youtubers and All Music lover&#39;s, Guess most of you all skip these comments, but for you who is still reading this, thanks ! I dont have any money for advertisiments, no chance of getting heard, nothing. All that&#39;s left is spam, sorry. Im 17, Rapper/Singer from Estonia. Please listen my new cover on my account. You wont regret it. Give me just a chance, please. Take half a second of your life and thumb this comment up. It will maybe change my life, for real. Thank you Wafence ",1,1872,hey youtubers and all music lover     s  guess most of you all skip these comments  but for you who is still reading this  thanks   i dont have any money for advertisiments  no chance of getting heard  nothing  all that     s left is spam  sorry  im     rapper singer from estonia  please listen my new cover on my account  you wont regret it  give me just a chance  please  take half a second of your life and thumb this comment up  it will maybe change my life  for real  thank you wafence ,0,"-1,-1,-1,-1,-1,-1,-1,1,-1",78
z13zj1grjzqhhxzlj23gdpzaovunwnn0f,HamzaMurt | Advanced Warefare | Lets Play!,2014-01-19T17:20:58,SUB 4 SUB PLEASE LIKE THIS COMMENT I WANT A SUCCESFULL YOUTUBE SO PPLEASE LIKE THIS  COMMENT AND SUBSCRIBE IT ONLY TAKES 10 SECONDS PLEASE IF YOU SUBSCRIBE ILL  SUBSCRIBE BACK THANKS﻿,1,38,sub   sub please like this comment i want a succesfull youtube so pplease like this  comment and subscribe it only takes    seconds please if you subscribe ill  subscribe back thanks,0,"-1,-1,-1,-1,-1,-1,0,1,-1",79
LneaDw26bFsBtfre7-TAAB3E03wBGNFYTtG5EG4-Zq8,Laura Brown,,"You guys should check out this EXTRAORDINARY website called MONEYGQ.COM .   You can make money online and start working from home today as I am!   I am making over $3,000+ per month at MONEYGQ.COM !   Visit MONEYGQ.COM and check it out!   Lake   . Magnificent . Noodile . Unequaled . Moderock . Gogopo . Lulerain . Olielle . Zesty . Laughable . Accidental . Pepelexa . Delightful . Wiry . Toogit . Uncovered . Chesture . Woozy . Adhoc . Weak . Shallow",1,1283,you guys should check out this extraordinary website called moneygq com     you can make money online and start working from home today as i am    i am making over         per month at moneygq com     visit moneygq com and check it out    lake     magnificent   noodile   unequaled   moderock   gogopo   lulerain   olielle   zesty   laughable   accidental   pepelexa   delightful   wiry   toogit   uncovered   chesture   woozy   adhoc   weak   shallow,1,"-1,1,-1,-1,-1,-1,0,-1,-1",80
z133stly3kete3tly22petvwdpmghrlli,Analena López,2015-05-28T17:08:29.827000,shakira is best for worldcup﻿,0,1590,shakira is best for worldcup,0,"-1,-1,-1,1,-1,-1,-1,-1,-1",81
_2viQ_Qnc6-CRJO_6pvsByopsnD3qpCbK0IPhkvTuS8,RanMC & RVNNIN' RVNN,2013-09-26T20:13:40.670000,Hey check out our new musicvideo &#39;&#39;Life&#39;s a celebration&#39;&#39; Peace !,1,1836,hey check out our new musicvideo           life     s a celebration           peace  ,1,"-1,1,-1,-1,-1,-1,-1,-1,-1",82
LneaDw26bFssNuHM19vJZwZIDvIkQHDPSkv7woLXuO0,ferhan kifle,,Go check out eminem survival.,1,1380,go check out eminem survival ,1,"-1,1,-1,-1,-1,-1,-1,-1,-1",83
_2viQ_Qnc694tFwvOhmFcrz4GGaxVyxStdYmFH-nR68,5000palo,2013-10-04T16:15:05.278000,I want new song,0,1805,i want new song,0,"0,-1,-1,-1,-1,-1,-1,-1,0",84
_2viQ_Qnc69xHT0POK7QFVihno_v_II_pWLoDMoFPXo,Directioner For Life,2013-10-04T13:54:20.918000,I remember this :D,0,1808,i remember this  d,0,"-1,-1,-1,-1,-1,-1,-1,-1,0",85
z12kix1zlmz3fhmhf04cipe5qpvsxrezbpg0k,Cromwell John Pascual,2014-11-07T12:51:06,WAT DA FUCK THIS THE MOST VIEWED VIDEO IN YOUTUBE!﻿,0,195,wat da fuck this the most viewed video in youtube ,0,"-1,-1,-1,-1,-1,-1,0,-1,-1",86
_2viQ_Qnc69S12dQyWLf0QBgUD29OMTe71geFOn4PJA,Oona Sarlotta,2013-07-15T16:08:50.204000,this song always gives me chills! :),0,1938,this song always gives me chills    ,0,"0,-1,-1,-1,-1,-1,-1,-1,-1",87
z13ghjrh5vqbetiw104chhdrlsv0szfqbxk0k,KodysMan Dunt Know,2014-11-05T21:10:09,https://www.tsu.co/KodysMan plz ^^﻿,1,139,https   www tsu co kodysman plz   ,1,"-1,-1,-1,-1,-1,1,-1,-1,-1",88
z13xxdyxcsbwdda5l04cfdexnunxzrgwo2o,snc,2014-09-09T17:08:44,follow me---&gt; https://twitter.com/f0llowshoutouts ﻿,1,424,follow me    gt  https   twitter com f llowshoutouts ,1,"-1,-1,-1,-1,-1,1,-1,-1,-1",89
z13ctjchczaqerw3i23aw3cbzqidflbb304,Naomi Rayner,2015-05-17T16:33:08.950000,I love it﻿,0,875,i love it,0,"-1,-1,0,-1,-1,-1,0,-1,0",90
z13jtruhmlzzznqps04cd5rrbl2uexth4to0k,Lorenzo Raggiante,2015-05-17T17:14:17.168000,Thumbs up if you&#39;re watching in 2015﻿,0,874,thumbs up if you     re watching in     ,0,"-1,-1,-1,-1,-1,-1,-1,1,-1",91
z13ccdmpbuuqc32bf04cj3xrcrrjsxozwtk0k,phemion23,2014-08-21T10:25:48,http://www.mediafire.com/download/yvovhafsv5qzzqo/Video.rar    download and  make money today ﻿,1,382,http   www mediafire com download yvovhafsv qzzqo video rar    download and  make money today ,1,"-1,-1,-1,-1,-1,1,-1,-1,-1",92
_2viQ_Qnc6-qc6sKOH4U0o8eIL4tVjojc-DyDYkkvWk,Comedy Recipe,2013-08-11T03:40:42.801000,"Hey guys and girls check out Comedy Recipe for hilarious you tube videos, pranks, and crank calls!",1,1903,hey guys and girls check out comedy recipe for hilarious you tube videos  pranks  and crank calls ,1,"-1,1,-1,-1,-1,-1,0,1,-1",93
z121hjrymmf2jh4rf04cjrybiyfotjmof1g,Jackal James,2014-11-06T22:53:08,https://soundcloud.com/jackal-and-james/wrap-up-the-night﻿,1,177,https   soundcloud com jackal and james wrap up the night,1,"-1,-1,-1,-1,-1,1,-1,-1,-1",94
LneaDw26bFu5aHCxlCYOFf1hW49mEQ4diJ3yjwxuW3U,Chuck Norris,,Do you need more instagram followers or photo likes? Check out IGBlast.com and get em in minutes!,1,1255,do you need more instagram followers or photo likes  check out igblast com and get em in minutes ,1,"-1,1,-1,-1,-1,-1,-1,1,-1",95
LneaDw26bFt_sZxaSVD4YYGDWlCcEfLjcNyYrRWcSrg,Eminem King of Rap !,,  Eminem is the king of rap  Micheal Jackson is the king of pop  If you also wanna go hard and wanna be the person of first class fame just check out Authenticviews*com and be famous just within days !! yO ~,1,1276,  eminem is the king of rap  micheal jackson is the king of pop  if you also wanna go hard and wanna be the person of first class fame just check out authenticviews com and be famous just within days    yo  ,1,"-1,1,-1,-1,-1,-1,0,-1,-1",96
_2viQ_Qnc6_ahzf6NP9Anh6ef2byWNEcrFHd9swO25s,mermskg,2013-10-04T05:20:55.524000,This makes me miss the world cup,0,1810,this makes me miss the world cup,0,"-1,-1,-1,-1,-1,-1,-1,1,-1",97
z13bttm5gxecfvrqq04cevkpuxj5s1u5ys40k,Vane Cavazos,2014-09-20T15:39:44,Katycat! https://m.facebook.com/profile.php?id=1461302180794905﻿,1,496,katycat  https   m facebook com profile php id                 ,1,"-1,-1,-1,-1,-1,1,-1,-1,-1",98
_2viQ_Qnc68BaXGVkheyDuF79FU05zYyvT-Q5xFyHzM,Alaa Foad,2013-09-06T18:32:07.187000,I love this song,0,1856,i love this song,0,"0,-1,0,-1,-1,-1,0,-1,0",99
z12istbx2lzbszmom04cfbgixnbrsbgai0s,Candyman 1000,2015-03-23T23:38:12.539000,Check out this video on YouTube:﻿,1,962,check out this video on youtube ,1,"-1,1,-1,-1,-1,-1,-1,-1,-1",100
z13rhxvopkjkxp1kr23xfrio3oyttbvuq,Xan Harmer,2015-05-26T06:19:34.669000,Check out this video on YouTube:﻿,1,759,check out this video on youtube ,1,"-1,1,-1,-1,-1,-1,-1,-1,-1",101
z12hh3bobpvle1mvt22icnvommzjjxaup,Ahmed al rawahi,2015-05-26T13:14:11.830000,that time in 2011 where this shirt was cool﻿,0,750,that time in      where this shirt was cool,0,"-1,-1,-1,-1,-1,-1,0,-1,-1",102
LneaDw26bFv9-vkMJy7kInsCbJzQ8qlJ8oUz9N7WfFQ,DanteBTV,,Check Out The New Hot Video By Dante B Called Riled Up,1,1256,check out the new hot video by dante b called riled up,1,"-1,1,-1,-1,-1,-1,0,-1,-1",103
z12tchtw5m2ff5oyl04cjnl4oofcgx0y1is,We are proud to be Smilers,2014-11-09T12:31:35,"great song, but we all know that Katy buys her views..﻿",0,675,great song  but we all know that katy buys her views  ,0,"0,-1,-1,-1,-1,-1,0,-1,-1",104
z13khxlwczzei1ymm22pv5bphlmuzrzac04,AUSENCIO garrido,2014-12-17T02:33:31.397000,Check out this video on YouTube:﻿,1,1065,check out this video on youtube ,1,"-1,1,-1,-1,-1,-1,-1,-1,-1",105
_2viQ_Qnc6-1oZCLsUWjl3-g4QrWxMQXsSTs2Hy4MGI,damion taylor,2013-07-21T20:20:34.118000,check out my new video,1,1924,check out my new video,1,"-1,1,-1,-1,-1,-1,-1,-1,-1",106
z13atpsx4ojrh3ze323nfbz4fzztjbik3,alanluna3,2015-02-18T17:45:43.182000,Check out this video on YouTube:﻿,1,1004,check out this video on youtube ,1,"-1,1,-1,-1,-1,-1,-1,-1,-1",107
z122tnij5nmvhtqkx22jdnc40rzbulxwe04,Jack lewandowski,2014-09-10T11:48:08,Hi guys i sell Jack Daniel's Hard Back Cover Case for iPhone 5 5S 5C 4S 4   6'' Old Time with only 3 Dollars on Ebay:  http://www.ebay.com/itm/251638183951?ssPageName=STRK:MESELX:IT&amp;_trksid=p3984.m1555.l2649 ﻿,1,435,hi guys i sell jack daniel s hard back cover case for iphone    s  c  s         old time with only   dollars on ebay   http   www ebay com itm              sspagename strk meselx it amp  trksid p     m     l     ,1,"-1,-1,-1,-1,-1,1,-1,-1,-1",108
z12iwnkoukqythvf022xx1ii4xisfn2dd,Emma C,2014-09-18T22:27:19,i am a big fan of you and i love you﻿,0,485,i am a big fan of you and i love you,0,"-1,-1,0,-1,-1,-1,-1,-1,-1",109
z134hfcw5v20ztroh04cjv4aezyaz5lq3zs0k,Tyler Gilman,,Check out this video on YouTube:﻿,1,1227,check out this video on youtube ,1,"-1,1,-1,-1,-1,-1,-1,-1,-1",110
z13ufngwhsmyedddo23yhp3hroypufsmz,Febe Gonzalez,2015-05-27T21:01:51.708000,I love music﻿,0,1223,i love music,0,"-1,-1,0,-1,-1,-1,0,-1,0",111
z13gy5vi3kzfzbtyu04cctyzpuz3vfqgw1w,citywok68,2014-09-20T03:45:12,Hey guys plz check out my youtube channel to c funny 2 girls 1 cup reaction  thanks and plz subscribe! Thanks﻿,1,493,hey guys plz check out my youtube channel to c funny   girls   cup reaction  thanks and plz subscribe  thanks,1,"-1,1,-1,-1,-1,-1,-1,-1,-1",112
z13oc3rzqy2pwxors04cflibxy2zutsakz40k,Kalle Eklund,2015-05-19T23:29:31.994000,"Hi, nice song Shakira! (Sorry for bad Brazilian)﻿",0,1725,hi  nice song shakira   sorry for bad brazilian ,0,"0,-1,-1,1,-1,-1,0,-1,-1",113
z12tvfbi0sntvhgzw04cgf35lymwivhqepo0k,blondedbythelight703,2014-09-09T20:36:30,She's an old Whore!﻿,0,426,she s an old whore ,0,"-1,-1,-1,-1,-1,-1,-1,1,-1",114
z13ss524vpztvf2de23cyz2bmlfbvtcx304,Melissa Erhart,,Check out this playlist on YouTube:chcfcvzfzfbvzdr﻿,1,1181,check out this playlist on youtube chcfcvzfzfbvzdr,1,"-1,1,-1,-1,-1,-1,-1,-1,-1",115
z132g5pqsr3wi3x5s04cerbyxuipctqg0hk,scott boshaw,2015-05-21T19:57:17.180000,"I don&#39;t understand this song, I have had the passion for women feel like im losing my mind but i don&#39;t understand the ideas of loving the the way someone lies.....﻿",0,1476,i don     t understand this song  i have had the passion for women feel like im losing my mind but i don     t understand the ideas of loving the the way someone lies     ,0,"0,-1,-1,-1,-1,-1,0,-1,-1",116
z13ejhmaiyjmcrlgw04ccvqwdobqtjn4ea4,David Sean,2014-09-15T10:53:46,"Hey guys! I've made a amazing Smiley T-Shirt.Of all the things you wear,  your expression is the most important and remember all the statistics in  the world can’t measure the warmth of a smile. If you're a big fan of  T-Shirts and want to gets more happiness, it's perfect for you.  Check this  out and buy it at www.teespring.com/smiley12 =)) thanks you guys so  much!!! ﻿",1,464,hey guys  i ve made a amazing smiley t shirt of all the things you wear   your expression is the most important and remember all the statistics in  the world cant measure the warmth of a smile  if you re a big fan of  t shirts and want to gets more happiness  it s perfect for you   check this  out and buy it at www teespring com smiley       thanks you guys so  much    ,1,"-1,1,-1,-1,-1,-1,-1,1,-1",117
z13sx1mitrmpcls3f22hi5ep1yq5cvmld,roflcopter2110,2014-11-04T02:22:06,http://thepiratebay.se/torrent/6381501/Timothy_Sykes_Collection﻿,1,100,http   thepiratebay se torrent         timothy sykes collection,1,"-1,-1,-1,-1,-1,1,-1,-1,-1",118
z12iubmp2mv1txfsy235vb2xdqirufcp304,jayson calzado,2014-11-07T17:03:01,How can this music video get 2 billion views while im the only one watching  here on earth?????? lol﻿,0,210,how can this music video get   billion views while im the only one watching  here on earth       lol,0,"-1,-1,-1,-1,-1,-1,0,-1,-1",119
z12aw1ah2m2vh30tb22bvl3olkbohlbid04,Benjy Growls,2015-05-27T09:27:26.667000,I love this song so much &lt;3<br />Keep em&#39; coming!﻿,0,1604,i love this song so much  lt   br   keep em      coming ,0,"0,-1,0,-1,-1,-1,-1,-1,-1",120
z12gf55w4pr0ibswj04cfzyb4my1zbnjsps0k,Andrea Incollingo,2015-04-21T14:52:10.879000,Check out this video on YouTube:﻿,1,934,check out this video on youtube ,1,"-1,1,-1,-1,-1,-1,-1,-1,-1",121
z123sbbrgryqhfwgi04cjpbxokbdifsibhw,Kiarna Burke,2015-04-11T08:36:04.034000,Check out this video on YouTube:﻿,1,950,check out this video on youtube ,1,"-1,1,-1,-1,-1,-1,-1,-1,-1",122
z13sgp25fzybg11lc23bhncaipqvgz14q04,Fill Reseni,2015-05-27T17:10:53.724000,The rap: cool     Rihanna: STTUUPID﻿,0,1241,the rap  cool     rihanna  sttuupid,0,"-1,-1,-1,-1,-1,-1,0,-1,-1",123
z13jhj1wdzmiwjdjn04ccx2gfpynuzyjo4w,Robert Kim,2014-09-07T17:13:39,"I'm sorry Katy Perry, I was being weird. I still love you &lt;3﻿",0,414,i m sorry katy perry  i was being weird  i still love you  lt  ,0,"-1,-1,0,-1,-1,-1,0,1,-1",124
z13mzpjq0wjly1ag304cfvsxhmmicxmg0gs,Rajnoor Bawa,2014-10-07T17:48:27.641000,Check out this video on YouTube:﻿,1,1090,check out this video on youtube ,1,"-1,1,-1,-1,-1,-1,-1,-1,-1",125
z12tul0onm20hffur22qxhs5mvijddfj404,David Boček,2014-11-06T22:40:49,https://www.change.org/p/facebook-twitter-youtube-do-not-censor-julien-blanc ﻿,1,176,https   www change org p facebook twitter youtube do not censor julien blanc ,1,"-1,-1,-1,-1,-1,1,-1,-1,-1",126
z13mxjrbuyv5slha204cjdwg0wauylyap3w,Peter Wilkes,2014-09-15T15:48:57,"really want this video to get 1 billion views, would be amazing!﻿",0,465,really want this video to get   billion views  would be amazing ,0,"-1,-1,-1,-1,-1,-1,0,-1,-1",127
z12uvzpw4tufgf2qw04chd5abu3uvf4rw5o,Eric Gonzalez,2015-05-24T15:35:03.844000,"To help shakira become the first female to hit 1billiom views, I&#39;ve decided to watch this Video at least one a day. Everyday! Shakifans we r so close just hit the replay button !!!﻿",0,1648,to help shakira become the first female to hit  billiom views  i     ve decided to watch this video at least one a day  everyday  shakifans we r so close just hit the replay button    ,0,"-1,-1,-1,1,-1,-1,-1,1,-1",128
z13ycvc43ynaerptk235dhnwnqf1hdhwl04,Patrick Pernia,2014-11-12T14:17:28,Limit sun exposure while driving. Eliminate the hassle of having to swing  the car visor between the windshield and window.  https://www.kickstarter.com/projects/733634264/visortwin﻿,1,325,limit sun exposure while driving  eliminate the hassle of having to swing  the car visor between the windshield and window   https   www kickstarter com projects           visortwin,1,"-1,-1,-1,-1,-1,1,-1,-1,-1",129
z13lezboqn35jtqlm23mcpgp3tjbghmvk,Parssa Alimadad,2014-11-07T07:54:13,"Dear person reading this, You are beautiful and loving Have a great day﻿",0,189,dear person reading this  you are beautiful and loving have a great day,0,"-1,-1,-1,-1,-1,-1,0,1,-1",130
