comment_id,author,date,old_text,expected_label,cid,text,model_pred,vectors,id
z12rt5qylz3ny5qdv221epkhvsvxwlgjz04,joe pepin-leblanc,2015-05-27T22:19:11.429000,"super nice, love musique﻿",0,719,super nice  love musique,0,"-1,-1,0,-1,-1,-1,0,-1,0",131
z13sjlb4rrjmdd2tl23cidlblkizefxvx,Yuliana Andrea  Caucali Acosta,2015-05-23T18:59:07.686000,2015<br />I like video﻿,0,788,     br   i like video,0,"-1,-1,-1,-1,-1,-1,-1,-1,0",132
z12avveb4xqiirsix04chxviiljryduwxg0,BeBe Burkey,2013-11-28T16:30:13,and u should.d check my channel and tell me what I should do next!﻿,1,10,and u should d check my channel and tell me what i should do next ,1,"-1,1,-1,-1,-1,-1,-1,-1,-1",133
z133ibkihkmaj3bfq22rilaxmp2yt54nb,Debora Favacho (Debora Sparkle),2015-05-21T14:08:41.338000,BEST SONG EVER X3333333333﻿,0,1702,best song ever x          ,0,"0,-1,-1,-1,-1,-1,-1,-1,0",134
z13jihf5luz0s5nlj22usvaquqeyvxk2u,Merle Walton,2015-05-26T12:53:14.308000,Love this video and the song of course﻿,0,751,love this video and the song of course,0,"0,-1,0,-1,-1,-1,0,-1,-1",135
z12iyf2wkybwerg5104cddairnrzf5vwoog0k,Anastasia Trevla,2015-05-23T18:35:07.666000,I love  Shakira !!!!!! ❤🎵🎶🎼🎸﻿,0,1663,i love  shakira        ,0,"-1,-1,0,1,-1,-1,0,-1,0",136
z13oghdjnqzcftxwp04cdv0acx3msl5zbkc0k,ollie123216,2014-10-23T22:20:43,"How do you forget you have a choice, and what the fuck, surviving a plane  crash has a 1/1000 chance of happening.﻿",0,597,how do you forget you have a choice  and what the fuck  surviving a plane  crash has a        chance of happening ,0,"-1,-1,-1,-1,-1,-1,0,1,-1",137
z122ghagzyvyzrv3b23fzf4pelvusdoub,a carlton,2014-11-06T00:55:49,I LOVE YOU!!! Because u make me smile when im sad you cheer me up with your  beautiful songs (: &lt;3﻿,0,648,i love you    because u make me smile when im sad you cheer me up with your  beautiful songs     lt  ,0,"0,-1,0,-1,-1,-1,0,1,-1",138
z13uffbajziyw5cfp23bwbw5auytzdl5b04,Juris Dumagan,2014-11-12T11:03:25,I think he was drunk during this :) x)﻿,0,324,i think he was drunk during this    x ,0,"-1,-1,-1,-1,-1,-1,0,1,-1",139
LneaDw26bFsltJodWnZAafXscqrATBuKDM8-8lA4TQE,miamiscraziest,,LADIES!!! -----&gt;&gt; If you have a broken heart or you just want to understand guys better you should check out this underground book called The Power of the Pussy on AMAZON. Best book ever for us girls! Oh...and just a warning it&#39;s for 18 and over...lol,1,1429,ladies          gt  gt  if you have a broken heart or you just want to understand guys better you should check out this underground book called the power of the pussy on amazon  best book ever for us girls  oh   and just a warning it     s for    and over   lol,1,"-1,1,-1,-1,-1,-1,-1,1,-1",140
z13ui5tzlzucinaab04chvzqps22cxhznxc0k,Sebastian Martinez,2015-05-27T23:35:12.915000,that is megan fox﻿,0,1222,that is megan fox,0,"-1,-1,-1,-1,-1,-1,-1,-1,0",141
_2viQ_Qnc68YhzlKOdq3h2y3v8TCi0RQSIFzQP8hltY,Derek Moya,2013-10-21T05:47:26.457000,"You guys should check out this EXTRAORDINARY website called MONEYGQ.COM .   You can make money online and start working from home today as I am!   I am making over $3,000+ per month at MONEYGQ.COM !   Visit MONEYGQ.COM and check it out!  Why does the fragile swim enlist the person? How does the ice audit the frequent son? The fantastic chance describes the rate.",1,1769,you guys should check out this extraordinary website called moneygq com     you can make money online and start working from home today as i am    i am making over         per month at moneygq com     visit moneygq com and check it out   why does the fragile swim enlist the person  how does the ice audit the frequent son  the fantastic chance describes the rate ,1,"-1,1,-1,-1,-1,-1,0,-1,-1",142
z12lfnvjjm3vi1fsx23mdjc5rpu3x3kox04,Jd Hurst,2015-05-23T01:50:08.642000,Check out this video on YouTube:﻿,1,798,check out this video on youtube ,1,"-1,1,-1,-1,-1,-1,-1,-1,-1",143
z12jvb5gsrnmebqqv04cg11jwtmdwfdx1jw,_ OMGiTzLeo _,2015-05-23T18:15:32.442000,Like this in 2015! :D﻿,0,790,like this in        d,0,"-1,-1,-1,-1,-1,-1,-1,-1,0",144
z125tj4zjlngxfvxr04cg5wyhkmxhxloesk0k,Anders Lundgren,2014-11-07T18:08:44,"#nowplaying ""Weekendmix"" track 04 : Katy Perry - Roar (DJ Denis Shmelev &amp; DJ Alex Serov Remix) http://youtu.be/CevxZvSJLk8   Listen live at: www.smartfm.nl/livestream.html﻿",1,665, nowplaying  weekendmix  track      katy perry   roar  dj denis shmelev  amp  dj alex serov remix  http   youtu be cevxzvsjlk    listen live at  www smartfm nl livestream html,1,"-1,-1,-1,-1,-1,1,-1,-1,-1",145
z12osrsgan34db4eh223gbwr4urwhzfzv04,Hugo Gonzalez,2015-05-25T14:33:19.596000,I love it and my mom to﻿,0,1317,i love it and my mom to,0,"-1,-1,0,-1,-1,-1,0,-1,-1",146
z13kxpqqssa0hlryd04cc1dxeyyngljjngk,Tasha Lucius,2014-01-19T13:25:56,2 billion....Coming soon﻿,0,35,  billion    coming soon,0,"-1,-1,-1,-1,-1,-1,-1,-1,0",147
z132e5zqwlbmjrich234epwa2kiwehdmd,Priscilla Sipinga,2015-01-19T05:53:12.118000,Check out this playlist on YouTube:hbbhhhgh﻿,1,1035,check out this playlist on youtube hbbhhhgh,1,"-1,1,-1,-1,-1,-1,-1,-1,-1",148
_2viQ_Qnc6_hoPuz8gsl9ZFXFZGPESkLzYU9REwL880,Adam Whitney,2013-08-24T03:05:10.278000,"Hello everyone :) I know most of you probably pass up these kind of comments, but for those who are still reading this, thanks! I don’t have any money for advertisements, no chance of getting heard, nothing. I live in such a small town... If this comes off as spam, sorry. I’m an instrumental songwriter from Columbus, Mississippi. Please go to my channel and check out my original music. It would be highly appreciated if you thumbs up this comment so my music can be heard! Thank you, Adam Whitney ",1,1889,hello everyone    i know most of you probably pass up these kind of comments  but for those who are still reading this  thanks  i dont have any money for advertisements  no chance of getting heard  nothing  i live in such a small town    if this comes off as spam  sorry  im an instrumental songwriter from columbus  mississippi  please go to my channel and check out my original music  it would be highly appreciated if you thumbs up this comment so my music can be heard  thank you  adam whitney ,1,"-1,1,-1,-1,-1,-1,0,1,-1",149
z12iztop3pyovxbl322eyxng2k3gi5rax04,Bizzle Sperq,2014-11-08T15:29:46,https://www.facebook.com/nicushorbboy add mee &lt;3 &lt;3﻿,1,304,https   www facebook com nicushorbboy add mee  lt    lt  ,1,"-1,-1,-1,-1,-1,1,-1,-1,-1",150
_2viQ_Qnc6-pY-1yR6K2FhmC5i48-WuNx5CumlHLDAI,Sabina Pearson-Smith,2013-07-13T13:14:30.021000,I love this song for two reasons: 1.it is about Africa 2.i was born in beautiful south Africa,0,1950,i love this song for two reasons    it is about africa   i was born in beautiful south africa,0,"0,-1,0,-1,-1,-1,0,1,-1",151
z13nujhysyf3ftvgt04ccrd4szrxcvzbvt00k,MeSoHornyMeLuvULongTime,2014-10-18T04:58:21,This video is so racist!!! There are only animals.﻿,0,573,this video is so racist    there are only animals ,0,"-1,-1,-1,-1,-1,-1,0,-1,-1",152
LneaDw26bFupwvoW3Go_MqiZr35wklInwfOlKebxCYE,Anon,,"youtube.com/watch?v=2ASFn9ShgHk&amp;feature=youtu.be  please check out my song. looking for feedback, and supporters.",1,1259,youtube com watch v  asfn shghk amp feature youtu be  please check out my song  looking for feedback  and supporters ,1,"0,1,-1,-1,-1,-1,-1,-1,-1",153
z133jzxzav2gw5lq504cgrnx3lbgulw5onc0k,itzquiffer,2014-11-08T03:47:23,C'mon 3 billion views!!!!!!!!﻿,0,259,c mon   billion views        ,0,"-1,-1,-1,-1,-1,-1,-1,-1,0",154
LZQPQhLyRh9EXArr4ZnVcDonSbvSMHKYOT24e_qR6fE,||GuitarZ||,2013-12-23T12:54:38,CHECK OUT MY CHANNEL,1,25,check out my channel,1,"-1,1,-1,-1,-1,-1,-1,-1,0",155
z13oulsz0uzyxflr304cjds5jqbmej1b3mg0k,manish srinivas,2015-05-26T10:35:10.230000,awesome song ever﻿,0,1287,awesome song ever,0,"0,-1,-1,-1,-1,-1,0,-1,0",156
z12th3fqdqq5yn0tq23rzboi3wb4tft0y,Markus Mairhofer,2014-11-08T08:49:47,"Hey, join me on tsū, a publishing platform where I share my content now:  http://tsu.co/MarkusMairhofer﻿",1,278,hey  join me on ts  a publishing platform where i share my content now   http   tsu co markusmairhofer,1,"-1,-1,-1,-1,-1,1,-1,-1,-1",157
z12ntdriqpfni1mtf23zwb0b0p34fnyak04,Frank co,2014-08-30T11:00:35,http://www.bubblews.com/news/6401116-vps-solutions﻿,1,396,http   www bubblews com news         vps solutions,1,"-1,-1,-1,-1,-1,1,-1,-1,-1",158
_2viQ_Qnc6-8fXmwJsxpt64D862oCsb0cCfnoF_7Pwg,david rodriguez,2013-09-04T04:08:26.821000,do you want to make some easy money? check out my page tvcmcadavid.weebly . com dont miss out on this opportunity give thumbs up i would  apprecitate it.,1,1873,do you want to make some easy money  check out my page tvcmcadavid weebly   com dont miss out on this opportunity give thumbs up i would  apprecitate it ,1,"-1,1,-1,-1,-1,-1,0,1,-1",159
