comment_id,author,date,old_text,expected_label,cid,text,model_pred,vectors
LZQPQhLyRh80UYxNuaDWhIGQYNQ96IuCg-AYWqNPjpU,Julius NM,2013-11-07T06:20:48,"Huh, anyway check out this you[tube] channel: kobyoshi02",1,1,huh  anyway check out this you tube  channel  kobyoshi  ,1,"1,-1,-1,-1"
LZQPQhLyRh_C2cTtd9MvFRJedxydaVW-2sNg5Diuo4A,adam riyati,2013-11-07T12:37:15,"Hey guys check out my new channel and our first vid THIS IS US THE  MONKEYS!!! I'm the monkey in the white shirt,please leave a like comment  and please subscribe!!!!",1,2,hey guys check out my new channel and our first vid this is us the  monkeys    i m the monkey in the white shirt please leave a like comment  and please subscribe    ,0,"1,-1,-1,1"
z13fwbwp1oujthgqj04chlngpvzmtt3r3dw,GsMega,2013-11-10T16:05:38,watch?v=vtaRGgvGtWQ   Check this out .﻿,1,5,watch v vtarggvgtwq   check this out  ,1,"0,-1,-1,-1"
LZQPQhLyRh9-wNRtlZDM90f1k0BrdVdJyN_YsaSwfxc,Jason Haddad,2013-11-26T02:55:11,"Hey, check out my new website!! This site is about kids stuff. kidsmediausa  . com",1,6,hey  check out my new website   this site is about kids stuff  kidsmediausa    com,1,"1,-1,-1,-1"
z13lfzdo5vmdi1cm123te5uz2mqig1brz04,ferleck ferles,2013-11-27T21:39:24,Subscribe to my channel ﻿,1,7,subscribe to my channel ,0,"-1,-1,-1,1"
z122wfnzgt30fhubn04cdn3xfx2mxzngsl40k,Bob Kanowski,2013-11-28T12:33:27,i turned it on mute as soon is i came on i just wanted to check the  views...﻿,0,8,i turned it on mute as soon is i came on i just wanted to check the  views   ,1,"1,-1,-1,-1"
z13ttt1jcraqexk2o234ghbgzxymz1zzi04,Cony,2013-11-28T16:01:47,You should check my channel for Funny VIDEOS!!﻿,1,9,you should check my channel for funny videos  ,1,"1,-1,-1,-1"
z12avveb4xqiirsix04chxviiljryduwxg0,BeBe Burkey,2013-11-28T16:30:13,and u should.d check my channel and tell me what I should do next!﻿,1,10,and u should d check my channel and tell me what i should do next ,1,"1,-1,-1,-1"
z13auhww3oufjn1qo04ci3grqqjmfjexxuo0k,Huckyduck,2013-11-28T17:06:17,Hey subscribe to me﻿,1,11,hey subscribe to me,0,"-1,-1,-1,1"
z13xit5agm2zyh4f523rst2gowmbx5bml,Lone Twistt,2013-11-28T17:34:55, Once you have started reading do not stop. If you do not subscribe to me  within one day you and you're entire family will die so if you want to stay  alive subscribe right now.﻿,1,12, once you have started reading do not stop  if you do not subscribe to me  within one day you and you re entire family will die so if you want to stay  alive subscribe right now ,0,"-1,-1,-1,1"
z121zxaxsq25z5k5o04ch1o5jqqfij3gtm40k,TheUploadaddict,2013-11-28T18:12:12,subscribe like comment﻿,1,14,subscribe like comment,0,"-1,-1,-1,1"
z13phrmwrkfisn5er22eyrbpbvaiwfvwf04,Gaming and Stuff PRO,2013-11-28T21:14:13,"Hello! Do you like gaming, art videos, scientific experiments, tutorials,  lyrics videos, and much, much more of that? If you do please check out our  channel and subscribe to it, we've just started, but soon we hope we will  be able to cover all of our expectations... You can also check out what  we've got so far!﻿",1,16,hello  do you like gaming  art videos  scientific experiments  tutorials   lyrics videos  and much  much more of that  if you do please check out our  channel and subscribe to it  we ve just started  but soon we hope we will  be able to cover all of our expectations    you can also check out what  we ve got so far ,0,"1,-1,-1,1"
z13bgdvyluihfv11i22rgxwhuvabzz1os04,Zielimeek21,2013-11-28T21:49:00,I'm only checking the views﻿,0,17,i m only checking the views,0,"-1,-1,1,-1"
z12axnji5w2axxht522thb3bktvqjdlbp04,zhichao wang,2013-11-29T02:13:56,i think about 100 millions of the views come from people who only wanted to  check the views﻿,0,21,i think about     millions of the views come from people who only wanted to  check the views,1,"1,-1,-1,-1"
z13ozdmr4lf3uzc5z04cix2zkyjzgvcyemw0k,Carlos Thegamer,2013-12-01T01:20:21,subscribe to my channel people :D﻿,1,22,subscribe to my channel people  d,0,"-1,-1,-1,1"
z12ntlcqht2bvjewi04cf1up0xjvs5lq3mc0k,Owen Lai,2013-12-01T04:51:52,just checking the views﻿,0,24,just checking the views,0,"-1,-1,1,-1"
LZQPQhLyRh9EXArr4ZnVcDonSbvSMHKYOT24e_qR6fE,||GuitarZ||,2013-12-23T12:54:38,CHECK OUT MY CHANNEL,1,25,check out my channel,1,"1,-1,-1,-1"
LZQPQhLyRh9vw01Xvvw5yWzZEUOPG1hSgRMHep55-Yw,8-BitMusic,2013-12-27T23:07:50,Hey guys! Im a 12 yr old music producer. I make chiptunes and 8bit music.  It would be wonderful if you checked out some of my 8bit remixes! I even  have a gangnamstyle 8bit remix if you would like to check that out ;)  Thanks!!,1,27,hey guys  im a    yr old music producer  i make chiptunes and  bit music   it would be wonderful if you checked out some of my  bit remixes  i even  have a gangnamstyle  bit remix if you would like to check that out     thanks  ,1,"1,-1,-1,-1"
z13kszcinpnvc34v2234fnpxkpmlw3nhc04,Kyle Jaber,2014-01-19T00:21:29,Check me out! I'm kyle. I rap so yeah ﻿,1,28,check me out  i m kyle  i rap so yeah ,1,"1,-1,-1,-1"
z13tj514otzlurfbc04ccjwhrnmej1iihqw0k,Brandon Pryor,2014-01-19T00:36:25,I dont even watch it anymore i just come here to check on 2 Billion or not﻿,0,29,i dont even watch it anymore i just come here to check on   billion or not,1,"0,-1,-1,-1"
z13zvh1rmk3cf3mby04civbq5mjtddmbysk0k,Fun&amp;Hacks,2014-01-19T00:42:35,"Subscribe to me for free Android games, apps.. ﻿",1,30,subscribe to me for free android games  apps   ,0,"-1,-1,-1,1"
z120y3ribybzdf3fj23sf1rpgq3cex0sh,Young Hittaz,2014-01-19T04:21:11,everyone please come check our newest song in memories of Martin Luther  King Jr.﻿,1,31,everyone please come check our newest song in memories of martin luther  king jr ,1,"1,-1,-1,-1"
z13autsqgzblcx3w104chr4r2kexd10rxc0,DropShotSk8r,2014-01-19T04:27:18,"Came here to check the views, goodbye.﻿",0,32,came here to check the views  goodbye ,1,"1,-1,-1,-1"
z121e3zq5kj3ip2ch22ks3vwekuaibrgc04,Joengz,2014-01-19T10:31:10,"Check out my dubstep song ""Fireball"", made with Fruity Loops. I really took  time in it.  /watch?v=telOA6RIO8o﻿",1,34,check out my dubstep song  fireball   made with fruity loops  i really took  time in it    watch v teloa rio o,1,"0,-1,-1,-1"
z12txle43yfhvt0f323eghbxivmuytieq,Kiddy Kidso,2014-01-19T16:49:52,Check my channel please! And listen to the best music ever :P﻿,1,37,check my channel please  and listen to the best music ever  p,1,"1,-1,-1,-1"
z13zj1grjzqhhxzlj23gdpzaovunwnn0f,HamzaMurt | Advanced Warefare | Lets Play!,2014-01-19T17:20:58,SUB 4 SUB PLEASE LIKE THIS COMMENT I WANT A SUCCESFULL YOUTUBE SO PPLEASE LIKE THIS  COMMENT AND SUBSCRIBE IT ONLY TAKES 10 SECONDS PLEASE IF YOU SUBSCRIBE ILL  SUBSCRIBE BACK THANKS﻿,1,38,sub   sub please like this comment i want a succesfull youtube so pplease like this  comment and subscribe it only takes    seconds please if you subscribe ill  subscribe back thanks,0,"-1,-1,-1,1"
z13csdop4venytrru04cf11q1wmbdvkrfpo0k,ii Trollercopter,2014-01-19T17:25:23," Hey everyone!! I have just started my first YT channel i would be grateful  if some of you peoples could check out my first clip in BF4! and give me  some advice on how my video was and how i could improve it. ALSO be sure to  go check out the about to see what Im all about. Thanks for your time :) .  and to haters... You Hate, I WIN﻿",1,39, hey everyone   i have just started my first yt channel i would be grateful  if some of you peoples could check out my first clip in bf   and give me  some advice on how my video was and how i could improve it  also be sure to  go check out the about to see what im all about  thanks for your time       and to haters    you hate  i win,1,"1,-1,-1,-1"
z13phfyxhovav1hl122bf5iidumufzbel,Cody Tolleson,2014-01-20T02:50:44,YouTube/codytolleson for awesome videos I'll subscribe back ﻿,1,41,youtube codytolleson for awesome videos i ll subscribe back ,0,"-1,-1,-1,1"
z13vsbcjwrybe3hsf23sgvnxfr3zxnion04,World327RS,2014-01-20T06:16:28,SUBSCRIBE TO ME AND I'LL SUBSCRIBE TO YOU! (Must like - cZFcxsn0jnQ) ﻿,1,43,subscribe to me and i ll subscribe to you   must like   czfcxsn jnq  ,0,"-1,-1,-1,1"
z13stv3brxe1snv2i225fnvganneudej004,MFkin PRXPHETZ,2014-01-20T09:08:39,"if you like raw talent, raw lyrics, straight real hip hop Everyone check my newest sound  Dizzy X - Got the Juice (Prod by. Drugs the Model Citizen)   COMMENT TELL ME WHAT YOU THINK  DONT BE LAZY!!!!  - 1/7 Prophetz﻿",1,45,if you like raw talent  raw lyrics  straight real hip hop everyone check my newest sound  dizzy x   got the juice  prod by  drugs the model citizen    comment tell me what you think  dont be lazy            prophetz,1,"1,-1,-1,-1"
z12ktfsarrv0wdj3p22ifbxz3zn2fthhw04,Dave X,2014-01-20T10:12:07,....subscribe......  ......to my........  .....channel.......﻿,1,46,    subscribe              to my               channel       ,0,"-1,-1,-1,1"
z12stpyqaonsercxw04cjbr4dlnrxd34soo0k,Phuc Ly,2014-01-20T15:27:47,go here to check the views :3﻿,0,49,go here to check the views   ,1,"1,-1,-1,-1"
z13uzhdomzvbffvwa04cgplq2zewfz2hm2k,Kirsty Brown,2014-01-20T16:41:27,Plz subscribe to my channel and I will subscribe back xx﻿,1,51,plz subscribe to my channel and i will subscribe back xx,0,"-1,-1,-1,1"
z13ucxa51rnftvu2j22if5oihq2qipjlp,Kochos,2014-01-20T17:08:37,i check back often to help reach 2x10^9 views and I avoid watching Baby﻿,0,52,i check back often to help reach  x     views and i avoid watching baby,1,"1,-1,-1,-1"
z120grixiomvyvbga04cfl24csz5jf4zzuc0k,eSkiip,2014-01-20T17:22:53,This video will get to 2 billion just because of people checking if it has  hit 2 billion yet.﻿,0,53,this video will get to   billion just because of people checking if it has  hit   billion yet ,0,"-1,-1,1,-1"
z12gv5qoconqsbe0h221wljgmwe4v1nmu,ProsGamerOnly,2014-01-20T20:00:55,hi guys check my youtube channel﻿,1,57,hi guys check my youtube channel,1,"1,-1,-1,-1"
z13eepr4dyjet34pt04cgr1rctvwsvqwqso0k,JP Jochem,2014-01-20T20:23:35,Subscribe and like to me for more how to videos on minecraft!﻿,1,58,subscribe and like to me for more how to videos on minecraft ,0,"-1,-1,-1,1"
z121st5w5k3ui1veg22zirn4gkr5tby2v,Jdidk Loma,2014-01-20T20:35:56,http://tankionline.com#friend=cd92db3f4 great game check it out!﻿,1,59,http   tankionline com friend cd  db f  great game check it out ,1,"1,-1,-1,-1"
z12rgllzmwnfuba4h04ch3njgy2fg3ryerg0k,Eanna Cusack,2014-01-20T22:20:59,Im just to check how much views it has﻿,0,61,im just to check how much views it has,1,"1,-1,-1,-1"
z12eexphzo2uslizg04cirmywyzjdnm5gqc0k,fab life,2014-11-02T00:48:57,plz check out fablife / welcome to fablife for diys and challenges so plz  subscribe thx!﻿,1,72,plz check out fablife   welcome to fablife for diys and challenges so plz  subscribe thx ,0,"1,-1,-1,1"
z12tcdxa5k3bsvtqh04ccnaqusj1vvfju3s,Salim Tayara,2014-11-02T14:33:30,"if your like drones, plz subscribe to Kamal Tayara. He takes videos with  his drone that are absolutely beautiful.﻿",1,76,if your like drones  plz subscribe to kamal tayara  he takes videos with  his drone that are absolutely beautiful ,0,"-1,-1,-1,1"
z123e1gg3zyuf30ox04cdtbzgmaby3ehjc0,Lucas Trigo,2014-11-02T15:52:22,"WHATS UP EVERYONE!? :-) I Trying To Showcase My Talent To The World! I Have Over 3000 SUBSCRIBERS! I PROMISE! I Dont Suck! Please Spread My Covers Around, SUBSCRIBE &amp; Share! Thanks so much for all your support! Lucas Trigo -Stay Awesome! ﻿",1,78,whats up everyone       i trying to showcase my talent to the world  i have over      subscribers  i promise  i dont suck  please spread my covers around  subscribe  amp  share  thanks so much for all your support  lucas trigo  stay awesome  ,0,"-1,-1,-1,1"
z12ywjvgdtrhxdlz504cd1tquqvuhbs4abw,Angel,2014-11-02T17:27:09,"Hi there~I'm group leader of Angel, a rookie Korean pop group. We have four  members, Chanicka, Julie, Stephanie, and myself, Leah. Please feel free to  check out our channel and leave some feedback on our cover videos (:  criticism is welcome as we know we're not top notch singers so please come  leave some constructive feedback on our videos; we appreciate any chance to  improve before auditioning for a Korean management company. We plan on  auditioning for JYP, BigHit, Jellyfish, YG or SM. Thank you for taking time  out of your day to read this !﻿",1,80,hi there i m group leader of angel  a rookie korean pop group  we have four  members  chanicka  julie  stephanie  and myself  leah  please feel free to  check out our channel and leave some feedback on our cover videos     criticism is welcome as we know we re not top notch singers so please come  leave some constructive feedback on our videos  we appreciate any chance to  improve before auditioning for a korean management company  we plan on  auditioning for jyp  bighit  jellyfish  yg or sm  thank you for taking time  out of your day to read this  ,1,"1,-1,-1,-1"
z12jud4o3n34v5wph04ce3db0y2njn55gog0k,Kaya Roberts,2014-11-02T20:00:37,Admit it you just came here to check the number of viewers ﻿,0,82,admit it you just came here to check the number of viewers ,1,"1,-1,-1,-1"
z12xxjkwevvjzvvms22xz3sjqovty3qip04,Prim N.,2014-11-02T22:48:21,"Just coming to check if people are still viewing this video. And  apparently, they still do.﻿",0,83,just coming to check if people are still viewing this video  and  apparently  they still do ,1,"1,-1,-1,-1"
z13ydfww3ruysvtmv23muhspwqqjszwjc04,James Ridge,2014-11-02T23:25:44,Check my first video out﻿,1,84,check my first video out,1,"1,-1,-1,-1"
z13vs53zipmszf1ib04cerd5xlmzdz5qlzw0k,Minecraft-Viasat,2014-11-03T14:38:53,Check my channel﻿,1,85,check my channel,1,"1,-1,-1,-1"
z12ufn5puwnve3b2k22ntjqogym0fllgb04,Angek95,2014-11-03T22:28:56,"Check my channel, please!﻿",1,93,check my channel  please ,1,"1,-1,-1,-1"
z13juvrhisuzsfczo04cgnsxhlfdiz2rhho,Imprezzi Vidzz,2014-11-04T03:12:23,"My videos are half way decent, check them out if you want.﻿",1,101,my videos are half way decent  check them out if you want ,1,"1,-1,-1,-1"
z12zdj5ptyzpurkan04chtsqjszjxfmrk2w,Gloria Garcia,2014-11-04T11:38:51,subscribe to itz recaps and above diddle﻿,1,103,subscribe to itz recaps and above diddle,0,"-1,-1,-1,1"
z13qgx0yzwf1uj1xm04ccbkhjnrsgz0i41g,firo mota,2014-11-04T14:38:42,please subscribe i am a new youtuber and need help please subscribe and i  will subscribe back :D hoppa HOPPA GaNgAm StYlE﻿,1,107,please subscribe i am a new youtuber and need help please subscribe and i  will subscribe back  d hoppa hoppa gangam style,0,"-1,-1,-1,1"
z123jlf4lzjbgpbcr23yhxyqbpe3gxpvm,TIGERIO_,2014-11-04T19:46:38,EHI GUYS CAN YOU SUBSCRIBE IN MY CHANNEL? I AM A NEW YOUTUBER AND I PLAY  MINECRAFT THANKS GUYS!... SUBSCRIBE!﻿,1,111,ehi guys can you subscribe in my channel  i am a new youtuber and i play  minecraft thanks guys     subscribe ,0,"-1,-1,-1,1"
z13kfzqicymszt0jp04ci5gqvqemyb2jsp00k,OFFICIAL LEXIS,2014-11-04T20:22:21,Hi everyone! Do you like music? Then why not check out my music channel.  The LEXIS band will be uploading their own songs and covers soon so don't  miss out. Please SUBSCRIBE too as it does help us out a lot. Just takes one  click. -&gt;﻿,1,112,hi everyone  do you like music  then why not check out my music channel   the lexis band will be uploading their own songs and covers soon so don t  miss out  please subscribe too as it does help us out a lot  just takes one  click    gt ,0,"1,-1,-1,1"
z13cyzbbqsrxyfaec23xc10rdrrqgd0ch,Malin Linford,2014-11-05T01:13:43,"Hey guys please check out my new Google+ page it has many funny pictures,  FunnyTortsPics  https://plus.google.com/112720997191206369631/post﻿",1,115,hey guys please check out my new google  page it has many funny pictures   funnytortspics  https   plus google com                       post,1,"1,-1,-1,-1"
z12jc1uququpzbsoq04cg15poyfsxpvoojw,pro stomper,2014-11-05T15:27:34,guys please subscribe me to help my channel grow please guys﻿,1,125,guys please subscribe me to help my channel grow please guys,0,"-1,-1,-1,1"
z122f10gdvathpo2222pshcxxpjliddjv04,BmwManDexter,2014-11-05T20:33:15,"check out ""starlitnightsky"" channel to see epic videos﻿",1,138,check out  starlitnightsky  channel to see epic videos,1,"1,-1,-1,-1"
z12udxjwpwurtlwz304ccbrhdtusth4herk0k,PacKmaN,2014-11-05T21:56:39,check men out i put allot of effort into my music but unfortunatly not many  watch it﻿,1,142,check men out i put allot of effort into my music but unfortunatly not many  watch it,1,"0,-1,-1,-1"
z13osluqrpefv1hd323idhejzxanc3ai004,Tyrek Sings,2014-11-05T22:50:02,CHECK MY CHANNEL OUT PLEASE. I DO SINGING COVERS﻿,1,145,check my channel out please  i do singing covers,1,"1,-1,-1,-1"
z12zstfhixudundzf04cjbsp0rjrzh1rw3k,MiningBip3,2014-11-06T02:22:00,Check out pivot animations in my channel﻿,1,148,check out pivot animations in my channel,1,"1,-1,-1,-1"
z12zjztrvlnafvk2n230wjmztyfxxpbk2,CronicleFPS,2014-11-06T03:10:26,Check me out I'm all about gaming ﻿,1,150,check me out i m all about gaming ,1,"1,-1,-1,-1"
z12scr5ixnexwh2xa04civ3o3k25dr3wkfw,Freddie Barton,2014-11-06T15:31:35,CHECK MY CHANNEL FOR MY NEW SONG 'STATIC'!! YOU'LL LOVE IT!!﻿,1,161,check my channel for my new song  static    you ll love it  ,1,"1,-1,-1,-1"
z12ox3a5vviky5ctq22nz1ewpo24wxyis04,JackTheLad,2014-11-06T19:00:11,Subscribe to me and I'll subscribe back!!!﻿,1,171,subscribe to me and i ll subscribe back   ,0,"-1,-1,-1,1"
z13chfswltzzyhys1234dvkb3r2ien0ld,DirtySouthFlorida3,2014-11-06T22:00:58,Subscribe to me i subscribe back!!!! Plus i have a nice ass lol﻿,1,175,subscribe to me i subscribe back     plus i have a nice ass lol,0,"-1,-1,-1,1"
z124y1czouyechz4j04citox1mn1wz5pmos0k,YoungBrothersRecords,2014-11-06T23:22:32,Please give us a chance and check out the new music video on our channel!  You won't be disappointed.﻿,1,179,please give us a chance and check out the new music video on our channel   you won t be disappointed ,1,"1,-1,-1,-1"
z12yu11xyumitzpho04cix1y3zn3ijrpcm40k,Chinsoman Films,2014-11-07T01:22:02,Please subscribe to me﻿,1,180,please subscribe to me,0,"-1,-1,-1,1"
z13neh044nq2wn0o404citkh2taufzqxuz40k,Mason Sieverding,2014-11-07T01:50:10,Please check out my vidios﻿,1,182,please check out my vidios,1,"1,-1,-1,-1"
z122srjbvovwzxg0522yd1i4ty3kznxqs04,Warrdrew,2014-11-07T07:46:57,I'm here to check the views.. holy shit﻿,0,188,i m here to check the views   holy shit,1,"1,-1,-1,-1"
z13mc51qfqeozdpun23kgri5kzjnjpitj,Callum Barr,2014-11-07T13:49:41,Subscribe to me plz plz plz plz plz plZ ﻿,1,200,subscribe to me plz plz plz plz plz plz ,0,"-1,-1,-1,1"
z13ccrthzkqdhl0ia04cjvobvtmafbd53ow0k,Pro Video,2014-11-07T17:53:51,subscribe to me :) ﻿,1,212,subscribe to me    ,0,"-1,-1,-1,1"
z134d5hbckywylmj404cgnlo3kysfhsjoeg,Kemal Kurtoglu,2014-11-07T19:33:46,"Im a RAPPER/SONGWRITER, check my video PLEASE..also subscribe for more  thanks :) tell me what you think.﻿",1,221,im a rapper songwriter  check my video please  also subscribe for more  thanks    tell me what you think ,0,"1,-1,-1,1"
z12wuz2qqnawe50js04cejpzosrzdr0r1k40k,Dana Matich,2014-11-08T03:32:55,Hey guys! Check this out: Kollektivet - Don't be slappin' my penis!  I  think that they deserve much more credit than they receive.﻿,1,257,hey guys  check this out  kollektivet   don t be slappin  my penis   i  think that they deserve much more credit than they receive ,1,"1,-1,-1,-1"
z13awjrbcpyhinimp23nwztqlrucvdio404,The Bibliophile Flautist,2014-11-08T03:49:38,"Hey everyone, I am a new channel and will post videos of book reviews and  music on the flute. Please subscribe if you would enjoy that. Thanks!﻿",1,260,hey everyone  i am a new channel and will post videos of book reviews and  music on the flute  please subscribe if you would enjoy that  thanks ,0,"-1,-1,-1,1"
z13shj4wpmflidcxc04ce5f4vlqdyzjowso0k,Tornike Noniashvili,2014-11-08T04:08:09,subscribe my chanel﻿,1,262,subscribe my chanel,0,"-1,-1,-1,1"
z12ruft4aq3thhpbl04cdxrzjvmohjyqhs00k,DylsFS,2014-11-08T10:40:00,Hi guys my name is Dylan and I do IRL football videos I have 1030  subscribers and I think you guys would like my content so come check it out  and if you do subscribe!﻿,1,293,hi guys my name is dylan and i do irl football videos i have       subscribers and i think you guys would like my content so come check it out  and if you do subscribe ,0,"1,-1,-1,1"
z12dixvi2qepuhb4o04chpd5exjdx3oqdic,DropItLikeItsSloth,2014-11-11T19:38:11,just came here to check the views :P﻿,0,310,just came here to check the views  p,1,"1,-1,-1,-1"
z12kw53jipujdzqex22qt5vxtoyde3cwg04,Itss Synco,2014-11-11T22:37:23,"COME AND CHECK OUT MY NEW YOUTUBE CHHANEL, GOING TO BE POSTING DAILY!﻿",1,311,come and check out my new youtube chhanel  going to be posting daily ,1,"1,-1,-1,-1"
z12qh5dbxp2uwj3s423qg3cqdqmzxrirt04,Mason Sieverding,2014-11-12T00:52:51,Please check out my vidios guys﻿,1,313,please check out my vidios guys,1,"1,-1,-1,-1"
z13pv52hkmf4jn23g22nzx5zqr2gen1gv04,LBEProductions,2014-11-12T01:40:22,Hey guys can you check my channel out plz. I do mine craft videos. Let's  shoot for 20 subs﻿,1,315,hey guys can you check my channel out plz  i do mine craft videos  let s  shoot for    subs,1,"1,-1,-1,-1"
z12ig3jrnlfvsthaa04chjkrply5zligbdg,Aaa Aaa,2014-11-12T05:46:27,PLEASE SUBSCRIBE ME!!!!!!!!!!!!!!!!!!!!!!!!!!!!!!!!!!!!!!!!!!!!!!!!!!!!﻿,1,317,please subscribe me                                                    ,0,"-1,-1,-1,1"
z12jeraoczqvvbkmz23hsbcptweedlrxx04,BIGMOFO Tonkatruck,2014-11-12T06:26:42,just came to check the view count﻿,0,318,just came to check the view count,1,"1,-1,-1,-1"
z12fgjx5zknbitgw104ce3op4v3nzlaxzqo0k,Young IncoVEVO,2014-11-12T07:14:06,Check out my Music Videos! Fuego - U LA LA Remix  hyperurl.co/k6a5xt﻿,1,319,check out my music videos  fuego   u la la remix  hyperurl co k a xt,1,"1,-1,-1,-1"
z124tligikzvt3kch22kx5daswzwdrjxp04,Young IncoVEVO,2014-11-12T07:14:46,Check out my Music Videos! and PLEASE SUBSCRIBE!!!! Fuego - U LA LA Remix  hyperurl.co/k6a5xt﻿,1,320,check out my music videos  and please subscribe     fuego   u la la remix  hyperurl co k a xt,0,"1,-1,-1,1"
z13supiartrcdr4la22xc3aripu2x1z3a,Ink Video Shorts,2014-11-13T02:33:53,Hey come check us out were new on youtube let us know what you think and  don't forget to subscribe thanks.﻿,1,333,hey come check us out were new on youtube let us know what you think and  don t forget to subscribe thanks ,0,"1,-1,-1,1"
z12gcx5hzkayhbmve23ghd3plt2czf2rp04,ArioseRose,2014-11-13T15:20:31,"Don't mind me, I'm just checking what the views are up to : )﻿",0,338,don t mind me  i m just checking what the views are up to    ,0,"-1,-1,1,-1"
z13qhxcb2ybzszosx22rh5hwhmmccpjx404,The Silent Troll Defuser HD,2014-11-13T15:47:27,"Hey guys can you check my YouTube channel I know you hate comments like  this one but I promise if you check my videos it will be entertaining I do  Shotgun Montages,Ninja Defuse Montages and Trolling please guys can you  check them out and thanks have a good day!!!!!!!﻿",1,339,hey guys can you check my youtube channel i know you hate comments like  this one but i promise if you check my videos it will be entertaining i do  shotgun montages ninja defuse montages and trolling please guys can you  check them out and thanks have a good day       ,1,"1,-1,-1,-1"
z130zd5b3titudkoe04ccbeohojxuzppvbg,BlueYetiPlayz -Call Of Duty and More,2015-05-23T13:04:32,subscribe to me for call of duty vids and give aways Goal-100 subs﻿,1,351,subscribe to me for call of duty vids and give aways goal     subs,0,"-1,-1,-1,1"
z12rw1o4zvidhdthz04cixxjssq5wzsrlpk0k,Nere Overstylish,2014-08-02T23:12:49,check out my rapping hope you guys like it  https://soundcloud.com/nereboy/call-of-the-lostproduce-by-atlastatlas-rapper-jkork  and follow and message me :)﻿,1,359,check out my rapping hope you guys like it  https   soundcloud com nereboy call of the lostproduce by atlastatlas rapper jkork  and follow and message me   ,1,"1,-1,-1,-1"
z13xizvwrki2hf2ev22txvrp2ovcyf3zq04,Jayki L,2014-08-03T21:20:41,"Subscribe pleaaaase to my instagram account , i'll subscribe back ♥  http://instagram.com/cyrine_ghorbel﻿",1,360,subscribe pleaaaase to my instagram account   i ll subscribe back   http   instagram com cyrine ghorbel,0,"-1,-1,-1,1"
z13ijjrgqqyqzfo2t23zfztbtlu4ghg5o04,Lil Misme,2014-08-09T03:01:25,Hey Guys this is Glamour Beauty! I just started my youtube channel please  go check it out! I'm going to post singing videos and also random videos  that I fell like! Please go to subscribe! More to come soon!. Remember to  subscribe!﻿,1,364,hey guys this is glamour beauty  i just started my youtube channel please  go check it out  i m going to post singing videos and also random videos  that i fell like  please go to subscribe  more to come soon   remember to  subscribe ,0,"1,-1,-1,1"
z122xxgxipvdzpovt22xjlyi5o3pebufp,Emilie,2014-08-09T20:12:26,Hey guys! My mom said if i got 100 subs before christmas I'll get a kitten  and I always have wanted an kitten so please watch my videos and if you  like it subscribe or like :) Please no mean comments﻿,1,365,hey guys  my mom said if i got     subs before christmas i ll get a kitten  and i always have wanted an kitten so please watch my videos and if you  like it subscribe or like    please no mean comments,0,"-1,-1,-1,1"
z13jtfwiuwrvy1tng23gid4hesqwxl4cm,Artady,2014-08-11T16:27:55,https://soundcloud.com/artady please check my stuff; and make some feedback﻿,1,367,https   soundcloud com artady please check my stuff  and make some feedback,1,"1,-1,-1,-1"
z13vendrur3zxdgkd22azzlzftn1vj3pp04,Evin Alshamas,2014-08-12T05:20:24,Subscribe me please﻿,1,369,subscribe me please,0,"-1,-1,-1,1"
z130s5kb0v3yjj3fp23zexx5iyuvv1js5,maddog1431,2014-08-12T18:38:42,Check out my covers I have a video coming out  please subscribe﻿,1,370,check out my covers i have a video coming out  please subscribe,0,"1,-1,-1,1"
z123std54m2ozht10232efr5svb4vh0au04,MB LOVE,2014-08-13T03:04:34,Subscribe to My CHANNEL﻿,1,371,subscribe to my channel,0,"-1,-1,-1,1"
