comment_id,author,date,old_text,expected_label,cid,text,model_pred,vectors
z13gv1bxbuytgjl3o23fdr5r3kaadbbm1,‫حلم الشباب‬‎,2015-05-25T23:42:49.533000,Check out this video on YouTube:﻿,1,1623,check out this video on youtube ,1,"1,-1,-1,-1"
z13ywdzqsnmjhts2v22qzrhpxzn5frizg04,Eidya Pal,2015-05-25T14:43:55.353000,i totally love this song. absolutely fantastic! i love ya shakira!﻿,0,1632,i totally love this song  absolutely fantastic  i love ya shakira ,0,"-1,1,-1,-1"
z12csjyqqru3tvlcb22hz3vrrn3jzfzyg04,Thiago Andrade,2015-05-25T08:08:49.121000,Nice vídeo shakira good﻿,0,1637,nice vdeo shakira good,0,"-1,1,-1,-1"
z12hsre40qqswblvg22kvlrhgznxul1xu04,JH Simene,2015-05-24T22:24:17.416000,Subscribe me please. i&#39;ll promise i&#39;ll sub back﻿,1,1643,subscribe me please  i     ll promise i     ll sub back,0,"-1,-1,-1,1"
z12zcxyjxof0ihx4w04cf1gojz3zwnty4ts0k,Syed Akbar Ali,2015-05-24T19:33:39.585000,Check out this video on YouTube:﻿,1,1646,check out this video on youtube ,1,"1,-1,-1,-1"
z12uvzpw4tufgf2qw04chd5abu3uvf4rw5o,Eric Gonzalez,2015-05-24T15:35:03.844000,"To help shakira become the first female to hit 1billiom views, I&#39;ve decided to watch this Video at least one a day. Everyday! Shakifans we r so close just hit the replay button !!!﻿",0,1648,to help shakira become the first female to hit  billiom views  i     ve decided to watch this video at least one a day  everyday  shakifans we r so close just hit the replay button    ,0,"-1,1,-1,-1"
z13rg14qosy3uvqz204cf1eaotyyjbyx1ec,Carmen W,2015-05-24T01:36:23.815000,I swear Shakira keeps getting more and more gorgeous! She definitely looks more gorgeous with her hair this way than super curly.﻿,0,1658,i swear shakira keeps getting more and more gorgeous  she definitely looks more gorgeous with her hair this way than super curly ,0,"-1,1,-1,-1"
z12iyf2wkybwerg5104cddairnrzf5vwoog0k,Anastasia Trevla,2015-05-23T18:35:07.666000,I love  Shakira !!!!!! ❤🎵🎶🎼🎸﻿,0,1663,i love  shakira        ,0,"-1,1,-1,-1"
z13fyrra1pres5hbj04chzwabkels11pe5c,GamingWith Kim,2015-05-23T17:40:19.322000,&lt;3 this song so much.SHAKIRA YOUR A REALLY GOOD ARTIST.﻿,0,1665, lt   this song so much shakira your a really good artist ,0,"-1,1,-1,-1"
z13cw35rwznvud1jt04cgl4zfpaqxj2z4qg0k,Raphael Lipusch,2015-05-23T17:07:04.122000,I love shakira<br />❤❤❤❤﻿,0,1666,i love shakira br   ,0,"-1,1,-1,-1"
z13isvpjcwadtnxfa23sdd0ipp20wzxdd,rtfamily,2015-05-23T16:45:03.492000,"Definitley the song for 2010 when im not listening to gypsy SHAKIRA ROCKS<br /><span class=""proflinkWrapper""><span class=""proflinkPrefix"">+</span><a class=""proflink"" href=""https://plus.google.com/101721377578919894134"" oid=""101721377578919894134"">shakiraVEVO</a></span>﻿",1,1667,definitley the song for      when im not listening to gypsy shakira rocks br    span class  proflinkwrapper   span class  proflinkprefix     span  a class  proflink  href  https   plus google com                        oid                         shakiravevo  a   span ,0,"-1,1,-1,-1"
z12ps3yhzryuzlg4504cezaxkwrjx3cpkgg,Hidayet Özsoy,2015-05-23T10:46:16.850000,"Shakira you are so beautiful. You are lovely, lively.. We love you.﻿",0,1672,shakira you are so beautiful  you are lovely  lively   we love you ,0,"-1,1,-1,-1"
z12zujgautikhxpn122mixwjkwavuldmd,alejandro rojas,2015-05-23T03:50:04.006000,Oh my god go to 1 billion of replay i love shakira﻿,0,1680,oh my god go to   billion of replay i love shakira,0,"-1,1,-1,-1"
z12ijbn5grjidp3vj23psvhyjvv2djpol04,Angie Vazquez,2015-05-23T02:51:23.999000,I love this song &amp;I love shakira&lt;333♡♡♡♡♡♡♡♡♡♡♡《33☆☆☆﻿,0,1682,i love this song  amp i love shakira lt      ,0,"-1,1,-1,-1"
z134y1ki5svvwt43i23wz5kqsxmaettuu,AlabaGames,2015-05-22T00:31:43.922000,Subscribe my channel  I RECORDING FIFA 15 GOALS WATCH NOW :D﻿,1,1694,subscribe my channel i recording fifa    goals watch now  d,0,"-1,-1,-1,1"
z13chhog1nbldb2xp04cgtkxcx35z1djpf0,Free Video Tv,2015-05-21T21:15:41.869000,subscribe to me and I wil subscribe to you back﻿,1,1696,subscribe to me and i wil subscribe to you back,0,"-1,-1,-1,1"
z12muzijetuwf3qgm04ce1nafxvtj535ao40k,Trollsif Stalin,2015-05-21T01:05:19.225000,"I believe that soccer promotes terrorism. Bad choice, Shakira.﻿",0,1709,i believe that soccer promotes terrorism  bad choice  shakira ,0,"-1,1,-1,-1"
z12xi1iaory1jvmlu23xfrayazjrv3jlj,Lili♥,2015-05-20T17:20:19.177000,"Shakira is different :) She is so happy all the time and she is spending for Africa :)<br />She can dance , sing and she speaks 4 languages﻿",0,1712,shakira is different    she is so happy all the time and she is spending for africa    br   she can dance   sing and she speaks   languages,0,"-1,1,-1,-1"
z13fzxyw3q3bupy0w22oc3wrmu2qdtmu4,Lucas Bonini,2015-05-20T17:15:30.741000,Gusttavo Lima Você não me conhece <br />Check out﻿,1,1713,gusttavo lima voc no me conhece  br   check out,1,"1,-1,-1,-1"
z131uprw3qv4w5iou04cjbbgtvjedpoonvs0k,Ruchira Naidu,2015-05-20T14:34:27.224000,"Help shakira&#39;s waka waka be the first song by a female artist to reach 1 billion views.<br />(dark horse is ahead by roughly 100 million more views, and roar has only 50 million more views)<br /><a href=""https://www.youtube.com/watch?v=pRpeEdMmmQ0"">https://www.youtube.com/watch?v=pRpeEdMmmQ0</a>﻿",1,1717,help shakira     s waka waka be the first song by a female artist to reach   billion views  br    dark horse is ahead by roughly     million more views  and roar has only    million more views  br    a href  https   www youtube com watch v prpeedmmmq   https   www youtube com watch v prpeedmmmq   a ,0,"-1,1,-1,-1"
z12guhfqxzvgy3sxc04ccblrqxbmvperiqg0k,vimal singhania,2015-05-20T09:48:09.938000,SHAKIRA SONG WAKA WAKA﻿,0,1719,shakira song waka waka,0,"-1,1,-1,-1"
z12bf3fptyfkzh44n04cdbxbnyanujcy2u00k,Dara O,2015-05-20T02:39:10.745000,So underrated better<br />Than  Katy perry :/ but in not saying Katy is bad but she has no meaning to her songs. Shakira has<br />Meaningful songs these are the songs which bring memories and vibe&#39;s. I will miss it.   <br />   ﻿,0,1720,so underrated better br   than  katy perry    but in not saying katy is bad but she has no meaning to her songs  shakira has br   meaningful songs these are the songs which bring memories and vibe     s  i will miss it     br      ,0,"-1,1,-1,-1"
z13oc3rzqy2pwxors04cflibxy2zutsakz40k,Kalle Eklund,2015-05-19T23:29:31.994000,"Hi, nice song Shakira! (Sorry for bad Brazilian)﻿",0,1725,hi  nice song shakira   sorry for bad brazilian ,0,"-1,1,-1,-1"
z13rv5wieu2fdnogl04cdl0bdmjuunpwcnk0k,C Williams,2015-05-18T21:51:36.079000,Check out this playlist on YouTube<br />﻿,1,1733,check out this playlist on youtube br   ,1,"1,-1,-1,-1"
z12yhleh5k2lcxtr304chn2gatiwur3xhz40k,Lizle Productions,2015-05-16T11:33:22.322000,Top three Shakira songs (my choice) <br /><br />1- Waka Waka (it&#39;s time for Africa)<br /><br />2- Can&#39;t remember to forget you <br /><br />3- Empire<br /><br />Like this comment if u like Shakira ﻿,1,1734,top three shakira songs  my choice   br    br      waka waka  it     s time for africa  br    br      can     t remember to forget you  br    br      empire br    br   like this comment if u like shakira ,0,"-1,1,-1,-1"
z122tvoquqzuirdhu04cfbfznza2jt05juk0k,gamila Khalil,2015-05-14T19:02:59.210000,Check out this video on YouTube:﻿,1,1735,check out this video on youtube ,1,"1,-1,-1,-1"
z13jgncbqw2cwjroj04cfxjisoyrsj2z4kw0k,Nancy Kiragu,2015-05-12T11:48:27.242000,Check out this playlist on YouTube:Central ﻿,1,1736,check out this playlist on youtube central ,1,"1,-1,-1,-1"
_2viQ_Qnc69LaqGJOI7p8VvK_26tIy8R0g_z-_ye79c,Laura Brown,2013-10-27T02:55:06.764000,"You guys should check out this EXTRAORDINARY website called FIREPA.COM .   You can make money online and start working from home today as I am!   I am making over $3,000+ per month at FIREPA.COM !   Visit FIREPA.COM and check it out!   Lake   . Duzafizz . Singlewave . Spourmo . Burder . Colorful . Claster . Incandescent . Ambitious . Winooze . Absorbing . Macabre . Crestboot . Boxium . Womanly . Tan . Ybuwyn . Forgetful . Pepelexa . Zealous",1,1737,you guys should check out this extraordinary website called firepa com     you can make money online and start working from home today as i am    i am making over         per month at firepa com     visit firepa com and check it out    lake     duzafizz   singlewave   spourmo   burder   colorful   claster   incandescent   ambitious   winooze   absorbing   macabre   crestboot   boxium   womanly   tan   ybuwyn   forgetful   pepelexa   zealous,1,"1,-1,-1,-1"
z13lwva51nepgdxi404ceffbmqnfgje410c,‫انس الغامدي‬‎,2015-05-09T00:09:35.368000,Pleas subscribe my channel GamezZMTA﻿,1,1740,pleas subscribe my channel gamezzmta,0,"-1,-1,-1,1"
z13axdfy2v21eltyr04cib5jvzz3etij0g0,GamezZ MTA,2015-05-09T00:08:26.185000,Pleas subscribe my channel﻿,1,1741,pleas subscribe my channel,0,"-1,-1,-1,1"
z12rvnaqcprqe1jmt23fynpy0ziidrrzg04,joory amora,2015-05-09T00:07:53.422000,Pleas subscribe GamezZ MTA my channel<br />﻿,1,1742,pleas subscribe gamezz mta my channel br   ,0,"-1,-1,-1,1"
z12nsvmo4yrifjeg504cfdvrhm2vt5p4wfg,Simon Morales,2015-05-08T20:28:10.938000,"cool song check out my animal trafficking petition.<br /><a href=""http://www.thepetitionsite.com/387/433/550/stop-animal-trafficking/?cid=headerClick"">http://www.thepetitionsite.com/387/433/550/stop-animal-trafficking/?cid=headerClick</a>﻿",1,1743,cool song check out my animal trafficking petition  br    a href  http   www thepetitionsite com             stop animal trafficking  cid headerclick  http   www thepetitionsite com             stop animal trafficking  cid headerclick  a ,1,"1,-1,-1,-1"
z13oxjdhkxzqyti1123rvxox2om4fpqqt04,Felipe Browne,2015-05-08T01:52:42.291000,Check out this video on YouTube: ﻿,1,1744,check out this video on youtube  ,1,"1,-1,-1,-1"
z12ohx343rfzs3nmz22rfnzbkqvqtnxwt04,CliP ArT shoW,2015-05-06T07:40:02.079000,Subscribe and Win a CAP<br />       ☆☆☆☆☆﻿,1,1745,subscribe and win a cap br          ,0,"-1,-1,-1,1"
z13tgdxgmputf1xfk22jjzhqgpi4v3xo104,Pauline Martinez,2015-05-06T03:21:12.870000,Check out this playlist on YouTube:﻿,1,1746,check out this playlist on youtube ,1,"1,-1,-1,-1"
z13zhngyrsyeffkvf22cjvtofreiub1lp,Hawa Bah,2015-05-03T17:20:32.978000,Hey guys love this but check out this girl name cause she knows how to dance so search up ej ba dancing.﻿,1,1747,hey guys love this but check out this girl name cause she knows how to dance so search up ej ba dancing ,1,"1,-1,-1,-1"
z13asbvq1n2ttvptn23vd1mpsmnju5n0o,GALAXIAN HD,2015-04-26T17:36:25.815000,i am from Brazil please subscribe my channel love you all﻿,1,1749,i am from brazil please subscribe my channel love you all,0,"-1,-1,-1,1"
z13szlz5sp2zw3fxc04cc3nbhlmjxnphivg0k,Robloxia Asap,2015-04-25T19:54:03.298000,Could Spanish people understand this?<br /><br />Any way&#39;s I how you doing subscribe to me I brake things<br /><br />-_-﻿,1,1750,could spanish people understand this  br    br   any way     s i how you doing subscribe to me i brake things br    br      ,0,"-1,-1,-1,1"
z13twxvoxwz1f11pk04cij1b0zi1ifbhdno0k,mariam shoja,2015-04-23T10:14:34.527000,Check out this video on YouTube:﻿,1,1752,check out this video on youtube ,1,"1,-1,-1,-1"
z12gj5gi4leawfcni225jty5wzvecj53m,Jet Lee,2015-04-23T08:08:38.925000,There are beautiful songs please subscribe﻿,1,1754,there are beautiful songs please subscribe,0,"-1,-1,-1,1"
_2viQ_Qnc6_NsO9XDTWC1TlbTRevVI-QGIqkXxuyl60,AllDailyVines,2013-11-03T12:11:52.335000,hahahahah ♥♥♥♥ :D like vines ?  Subscribe to me for daily vines,1,1759,hahahahah   d like vines    subscribe to me for daily vines,0,"-1,-1,-1,1"
_2viQ_Qnc6-FlNdROU4zIseFCr76DMg7l8N-trEo764,real money,2013-10-30T15:55:56.097000, subscribe to my feed,1,1763, subscribe to my feed,0,"-1,-1,-1,1"
_2viQ_Qnc6_1RPym_S70n6Rv617-TI9Z8GVhGlwXs_I,AllDailyVines,2013-10-28T00:00:12.526000,:D subscribe to me for daily vines,1,1764, d subscribe to me for daily vines,0,"-1,-1,-1,1"
_2viQ_Qnc6-fnXF3jNuC5sr8txrOVFd4Uozj9Y4xC-w,FreshisYummy,2013-10-26T06:28:32.523000,Waka Waka!:D   Check out my new HALLOWEEN VIDEO!:),1,1766,waka waka  d   check out my new halloween video   ,1,"1,-1,-1,-1"
_2viQ_Qnc6-awsV_zO5HWBhiYFzj5-4qgeeFv1iJwRU,Ferdi David,2013-10-25T11:26:10.848000,we are 14 year old boys we are trying to enter in the music industry Maybe we are just a dreamers but we are not the? only one. Please give us one chance to prove ourself to you. we know these things are annoying as hell we are sorry? about that. But we do anything to get music heard. Please visit our channel subscribe if you like and thumb this comment up so everyone can see we have made a song called: I Wanna Play A Game please take a look on our channel Thankss!!!,1,1767,we are    year old boys we are trying to enter in the music industry maybe we are just a dreamers but we are not the  only one  please give us one chance to prove ourself to you  we know these things are annoying as hell we are sorry  about that  but we do anything to get music heard  please visit our channel subscribe if you like and thumb this comment up so everyone can see we have made a song called  i wanna play a game please take a look on our channel thankss   ,0,"-1,-1,-1,1"
_2viQ_Qnc69HTQ21lx0wtZ4TFYSpc_gMDApvlQt0q8o,Ishfaq khan,2013-10-21T07:18:41.460000, plz i wilsubscribe me frndzzl subscribe u back,1,1768, plz i wilsubscribe me frndzzl subscribe u back,0,"-1,-1,-1,1"
_2viQ_Qnc68YhzlKOdq3h2y3v8TCi0RQSIFzQP8hltY,Derek Moya,2013-10-21T05:47:26.457000,"You guys should check out this EXTRAORDINARY website called MONEYGQ.COM .   You can make money online and start working from home today as I am!   I am making over $3,000+ per month at MONEYGQ.COM !   Visit MONEYGQ.COM and check it out!  Why does the fragile swim enlist the person? How does the ice audit the frequent son? The fantastic chance describes the rate.",1,1769,you guys should check out this extraordinary website called moneygq com     you can make money online and start working from home today as i am    i am making over         per month at moneygq com     visit moneygq com and check it out   why does the fragile swim enlist the person  how does the ice audit the frequent son  the fantastic chance describes the rate ,1,"1,-1,-1,-1"
_2viQ_Qnc6_KD8seCZD8AcEirg_4NEFXuEO1fKw3lmY,VideoPro,2013-10-20T20:52:44.901000,SUBSCRIBE ME AND I REQUITE,1,1770,subscribe me and i requite,0,"-1,-1,-1,1"
_2viQ_Qnc6_kxEjV8Ut57SeEGdqSKmC8VGP1K38Q2qY,Scott Johnson,2013-10-18T19:45:43,"You guys should check out this EXTRAORDINARY website called ZONEPA.COM .   You can make money online and start working from home today as I am!   I am making over $3,000+ per month at ZONEPA.COM !   Visit Zonepa.com and check it out!  Why does the statement conciliate the acidic stretch? The earth recognizes the money. When does the numberless number transport the trade?",1,1773,you guys should check out this extraordinary website called zonepa com     you can make money online and start working from home today as i am    i am making over         per month at zonepa com     visit zonepa com and check it out   why does the statement conciliate the acidic stretch  the earth recognizes the money  when does the numberless number transport the trade ,1,"1,-1,-1,-1"
_2viQ_Qnc6-q29okw74KTmVXCvhacMZ5NjAiYdAwHww,Louis Bryant,2013-10-12T15:55:05.693000,"You guys should check out this EXTRAORDINARY website called ZONEPA.COM . You can make money online and start working from home today as I am! I am making over $3,000+ per month at ZONEPA.COM ! Visit Zonepa.com and check it out! The meat discusss the successful memory. How does the peaceful unit arbitrate the guide? The addition designs the worried loss.",1,1780,you guys should check out this extraordinary website called zonepa com   you can make money online and start working from home today as i am  i am making over         per month at zonepa com   visit zonepa com and check it out  the meat discusss the successful memory  how does the peaceful unit arbitrate the guide  the addition designs the worried loss ,1,"1,-1,-1,-1"
_2viQ_Qnc69vgWhC2acrKSH-tvjKq1KuKBca1UtB8wk,Louis Bryant,2013-10-12T15:20:19.887000,"You guys should check out this EXTRAORDINARY website called ZONEPA.COM . You can make money online and start working from home today as I am! I am making over $3,000+ per month at ZONEPA.COM ! Visit Zonepa.com and check it out! How does the mother approve the axiomatic insurance? The fear appoints the roll. When does the space prepare the historical shame?",1,1781,you guys should check out this extraordinary website called zonepa com   you can make money online and start working from home today as i am  i am making over         per month at zonepa com   visit zonepa com and check it out  how does the mother approve the axiomatic insurance  the fear appoints the roll  when does the space prepare the historical shame ,1,"1,-1,-1,-1"
_2viQ_Qnc69mufWqn8FcFN6u6tahNMkNWgB4-jKb2hs,Louis Bryant,2013-10-12T15:19:50.282000,"You guys should check out this EXTRAORDINARY website called ZONEPA.COM . You can make money online and start working from home today as I am! I am making over $3,000+ per month at ZONEPA.COM ! Visit Zonepa.com and check it out! The plausible summer submits the behavior. When does the grass check the peaceful seat? The country strategizes the edge.",1,1782,you guys should check out this extraordinary website called zonepa com   you can make money online and start working from home today as i am  i am making over         per month at zonepa com   visit zonepa com and check it out  the plausible summer submits the behavior  when does the grass check the peaceful seat  the country strategizes the edge ,1,"1,-1,-1,-1"
_2viQ_Qnc6_QZJzAERyAVzhcr3jy2ctVM4zQMfesQWQ,The NeedleWork,2013-10-12T09:32:49.512000,Check out my channel :),1,1783,check out my channel   ,1,"1,-1,-1,-1"
_2viQ_Qnc6_qs30Ph_whafzKoWVyh_xIYpN3-7U_VmA,high tems,2013-10-12T09:13:19.285000,subscribe  my,1,1784,subscribe  my,0,"-1,-1,-1,1"
_2viQ_Qnc6-k1VSPmCd2mrSAAQXChBMxF7oeJGCepUU,Anderson St. Martin,2013-10-09T03:22:24.252000,"Hello everyone my name&#39;s Anderson and i&#39;m a singer. not expecting to buy subscribers with words BUT to gain them with my voice. I might not be the best but my voice is different (in a good way) and i&#39;ll work harder than anyone out there to get better, &#39;cuz &quot;yeah&quot; i have a dream  a HUGE one, (who doesn&#39;t?) so please take 3 minutes of your time to check out my covers. Give me a chance you won&#39;t regret it If you feel like subscribing that&#39;d be awesome and it&#39;d mean the world to me THANK YOU SO MUCH",1,1788,hello everyone my name     s anderson and i     m a singer  not expecting to buy subscribers with words but to gain them with my voice  i might not be the best but my voice is different  in a good way  and i     ll work harder than anyone out there to get better       cuz  quot yeah quot  i have a dream  a huge one   who doesn     t   so please take   minutes of your time to check out my covers  give me a chance you won     t regret it if you feel like subscribing that     d be awesome and it     d mean the world to me thank you so much,1,"1,-1,-1,-1"
_2viQ_Qnc68jroUSzJhg6jrxFj86oxZrAtGB_PWbOm4,latrell brown,2013-10-08T18:26:06.234000,Check Out Daneja Good Girl,1,1789,check out daneja good girl,1,"1,-1,-1,-1"
_2viQ_Qnc6_eMN0NwT5paySjJPFbN5xI9W8C1Bwoq1U,WhatUKnow,2013-10-07T02:59:17.497000,Subscribe to my Youtube Channel!! :) Suscribite a mi canal de Youtube -WhatUKnow,1,1791,subscribe to my youtube channel      suscribite a mi canal de youtube  whatuknow,0,"-1,-1,-1,1"
_2viQ_Qnc68DyUSaxqDmv-6yHPVUpKeYAZhrh2PUMZg,jameskileymusic,2013-10-06T05:38:47.524000,Check out my bass cover of hips don&#39;t lie by shakira!,1,1792,check out my bass cover of hips don     t lie by shakira ,1,"1,1,-1,-1"
_2viQ_Qnc6-TLlBlT0itl1DbMJQGBx_6ZbscBXA3Nww,WhatUKnow,2013-10-06T03:24:16.073000,Subscribe to my channel :)  &lt;3,1,1793,subscribe to my channel      lt  ,0,"-1,-1,-1,1"
_2viQ_Qnc69JZ1f3TJQWKMLhmdP0inDDPwOvzMQiFjE,Su Xianfeng,2013-10-05T11:54:10.192000,subscribe now!!!!!! love the song!!!!!! love football!!!,1,1795,subscribe now       love the song       love football   ,0,"-1,-1,-1,1"
_2viQ_Qnc6_lxLB2IBIspObma9o3R5-8SwQnc8zq9Sk,Alain Bruno,2013-10-04T14:24:49.500000,Shakira is perfect,0,1806,shakira is perfect,0,"-1,1,-1,-1"
_2viQ_Qnc6-kUg8jc2n9-Cudm5lEsM-cSzIjF182TJo,Pyles Baxter,2013-10-03T02:25:19.324000,"  Perhaps you have seen the newest Miley Cyrus SECRET video ?   She&#39;s sucking an old man&#39;s cock ,  If you wish to see her , check out the celebrity website beneath :   miley-secret-video.co.uk ",1,1814,  perhaps you have seen the newest miley cyrus secret video     she     s sucking an old man     s cock    if you wish to see her   check out the celebrity website beneath     miley secret video co uk ,1,"1,-1,-1,-1"
_2viQ_Qnc680Rh_y5Dlwtkr_llWVOG7ZQdmNVip_dno,Minh Lý,2013-10-02T12:15:58.210000,i like and love so much people all friends..... I love Shakira ^^,0,1822,i like and love so much people all friends      i love shakira   ,0,"-1,1,-1,-1"
_2viQ_Qnc6-pgdb3FeyKxBCq6-zYy7OAn_tWkX5Xgz4,Chris Williams,2013-10-02T07:50:13.051000,Shakira I love you,0,1824,shakira i love you,0,"-1,1,-1,-1"
_2viQ_Qnc6_umVgV0fI-CSScDHuFxNHIVvezCGhajW8,Alain Bruno,2013-10-02T04:01:20.922000,Shakira is very beautiful,0,1826,shakira is very beautiful,0,"-1,1,-1,-1"
_2viQ_Qnc6-TMFClPlfFIBHdy_HbPbLyMhBsuEz5Lj8,Trang Le,2013-10-02T00:48:17.158000,Shakira voice sound spanish but that is what make the music sound amazing ♥I LOVE IT,0,1831,shakira voice sound spanish but that is what make the music sound amazing i love it,0,"-1,1,-1,-1"
_2viQ_Qnc69D1Jxs1IlkkF0Xzce0uBoJN_OzDHnfmV0,latrell brown,2013-10-01T23:42:30.928000,CHECK OUT DANEJA GOOD GIRL,1,1832,check out daneja good girl,1,"1,-1,-1,-1"
_2viQ_Qnc68Lfu14asBabOAcqL9B7Anp_6zX66rSWP0,42o2 Studios,2013-10-01T19:10:56.808000,Check out my covers please!,1,1833,check out my covers please ,1,"1,-1,-1,-1"
_2viQ_Qnc68dceJbTRNTP2sksMxa_lm35LaCu_jPluY,Shadrach Grentz,2013-09-29T13:59:42.162000,"Hey Music Fans I really appreciate any of you who will take the time to read this, and check my music out! I&#39;m just a 15 year old boy DREAMING of being a successful MUSICIAN in the music world. I do lots of covers, and piano covers. But I don&#39;t have money to advertise. A simple thumbs up to my comment, a comment on my videos or a SUBSCRIPTION would be a step forward! It will only be a few seconds of your life that you won&#39;t regret!!! Thank u to all the people who just give me a chance! :) ",1,1834,hey music fans i really appreciate any of you who will take the time to read this  and check my music out  i     m just a    year old boy dreaming of being a successful musician in the music world  i do lots of covers  and piano covers  but i don     t have money to advertise  a simple thumbs up to my comment  a comment on my videos or a subscription would be a step forward  it will only be a few seconds of your life that you won     t regret    thank u to all the people who just give me a chance     ,1,"1,-1,-1,-1"
_2viQ_Qnc69A12xULkAOn5BEAGFKxQTTP02SSbsMsmc,Vincent T.,2013-09-29T00:44:30.904000,"Echa un vistazo a la remezcla! / Check out the remix!  MILEY CYRUS - WRECKING BALL (THE HOUSE OF EDM REMIX)  MILEY CYRUS - WRECKING BALL (VINCENT T. REMIX)  ...click, enlace, suscríbase! / ...click, link, subscribe!",1,1835,echa un vistazo a la remezcla    check out the remix   miley cyrus   wrecking ball  the house of edm remix   miley cyrus   wrecking ball  vincent t  remix      click  enlace  suscrbase       click  link  subscribe ,0,"1,-1,-1,1"
_2viQ_Qnc6-CRJO_6pvsByopsnD3qpCbK0IPhkvTuS8,RanMC & RVNNIN' RVNN,2013-09-26T20:13:40.670000,Hey check out our new musicvideo &#39;&#39;Life&#39;s a celebration&#39;&#39; Peace !,1,1836,hey check out our new musicvideo           life     s a celebration           peace  ,1,"1,-1,-1,-1"
_2viQ_Qnc6_onwOgxju-DV6WkqHZEOztCXD04EgEFBU,Hidden Love,2013-09-24T14:29:54.072000,Hi. Check out and share our songs.,1,1837,hi  check out and share our songs ,1,"1,-1,-1,-1"
_2viQ_Qnc6_rdI1pDiJrFRv9uqSk3MizTk-rQeALntU,Noise​Break,2013-09-21T22:11:23.900000,Subscribe &amp; Like /watch?v=5tu9gN1l310,1,1838,subscribe  amp  like  watch v  tu gn l   ,0,"-1,-1,-1,1"
_2viQ_Qnc69uhVbXr8SjkhLHu7T1HOxqrEF1f6h8vUA,Finuccsi Aka csincsilla3M,2013-09-21T15:43:40.171000,/watch?v=Dtqcftr1Fac JUSTIEN BIEBER CAR 2013. LIKE&amp;SUBSCRIBE,1,1839, watch v dtqcftr fac justien bieber car       like amp subscribe,0,"-1,-1,-1,1"
_2viQ_Qnc69ETVqiialEz0s1k4Xnlmwuu1m1Hr-YzRE,killtheclockhd,2013-09-17T15:23:13.101000,check out our bands page on youtube killtheclockhd - check out some of our original songs including &quot;your disguise&quot;,1,1840,check out our bands page on youtube killtheclockhd   check out some of our original songs including  quot your disguise quot ,1,"1,-1,-1,-1"
_2viQ_Qnc6_0DIjqw5n_WRhiiEtCGnZgvPPZJgZwPjU,The-ZiZ Oh,2013-09-14T16:15:00.990000,HI! CHECK OUT OUR AWESOME COVERS! AND SAY WHAT YOU THINK!,1,1841,hi  check out our awesome covers  and say what you think ,1,"1,-1,-1,-1"
