comment_id,author,date,text,expected_label,model_pred,vectors,signal_strength
z12nsvmo4yrifjeg504cfdvrhm2vt5p4wfg,Simon Morales,2015-05-08T20:28:10.938000,cool song check out my animal trafficking petition  br    a href  http   www thepetitionsite com             stop animal trafficking  cid headerclick  http   www thepetitionsite com             stop animal trafficking  cid headerclick  a ,1,0,"0,1,-1,-1,-1,1,0,1,0",6
z12dhjqivqv3zvxwl04ccrs43v2wz1cbys40k,Bella Cullen,2015-05-19T23:21:48.011000,check out this video on youtube  br   gotta dance and just have a blast every time i hear this song      just love it  br   ,1,0,"0,1,0,-1,-1,-1,0,0,0",6
z12wefdg1w2sz3ase22tsd4j2xn1ybakp,There's No Saving Grace (FreakOffLeash),,check out this video on youtube  br    br   love this song    it     s all good will never go back that but i     ll always remember the passion but never want to go back to being dysfunctional insanity        goal is to live happy not live insane  ,1,0,"0,1,0,-1,-1,-1,0,0,0",6
LneaDw26bFuMmBaTaA7SRY7EwUqxN2vHR8tDEuQfjRQ,BloodspitsMusic,,come check out our music channel  go check out the song  quot love me quot  by j e m ini  if you do you are a very amazing person  thank you to all who check it out  if you don     t check it out you     re still an amazing person just for reading this post,1,0,"0,1,0,-1,-1,-1,0,0,0",6
z13fsfeyruulsxerl04ch1aatpbhv31z32c,James Lim,,check out this video on youtube   a href  http   www youtube com user jlimvuth  http   www youtube com user jlimvuth  a      eminem ft rihanna   love the way you lie,1,0,"-1,1,0,-1,-1,1,0,0,1",6
z12duvyaxqmrstxs3223jdjjrsb0wllzn04,Vivid Phantasm,2015-01-31T23:42:34.531000,men stop being naive idiots believing in love and believing that women actually respect you  want a more fulfilling drama fee life  check out mgtow  there are many channels here on youtube that you can chose from which will give you all the information needed   caution  not for men who enjoy being disposable providers of utility ,1,0,"-1,1,0,-1,-1,-1,0,0,0",5
z13zhngyrsyeffkvf22cjvtofreiub1lp,Hawa Bah,2015-05-03T17:20:32.978000,hey guys love this but check out this girl name cause she knows how to dance so search up ej ba dancing ,1,0,"-1,1,0,-1,-1,-1,0,0,0",5
z131x1cimrnfuz2zs04ci5gqvqemyb2jsp00k,OFFICIAL LEXIS,2014-11-04T20:26:48.030000,hi everyone  do you like music  then why not check out my music channel  the lexis band will be uploading their own songs and covers soon so don     t miss out  please subscribe too asit does help us out a lot  just takes one click    gt ,1,0,"0,1,-1,-1,-1,-1,0,1,0",5
z12scr5ixnexwh2xa04civ3o3k25dr3wkfw,Freddie Barton,2014-11-06T15:31:35,check my channel for my new song  static    you ll love it  ,1,0,"0,1,0,-1,-1,-1,0,-1,0",5
LneaDw26bFs87f8zCtdgtSzADarWSHU_uPcclXWKxms,Andrew Guasch,,listen   check out andrew guasch   crazy  sick flow   i     m dope    that     s all there is too it  if you like it subscribe  if not  ill be with aftermath of tde soon enough   one love   peace ,1,0,"-1,1,0,-1,-1,-1,0,0,0",5
z13qczlqnoqajv4rd04ci5arplmksbi5yq00k,Andrew Willigar,, a rel  nofollow  class  ot hashtag  href  https   plus google com s    awesome   awesome  a   a rel  nofollow  class  ot hashtag  href  https   plus google com s    share   share  a   a rel  nofollow  class  ot hashtag  href  https   plus google com s    rt   rt  a  eminem   love the way you lie ft  rihanna  a href  http   ow ly  zme f  http   ow ly  zme f  a ,1,0,"-1,-1,0,-1,-1,1,0,0,1",5
z13iyvux4tzxsdf2x23vixxpfxfbixban04,((A.B)),2014-10-04T01:35:02.414000,lmfao is crazy dope    check out my music on my channel if you have a minute  it would mean a lot  much love  ,1,0,"-1,1,0,-1,-1,-1,0,1,0",5
z13bcvcqts3bwtl3g223shlrvqe1wdtmg,KingLoTheDancer,2015-02-01T05:48:32.623000,check out my dance videos   you won     t be disappointed    a rel  nofollow  class  ot hashtag  href  https   plus google com s    kinglothedancer   kinglothedancer  a ,1,0,"-1,1,-1,-1,-1,1,0,1,0",5
z13tczjy5xj0vjmu5231unho1ofey5zdk,LaS Music,2015-05-28T19:23:35.355000,hey guys  i     m a human  br    br    br   but i don     t want to be a human  i want to be a sexy fucking giraffe  br    br    br   i already have the money for the surgery to elongate my spinal core  the surgery to change my skin pigment  and everything else  like this post so others can root me on in my dream     br    br    br   im fucking with you  i make music  check out my first song   a rel  nofollow  class  ot hashtag  href  https   plus google com s    giraffebruuh   giraffebruuh  a ,1,0,"0,1,-1,-1,-1,1,0,-1,0",5
z13xw1iqty25xhrcb23eg3yjrzift5yfq,ownpear902,2014-07-22T18:44:36.299000,check it out free stuff for watching videos and filling surveys br    br    a href  http   www prizerebel com index php r          http   www prizerebel com index php r          a ,1,0,"-1,1,-1,-1,-1,1,0,0,0",5
LneaDw26bFuiTZZU8HrWJPqWfqnrKTtUXy7-rTnPwfU,Lil M,,hi i     m lil m     check out love the way you lie     my live performance and many others    videos and my own lyrics      thanks,1,0,"-1,1,0,-1,-1,-1,0,1,0",5
z13mgtcxivevf3thn04cdvty0sqzuteqpys0k,Sean B,2014-11-10T07:35:42.081000,check out our app to solve all your party drunk problems  br    a href  https   play google com store apps details id vn ibit applocker amp hl en  https   play google com store apps details id vn ibit applocker amp hl en  a ,1,0,"-1,1,-1,-1,-1,1,0,0,0",5
_2viQ_Qnc69fyi7qH4TDPB7CSJnioSrJi3CoQXBbjCo,Mayla Stephens,2013-10-18T20:28:32.779000,i love this      this is one of my fave songs now and i just subscribed         ,1,0,"0,-1,0,-1,-1,-1,0,1,0",5
z13wytcx3ljjhvo2w23qejnwjyzryv2xh04,Sam Kesha,2014-11-07T23:21:19,http   www wattpad com story          she can love you good,1,0,"-1,-1,0,-1,-1,1,0,0,0",5
z13nsd141x24yjh2m224xvlhisrqet4pj04,TheJohnRage,,alright ladies  if you like this song  then check out john rage  he     s a smoking hot rapper coming into the game  he     s not better than eminem lyrically  but he     s hotter  hear some of his songs on my channel ,1,0,"0,1,-1,-1,-1,-1,0,1,1",5
LneaDw26bFttCkyddOJEPH8MvdMEkuYK_CTH-fLEm8E,lisabelb,,check out my cover of love the way you lie please  ,1,0,"-1,1,0,-1,-1,-1,0,1,0",5
z13kfzqicymszt0jp04ci5gqvqemyb2jsp00k,OFFICIAL LEXIS,2014-11-04T20:22:21,hi everyone  do you like music  then why not check out my music channel   the lexis band will be uploading their own songs and covers soon so don t  miss out  please subscribe too as it does help us out a lot  just takes one  click    gt ,1,0,"0,1,-1,-1,-1,-1,0,1,0",5
LneaDw26bFshakV1mr8xdnPsZTs4kKWkL20CH_8-gww,George Raps,,my name is george and let me tell u eminem is my idol my inspiration  i     ve listen to him growing up  i never thou i would love rap this much but i thank him for helping me find my dream  so i rap now and make youtube videos and yesterday i covered the song mockingbird it     s in my channel i worked really hard on it and it     s one of my favorite songs of him  so please go check it out and subscribe it would mean the world to me n sorry for the spam  don     t hate i     m not eminem,1,0,"0,1,0,-1,-1,-1,0,-1,1",5
z13cyzbbqsrxyfaec23xc10rdrrqgd0ch,Malin Linford,2014-11-05T01:13:43,hey guys please check out my new google  page it has many funny pictures   funnytortspics  https   plus google com                       post,1,0,"-1,1,-1,-1,-1,1,0,1,0",5
z12pf3tjfnmkhfcca223xlp5ayb3yfosc,Miss.Farrell Wall,2014-10-09T13:28:49,i was playing this song and the baby in my belly started to dance to  it     sooooo cute  but had to take the song out cause of copy right and  add in a youtube made song    still sooo cute the baby danced to this song  lmfao    https   plus google com                       posts g jvinpuemo,1,0,"0,-1,-1,-1,-1,1,0,1,0",5
z121st5w5k3ui1veg22zirn4gkr5tby2v,Jdidk Loma,2014-01-20T20:35:56,http   tankionline com friend cd  db f  great game check it out ,1,0,"-1,1,-1,-1,-1,1,0,0,0",5
_2viQ_Qnc6-r7fiKCYAGotgCULCIx695QCHaAZDKHBM,Tiffanythebest,2013-09-02T19:42:46.640000,please check out this video called  quot we love mind master it quot   thank u   ,1,0,"-1,1,0,-1,-1,-1,0,0,0",5
z12wujphdvrxcbksz23lc3j5xsqadn0cz,Made2Falter,2014-09-09T23:55:30,check out our vids  our songs are awesome  and that i guarantee   ,1,0,"0,1,-1,-1,-1,-1,0,0,0",5
z12hif0a3nj0vlkxj04cif1wcpuxvf0gpno0k,Hazetrix (EHazardStudio),2015-04-08T00:09:33.033000,hey guys im    years old remixer and producer and i want you guys to help me checking my videos i am sure you will love those music if you love them then subscribe so you will know more about me  ,1,0,"-1,-1,0,-1,1,-1,0,1,0",5
z131ynbp4yepzvz4304cj5ly3oyietfpbj0,Soundhase,2014-08-19T18:59:38,hi guys  check this awesome edm  amp  house mix    thanks a lot    https   soundcloud com soundhase edm house mix  ,1,0,"-1,1,-1,-1,-1,1,0,0,0",5
z120s1agtmmetler404cifqbxzvdx15idtw0k,Sheila Cenabre,2014-08-19T12:33:11,i really love this video   http   www bubblews com account        sheilcen,1,0,"-1,-1,0,-1,-1,1,0,0,0",5
z13wt1vrismyzpiij04cj5vz4nzlyj4yfzo0k,Alexander Mcdonald,2014-10-13T09:19:13,anyone who loves music   please go check out my youtube page and tell me  what you think   i just put a video up and will be doing more song  i m  just trying to get myself started  any love is much appreciated ,1,0,"0,1,0,-1,-1,-1,-1,1,0",5
LneaDw26bFs9Rg2Ij9HjO7kLn-wwxZttoa9Dx9BEGzQ,armontre,,ayyy can u guys please check out my rap video im    n im juss tryna get some love please chrck it out an thank u,1,0,"-1,1,0,-1,-1,-1,0,1,0",5
LneaDw26bFvEGhYWZTzIRiff9BXME_JsdLXh4hiJEqo,Daniel Ebrey,,sorry for the spam yall i know its annoying  but if you can spare a min please check out the new track on my channel i     m a upcoming uk rapper please come check out my songs u might like em  if not no worries im sorry for wastin your time  even thumbs up to get more noticed will really help  peace yall,1,0,"0,1,-1,-1,-1,-1,0,1,0",5
LneaDw26bFtNnEGpg7pf921bsfI1m57qBsEWQKlItrk,KC Cassette,,check out my remix to tyga     s   molly ft  whiz khalifa peace and love,1,0,"-1,1,0,-1,-1,-1,0,1,0",5
z13ufbpg5smtedf4v04ci5gqvqemyb2jsp00k,OFFICIAL LEXIS,2014-11-04T20:24:58,hi everyone  do you like music  then why not check out my music channel   the lexis band will be uploading their own songs and covers soon so don t  miss out  please subscribe too as it does help us out a lot  just takes one  click    gt ,1,0,"0,1,-1,-1,-1,-1,0,1,0",5
_2viQ_Qnc6_fyjM2m-ismUToowpNFauwtldKlfjbtIk,Joshua Kasey,2013-07-21T08:26:18.155000,hello everyone  it is not my intention to spam and am truly sorry if anyone is annoyed by this but just please hear me out   i am a rapper  singer  music producer and a song writer and have been making music for a while now  eight years to be exact   i enjoy making all types of music that anyone can listen to  doesn     t have me talking about killing anyone and most importantly  focuses on the quality of the music   please check out my page  it     s only a click away   thank you and have a nice day   ,1,0,"0,1,-1,-1,-1,-1,0,1,0",5
z13oxrgicuueitsig04cijfwpunexhgyd3k,FreddyLegends Songs,2015-05-11T20:43:01.326000,iiiiiiiiiii love this shake it song oh sorry every shake it song i like watch subscribe and never unlike brooooo            shake it up,1,0,"0,-1,0,-1,-1,-1,0,0,0",5
LneaDw26bFu8afPj-GzbZYFHKXzdkhupARKxWs82nbQ,Dominic Randall,,hi everyone  we are a duo and we are starting to record freestyles and put them on youtube  if any of you could check it out and like comment it would mean so much to us because we love doing this  we may not have the best recording equipment but if you listen to our lyrics and rhymes i think you     ll like it  if you do then please subscribe and share because we love making these videos and we want you to like them as much as possible so feel free to comment and give us pointers  thank you ,1,0,"-1,1,0,-1,-1,-1,0,0,0",5
z12xhdjrsxm3v550w22oynsjrnmvjhkvj,LuckyMusiqLive,2014-07-21T22:25:54.048000,this song is awesome  these guys are the best  love this video too its hilarious lol  im getting popular fast because i rap with meaning  thumbs up if you piss next to the water in the toilet so it doesnt make noise,1,0,"0,-1,0,-1,-1,-1,0,0,0",5
z12pgdhovmrktzm3i23es5d5junftft3f,lekanaVEVO1,2014-07-22T15:27:50,i love this so much  and also i generate free leads on auto pilot  amp  you can  too  http   www myleadergate com moretraffic,1,0,"-1,-1,0,-1,-1,1,0,0,0",5
z13isvpjcwadtnxfa23sdd0ipp20wzxdd,rtfamily,2015-05-23T16:45:03.492000,definitley the song for      when im not listening to gypsy shakira rocks br    span class  proflinkwrapper   span class  proflinkprefix     span  a class  proflink  href  https   plus google com                        oid                         shakiravevo  a   span ,1,0,"0,-1,-1,1,-1,1,-1,0,0",5
z131uprw3qv4w5iou04cjbbgtvjedpoonvs0k,Ruchira Naidu,2015-05-20T14:34:27.224000,help shakira     s waka waka be the first song by a female artist to reach   billion views  br    dark horse is ahead by roughly     million more views  and roar has only    million more views  br    a href  https   www youtube com watch v prpeedmmmq   https   www youtube com watch v prpeedmmmq   a ,1,0,"0,-1,-1,1,-1,1,-1,0,0",5
z13ahnbavmbgi50bv04cenuj1yyifhxq3hw,LuckyMusiqLive,2014-10-09T23:22:50,this song is so addicting  the hook is dope and catchy  love the video too   i m getting popular fast because i rap real   thumbs up if you piss next to  the water in the toilet so its quiet                                ,1,0,"0,-1,0,-1,-1,-1,-1,0,0",4
z12ohzkgtoreyzoqw04ccxgzxmnag3nhq5s,Danny Ly,2014-10-09T00:37:48,free itunes gift card http   shhort com a r x j gbrne,1,0,"-1,-1,-1,-1,-1,1,0,0,0",4
LneaDw26bFvaBIGMY4DfxNzifyIUm7GOWp8Br9oySEk,DanteBTV,,check out the new hot video by dante b called riled up,1,0,"-1,1,-1,-1,-1,-1,0,0,0",4
z13yele45yacxp1ux22muvvg2virwhwxh04,Magic Man,2014-10-06T19:57:32,download rapid facebook for free now https   play google com store apps details id com rapid facebook magicdroid,1,0,"-1,-1,-1,-1,-1,1,0,0,0",4
z13vdlhzymiuvvd2h224yxwomxrhczqdw,Beryllium,2014-09-27T21:21:50,hi everyone  my dream is to have passionate sex with katy perry  some people do not believe in mebut maybe you will  sex is a giant part of my life and it pushes me to be a better person  please give me a chance by giving me a thumbs up  if you love my ambition please subscribe ,1,0,"-1,-1,0,-1,-1,-1,0,1,0",4
LneaDw26bFtQ_DKei9k8hUUWHEzYNvZwn-q5QT2FCVU,Derek Moya,,you guys should check out this extraordinary website called moneygq com     you can make money online and start working from home today as i am    i am making over         per month at moneygq com     visit moneygq com and check it out   the metal drews the reflective effect  why does the expansion intervene the hilarious bit  the sneeze witnesss the smoke ,1,0,"-1,1,-1,-1,-1,-1,0,0,0",4
z12jj5kyfrjjhbq4e04cenuj1yyifhxq3hw,LuckyMusiqLive,2014-09-25T22:54:00,katy is beautiful  and this song is catchy  i m a rapper with        subscribers   thumbs up if you hate when you take a shit and the water  splashes your balls,1,0,"0,-1,-1,-1,-1,-1,0,0,0",4
_2viQ_Qnc6_kxEjV8Ut57SeEGdqSKmC8VGP1K38Q2qY,Scott Johnson,2013-10-18T19:45:43,you guys should check out this extraordinary website called zonepa com     you can make money online and start working from home today as i am    i am making over         per month at zonepa com     visit zonepa com and check it out   why does the statement conciliate the acidic stretch  the earth recognizes the money  when does the numberless number transport the trade ,1,0,"-1,1,-1,-1,-1,-1,0,0,0",4
z12sfnzallq5t5iki23gfbjb0ynxgxjyc04,Vincent Lenzi,2014-09-22T23:23:33,free itunes     giftcard codes  http   shhort com a r oocnjqu b,1,0,"-1,-1,-1,-1,-1,1,0,0,0",4
z13htjnpxw3sgfsdq22sdnc4vnyrfpiue,budhanmike,2014-09-01T03:32:14.127000,check out this funny video  quot cereal box knocks out baby quot  on my channel ,1,0,"-1,1,-1,-1,-1,-1,0,1,0",4
z12vzxcymvqtyrx3s22hi5ep1yq5cvmld,roflcopter2110,2014-09-19T23:18:41,http   thepiratebay se torrent          the expendables        dvdscr leaked clean xvid mp  rarbg ,1,0,"-1,-1,-1,-1,-1,1,0,0,0",4
LneaDw26bFuFItWTKmffBRPA4v3HwunSq-ceF3kwQZ4,Juarez Ounfee,, i can     t believe this i just now watched a brand new adult video clip with rihanna she has been screwing a black basketball player  check out her video right here if you wish    crazy celeb news eu pn,1,0,"-1,1,-1,-1,-1,-1,0,0,0",4
z12btr5hfnjydpwm023xtt0q4urzs1ju4,Mah Productions,2014-07-26T17:07:51.274000,check the shit out on my channel br    br    br   subscribe you will like it,1,0,"-1,1,-1,-1,-1,-1,0,1,0",4
_2viQ_Qnc6-q29okw74KTmVXCvhacMZ5NjAiYdAwHww,Louis Bryant,2013-10-12T15:55:05.693000,you guys should check out this extraordinary website called zonepa com   you can make money online and start working from home today as i am  i am making over         per month at zonepa com   visit zonepa com and check it out  the meat discusss the successful memory  how does the peaceful unit arbitrate the guide  the addition designs the worried loss ,1,0,"-1,1,-1,-1,-1,-1,0,0,0",4
z12tclby1nuyflgbw04cdnyg3zfvefn5lrg0k,Technibility,2014-09-12T21:08:47,great video by a great artist in katy perry  admire her creativity  check  out our channel for no nonsense mobile tech reviews and comparisons as well  as an iphone   and   plus review and comparison ,1,0,"-1,1,-1,-1,-1,-1,0,0,0",4
z13xwb3adyricdunf223txebnov1f1aiz04,Gram Bangla,2014-09-12T09:03:16,wow very nice congrasulation i live so much http   en prothom alo com sport news       zimbabwe a team due in dhaka wednesday ,1,0,"-1,-1,-1,-1,-1,1,0,0,0",4
_2viQ_Qnc69mufWqn8FcFN6u6tahNMkNWgB4-jKb2hs,Louis Bryant,2013-10-12T15:19:50.282000,you guys should check out this extraordinary website called zonepa com   you can make money online and start working from home today as i am  i am making over         per month at zonepa com   visit zonepa com and check it out  the plausible summer submits the behavior  when does the grass check the peaceful seat  the country strategizes the edge ,1,0,"-1,1,-1,-1,-1,-1,0,0,0",4
_2viQ_Qnc6-k1VSPmCd2mrSAAQXChBMxF7oeJGCepUU,Anderson St. Martin,2013-10-09T03:22:24.252000,hello everyone my name     s anderson and i     m a singer  not expecting to buy subscribers with words but to gain them with my voice  i might not be the best but my voice is different  in a good way  and i     ll work harder than anyone out there to get better       cuz  quot yeah quot  i have a dream  a huge one   who doesn     t   so please take   minutes of your time to check out my covers  give me a chance you won     t regret it if you feel like subscribing that     d be awesome and it     d mean the world to me thank you so much,1,0,"-1,1,-1,-1,-1,-1,0,1,0",4
z12hzb1hzxbjh310c234ddqgoluidjufb,Aemon Sevker,2014-09-07T19:34:29, go to my channel and check out my written songs,1,0,"0,1,-1,-1,-1,-1,-1,1,0",4
z13vsfqirtavjvu0t22ezrgzyorwxhpf3,Ajkal Khan,,my sister just received over       new  a rel  nofollow  class  ot hashtag  href  https   plus google com s    active   active  a  youtube views right now  the only thing she used was pimpmyviews  com,1,0,"-1,-1,-1,-1,-1,1,0,1,0",4
_2viQ_Qnc68DyUSaxqDmv-6yHPVUpKeYAZhrh2PUMZg,jameskileymusic,2013-10-06T05:38:47.524000,check out my bass cover of hips don     t lie by shakira ,1,0,"-1,1,-1,1,-1,-1,-1,1,0",4
_2viQ_Qnc68YhzlKOdq3h2y3v8TCi0RQSIFzQP8hltY,Derek Moya,2013-10-21T05:47:26.457000,you guys should check out this extraordinary website called moneygq com     you can make money online and start working from home today as i am    i am making over         per month at moneygq com     visit moneygq com and check it out   why does the fragile swim enlist the person  how does the ice audit the frequent son  the fantastic chance describes the rate ,1,0,"-1,1,-1,-1,-1,-1,0,0,0",4
z12jzdjxvvmxz3ymb23fwhyg4ub0xdju2,craftygirl20141,2014-11-10T19:46:03.336000,hi everyone this is cool check out sexy and i know it,1,0,"-1,1,-1,-1,-1,-1,0,0,0",4
z12kzxgg4w2ptbq2j23nv3sxorekzri1j,Salena Oneal,2014-10-16T12:24:32,if you looking for new music to listen to check out cece song called  dead me on itunes music video out now right here on youtube ,1,0,"0,1,-1,-1,-1,-1,-1,0,0",4
z12fxf2xaofxhvj1b220dn1qhnyotpybx04,Bob McBobbers,2014-10-17T03:05:04,hey guys  i was working last night on this project  it s a music streamer  like spotify  but it allows you to download the files to listen to when  you re offline  opening it as a free beta  feel free to try it out    download  https   mega co nz   ehvjzkya  bgkg iwphzohwaeuesrwnegqg labco rw wfx hao,1,0,"-1,-1,-1,-1,-1,1,0,0,0",4
LneaDw26bFuhuiZ8uX6C-qYLIsOFj9BIWtKWtCz870c,Lizzy Molly,,please check out my video called  quot we love mind master it quot  thanks,1,0,"-1,1,0,-1,-1,-1,-1,1,0",4
LneaDw26bFsPpgYyHcGAJk2dyALknpZ1ITQKBmY32HI,Chelsea Cameron,,     please read       hey everyone  i     m a    year old student  who loves to sing   i record and upload covers on my channel  i would love if you could check them out   just give me a chance  you don     t have to thumbs up or subscribe  but you can if you like what your hear   just listen  i     d really appreciate    thank you for your time   ,1,0,"-1,1,0,-1,-1,-1,-1,1,0",4
_2viQ_Qnc69LaqGJOI7p8VvK_26tIy8R0g_z-_ye79c,Laura Brown,2013-10-27T02:55:06.764000,you guys should check out this extraordinary website called firepa com     you can make money online and start working from home today as i am    i am making over         per month at firepa com     visit firepa com and check it out    lake     duzafizz   singlewave   spourmo   burder   colorful   claster   incandescent   ambitious   winooze   absorbing   macabre   crestboot   boxium   womanly   tan   ybuwyn   forgetful   pepelexa   zealous,1,0,"-1,1,-1,-1,-1,-1,0,0,0",4
z12yhleh5k2lcxtr304chn2gatiwur3xhz40k,Lizle Productions,2015-05-16T11:33:22.322000,top three shakira songs  my choice   br    br      waka waka  it     s time for africa  br    br      can     t remember to forget you  br    br      empire br    br   like this comment if u like shakira ,1,0,"0,-1,-1,1,-1,-1,-1,1,0",4
LneaDw26bFvuJSk9kaYj6_W0OBzf4mgoIFuYUzJMheY,Brandon Thaler,,hey everyone check out my channel leave a like and subscribe please and if there is a song you want me to do post the name in the comments and i will get on to it   thanks,1,0,"0,1,-1,-1,-1,-1,-1,1,0",4
z12uujnj2sifvzvav04chpypvofvexpoggg,Sudheer Yadav,2015-05-28T10:28:25.133000,see some more song open google and type shakira guruofmovie,1,0,"0,-1,-1,1,-1,-1,-1,0,0",4
LneaDw26bFtRu4tHavOZ4hr-PDVn2oz-9B1QtAfp6pc,david rodriguez,,do you want to make some easy money  check out my page tvcmcadavid weebly   com dont miss out on this opportunity,1,0,"-1,1,-1,-1,-1,-1,0,1,0",4
LneaDw26bFv4NFg1m91sL1Aq1p-2N06VweQT4vOwTqc,Ando Nesia - | MC | Music Producer,,do you know how sean kingston got famous why don     t you look it up kid before your so hard on yourself    if you hit me up with a message in my inbox and subscribe i will check out your channel    sounds fair to me ,1,0,"-1,1,-1,-1,-1,-1,0,1,0",4
LneaDw26bFtpMGuaegzvwo3PCtnpRUXnTXAHz_DzpKA,GhostPoet100,,eminem fans       check out the new song  quot feelin      good quot  by j d p  just click the  quot ghostpoet    quot  link above this post  thank you all   ,1,0,"0,1,-1,-1,-1,-1,-1,0,1",4
LneaDw26bFsFwQBcbaeKWWcSsBB7EA1zRf2nBgT9NyY,Ashim Limbu,, hi im    year rapper support me guy and check out my channel and check out my song you might like it also follow me in twitter  mcashim for follow back ,1,0,"0,1,-1,-1,-1,-1,-1,1,0",4
LneaDw26bFvq7Rq_343ImPD-uDHf2clFCLMRkYqXPX4,Tiffanythebest,,check out this new video i made called  quot we love mind master it quot   thank u so much ,1,0,"-1,1,0,-1,-1,-1,-1,0,0",4
LneaDw26bFtl5IRz0aJhyk-Id8DQ1p28SKectuNzbmE,Davide Puzzanghera,,hi guys      check out my remixes      thanx you     re great     swag    ,1,0,"-1,1,-1,-1,-1,-1,0,1,0",4
LneaDw26bFtlox7jDN60_ys-XolAIlgwwc5y6aEKR68,M.E.S,,hey guys i know its annoying getting spammed sorry bout that but please take a moment to check out my channel  im a rapper with decent skills  i want to share my music with more people so take a listen   thumbs up so more can see this,1,0,"-1,1,-1,-1,-1,-1,0,1,0",4
z12idnt4plzphv3jx04cd5jxoqjkzfxxsf0,THE AMAZING MOVIE MAKING NAD GAMING TOM BURKE,2015-04-11T20:32:48.515000,lol check out my chanell and subscribe please i want      subs thats it im nearly their now,1,0,"-1,1,-1,-1,-1,-1,0,1,0",4
LneaDw26bFvwhMGEs3mKR9qcJjIwC7L04F9DEGkLQfY,Drake Gagne,,i know you may not want to read this but please do  i     m    cypher an    year old rapper i have skill people said  my stuff isn     t as good as my new stuff but its good please check out my current songs comment and like thank you for reading rap is my life,1,0,"0,1,-1,-1,-1,-1,-1,1,0",4
_2viQ_Qnc6_pJLNSe-ysm1Q4pDNKWrl6EWw0cSIBV14,Ali Reza Nipu,2013-11-05T06:23:41.092000,i really love watching football and also ive started off making income with out financial risk from acquiring bonus deals  its this weird technique where you wager on something with one bookmakers and bet against it on betfair  you secure the bonus as income   a chap named jim vanstone is finding the wagers free on his own website vanstone secrets  google it    ive made about     quid thus far  and it is cost free  i guess the bookies pay him to obtain new consumers  yet this actually works ,1,0,"-1,-1,0,-1,-1,-1,0,0,0",4
LneaDw26bFuR9smjLJUhkDMS-5WcFp80WGZVHVi9Tsw,Butter Forbes,,hello  i only made one eminem song on my channel  could you guys just put a like on it please  don     t need to subscribe  thanks ,1,0,"0,-1,-1,-1,-1,-1,0,1,1",4
LneaDw26bFtI-0_UfYJ5VmhFKI63wbPsqzmdZkuvXd4,Andrew Guasch,,hey if you guys wouldnt mind   could you check out my boys and my music   we just made a real lyrical song   search dna andrew guasch   i appreciate it  leave some real feedback and keep hip hop alive,1,0,"0,1,-1,-1,-1,-1,-1,1,0",4
