comment_id,author,date,text,expected_label,model_pred,vectors
z12zer0p2uaowfzqu04ccnczoyyryjj5u1s,Annie Trace,2014-10-06T16:13:36,if only i had the body like katy perry      she looks so hot  i love her     ,0,0,"-1,-1,0,-1,-1,-1,0,0,0"
z13yele45yacxp1ux22muvvg2virwhwxh04,Magic Man,2014-10-06T19:57:32,download rapid facebook for free now https   play google com store apps details id com rapid facebook magicdroid,1,1,"-1,-1,-1,-1,-1,1,1,1,1"
z12ih1iyqojdhlxgu04cdhsb1ofdtll5a3g,Deepty Awasthy,2014-10-07T03:41:31,the song is very good    but the video makes no sense   just a nonsense  video   i mean she is telling her story of being stuck on an island  but  the song doesn t fit in the situation   but nvm   the song is good,0,0,"0,-1,-1,-1,-1,-1,0,0,0"
z121gzyrrsm4jlvid04cjj0zzpyxwv3qocc,desing,2014-10-08T07:19:15,who else would give katy perry a good old mighty roar    ,0,0,"-1,-1,-1,-1,-1,-1,0,0,1"
z12pdlwxuwmktfmoq04civd5ypmzv5np0os0k,Maryam Yassine,2014-10-08T12:39:49,omg i love you katy parry your songs rock                  thats a total  subscribe,0,1,"0,-1,0,-1,-1,-1,1,-1,1"
z13iyvl5vzqledtym04cirookpa1edwpvuw0k,Tomas Adomaitis,2014-10-08T18:24:05,https   www paidverts com ref tomuciux   esyest money ever  join to our  team    ,1,1,"-1,-1,-1,-1,-1,1,-1,1,1"
z130tpc5mwbqtxkox04cipervsaysn0w22o,William Fernandez,2014-10-08T18:47:52,katy perry   roar  official   http   youtu be cevxzvsjlk ,0,0,"-1,-1,-1,-1,-1,1,-1,0,-1"
z12ohzkgtoreyzoqw04ccxgzxmnag3nhq5s,Danny Ly,2014-10-09T00:37:48,free itunes gift card http   shhort com a r x j gbrne,1,1,"-1,-1,-1,-1,-1,1,1,1,1"
z12pf3tjfnmkhfcca223xlp5ayb3yfosc,Miss.Farrell Wall,2014-10-09T13:28:49,i was playing this song and the baby in my belly started to dance to  it     sooooo cute  but had to take the song out cause of copy right and  add in a youtube made song    still sooo cute the baby danced to this song  lmfao    https   plus google com                       posts g jvinpuemo,1,0,"0,-1,-1,-1,-1,1,0,0,0"
z13osblxvrj0ibtcn22cjjzguw31d5534,Dana Nipper,2014-10-09T23:17:15,katy perry is awesome,0,0,"-1,-1,-1,-1,-1,-1,0,0,-1"
z13ahnbavmbgi50bv04cenuj1yyifhxq3hw,LuckyMusiqLive,2014-10-09T23:22:50,this song is so addicting  the hook is dope and catchy  love the video too   i m getting popular fast because i rap real   thumbs up if you piss next to  the water in the toilet so its quiet                                ,1,1,"0,-1,0,-1,-1,-1,-1,1,1"
z134htdz0kjvgbd5w04cebardrm5zp15mw40k,Matt Twine,2014-10-10T16:24:57,nice song  see my new track ,1,0,"0,-1,-1,-1,-1,-1,0,-1,-1"
z12lhtpotlygylwcj23idphbpsjih0e0,Kane Bradford,2014-10-10T18:09:13,i love this sooooooooooooong i love katy perry,0,0,"-1,-1,0,-1,-1,-1,0,0,-1"
z13utrmbosiawt10p22kextrikr0fprhh04,Tiny Tim,2014-10-11T02:28:19,what does that tattoo on her right tricep say ,0,0,"-1,-1,-1,-1,-1,-1,0,0,-1"
z12auh0b1vajetih404cfbl5uyfehpi4kb4,fortune kitty52,2014-10-11T11:26:00,since when has katy perry had her own youtube channel ,0,1,"-1,-1,-1,-1,-1,-1,0,1,1"
z13myxsrskidhjt5u04cfb3hpqn4vb1q5ts0k,imscarlet,2014-10-11T17:16:36,every time i watch this mv i just so so so glad that i live in a world that  don t have to worry about running from a real  human eating tiger ,0,0,"-1,-1,-1,-1,-1,-1,0,0,0"
z13vz1qqzlq5flz2k223znxpkmvgutlei,b0b1t.48058475,2014-10-12T03:45:07,i rekt ur mum last nite  cuz da haterz were   much   meh lik dis if u cri evertim and sponswer mi robox vidz https   www indiegogo com projects gimme dem moneyz   roblox x         home,1,0,"-1,-1,-1,-1,-1,1,-1,0,0"
z13gw3uz2kfkcf3np22nsvz4zkr0u5xzl04,ambareesh nimkar,2014-10-12T05:09:56, eye of the tiger   i am the champion  seems like katy perry is using  titles of old rock songs for lyrics  ,0,0,"0,-1,-1,-1,-1,-1,-1,0,0"
z12ocr0rypvrdbq4004chheqepesuxkicyw0k,Orfeu LUZ DO SOL,2014-10-12T07:23:27,she is a perfect wonder     ,0,0,"-1,-1,-1,-1,-1,-1,0,0,-1"
z12suvdjtluxipdj004cdh5ymvukufbrl4w,Fred Smith,2014-10-12T21:53:00,https   www indiegogo com projects help stop my poverty cyber pan handleing x         home ,1,1,"-1,-1,-1,-1,-1,1,-1,-1,1"
z121gdxzazm3cplce234g5uheyn4c5e4104,WWWWWWWWWWWWWWWVWW,2014-10-13T06:57:57,she is horrible at acting  cringe worhty ,0,0,"-1,-1,-1,-1,-1,-1,-1,0,-1"
z12auv0iwzukvnvf322vsd2y0pnpw5ure04,Feredea SJ,2014-10-13T09:03:58,i love katy fashions tiger  care to visit my blog sinar jahitan  i also have the tiger collections tqvm,1,0,"-1,-1,0,-1,-1,-1,0,-1,0"
z13wt1vrismyzpiij04cj5vz4nzlyj4yfzo0k,Alexander Mcdonald,2014-10-13T09:19:13,anyone who loves music   please go check out my youtube page and tell me  what you think   i just put a video up and will be doing more song  i m  just trying to get myself started  any love is much appreciated ,1,1,"0,1,0,-1,-1,-1,-1,1,1"
z13idnfjpl3njhnyv04ccfuzwsryhpcbkjg,Ella-Grace Aldred,2014-10-13T10:58:22,is that tiger called  katty purry  ,0,0,"-1,-1,-1,-1,-1,-1,-1,0,-1"
z13bhfphlnbjsb4n123huzyy1urufxjp004,uranium 239,2014-10-13T16:22:59,blue eyes  can t be trusted   uranus bless america ,0,0,"-1,-1,-1,-1,-1,-1,-1,0,-1"
z12ojhxjqrnqj5rlc22bivs5jnmkhrylt,by.Ovskiy,2014-10-13T17:09:46,rap from belarus  check my channel  ,1,1,"-1,1,-1,-1,-1,-1,-1,1,-1"
z13pupugayfozd3zn04cc3kaim3qttfoh2s,Morgensen Freya,2014-10-13T21:50:51,follow me on twitter  freyacumqueen,1,1,"-1,-1,-1,-1,-1,-1,-1,1,-1"
z12yfvzzpt2tizxvb22yj334vzmrh13gc04,Natalya Korshunova,2014-10-14T03:29:19,katy perry   roar  official   http   youtu be cevxzvsjlk ,0,0,"-1,-1,-1,-1,-1,1,-1,0,-1"
z12odl0g1lv2sny2a23mxtijuvftznai404,Alex Lynch,2014-10-14T17:27:28,c mon katy you are so close to            subscribers   come up with  another hit like this and it will happen,0,0,"-1,-1,-1,-1,-1,-1,-1,0,0"
z12kulnquwqogxxj104chtgr4vbxvt4zg5k,Rick Casse,2014-10-15T05:00:50,vote for katy for the emas   katycats  http   tv mtvema com artists katy perry i  xh ,1,0,"-1,-1,-1,-1,-1,1,-1,0,0"
z13lwnfyppu2ujssg23eezvyfnu3h3t4t04,Rajesh Bhat,2014-10-15T05:15:27,my honest opinion  it s a very mediocre song  nothing unique or special  about her music  lyrics or voice  nothing memorable like billie jean or  beat it  before her millions of fans reply with hate comments  i know this  is a democracy and people are free to see what they want  but then don t i  have the right to express my opinion  please don t reply with dumb comments  lie  if you don t like it don t watch it   i just came here to see what s  the buzz about     million views    and didn t like what i saw  ok ,0,0,"0,-1,-1,-1,-1,-1,0,-1,0"
z124whipbluof3y2t23gvfmb1la2w5aw204,Bi - Bases of Image [Musical videos],2014-10-15T11:02:31,visit my channel,1,1,"-1,-1,-1,-1,-1,-1,-1,1,-1"
z13bevebfqauylm4h04cidqh4xuoy5ayrlo0k,big macintosh,2014-10-16T12:21:58,wow she is sexy xd,0,0,"-1,-1,-1,-1,-1,-1,0,0,-1"
z12kzxgg4w2ptbq2j23nv3sxorekzri1j,Salena Oneal,2014-10-16T12:24:32,if you looking for new music to listen to check out cece song called  dead me on itunes music video out now right here on youtube ,1,1,"0,1,-1,-1,-1,-1,-1,1,1"
z13vvheilmf1cbqfr22ge1rwqszpcvbgc04,ColoursBruh,2014-10-17T00:54:50,katy has a voice of an angel,0,0,"-1,-1,-1,-1,-1,-1,-1,0,-1"
z12fxf2xaofxhvj1b220dn1qhnyotpybx04,Bob McBobbers,2014-10-17T03:05:04,hey guys  i was working last night on this project  it s a music streamer  like spotify  but it allows you to download the files to listen to when  you re offline  opening it as a free beta  feel free to try it out    download  https   mega co nz   ehvjzkya  bgkg iwphzohwaeuesrwnegqg labco rw wfx hao,1,0,"-1,-1,-1,-1,-1,1,1,0,0"
z13lzjnbmpmlc5p1o23ahn1wvkuvzzzvl,Ed Diamond,2014-10-17T16:41:35,man she is hot in this one  male companions visit my profile to check out  the coolest sextoy ever made ,1,1,"-1,1,-1,-1,-1,-1,-1,1,1"
z123ynxxyou1wrzri04cjh2buyfez5jjxcw,Brandon Tomlin,2014-10-17T18:34:08,like my page please     https   m facebook com dreaddis ref m notifif t fbpage fan invite amp actorid             ,1,1,"-1,-1,-1,-1,-1,1,-1,1,1"
z13nujhysyf3ftvgt04ccrd4szrxcvzbvt00k,MeSoHornyMeLuvULongTime,2014-10-18T04:58:21,this video is so racist    there are only animals ,0,0,"-1,-1,-1,-1,-1,-1,0,0,-1"
z131zt3poqazypy0a23ghxojfme5ydmmp,Aarjav Parmar,2014-10-18T06:15:45,man she is beautiful ,0,0,"-1,-1,-1,-1,-1,-1,0,0,-1"
z12fzrxbvl3xjlmyi04chleb0uexczkjquk0k,FreexGaming,2014-10-18T08:12:26,want to win borderlands the pre sequel  check my channel   ,1,1,"-1,1,-1,-1,-1,-1,-1,-1,1"
z13nev2azv3mftkx404cf1gilnvsi15hfjg,nanaIAMNANA,2014-10-18T12:41:41,hi  i would appreciate it if you all could help to like this poster on  facebook   https   www facebook com nyghdramafest     photos a                                                             type   amp theater ,1,1,"-1,-1,-1,-1,-1,1,-1,1,1"
z13hst3ihoetvtdls221z1khwtfmutjdd,abdilefe,2014-10-18T19:09:29,plz help me getting       subscribers tonight today   thanks to all who sub me   ,1,1,"-1,-1,-1,-1,-1,-1,-1,1,1"
z12etvywgsjpthpvz22gwfm4vnqyydj3l,Rebecca Shields,2014-10-19T13:59:50,yesterday this video have   million likes and now it has   million,0,0,"-1,-1,-1,-1,-1,-1,-1,0,0"
z13oxduriwbjvd41y235g1k4porjcr2xu04,Mardhy Hassan,2014-10-19T14:59:26,why tiger succumbs to a beautiful girl   probably male tiger            ha ha ha  ,0,0,"-1,-1,-1,-1,-1,-1,0,0,1"
z13nv5tycmikx3syi04cdv5bmruufbrqjyk0k,Abigail Gustav,2014-10-19T15:28:10,best song ever ,0,0,"0,-1,-1,-1,-1,-1,-1,0,-1"
z12jxb3rkze0jljrq04cib0xbxbrt3mae1k,Fredrik Jonsson,2014-10-19T16:07:16,thank you katyperryvevo for your instagram likes  axeljonssons,1,1,"-1,-1,-1,-1,-1,-1,-1,1,-1"
z13qw3ahhwftv3tnd23tihhxvlr0erteu,TopMusicWorld HD,2014-10-19T23:27:50,please subscribe in my channel ,1,1,"-1,-1,-1,-1,-1,-1,-1,1,-1"
z12fzn5rgqi4sdwwe04cj33qdvbbipgjylc0k,Mary-Jane Watson,2014-10-20T02:25:02,she is good  does she make any more music  if she doesn t  she should ,0,0,"-1,-1,-1,-1,-1,-1,0,1,0"
z12wzpww1rnqwjq0223dd5gofvzbwjqth,ikbal kemerkaya,2014-10-20T17:56:04,i love you katty perry  lt   ,0,0,"-1,-1,0,-1,-1,-1,0,0,-1"
z13pch5b4xn1z1mju04cjdtaymyust4hvqs0k,Flip Tee,2014-10-20T18:33:44,honestly  i wanna see you be brave  oh wait   ,0,0,"-1,-1,-1,-1,-1,-1,1,0,-1"
z13yvbabmkemtbqk122repparnvhudrgr04,hernan perez ovando,2014-10-20T20:35:13,   ,0,0,"-1,-1,-1,-1,-1,-1,-1,0,-1"
z13qdpxqiziasxzsv234hhqoeretuhabc04,Merenguette,2014-10-21T04:52:03,this video is great          i love this        and like much katy perry,0,0,"-1,-1,0,-1,-1,-1,0,0,0"
z12axxpa2p2cdxu1p22vwfya1kz1gps4o04,Freya Questionmark,2014-10-21T13:50:47,good thing she brought her spray on tan  hairstylist  makeup artist  and  cameraman ,0,0,"-1,-1,-1,-1,-1,-1,0,1,0"
z130fjzbglzugzfdx23cipvotlrkdpepo04,subscrool,2014-10-21T15:07:11,            views      million       katy perry illuminati confirmed   ,0,0,"-1,-1,-1,-1,-1,-1,0,0,-1"
z13qehwbnsfyvpaa004cdt0yqzqiy5mo2bk,Youyou A.,2014-10-21T15:20:49,i make guitar covers  please have a look at my channel,1,1,"-1,-1,-1,-1,-1,-1,-1,1,0"
z12mhbmbhlv5jbi1n231chnqtrmkjrenc,MrSlowGhost,2014-10-21T15:30:56,it should be illegal to be this goodlooking as this babe is   ,0,0,"-1,-1,-1,-1,-1,-1,-1,0,0"
z13odfj4atu3vdw0k22xwbtrftfoubzwf04,sebastian hudson,2014-10-21T18:16:46,katy is mine the girl of my dreams ,0,0,"-1,-1,-1,-1,-1,-1,-1,0,-1"
z13uhfazpsvxed2x004chpwjayudxpvhv3o,Chewwy Moriarty,2014-10-21T20:53:49,i love this song,0,0,"0,-1,0,-1,-1,-1,0,0,-1"
z12kstz4owbggv12p230vpcwntjbyrqim04,haribo elf,2014-10-21T21:09:29,she is fit,0,0,"-1,-1,-1,-1,-1,-1,-1,0,-1"
z13jddxactekydkim04cfvzijxiygbvgkh4,Patricia  Reyes,2014-10-23T05:24:14,i love the song roar it make me think am fill the way,0,0,"0,-1,0,-1,-1,-1,0,0,0"
z12ndfzrsunjyji1522exnrwcl3rt11eh,AliBerk Özer,2015-05-27T15:16:59.137000,love,0,0,"-1,-1,0,-1,-1,-1,0,0,-1"
z13oghdjnqzcftxwp04cdv0acx3msl5zbkc0k,ollie123216,2014-10-23T22:20:43,how do you forget you have a choice  and what the fuck  surviving a plane  crash has a        chance of happening ,0,0,"-1,-1,-1,-1,-1,-1,0,0,0"
z12gsvozdnffulgly23tdzyholacht41h,nleeklee polowtehow,2014-10-24T01:21:49,she is a fool  this is a foolish video  the lyrics are all about her and  how great she is  she is arrogant  obviously  but the thing is that there  are a lot of idiots   look how many hits this garnered  the young stupid  girls who listen to her are numbering in the millions i guess  this video  is a piece of trash  why would anyone ever like it or listen to it  because  these stupid little girls have idiots for fathers and mothers   and so they  are going to turn into idiots also   just like this stupid singer  ,0,0,"-1,-1,-1,-1,-1,-1,0,0,0"
z13xuxwywsewv3dvu23jgfig3um3ct5vv,KatyPerry TheQueenOfPop,2014-10-24T06:05:07,   attention   we need    million views more for firework to reach    m    we have only   and half day left for katy s birtgday  listen how it could be possible    gt  gt just open different tabs from different browser  gt  gt dont watch full video  remember we dont have time on hand  its time wasting  view it only for    sec  plz thumbs up and share,1,1,"-1,-1,-1,-1,-1,-1,1,1,1"
z13cynorbtfoydmbx04cfxohsqzvh1jwnlc0k,احمد الهوارى,2014-10-24T09:55:30,   rapid facebook    the free version of all colors and is characterized by  fast and beauty download now https   play google com store apps details id com rapid facebook magicdroid,1,1,"-1,-1,-1,-1,-1,1,0,1,1"
z12vyf0jry25cbtif04cilsxal2quhowmw00k,katy perry,2014-10-24T14:12:49,hey katycats  we are releasing a movie at midnight uk time to celebrate  katy s   th birthday  be sure to subscribe to our channel and watch the  movie ,1,1,"-1,-1,-1,-1,-1,-1,1,1,0"
z13xxt4idrj0xx0vy23mzfswexbtytozw04,randman21,2014-10-24T17:11:17,i just realized that this verses in this song have the exact same melody as  the verses in  hey ho  by the lumineers ,0,0,"0,-1,-1,-1,-1,-1,-1,0,0"
z12iup4axsfpz50rz04cgr3xiuakujcwvb0,ΑΓΛΑΪΑ ΛΕΠΤΟΚΑΡΙΔΟΥ,2014-10-24T17:41:52,  d  this is my favorite song ,0,0,"0,-1,-1,-1,-1,-1,0,1,-1"
z13mwftg2ozrfpmzm04cjpaxuqv0tpygyl00k,Brian Schultes,2014-10-25T01:53:36,this song never get s old  lt   ,0,0,"0,-1,-1,-1,-1,-1,-1,0,-1"
z133x1cptruyddomf230yx1zfwqhfzoxs04,Hude Deni,2014-10-25T08:13:25,happy birthday katy    http   giphy com gifs birthday flowers happy gw jy uqiaxkaqxs fullscreen   thats not me ,1,1,"-1,-1,-1,-1,-1,1,1,1,0"
z13yfl2wqnzjynufz23dejrjetqedzgqx04,Ashley Smith,2014-10-25T15:23:36,hey   i know most people don t like these kind of comments  amp  see at spam   but i see as free advertising   so please check out my cover of sparks fly  by taylor swift   it is not the best ever i know  but maybe with some  encouraging words of wisdom from many of you i can become better  please go  to my channel and check it out  ,1,1,"-1,1,-1,-1,-1,-1,0,0,1"
z13xg3oatsy5uljmc22ictmhgtf5vzxmg,Charles Breheny,2014-10-25T15:55:59,www youniqueproducts com joannagordon younique by joanna gordon www youniqueproducts com,1,1,"-1,-1,-1,-1,-1,-1,-1,1,1"
z12dynswht2rujq1e22xi5dappq1vrlh504,ali aydın,2014-10-25T16:59:02,i like you   katy perry       ,0,0,"-1,-1,-1,-1,-1,-1,-1,0,-1"
z12czbcjtzzjxfz5p04cffk5xsztwvsrop00k,IMustKillGoogle+,2014-10-25T20:10:35,glad to know im not the only one who knows its katheryn s birthday today     happy birthday katy   and my sister   they seriously have the same  birthday    ,0,0,"-1,-1,-1,-1,-1,-1,0,1,0"
z12dujcgssjgd505g04ce5zzlka4d1p40vs0k,GX2re,2014-10-26T08:33:48,katy perry can t sing for shit  all i hear it autotune ,0,1,"-1,-1,-1,-1,-1,-1,0,1,1"
z13jj5yx2lmeznske23dxrg51xnyhtrae04,Denzel Saimi,2014-10-26T08:38:36,i fucking hate her  why  because she don t write her songs she got  producers for that  second why tha fack is she in every song almost nude  mayby because she s an attention hooker ,0,0,"0,-1,-1,-1,-1,-1,-1,0,0"
z135jfhquofkjjxam04cdraphzuxxry4iso0k,Shaun Mac,2014-10-26T20:10:46,also luckymusiqlive she probably could help u make it big because i think u  have talent  just look her name up on the internet  hit me up when u get  this message,1,0,"-1,-1,-1,-1,-1,-1,-1,-1,0"
z12eszqpikzjdjnic04celpbjnityp1j24k,Nick McGoldrick,2014-10-27T13:19:06,check out my drum cover of e t  here  thanks   gt     watch v no povz oiq amp list uultucdihsdei  by ow wuq,1,1,"-1,1,-1,-1,-1,-1,-1,1,1"
z13pwzyitx2sgz1w504cdlq4bxa5uvsqf0g,Emily Thrun,2014-10-27T21:59:07,put famous people in the jungle for an hour and look what happens ,0,0,"-1,-1,-1,-1,-1,-1,0,0,1"
z13achnwtnfohviax04ccn2rlraugdighjg,Robert Petrea,2014-10-27T22:31:50,she kinda let herself go  huh ,0,0,"-1,-1,-1,-1,-1,-1,-1,0,-1"
z12sc3pptnvrfbgwl04cdnfgynv5gtuwcpg0k,ahmed soliman,2014-10-28T16:12:32,we all love you katy perry  lt  ,0,0,"-1,-1,0,-1,-1,-1,0,0,-1"
z13ghzwpmz30ilzzw04cit0gup2kwtajq5o,Yonate,2014-10-28T17:22:33,sign up for free on tsu and start making money on social media add follow  me and ill add follow you   http   tsu co roberts    ,1,1,"-1,-1,-1,-1,-1,1,1,1,1"
z12uwdpwjlnrvvuri04chd4ojrfrhvzjjls0k,Marie farias,2014-10-28T18:10:39,love it when i can relate to my daughter s music      katy perry   roar   official   http   youtu be cevxzvsjlk ,0,0,"-1,-1,0,-1,-1,1,0,0,0"
z12izheoltagv1vvg233cvfgpt3yxdhed,NeverGreen35,2014-10-28T20:04:45,subscribe me and i subscribe you back  ,1,1,"-1,-1,-1,-1,-1,-1,-1,1,-1"
z13ez3wxdsnjv1dej22uedkr2vbsgj2m3,Chris Madzier,2014-10-29T01:23:19,katy perry   roar  official    soundsofsunday    music  ,0,0,"-1,-1,-1,-1,-1,-1,-1,0,-1"
z122sdu5jnnwsr0kf23aghaz5rnkijtkl,adrianavargova,2014-10-29T09:46:20,when i hear katy singing this  i cry  the song has got depth ,0,0,"0,-1,-1,-1,-1,-1,-1,0,0"
z12yirkj4lzkupsnl222tbl5zwnwxfepj04,Boshra Abdrhman,2014-10-29T09:53:12,love it,0,0,"-1,-1,0,-1,-1,-1,0,0,-1"
z12lznkqhkyysbznf222ft35zmy1shkb504,youngj,2014-10-29T11:28:58,people who believe in illuminati are stupid the same people believe that      was made by the american government,0,0,"-1,-1,-1,-1,-1,-1,-1,0,1"
z12jwlxzxsa3srdwf04cftvx1rfjj1vrxms0k,themind blasters,2014-10-29T19:39:38,plz subscribe to my channel i need subs and if you do i will sub back i  need help,1,1,"-1,-1,-1,-1,-1,-1,-1,1,1"
z12qxxchsv2oetuut22jwxur3tjjcvmw004,D Germain,2014-10-29T21:34:30,please look up dhg songs this is my playlist with a bunch of amazing songs ,1,1,"0,-1,-1,-1,-1,-1,1,1,1"
z13chb0r5lndj1mz504cefmpetrryb3qvf0,Nerdy Peach,2014-10-29T22:44:41,hey  i m nerdy peach and i m a new youtuber and it would mean the absolute  world to me if you could check  em out   lt    hope you like them   d,1,1,"-1,1,-1,-1,-1,-1,1,1,1"
z13mznp52kzciz12t22xx1q5unnxxd1ih04,michael smith,2014-10-30T05:20:18,        im pretty sure that tiger just wanted a hug,0,0,"-1,-1,-1,-1,-1,-1,0,0,-1"
z12jwx2ikmq2hh05q04chpgannnofjzgxto0k,Alain Marius,2014-10-30T16:19:21,http   vimeo com          ,1,1,"-1,-1,-1,-1,-1,1,-1,1,-1"
z12kj5iz2obvunpm222oynsjrnmvjhkvj,LuckyMusiqLive,2014-10-30T17:58:18,this song gives me strength  love her lyrics  this video really brings the  lyrics to life  i m getting known fast because i rap with meaning   thumbs  up if you piss next to the water in the toilet so its quiet   ,1,0,"0,-1,0,-1,-1,-1,-1,-1,1"
z125idl4dkrwsdlbj04ccpvbcqjbt3hbbqk0k,Mauro Tricolor,2014-10-30T20:43:47,http   minhateca com br mauro sp     filmes series desenhos animes mp  etc,1,1,"-1,-1,-1,-1,-1,1,-1,1,1"
z13xzfroimzmyxp4o04cdn1i3wypsflpj4k,Grace R,2014-10-31T01:02:53,https   www facebook com antrobofficial,1,1,"-1,-1,-1,-1,-1,1,-1,1,-1"
z12cffepsub4gv5z204cjn5zykntdz45ygk,Meneer Mandje,2015-05-26T11:51:10.891000,ah  good old times   ,0,0,"-1,-1,-1,-1,-1,-1,-1,0,-1"
z13fzno5fnzdwl0wm04cc3fxqkubz3v4ieg,sreekrishna praveen,2014-10-31T07:37:32,i love you katy perry because you will sing nice than shakira,0,0,"-1,-1,0,1,-1,-1,0,0,1"
z13hexio2vibenqip04cinuwsv2iifw5zeg,EDIN TIUL,2014-10-31T20:39:28,http   hackfbaccountlive com  ref        ,1,1,"-1,-1,-1,-1,-1,1,-1,1,-1"
z13vcxagnwzruv4yn04cg3dzxsvkelcqgyk0k,Nedim Alp SEÇGEL,2014-11-01T02:37:29, facebook account hack   http   hackfbaccountlive com  ref        ,1,1,"-1,-1,-1,-1,-1,1,-1,1,-1"
z12xf55o4niwyvdor04cizohvyuafzpowww0k,Jackson Heber,2014-11-01T17:28:29,i love katty perry,0,0,"-1,-1,0,-1,-1,-1,0,0,-1"
z13bcdoyolulstiif04cef2bvmepy1i54k40k,Khris Parkhill,2014-11-02T02:37:16,the perry you re doing a good job good job i love all of their videos and  by the way can you please describe to my channel please please please  please i m trying to get as many comments to skyburst lights is a cancer  and get famous please,1,1,"-1,-1,0,-1,-1,-1,1,1,1"
z123tv1ijsqaz5tv123atxqy3wj5j5mqg04,Michael Jurek,2014-11-02T13:37:06,i did a cover if u want to check it out thank u     michael age  ,1,1,"-1,1,-1,-1,-1,-1,-1,1,0"
z12yehjxukfljxa2x23iyhoqjna4zp0mi,Bruno Alderete,2014-11-02T14:15:55,everybody please vote katy at ema             best song  best female best pop best live best look  best video  please vote katy       please please please       vote vote vote       katy katy katy      ,1,0,"0,-1,-1,-1,-1,-1,-1,0,1"
z12whdyrktazxzbls22jjjaz5tvohh0nz,John Monster,2014-11-03T14:08:14,h my god     roar is the most liked video at vevo    while   months ago  was justin s baby   congrats katy   applause  lt   ,0,0,"-1,-1,-1,-1,-1,-1,0,0,1"
z13ujhk4nwzsf14jl04cgd3o5yrnindgc2s,kyle kops,2014-11-04T03:52:25,https   soundcloud com j supt fils du son fucking hostile,1,1,"-1,-1,-1,-1,-1,1,1,1,1"
z12ltb3iavfkyl4yr04cjperksqvs51otyg0k,Truc Ng,2014-11-04T13:13:28,https   www facebook com myfunnyriddles,1,1,"-1,-1,-1,-1,-1,1,-1,1,-1"
z13ufbpg5smtedf4v04ci5gqvqemyb2jsp00k,OFFICIAL LEXIS,2014-11-04T20:24:58,hi everyone  do you like music  then why not check out my music channel   the lexis band will be uploading their own songs and covers soon so don t  miss out  please subscribe too as it does help us out a lot  just takes one  click    gt ,1,1,"0,1,-1,-1,-1,-1,1,1,1"
z12ig3mwynaxu5vtr23ed33wdofvwp2ve,hassan ss,2014-11-05T11:36:42,https   www facebook com photo php fbid                 amp set a                                            amp type   amp theater                     ,1,1,"-1,-1,-1,-1,-1,1,-1,1,1"
z12gjxa44vzxcfuqz04cjjmphmiyhzopcuk0k,ELPaso1990TX,2014-11-05T17:37:25,i d rather hear some propa explicit gangsta rap insted of this garbage   this song is trash  ,0,0,"0,-1,-1,-1,-1,-1,-1,0,0"
z13uhfapiubszxn3g23jctqqpvaectjss,m450nH,2014-11-05T18:30:45,damnnnnnnnn  she is sexy o o,0,0,"-1,-1,-1,-1,-1,-1,0,0,-1"
z13hhrvguty1drrkk23ie1ywjn31zj0sl,RezAIIDay,2014-11-05T22:50:58,such a good song ans katy sounds great over the melody  im growing as an  artist everyday from my hit song  crazy  which has got my name out there   cant thank my fans more for their support  if you could take a moment  to  check it and my music  maybe you ll join me to make my dream come true     thank you for your time,1,1,"0,1,-1,-1,-1,-1,1,-1,1"
z122ghagzyvyzrv3b23fzf4pelvusdoub,a carlton,2014-11-06T00:55:49,i love you    because u make me smile when im sad you cheer me up with your  beautiful songs     lt  ,0,0,"0,-1,0,-1,-1,-1,1,0,1"
z122g12wzuztdjac4232jxuomqylcfjhc04,William Carey,2014-11-06T02:47:23,this song is the most boring  asinine song i have ever heard  coming from a  guy who liked  teenage dream   the song   ever since katy perry s divorce  it s wave after wave of shitty but successful songs    for those of you  saying  this is the next wave of pop music   stick it up your ass  katy  perry is like silly putty  ,0,0,"0,-1,-1,-1,-1,-1,1,0,0"
z13qh3azhtvkvbypn04cflwaxoz5x51bip00k,Googles top ten pics,2014-11-06T05:26:28,katy perry   roar  official   http   youtu be cevxzvsjlk   i love this song  and video katy perry rocks wahoo  ,0,0,"0,-1,0,-1,-1,1,1,0,0"
z13zyrkzxm21hblzq04cgl4yslaoc1zh52g,Abhishek Kumar Gendah,2014-11-06T12:56:46,and somehow she has access to makeup in the middle of the woods   ,0,0,"-1,-1,-1,-1,-1,-1,-1,0,0"
z12wy3fjlwnexjpzw04cf5ubzkudvfdinn00k,Fazeela Boodoo,2014-11-06T13:44:00,it looks so real and my daughter is a big fan and she likes a lot of your  songs ,0,1,"0,-1,-1,-1,-1,-1,-1,1,0"
z133v1lwfvzcvrlp004cgbnqivi4xnqwgbk,LrsLzk,2014-11-06T15:58:58,i can t comprehend why this video has nearly             views  some people  found  gangnam style  funny so that explains its high view count but this  is just an awful pop song  i really have no clue on this one ,0,0,"0,-1,-1,-1,-1,-1,0,0,0"
z12kh3rhbs3duzfea23hzf1qhlyuextzx04,Bobby Carlos,2014-11-06T16:30:30,lets be honest  you wouldn t last   day on your own in the jungle  stop  living n a fairy world ,0,1,"-1,-1,-1,-1,-1,-1,1,0,1"
z133hdqrqpukup0lp22chhoaztrhvxov5,Quinho Divulgaçoes,2014-11-06T19:50:16,me segue ha  https   www facebook com marcos sousa  fref ts,1,1,"-1,-1,-1,-1,-1,1,-1,1,1"
z130ut4izmyus5xr504cfzrx1umeglx4urg0k,Serj Cat,2014-11-06T20:04:45,nature is beautiful  no need to place tits in video to impress people ,0,0,"-1,-1,-1,-1,-1,-1,0,0,1"
z12xjtzzfw2rtdt5p04cfbmihmusv3hjouc0k,Yourmomma Son,2014-11-06T22:17:27,this is so stupid  if you roared at a lion in real life you d dede,0,0,"-1,-1,-1,-1,-1,-1,0,0,0"
z12cvzca1qi3frejt04chrbhzsekxxopids,Paola Zelaya Deras,2014-11-07T01:17:29,this song is so awesome   she made everything stand out and all the viewers  could imagine themselves at the setting of the video  awesome job katy  perry    ,0,0,"0,-1,-1,-1,-1,-1,0,0,0"
z12esjnx1qn4vhywy04cfvpaunnxtvhbpnw0k,dinda zivic,2014-11-07T09:19:50,katy perry   roar  official   http   youtu be cevxzvsjlk ,0,0,"-1,-1,-1,-1,-1,1,-1,0,-1"
z12xunyyvkfmjpwbn04chxeipmaqg1apkxs0k,BIANCA FLORENTINA MANTA,2014-11-07T11:25:13,katy perry is lion,0,0,"-1,-1,-1,-1,-1,-1,-1,0,-1"
z13ocdbaxwqdvjnwx04ccz1pnvqtezdriqc0k,Uroš Slemenjak,2014-11-07T12:16:21,people  here is a new network like fb   you register also free  the  difference is only that you get paid for sharing  commenting and liking  posts and so one   don t waste your time on fb for sharing and not being  paid   register here to make also money with your everyday posts    https   www tsu co slema   wellcome to everyone    ,1,1,"-1,-1,-1,-1,-1,1,1,1,1"
