comment_id,author,date,text,expected_label,model_pred,vectors,signal_strength
_2viQ_Qnc6_FlLJN0izQaKVQNe6LGDmPZMmkVDjjymE,Neeru bala,2013-09-05T23:07:09.056000,hi   everyone   if anyone after real online work  i can help u  earn lots of money  it     s fun  it     s real and affiliated company   u not think u r working  it     s easy and enjoyable  for more info contact me    neeru     gmail com,1,0,"-1,-1,-1,-1,-1,-1,-1,0,0",2
_2viQ_Qnc69wycunZGebHhH3CnhNYYLjUzHrnXdzkV8,How To Advertise On Facebook,2013-09-01T16:16:00.721000,ways to make money   k per month search google now  gt  gt   nl me make money without investment  ,1,0,"-1,-1,-1,-1,-1,-1,-1,0,0",2
_2viQ_Qnc6_JXdgRpQbBADKUYa1ESkXLxO1oW_ouaxU,How To Make Money On Youtube,2013-09-01T10:24:20.112000,meet the richest online marketer  now click   bit ly make money without adroid,1,0,"-1,-1,-1,-1,-1,-1,-1,0,0",2
_2viQ_Qnc6-76PJqtBpzwmOHbogHlzWG9RSSpe-Kr1s,Maika Kate Mish Linn,2013-08-31T08:59:35.957000,how did you know that people makes another account just for subscribing itself and liking      ,1,0,"-1,-1,-1,-1,-1,-1,-1,0,0",2
_2viQ_Qnc69AVbPU2gXuoLiAOr6muFqsr7sm17CjhX4,Maika Kate Mish Linn,2013-08-31T08:56:12.507000,   i     ll subscribe to you  you look nice   ,1,0,"-1,-1,-1,-1,-1,-1,0,0,-1",2
_2viQ_Qnc6-lW0XpQ5szMbbKcq0fuK2p4lDhPbQpGn0,CC FootballWorld,2013-08-24T12:41:23.384000,please go in and see our channel and subscribe      it would be nice mate ,1,0,"-1,-1,-1,-1,-1,-1,0,-1,0",2
_2viQ_Qnc6_-PxFkTE_Kx-BN9mjiueYqg5wrx_hMGb4,angela pollman,2013-11-04T01:38:02.979000,and how many subscribers compared to her over a million,1,0,"-1,-1,-1,-1,-1,-1,-1,0,0",2
z12rwfnyyrbsefonb232i5ehdxzkjzjs2,Lisa Wellas,,              lovely girl talk to me xxx,1,0,"-1,-1,-1,-1,-1,-1,0,0,-1",2
z132jbmxfqm4fjysg23nwjfb2mv2vxnua,Decio Alves Martins,2015-06-05T19:29:20,katy perry  i am the  dcio cabelo    decio hair   i am    years of age  i  don t have family  i m single  alone  homeless  i was an alcoholic     at  the age of     i am an invisible composer  my dream is to record my songs   could you help me  please  please  i trust that the you will give me a  chance  i have     videos in the youtube  deciocabelo canal  katy perry  i  was born in october     too  thank you very much    decio hair ,1,0,"0,-1,-1,-1,-1,-1,-1,-1,0",2
z13awjrbcpyhinimp23nwztqlrucvdio404,The Bibliophile Flautist,2014-11-08T03:49:38,hey everyone  i am a new channel and will post videos of book reviews and  music on the flute  please subscribe if you would enjoy that  thanks ,1,0,"-1,-1,-1,-1,-1,-1,-1,0,0",2
z12kcfcxyvb1cxhls220s3g4jlrtuppxg04,Eli Zabeth,2015-05-17T01:14:28.368000,in my head this is like   years ago   time flies,0,1,"-1,-1,-1,-1,-1,-1,-1,1,0",2
z13kf5iwrofhglmk1231xreqhuu4xrwcl,Synchronized™ Nightcore,2015-05-15T14:58:48.131000,do not like this comment if you are not watching in     ,1,0,"-1,-1,-1,-1,-1,-1,-1,0,0",2
z12dixvi2qepuhb4o04chpd5exjdx3oqdic,DropItLikeItsSloth,2014-11-11T19:38:11,just came here to check the views  p,0,1,"-1,1,-1,-1,-1,-1,-1,0,-1",2
z12ovv2xcmmtv5exl04cdxe4ql31dd2jiy00k,Liu Chu Yi,2014-11-08T13:12:10,i am so awesome and smart    sucscribe to me ,1,0,"-1,-1,-1,-1,-1,-1,0,0,-1",2
z13md5uabuyschuvr22rx3fybuzczpdai04,Ori Yonay (EatDaPoison),2015-05-04T02:32:37.593000,i just wanna see how many people like this comment  i     ll give it a month or so   ,1,0,"-1,-1,-1,-1,-1,-1,-1,0,0",2
z13wyl5pgmjgvj1rr04cfxfpjz22yfbwly00k,Malvin Baez,2015-05-03T01:39:03.193000,please don     t like this comment if you are watching in                ,1,0,"-1,-1,-1,-1,-1,-1,-1,0,0",2
z13nvtepirfuhrral04cc10xkkygibq53t40k,"nobleMC | Minecraft, GFX and More!",2014-11-08T10:48:41,if i get     subscribers by tomorrow i ll do a epic hunger games video  ,1,0,"-1,-1,-1,-1,-1,-1,-1,0,0",2
z12ztdojvxyhy3bpc04cf34jnnrnfpuyj1c,Harrys Edits,2014-11-08T10:05:40,if i reach     subscribers i will go round in public pouring a bucket of  ice water over people and then running away acting like it wasn t me  like  so people can see  ,1,0,"-1,-1,-1,-1,-1,-1,-1,0,0",2
z13vhnh5ewvdyzh3o23bjz55lxbwjznor04,diego acosta,2014-11-08T10:05:27,if i get     subscribers  i will summon freddy mercury s ghost to whipe  from the face of earth one direction and miley cirus ,1,0,"-1,-1,-1,-1,-1,-1,-1,0,0",2
z125zdpzksrzyt10m232x1cpcobdjduoo04,Pj Jessie,2015-03-22T01:04:09.486000,omg can this be the first video on youtube to hit   billion views like this comment of you agree ,1,0,"-1,-1,-1,-1,-1,-1,-1,0,0",2
z13wg12iskysxzuhi04cdhcxam2wdxfi4hk,Nina Mackie,2015-05-17T09:07:30.578000,take a look at this video on youtub br   you,1,0,"-1,-1,-1,-1,-1,-1,-1,0,0",2
z13eglu51lmgxbhj304cfh2ifo3phfqwa3k,Maximus Decimus Meridius,2015-03-21T19:57:26.765000,  br   please help me get     subscribers by the end of the night  thx,1,0,"-1,-1,-1,-1,-1,-1,-1,0,0",2
z134tnezjunhvxqq504cfpcr2qajwj0gbo40k,조윤기,2015-03-21T18:25:05.665000,like this comment if you     re watching this video when big bang happened br   i do,1,0,"-1,-1,-1,-1,-1,-1,-1,0,0",2
z13ecbgzonmri3yjj04cj14ooragi1ij450,Kingphillip9,2015-03-20T22:24:23.394000,   br         br      o     br             br            br    br       you have been spooked by the spookinati br    br     share this to     people to be unspooked br    br    br    br    br    br    br    br   ,1,0,"-1,-1,-1,-1,-1,-1,-1,0,0",2
z13rdtkxmnfsdptlc22qwryhlsrfslcht04,Adele Lupei,2014-11-07T19:47:06,is this the video that started the whole  got my dick stuck in an elevator   excuse thing  ,0,1,"-1,-1,-1,-1,-1,-1,-1,1,0",2
z13dxnsrvvfiu5ipf04cfxpowt3swh2oi34,Emily Horposniac,2015-03-19T10:33:00.987000,help me get          subscribers by tomorrow  br    br    br    br    br    br    br    br    br    br    br    joking don     t get butt hurt   ,1,0,"-1,-1,-1,-1,-1,-1,-1,0,0",2
z12pgx55amraefo3423kchdy1tmeu1avo,Darth Vaderbro,2014-09-20T00:05:45,if interested in making extra money by internet use the next link www swagbucks com refer nonturtle  ,1,0,"-1,-1,-1,-1,-1,-1,-1,0,0",2
z12nexwg5uj0zr2ph04cjbjgskioe1fzsug0k,GrayGRW,2015-03-11T05:26:51.968000,like this comment if you are watching on a phone,1,0,"-1,-1,-1,-1,-1,-1,-1,0,0",2
z12sitjpgyy3f5j2322iy1figqa4vnyja04,OverSpace33,2014-11-06T19:40:59,for christmas song visit my channel    ,1,0,"0,-1,-1,-1,-1,-1,-1,1,-1",2
z132ep1gxunohv3as04cgjsomlfhtnc5pwo0k,Jephone Cañas,2015-03-01T11:29:19.167000,this video has     m views br   and the channel got  m subscribers,1,0,"-1,-1,-1,-1,-1,-1,-1,0,0",2
z12jeraoczqvvbkmz23hsbcptweedlrxx04,BIGMOFO Tonkatruck,2014-11-12T06:26:42,just came to check the view count,0,1,"-1,1,-1,-1,-1,-1,-1,0,-1",2
z130zd5b3titudkoe04ccbeohojxuzppvbg,BlueYetiPlayz -Call Of Duty and More,2015-05-23T13:04:32,subscribe to me for call of duty vids and give aways goal     subs,1,0,"-1,-1,-1,-1,-1,-1,-1,0,0",2
z13xhp2xmkeowtbyo04cffggylf3yjjpsns0k,Brotha B,2014-11-05T16:18:58,like getting gift cards  but hate spending the cash     try juno wallet     at juno wallet you can earn money for gift cards such as   nike  gamestop   amazon   ebay etc  amp  its easy  earn money by doing simple task like watching videos  downloading apps  amp   you can even earn money by inviting your friends to join   its free for  signup sign up today  amp  use promo code bd       ,1,0,"-1,-1,-1,-1,-1,-1,0,-1,0",2
z13xg3oatsy5uljmc22ictmhgtf5vzxmg,Charles Breheny,2014-10-25T15:55:59,www youniqueproducts com joannagordon younique by joanna gordon www youniqueproducts com,1,0,"-1,-1,-1,-1,-1,-1,-1,0,0",2
z132zl1rupqcylbep23jgfig3um3ct5vv,KatyPerry TheQueenOfPop,2014-09-22T06:50:24,   gt attention katycats  katy leads with   noms at this year mtv ema  do vote daily for her  tv   mtvema  com vote  delete spaces  thumbs up and share on fb,1,0,"-1,-1,-1,-1,-1,-1,-1,0,0",2
z12ijdi5kuimjphgy04cjzxxzyusg3xjoyc0k,Ari4Cortez5Ortiz 9Uria,2014-09-18T15:57:36,katty perry please say in one of your new videoes that they follow the  girls girls please,1,0,"-1,-1,-1,-1,-1,-1,-1,0,0",2
z13ighypdmuywprvc222crt42va2ctluz,Vena Veno,2014-09-17T22:22:44,she loves vena  trojmiasto pl vena bus taxi o      html,1,0,"-1,-1,-1,-1,-1,-1,-1,0,0",2
z130tpc5mwbqtxkox04cipervsaysn0w22o,William Fernandez,2014-10-08T18:47:52,katy perry   roar  official   http   youtu be cevxzvsjlk ,0,1,"-1,-1,-1,-1,-1,1,-1,0,-1",2
z134htdz0kjvgbd5w04cebardrm5zp15mw40k,Matt Twine,2014-10-10T16:24:57,nice song  see my new track ,1,0,"0,-1,-1,-1,-1,-1,0,-1,-1",2
z13ncdbb1urrxdhcs22gfp35gkqiuhgcr,Neo Joey,2014-09-10T09:09:57,katy perry is and inspirational singer her voice is awesome and i loved her  so much   she achieved music history and i couldn t believe that   guys if  you could take  min to go to my channel and watch my first video i would be  greatly thankful for this    ty guys n katy is still awesome xoxo,1,0,"-1,-1,-1,-1,-1,-1,0,-1,0",2
z12yfvzzpt2tizxvb22yj334vzmrh13gc04,Natalya Korshunova,2014-10-14T03:29:19,katy perry   roar  official   http   youtu be cevxzvsjlk ,0,1,"-1,-1,-1,-1,-1,1,-1,0,-1",2
z13hst3ihoetvtdls221z1khwtfmutjdd,abdilefe,2014-10-18T19:09:29,plz help me getting       subscribers tonight today   thanks to all who sub me   ,1,0,"-1,-1,-1,-1,-1,-1,-1,0,0",2
z13ay5zytl3icfrij04cc1kakqb4cpu4oks0k,Kathy L.,2014-09-08T01:03:41,in my opinion i think you look better with black hair then blond hair    ,0,1,"-1,-1,-1,-1,-1,-1,-1,1,0",2
z12esjnx1qn4vhywy04cfvpaunnxtvhbpnw0k,dinda zivic,2014-11-07T09:19:50,katy perry   roar  official   http   youtu be cevxzvsjlk ,0,1,"-1,-1,-1,-1,-1,1,-1,0,-1",2
z12gyripbnbehdria04ccn2jxlqkwjhqbio,Damn Son,2015-05-19T03:49:19.732000,thumbs up if fe fe fe fe fegelein brought u here,1,0,"-1,-1,-1,-1,-1,-1,-1,0,0",2
z13szfnqoxaouldyf04cgrp5tmichhawj2g,FudgePlaysMC,2014-11-10T18:18:08,my  th grade teacher looked exactly like katy perry come to think of it   ,0,1,"-1,-1,-1,-1,-1,-1,-1,1,0",2
z13sfvhiwxmqz3xad04cddehoyr5g1i5c0s,TWIN MELODY,2014-09-02T19:57:01,  hi  d    we re twin melody     year old twins    we did some covers  we did a cover of birthday by katy perry    please just take   second and watch it   thanks merci gracias danke obrigado grazie            lt    xx have a nice day   d,1,0,"-1,-1,-1,-1,-1,-1,-1,0,0",2
LneaDw26bFvtmJorLbUQjuqmpL7TdjOKPGJT_DGUUJ4,louis canellony,,watch youtube video  quot eminem  ytma artist of the year quot  plz share to vote   ,1,0,"-1,-1,-1,-1,-1,-1,-1,0,1",2
z13lhdo5vnyndj3p304cjjs4zze3sldrqbg,Mai Nguyễn,2014-08-28T03:53:35,help me click on the subscribe mai nguyen  thank you,1,0,"-1,-1,-1,-1,-1,-1,-1,0,0",2
z13zxxtwurq5cxuiz04cc5xapsypshtipdo,Elle xox,2014-08-20T02:55:54,hiya i just started youtube and it would mean a lot if some of you could  subscribe and watch my first video xx,1,0,"-1,-1,-1,-1,-1,-1,0,-1,0",2
z13ms12adsbdjbdds23nctrqsq2qhtose,Angela Alor,2015-05-20T19:53:57.924000,how do you put a picture for your image thingie    ,1,0,"-1,-1,-1,-1,-1,-1,-1,0,0",2
z12cjdywboihdxu5d04celsj0m2vjzrwk0k,DrPunkable,2015-05-20T17:39:26.476000,okay  this should cover me for some time    thumbs up if you     re watching while youtube still exists ,1,0,"-1,-1,-1,-1,-1,-1,-1,0,0",2
z12vsvqwqyjiinvj204cjjjyflbgvbsgtlg0k,Eduardo Salgado Uresti,2015-05-20T13:16:34.752000,thumbs up if shrek is gay ,1,0,"-1,-1,-1,-1,-1,-1,0,0,-1",2
z122xxgxipvdzpovt22xjlyi5o3pebufp,Emilie,2014-08-09T20:12:26,hey guys  my mom said if i got     subs before christmas i ll get a kitten  and i always have wanted an kitten so please watch my videos and if you  like it subscribe or like    please no mean comments,1,0,"-1,-1,-1,-1,-1,-1,0,-1,0",2
z12bv5zxvpryjjspn04cdfwz5lrtzjhooqw0k,Peter Johnson,2014-11-06T01:44:12,get free gift cards and pay pal money ,1,0,"-1,-1,-1,-1,-1,-1,0,0,-1",2
z12xtzhzyr2lx53oo04cexm5vlrvxptiywo0k,sarah fitzgerald,2014-09-20T07:43:50,please subscribe every sub gets a shout out tell me what type of videos u  want and i will try make it happen,1,0,"-1,-1,-1,-1,-1,-1,-1,0,0",2
z124jvbxusjnsn2oi04cidm5hqmoftu4ovg0k,XxNorwegianELITEGaming xX,2015-01-31T20:56:05.396000,pleas subscribe on me for ps  games video br    i                                 i  br   if you have som tips so contact me on kik or skype br    i                                 i  br   kik  pander   br   skype  sander nicolaysen  br    i                         i  br   pleas subscribe on me and kashoo gaming,1,0,"-1,-1,-1,-1,-1,-1,-1,0,0",2
z130tflr2suzejk2s22expyzjmfjifvgs04,Sebastian Garcia,2014-10-16T00:50:14.327000,great l subscribe,1,0,"-1,-1,-1,-1,-1,-1,0,0,-1",2
z12rgllzmwnfuba4h04ch3njgy2fg3ryerg0k,Eanna Cusack,2014-01-20T22:20:59,im just to check how much views it has,0,1,"-1,1,-1,-1,-1,-1,-1,0,-1",2
z12stpyqaonsercxw04cjbr4dlnrxd34soo0k,Phuc Ly,2014-01-20T15:27:47,go here to check the views   ,0,1,"-1,1,-1,-1,-1,-1,-1,0,-1",2
z13vsbcjwrybe3hsf23sgvnxfr3zxnion04,World327RS,2014-01-20T06:16:28,subscribe to me and i ll subscribe to you   must like   czfcxsn jnq  ,1,0,"-1,-1,-1,-1,-1,-1,-1,0,0",2
z12mjlfh2wyzzzc3e22sehuzmmjmstlv2,Bilinmeyenin Bilinmeyeni,,subscribe me secret videos  d,1,0,"-1,-1,-1,-1,-1,-1,0,0,-1",2
z13jhp0bxqncu512g22wvzkasxmvvzjaz04,ElNino Melendez,2013-11-09T08:28:43,me shaking my sexy ass on my channel enjoy     ,1,0,"-1,-1,-1,-1,-1,-1,0,1,-1",2
LneaDw26bFt7RP87Zm4xWaDRwG5SE0XUHC_YBbvPQhQ,ultimatecleanmusic,,subscribe to me for clean eminem ,1,0,"-1,-1,-1,-1,-1,-1,0,0,-1",2
z13autsqgzblcx3w104chr4r2kexd10rxc0,DropShotSk8r,2014-01-19T04:27:18,came here to check the views  goodbye ,0,1,"-1,1,-1,-1,-1,-1,-1,0,-1",2
z122djvavnibdrr1j23pjbm4szvfuzlzd04,RandomFuntime,2014-08-04T13:27:47.451000,hey i     m a british youtuber   br   i upload weekly    br   it would mean the world if you could subscribe   br   thanks joyce   br   ,1,0,"-1,-1,-1,-1,-1,-1,-1,0,0",2
z134yz2xnujfdnky504cfjnrxuu2vbpgmhk,ZeroxAbood677,2014-08-07T13:57:40.272000,nezo and ed br   like amp share this page on facebook please,1,0,"-1,-1,-1,-1,-1,-1,-1,0,0",2
LneaDw26bFvYw369Q5okcXCmHP7yDxn75UhHEKdI8Kc,AllDailyVines,,hahahahah   d like vines    subscribe to me for daily vines,1,0,"-1,-1,-1,-1,-1,-1,-1,0,0",2
LneaDw26bFsR_suTFQXPd6_Nuv-oikecM7Vx539o-2k,Samantha Sawyer,,please read this please  i am a country singer who is trying to become someone  so if you would like my videos please  just type    boys round here by country girl  only on computer  wasting all these tears e t  please subscribe and like,1,0,"-1,-1,-1,-1,-1,-1,0,-1,0",2
z13qgx0yzwf1uj1xm04ccbkhjnrsgz0i41g,firo mota,2014-11-04T14:38:42,please subscribe i am a new youtuber and need help please subscribe and i  will subscribe back  d hoppa hoppa gangam style,1,0,"-1,-1,-1,-1,-1,-1,-1,0,0",2
z130drwgasjgevh0n234ht3gfrmugfguz,Guren - MKII,2014-10-01T19:53:07.387000,everyday i     m subscribe,1,0,"-1,-1,-1,-1,-1,-1,0,0,-1",2
LneaDw26bFscYlZhrdft-O6Q7koeIpT4s4zpkbDHxl4,FreshX,,guys share this video       he must have               views  share on facebook  groups  pages  ,1,0,"-1,-1,-1,-1,-1,-1,-1,0,0",2
z124hbc4umr5yxikd23kupyodqvben3yb04,Sami Nashawi,2014-10-29T15:28:53.402000,sup gus this is a video for people who loves party rock so thanks for watching and please subscribe    ,1,0,"-1,-1,-1,-1,-1,-1,-1,0,0",2
z13qgviizlv1d1c1422lylyahqz2h1zm5,Connor Groom,2014-11-04T18:00:07,sub me if you dont like the song,1,0,"0,-1,-1,-1,-1,-1,-1,0,-1",2
LneaDw26bFvF20ISV3_bAs2_rN15DyE6cTqB-iNAgkY,spamworld2009,,watch v arkglzjqup  like this comment and share this video so em can win     ytma,1,0,"-1,-1,-1,-1,-1,-1,-1,0,0",2
LneaDw26bFtg4S7L4GethprEUChZq3UF60r8hc2sHYE,spamworld2009,,share eminem     s artist of the year video so he can win  we could see a performance and acceptance speech  like this comment so everyone can see           year of eminem,1,0,"-1,-1,-1,-1,-1,-1,-1,0,1",2
z13ttt1jcraqexk2o234ghbgzxymz1zzi04,Cony,2013-11-28T16:01:47,you should check my channel for funny videos  ,1,0,"-1,1,-1,-1,-1,-1,0,-1,-1",2
LneaDw26bFtiRx1bZC7n8eZ5ZsRoXrrrfdVu_92PJd4,SlimShadyPG,,everyone go and share youtu  be arkglzjqup  on fb twitter g  to vote for eminem to become artist of the year on first ever youtube music awards      and get this method to cheat at internet roulette out of eminems video   shady artist of the year  ,1,0,"-1,-1,-1,-1,-1,-1,-1,0,1",2
z13vehm4enr5zbohl04chhjoixzes32rvjw,Desert Loner,2014-12-25T19:52:25.333000,want a sub  tell me about your channel and i will subscribe  with a couple exceptions ,1,0,"-1,-1,-1,-1,-1,-1,-1,0,0",2
z13eepr4dyjet34pt04cgr1rctvwsvqwqso0k,JP Jochem,2014-01-20T20:23:35,subscribe and like to me for more how to videos on minecraft ,1,0,"-1,-1,-1,-1,-1,-1,-1,0,0",2
z13zvh1rmk3cf3mby04civbq5mjtddmbysk0k,Fun&amp;Hacks,2014-01-19T00:42:35,subscribe to me for free android games  apps   ,1,0,"-1,-1,-1,-1,-1,-1,0,0,-1",2
LZQPQhLyRh9y57URF7qpZRk3MVAJNLNhhZga_5YWBU8,Living4Techno,2013-12-25T19:46:26,marketglory   com strategygame andrijamatf earn real money from game,1,0,"-1,-1,-1,-1,-1,-1,-1,0,-1",1
_2viQ_Qnc6-1fj_YPI5S4X9e9VnvAzoykRbwZGAlYgo,emoclew71,2013-10-04T19:18:44.700000,              gangnam style   ,1,0,"-1,-1,-1,-1,-1,-1,-1,0,-1",1
_2viQ_Qnc6-nD73Whq8IPs5SpJ3v8OO6PlgvyoopAqQ,Merabi Mazmaniani,2013-10-10T09:39:11.008000,please visit this website  oldchat tk,1,0,"-1,-1,-1,-1,-1,-1,-1,0,-1",1
z13vendrur3zxdgkd22azzlzftn1vj3pp04,Evin Alshamas,2014-08-12T05:20:24,subscribe me please,1,0,"-1,-1,-1,-1,-1,-1,-1,0,-1",1
_2viQ_Qnc68tZfiBq8O7pExj1MmWcnorsu-kyc0Jz8Q,Merabi Mazmaniani,2013-10-09T14:20:36.334000,please visit this website  oldchat tk,1,0,"-1,-1,-1,-1,-1,-1,-1,0,-1",1
z13osnp4hnzry1o15224yfzbotr0epxqk04,BaconBro HD,2014-01-20T21:11:52,subscribe me ,1,0,"-1,-1,-1,-1,-1,-1,-1,0,-1",1
z13phfyxhovav1hl122bf5iidumufzbel,Cody Tolleson,2014-01-20T02:50:44,youtube codytolleson for awesome videos i ll subscribe back ,1,0,"-1,-1,-1,-1,-1,-1,-1,0,-1",1
_2viQ_Qnc6_rAWi6BK2OqTQ_Ob0X8DkXenO0qL0qWm0,Ryan Alexander Osborn,2013-10-04T02:26:08.693000,believe that jesus christ is your savior for all your sins  if you truly believe in jesus christ to be your savior for all your sins then you will go to heaven  if you believe in jesus christ then you are saved and you are in salvation and you have gained gods righteousness  it matters not how much you have sinned in the past  in the present and especially in the future  believe that jesus christ is your savior and you will go to heaven forever and that is the whole truth  spread the truth  ,1,0,"-1,-1,-1,-1,-1,-1,-1,-1,0",1
z13auhww3oufjn1qo04ci3grqqjmfjexxuo0k,Huckyduck,2013-11-28T17:06:17,hey subscribe to me,1,0,"-1,-1,-1,-1,-1,-1,-1,0,-1",1
z121zxaxsq25z5k5o04ch1o5jqqfij3gtm40k,TheUploadaddict,2013-11-28T18:12:12,subscribe like comment,1,0,"-1,-1,-1,-1,-1,-1,-1,0,-1",1
z134e5zjck2agxwd423hdjgx1y3ndvhf4,Christopher Pete S.,2014-09-07T22:39:21,subscribe and u are gonna hear me roar   ,1,0,"-1,-1,-1,-1,-1,-1,-1,0,-1",1
_2viQ_Qnc6-Lev7nxVg9RnkxHYNAykFf9lV9qiEIFJY,macgyver16,2013-07-24T14:07:32.431000,adf ly   kld y,1,0,"-1,-1,-1,-1,-1,-1,-1,0,-1",1
z13xvrgzkoydytjr304ch1no1raxwjahesc0k,Richard Valko,2014-09-07T15:01:49,follow me watch my videos    follow me watch my videos    follow me watch  my videos    follow me watch my videos    follow me watch my videos     follow me watch my videos    follow me watch my videos   ,1,0,"-1,-1,-1,-1,-1,-1,-1,-1,0",1
z12lcb0rxw3qtlsqm04cebpbjkqjtdza1xs0k,Veronica Kkk,2014-09-14T14:17:49,my telephone ,0,1,"-1,-1,-1,-1,-1,-1,-1,1,-1",1
z12mt5kxyqyful0jq04cdrchivu0v5ip51k,TheParkourGamingPotato,2014-09-10T22:58:23,subscribe to me,1,0,"-1,-1,-1,-1,-1,-1,-1,0,-1",1
_2viQ_Qnc6_sGHV0-pAXNa1RF9Xja5vmr53ULlzlG3g,macgyver16,2013-07-23T17:00:14.596000,adf ly   kld y,1,0,"-1,-1,-1,-1,-1,-1,-1,0,-1",1
_2viQ_Qnc6_rdI1pDiJrFRv9uqSk3MizTk-rQeALntU,Noise​Break,2013-09-21T22:11:23.900000,subscribe  amp  like  watch v  tu gn l   ,1,0,"-1,-1,-1,-1,-1,-1,-1,0,-1",1
_2viQ_Qnc6-LyNEXRld9VERRpRICrMPNxpnGjL8ZsF4,DJ ROY,2013-08-02T21:02:09.931000,hey youtubers    i really appreciate all of you who took the time  to read this  i am just a    year old boy who wants to be a successful musician in the music world  i dont have any money to advertise my channel  if you could just visit my channel  comment on my video or subscribe  that would be great     it will only be few seconds of your life      thank u to all the people who just gave me a chance l really appreciate it  ,1,0,"-1,-1,-1,-1,-1,-1,-1,-1,0",1
_2viQ_Qnc6-oktCjZuAEscq8DxT2RHFY1nfSS_hCWf0,Wafence,2013-09-04T19:16:44.109000,hey youtubers and all music lover     s  guess most of you all skip these comments  but for you who is still reading this  thanks   i dont have any money for advertisiments  no chance of getting heard  nothing  all that     s left is spam  sorry  im     rapper singer from estonia  please listen my new cover on my account  you wont regret it  give me just a chance  please  take half a second of your life and thumb this comment up  it will maybe change my life  for real  thank you wafence ,1,0,"-1,-1,-1,-1,-1,-1,-1,-1,0",1
z13zxdkalk3ryvxr004cj1vabkn2dvcyusg0k,Ju`Wan Wright,2014-11-06T02:39:07,follow me on twitter  amp  ig     killuminati  ,1,0,"-1,-1,-1,-1,-1,-1,-1,0,-1",1
z13mtrjqsqzliho5w04cex3zmoqfvnpgyys0k,FatPocketsTv,2014-11-06T09:49:14,search  chubbz dinero   ready or not   thanks ,1,0,"-1,-1,-1,-1,-1,-1,-1,0,-1",1
z12lg1vizrmsgxm3q23oij4aqrjxjdd1p,Holly,2014-11-06T13:41:30,follow me on twitter  mscalifornia  ,1,0,"-1,-1,-1,-1,-1,-1,-1,0,-1",1
z13actcqdm31slqqu04cctub4n2nw1swwy00k,Sean Ortiz,2014-11-06T16:48:02,incmedia org where the truth meets you ,1,0,"-1,-1,-1,-1,-1,-1,-1,0,-1",1
z12ox3a5vviky5ctq22nz1ewpo24wxyis04,JackTheLad,2014-11-06T19:00:11,subscribe to me and i ll subscribe back   ,1,0,"-1,-1,-1,-1,-1,-1,-1,0,-1",1
_2viQ_Qnc68ohvE0UyLK_gdOAe__2iDVi8CqVB97qeA,How To Make Money On The Internet,2013-08-21T14:18:11.087000,i can to make money,1,0,"-1,-1,-1,-1,-1,-1,-1,0,-1",1
_2viQ_Qnc6_nI97BKqkdeX9pbSkcDCWrg5cDb74C7kk,Gotcha Laughs,2013-08-19T17:21:29.806000,wanna laugh    please subscribe to our channel   ,1,0,"-1,-1,-1,-1,-1,-1,-1,0,-1",1
z12yu11xyumitzpho04cix1y3zn3ijrpcm40k,Chinsoman Films,2014-11-07T01:22:02,please subscribe to me,1,0,"-1,-1,-1,-1,-1,-1,-1,0,-1",1
z13mc51qfqeozdpun23kgri5kzjnjpitj,Callum Barr,2014-11-07T13:49:41,subscribe to me plz plz plz plz plz plz ,1,0,"-1,-1,-1,-1,-1,-1,-1,0,-1",1
z13oyfkydl30exyip04cejozdtahgvx44ao,Pat M,2014-11-05T00:21:29,gofundme com grwmps,1,0,"-1,-1,-1,-1,-1,-1,-1,0,-1",1
_2viQ_Qnc68ked0J7OAfephXPfR-pvW7HiuIC5ZRduI,macgyver16,2013-08-16T14:07:09.668000,adf ly  kld y,1,0,"-1,-1,-1,-1,-1,-1,-1,0,-1",1
z13oc52ihn22tfz3n231vv4bvxrujn0f0,2666playboy,2014-11-07T21:39:21, follow me on instagram   chris cz  ,1,0,"-1,-1,-1,-1,-1,-1,-1,0,-1",1
_2viQ_Qnc6_Zg0GECxJ4iGuOCFBrzjOBZguGqOhU5ms,DJ ROY,2013-08-14T21:07:42.306000,hey youtubers    i really appreciate all of you who took the time  to read this  i am just a    year old boy who wants to be a successful musician in the music world  i dont have any money to advertise my channel  if you could just visit my channel  comment on my video or subscribe  that would be great     it will only be few seconds of your life      thank u to all the people who just gave me a chance l really appreciate it  ,1,0,"-1,-1,-1,-1,-1,-1,-1,-1,0",1
z13fib54ilj0ix3ln23cy5h41xi0hduex,The O'dowd Crowd,2014-11-08T06:53:38,come and watch my video it is called the odowd crowd zombie movie part   ,1,0,"-1,-1,-1,-1,-1,-1,-1,-1,0",1
z12ct5z5hsnsjjpii04ccbzztmf1ulxxous0k,Viperas Lord,2014-11-12T09:20:12,www marketglory com strategygame lordviperas,1,0,"-1,-1,-1,-1,-1,-1,-1,0,-1",1
z12dcrdpiky1w3oia04chrvgxpmuzjv4gcw,Tedi Foto,2014-11-08T09:33:30,what my gangnam style,0,1,"-1,-1,-1,-1,-1,-1,-1,1,-1",1
z12zdj5ptyzpurkan04chtsqjszjxfmrk2w,Gloria Garcia,2014-11-04T11:38:51,subscribe to itz recaps and above diddle,1,0,"-1,-1,-1,-1,-1,-1,-1,0,-1",1
z13zfpqpvpyvwfymk232ux4odsr1s5wm0,Jack ToadROXMK,2014-11-04T02:00:14,anybody who subscribes to me will get    subscribers,1,0,"-1,-1,-1,-1,-1,-1,-1,0,-1",1
_2viQ_Qnc6978LweIjWZsjP3qK1bgFSYyumKWxPsq_I,Titan,2013-08-08T21:16:25.626000,subscribe me  i will  subscribe you back   ,1,0,"-1,-1,-1,-1,-1,-1,-1,0,-1",1
_2viQ_Qnc6-jidHqOHj6hf4XnhflHNGicw4dL1vZRvQ,DizzyDank314,2013-09-07T20:04:51.947000,          ,1,0,"-1,-1,-1,-1,-1,-1,-1,0,-1",1
z121zn0biqizsti0j23rghdafmjzgpuu4,nathan robson,2014-11-08T11:20:48,if i reach     subscribers i will tazz my self and my friend,1,0,"-1,-1,-1,-1,-1,-1,-1,-1,0",1
z13fdvwhykzhuldpn04cfdtwkyqterlavnk0k,iKap Taz,2014-11-08T13:34:27,follow   follow                             vaahidmustafic like   like ,1,0,"-1,-1,-1,-1,-1,-1,-1,0,-1",1
_2viQ_Qnc6812QtCcbHa3ZgmjznXhr0Ar324LJpkSHE,Titan,2013-08-08T21:15:36.040000,subscribe me  i will  subscribe you back   ,1,0,"-1,-1,-1,-1,-1,-1,-1,0,-1",1
_2viQ_Qnc69bp77hGJ6em0Gm1Fg_TLmNoUuS_ydlofg,TheEpicMixx':)x,2013-08-08T13:34:40.655000,i really ask nicely to view my vids   i subscribe back  ,1,0,"-1,-1,-1,-1,-1,-1,-1,-1,0",1
z12ig3jrnlfvsthaa04chjkrply5zligbdg,Aaa Aaa,2014-11-12T05:46:27,please subscribe me                                                    ,1,0,"-1,-1,-1,-1,-1,-1,-1,0,-1",1
z12jc1uququpzbsoq04cg15poyfsxpvoojw,pro stomper,2014-11-05T15:27:34,guys please subscribe me to help my channel grow please guys,1,0,"-1,-1,-1,-1,-1,-1,-1,-1,0",1
z135fnx4ntvdx1rzn04cih1ihmqtsrbzcno0k,Backup Plus,2014-11-03T17:39:07,suscribe my channel please xd lol,1,0,"-1,-1,-1,-1,-1,-1,0,-1,-1",1
z123e1gg3zyuf30ox04cdtbzgmaby3ehjc0,Lucas Trigo,2014-11-02T15:52:22,whats up everyone       i trying to showcase my talent to the world  i have over      subscribers  i promise  i dont suck  please spread my covers around  subscribe  amp  share  thanks so much for all your support  lucas trigo  stay awesome  ,1,0,"-1,-1,-1,-1,-1,-1,-1,-1,0",1
z13ccrthzkqdhl0ia04cjvobvtmafbd53ow0k,Pro Video,2014-11-07T17:53:51,subscribe to me    ,1,0,"-1,-1,-1,-1,-1,-1,-1,0,-1",1
LneaDw26bFsTytWDcS_4DFWlbxAlCfw2c_9PIcArNdw,chantel toledo,,tell us the title so i can like and subscribe your music fgw please,1,0,"-1,-1,-1,-1,-1,-1,-1,-1,0",1
