comment_id,author,date,text,expected_label,model_pred,vectors
z12dc1xrjv3zgfpfl22pu5dh4va2upijn04,faith jones,2015-05-23T23:47:20.885000,megan fox is gorg in this   eminem is truly the rap god   ,0,0,"-1,-1,-1,-1,-1,-1,-1,0,0"
LneaDw26bFtX5RMSmXwiWyM-cpLU5CtNk9C9QQiT9Lc,Vincent T.,,rihanna   pour it up  vincent t  remix  rihanna   pour it up  vincent t  remix  rihanna   pour it up  vincent t  remix  rihanna   pour it up  vincent t  remix  rihanna   pour it up  vincent t  remix  rihanna   pour it up  vincent t  remix  rihanna   pour it up  vincent t  remix  rihanna   pour it up  vincent t  remix  rihanna   pour it up  vincent t  remix   click  subscribe ,1,1,"-1,-1,-1,-1,-1,-1,-1,1,1"
z12wgbl4exjaf3xu223jej34rlabtjbkz,Rose Bruhns,,check out this video on youtube ,1,1,"-1,1,-1,-1,-1,-1,-1,1,-1"
LneaDw26bFuWopul-gr37Vv-5semureg7PfAdqw3V5c,..xXCoolMultiXx..,,he gets more views but has less subscribers lol,1,1,"-1,-1,-1,-1,-1,-1,-1,1,-1"
LneaDw26bFssNuHM19vJZwZIDvIkQHDPSkv7woLXuO0,ferhan kifle,,go check out eminem survival ,1,1,"-1,1,-1,-1,-1,-1,-1,1,-1"
LneaDw26bFvdvI7rlQIcNpETWIMuWByXcsQPGKS7EVg,Chris King,,hey  i     m a    year old rapper from texas i don     t rap  quot pmw quot  but i promise my music will not disappoint   search therealchrisking  to find me and listen to my track  quot memory lane quot  i just released my  rd mix tape  quot crown me quot  and so far i     ve had nothing but good reviews about it  i     m not asking you to like or subscribe but just   view will help me catch my dream  and if you could leave a comment letting me know what you think it would be much appreciated also  thank you ,1,1,"-1,-1,-1,-1,-1,-1,-1,-1,1"
LneaDw26bFsEJWfgAAquASY-phBHckFFppU0EKqD-yY,Elias Uchiha,,if eminem gets   penny per view he would have     million dollars,1,1,"-1,-1,-1,-1,-1,-1,-1,1,1"
LneaDw26bFtmqnbwore5s5LHQD3cpRwhBYdsz4yXRkM,INCRIVELawesome,,check out leandrus   playtime it     s awesoooome   ,1,1,"-1,1,-1,-1,-1,-1,-1,1,-1"
z12zcvjo2tbez1mfy23pvjwzckbbcdivp,Melody Peace,,check out this video on youtube ,1,1,"-1,1,-1,-1,-1,-1,-1,1,-1"
LneaDw26bFu1Ru9jx_4ZrghWiGAVmVtFPtTTpL7ihGI,deazy99,,i know that maybe no one will read this but please type in  quot deazy   quot  i     m a rapper with a dream  i know you must see like millions of those on here everyday but please check out my music and subscribe if you     d like thank you  i would love nothing more than to have a decent following on youtube from people if anyone reading this could give it a  quot thumbs up quot  because what some might see as just a simple button press could make my dream come true  thank you again for your time  amp  may god bless you,1,1,"-1,1,0,-1,-1,-1,-1,-1,1"
LneaDw26bFsOYjjXTrDu7GwukppwT8U_8uWaxcdut44,Monica Lewis,,dress like rihanna at kpopcity net   the largest discount fashion store in the world  check out our  quot hollywood collection quot  to dress like all your favourite stars    dress like rihanna at kpopcity net   the largest discount fashion store in the world  check out our  quot hollywood collection quot  to dress like all your favourite stars ,1,1,"-1,1,-1,-1,-1,-1,-1,1,1"
LneaDw26bFuXMGzeve-9_Piipp0wpaS_5AJyXS2fqJw,Kate Mcdermit,,check out this dope channel     phenomenallyricshere check out this dope channel     phenomenallyricshere check out this dope channel     phenomenallyricshere check out this dope channel     phenomenallyricshere check out this dope channel     phenomenallyricshere check out this dope channel     phenomenallyricshere check out this dope channel     phenomenallyricshere check out this dope channel     phenomenallyricshere check out this dope channel     phenomenallyricshere,1,1,"-1,1,-1,-1,-1,-1,-1,1,1"
z13hcfzbesmjhpuzp04ccvzilqvcyj0x3yo0k,Vivek Bhardwaj,2015-05-23T22:14:55.993000,amazing song,0,0,"0,-1,-1,-1,-1,-1,0,0,-1"
z12vcv5xuqq4gvpgu04ch5ah3vyqwzphryc0k,kissmehk,2015-05-23T19:37:52.240000,  ,0,0,"-1,-1,-1,-1,-1,-1,-1,0,-1"
z12mt1p4mljosxzto224jzypky2henlbn04,Sandeep Singh,2015-05-23T17:51:58.957000,charlie from lost,0,0,"-1,-1,-1,-1,-1,-1,-1,0,-1"
LneaDw26bFviVGu48zFp_sMMENzTpzWdbhRUvgtprCI,Dengesiz Adam,,subscribe me pls emnem fans,1,1,"-1,-1,-1,-1,-1,-1,-1,1,-1"
LneaDw26bFtleYKQHQZ7EJNapbBNzTiP3Yzy8i_2Dmc,Paiky MC,,dude check out psy,1,1,"-1,1,-1,-1,-1,-1,-1,1,-1"
z12tzpcjazigvrodo22dubixisqhfxtuo,twe enyss,2015-05-23T16:41:29.823000,i love this the talents of eminem and skylar works well together,0,0,"-1,-1,0,-1,-1,-1,0,0,0"
LneaDw26bFsXWfdCYFbqrDwjflNnbdxcinzjRtW2rzw,FreshX,,share this video   this song can beat psy   gangnam style ,1,0,"0,-1,-1,-1,-1,-1,-1,0,0"
z12muxdydqnggz0gw04cgldbmvnlhzuxpu40k,AreWEFaumos Now,2015-05-23T14:24:32.712000,thumb up if you watching in      and you like it,0,0,"-1,-1,-1,-1,-1,-1,-1,0,0"
LneaDw26bFtNnEGpg7pf921bsfI1m57qBsEWQKlItrk,KC Cassette,,check out my remix to tyga     s   molly ft  whiz khalifa peace and love,1,1,"-1,1,0,-1,-1,-1,1,1,1"
LneaDw26bFsVCGrj_dxDKFtnhKwpdiPRkVcanAW9w7E,markwardist,,check out my channel please ,1,1,"-1,1,-1,-1,-1,-1,-1,1,-1"
LneaDw26bFuM4VU33XXogBzYQDxO-q19BsZLZRAklss,Ractive,,i been working so hard for the past    days to improve i been writing recording mixing performing    bars everyday im doing it for a whole year     days  today i     m on day    today i work so hard now i     m doing   verses everyday to improve i     m going all the way to     please subscribe to my channel  help me build a fan base  watch me improve help me get closer to my dream i     m lyrical and i keep it real i won     t leave you down i promise   please subscribe please like this  commment so people can see,1,1,"-1,-1,-1,-1,-1,-1,1,1,1"
LneaDw26bFuFItWTKmffBRPA4v3HwunSq-ceF3kwQZ4,Juarez Ounfee,, i can     t believe this i just now watched a brand new adult video clip with rihanna she has been screwing a black basketball player  check out her video right here if you wish    crazy celeb news eu pn,1,1,"-1,1,-1,-1,-1,-1,1,1,1"
LneaDw26bFsHGo2NsZjHkppLdvkxCkgu3s2nWi99Oa8,MrJtill0317,,           check my videos and subscribe and like plzz,1,1,"-1,1,-1,-1,-1,-1,-1,-1,-1"
z133sxsrnzbuwbe2o22iizkhvyicd5z0t,Sawa Jamal,2015-05-23T12:12:59.082000,never gets old best song ever  ,0,0,"0,-1,-1,-1,-1,-1,-1,0,-1"
z13idj4w4yy5g1mx104cd3rwetmew3kq554,Fantasy Mysteries,2015-05-23T12:12:16.470000,first they were fighting    then they were making out   ,0,0,"-1,-1,-1,-1,-1,-1,-1,0,-1"
LneaDw26bFupd-SDZSJybM-YnylZY3yw4Hx0dpG5Ars,deazy99,,i know that maybe no one will read this but please type in  quot deazy   quot  i     m a rapper with a dream  i know you must see like millions of those on here everyday but please check out my music and subscribe if you     d like thank you  i would love nothing more than to have a decent following on youtube from people if anyone reading this could give it a  quot thumbs up quot  because what some might see as just a simple button press could make my dream come true  thank you again for your time  amp  may god bless you,1,1,"-1,1,0,-1,-1,-1,-1,-1,1"
LneaDw26bFua7KQM3MpFFLNg9dDrNznsK0wQXgR61YQ,rukshan bieber,,hey guys please just spent one minute for me   im a singer from srilanka and im    year     s old  sooo i like to be great singer will be a one day so i hope it would be happen in really my life  just view my videos and rate it and let me know how is my voice please help us guys closer to living my dream    i really know you     d helped me who read this comment he she can just understand my feeling   thanks guys lv u really much more  subscribe it my channel and onece again thank u  ,1,1,"-1,-1,-1,-1,-1,-1,-1,-1,1"
LneaDw26bFtUEhNudjpH0X1gcH2nF0v4w6dhXurctSU,Ashim Limbu,,yo guys im    year old rapper just started rapping  so please check out my site and leave feedback and subscribe  also like this comment so more can see and make my channel big aswell,1,1,"-1,1,-1,-1,-1,-1,-1,-1,1"
z122j3v55kiwzpqpc04cdxc4elf3zjuir4o,Linda Dipilato,,check out this video on youtube ,1,1,"-1,1,-1,-1,-1,-1,-1,1,-1"
LneaDw26bFuGts11KE-vf8DxNybKxvOCLkkkExJk2pk,Honest586,, for        s rap fans   check out my big pun        beware      cover   likes n comments very much appreciated ,1,1,"-1,1,-1,-1,-1,-1,-1,1,1"
z12ywjeyiwu3jdqvq22ptpzpowithfaz204,hazem bitar,2015-05-23T10:27:43.205000,i love this song up to the moon  gt   you are rocks ,0,0,"0,-1,0,-1,-1,-1,0,0,0"
z12xu1bi1umyxxs2023ejhfpuumozd45n04,Ferhad Babayev,2015-05-23T08:55:42.007000,hello   am from azerbaijan br   ,0,0,"-1,-1,-1,-1,-1,-1,-1,0,-1"
LneaDw26bFvv8RbyHRBDnA-4Bb1lhF9UlpzJf_5FkWM,이 정훈,,this great warning will happen soon     lneadw  bfst  vhkjl pxaey vmnlvmriudtsfk vy ali paa           t                croatia  lt     lneadw  bfvkahxpkenm  fywkyxthsupri juqsznu g belrus           t                nice one   lneadw  bftvzqt juehasiefrjg exi dvqdnqvpho exode  comeback            t                   m views    lneadw  bfunoarag  awgu tjo azdkfiun tz  hy muhammad shaeel abbas           t                fuck off    lneadw  bft otoufj z vfflfnaxykwzsivqhimx e notorious niko           t                 hey guys im a   yr old rapper trying to get exposure    i live in belgium where no one speaks english so i have to resort to this gay spam     check out my   latest tracks as they are probably my best   audio isnt the best but im gonna invest in some real equipment for my next track    please thumbs this up so others can see   or hey dont just check me out yourself and leave a response and a like  d  thanks in advance  you guys will be part of making my dream come true    notorious niko ,1,1,"-1,1,-1,-1,-1,-1,-1,1,1"
LneaDw26bFvpoWuT_30FVDq9XRmjOIn_01gQXnGANo4,Notorious Niko,,hey guys im a   yr old rapper trying to get exposure    i live in belgium where no one speaks english so i have to resort to this gay spam     check out my   latest tracks as they are probably my best   audio isnt the best but im gonna invest in some real equipment for my next track    please thumbs this up so others can see   or hey dont just check me out yourself and leave a response and a like  d  thanks in advance  you guys will be part of making my dream come true    notorious niko ,1,1,"-1,1,-1,-1,-1,-1,-1,1,1"
z13csrxzhwnis5zg404cdxpyrpbvtdcocz40k,Boksu Boc,2015-05-23T08:36:40.952000,eminem lt   br   the best rapper ever lt  ,0,0,"-1,-1,-1,-1,-1,-1,-1,0,-1"
z13wtn0o5ueli5m4b04cdjnjqzb5xftz4hw,Chelsea Yun,2015-05-23T07:17:09.691000,i hate rap,0,0,"-1,-1,-1,-1,-1,-1,0,0,-1"
LneaDw26bFtSk2czbMLQl8KluoXusyGfmZ0u3D3dXek,media.uploader,,check out my channel to see rihanna short mix by me   ,1,1,"-1,1,-1,-1,-1,-1,-1,1,1"
LneaDw26bFv2Ps-QqkMShtEbaXEAA7MO4d-ZFRdrrW0,Anthony Konstantinou,,every weekend a new lyric video of eminem here view like subscribe,1,1,"-1,-1,-1,-1,-1,-1,0,1,1"
z12ojrdgoryvz5k4n04cidzimov5inlppto0k,Laura Winner,2015-05-23T05:14:55.214000,this song video is such a trigger but it     s just so good   ,0,0,"0,-1,-1,-1,-1,-1,1,0,0"
LneaDw26bFvaBIGMY4DfxNzifyIUm7GOWp8Br9oySEk,DanteBTV,,check out the new hot video by dante b called riled up,1,1,"-1,1,-1,-1,-1,-1,1,1,1"
z13mh5zhdtrcst5xs04cddwzqtz5yhapzf0,LUKAZ G,2015-05-23T04:45:12.703000,was that meghan fox  ,0,0,"-1,-1,-1,-1,-1,-1,-1,0,-1"
LneaDw26bFs9Rg2Ij9HjO7kLn-wwxZttoa9Dx9BEGzQ,armontre,,ayyy can u guys please check out my rap video im    n im juss tryna get some love please chrck it out an thank u,1,1,"-1,1,0,-1,-1,-1,1,1,0"
LneaDw26bFtHPL0j2tW4vknwh8imHXGX4vzYDmr2nhc,Jay Stevens,,come subscribe to my channel       please  ,1,1,"-1,-1,-1,-1,-1,-1,-1,1,-1"
z13cztvzwlzawvszx04cfp3rdma0dlyonso0k,Maria Montana,2015-05-23T04:15:02.178000,awesome song  congratulations   ,0,0,"0,-1,-1,-1,-1,-1,0,0,-1"
LneaDw26bFuMmBaTaA7SRY7EwUqxN2vHR8tDEuQfjRQ,BloodspitsMusic,,come check out our music channel  go check out the song  quot love me quot  by j e m ini  if you do you are a very amazing person  thank you to all who check it out  if you don     t check it out you     re still an amazing person just for reading this post,1,1,"0,1,0,-1,-1,-1,1,1,1"
LneaDw26bFvPh9xBHNw1btQoyP60ay_WWthtvXCx37s,janez novak,,share and like this page to win a hand signed rihanna photo    fb    fans of rihanna,1,0,"-1,-1,-1,-1,-1,-1,-1,0,0"
LneaDw26bFuQPBnfEIFhEOee5UVNZ-dSDr4EIsxWocE,Adam B,,check out my page adam b beats     ,1,1,"-1,1,-1,-1,-1,-1,-1,1,-1"
LneaDw26bFtoHCZ_b-m1MyTEpaNHWvF8VmCFhVRFMgU,HEADSHOT946,,look and shares my video please  d,1,1,"-1,-1,-1,-1,-1,-1,-1,1,-1"
z125w1ejhpqzinkmb23jej34rlabtjbkz,Rose Bruhns,,check out this video on youtube ,1,1,"-1,1,-1,-1,-1,-1,-1,1,-1"
LneaDw26bFtJyeoa9E-59ntF4zGVkZb4OaitZmuvNyw,Noise​Break,,like  amp  subscribe  watch v  tu gn l   ,1,1,"-1,-1,-1,-1,-1,-1,-1,1,-1"
z12xyzfbixyuxf5wm04ccn2inoiyevdqwgo,PDV10,2015-05-23T02:32:21.664000,charlieee  dddd  those who saw lost only will understand ,0,0,"-1,-1,-1,-1,-1,-1,0,0,-1"
LneaDw26bFsltJodWnZAafXscqrATBuKDM8-8lA4TQE,miamiscraziest,,ladies          gt  gt  if you have a broken heart or you just want to understand guys better you should check out this underground book called the power of the pussy on amazon  best book ever for us girls  oh   and just a warning it     s for    and over   lol,1,1,"-1,1,-1,-1,-1,-1,-1,1,1"
LneaDw26bFvSkELgnp-ZdS5ZiYbn_tFmogawXBUucN4,Ked Woodly,,coffee   lovers   please   read   check out a song i wrote and sing on you tube called coffee lova type coffee lova like i spell it while your already on you tube hit enter then look for video titled coffee lova hit enter and blast   off  ,1,1,"0,1,-1,-1,-1,-1,-1,1,1"
LneaDw26bFtxWo398a4IB63xJxVOTtPd1Xqz0vPfw9s,Ractive,,hey guy if you can please subscribe to my channel im a young dedicated rapper i post videos everyday to improve  i write perform record mix edit post everyday  i do a verse everyday     bars to improve i     m doing it for     days a whole year to improve right now i     m on day     if you guys can please like this comment so everyone can see it and follow me on my journey watch me improve everyday subscribe please i     m lyrical and i keep it real  help me reach my dream help me build a fan base thanks  ,1,1,"-1,-1,-1,-1,-1,-1,1,-1,1"
z12wyxvyuyiach5og04cclng3ujizpmbtg0,dmrc43,2015-05-23T02:13:21.735000,so many comments ,0,0,"-1,-1,-1,-1,-1,-1,-1,0,-1"
z12qv3vybobijlzot04cjvqwxrnvvlzrs50,Unitedstates America,2015-05-23T02:13:15.643000,getting too  billion views  holy moly    ,0,0,"-1,-1,-1,-1,-1,-1,-1,0,-1"
z13rzhjaxxr3z1t4504ccvlp1uqnddvqoyg0k,Kate Love,2015-05-23T01:14:31.812000,best song,0,0,"0,-1,-1,-1,-1,-1,-1,0,-1"
LneaDw26bFvjY8Hcx4VMm_TW6lDgVntTQMvU8NjWnEU,FaZe MinEz,,subscribe to me  i make music ,1,1,"-1,-1,-1,-1,-1,-1,-1,1,-1"
z12zz5eqkxqfzxcof04cjfow2lf5c53hbcc,Nader sheckler,2015-05-22T23:24:03.588000,   song in world even in     ,0,0,"0,-1,-1,-1,-1,-1,-1,0,-1"
z12agzlqdsjwthnkc23sfxaofvjoevvx204,Lily Barboza,2015-05-22T22:36:11.416000,hi loving it,0,0,"-1,-1,-1,-1,-1,-1,0,0,-1"
LneaDw26bFtE0-kLDaaiizhZVUyP1tE0FLTPo6TPFPY,Amir bassem,,subscribe me if u love eminem,1,1,"-1,-1,0,-1,-1,-1,1,1,-1"
z12wddhwuqintd14y04cif5i5z3vxjfwd5s,Elsa Ekokobe Rønning,2015-05-22T22:19:43.707000,lol thats the guy from animal planet and lost  and the girl is megan fox i think hahah ,0,0,"-1,-1,-1,-1,-1,-1,0,0,0"
z12scbmwdyaogtjcc223gjn4dpzmerkt3,Angie Schear,2015-05-22T16:01:46.636000,this song is true because it is insane because boys will do this to a girl and it is not true that people say that a guy will never do it to a girl but boys you liers now stop treating us girls this way you all suck ,0,0,"0,-1,-1,-1,-1,-1,0,0,0"
z13gdxtwjrjoczd5h04cejcqqpedxxoyn34,Aleesha Hoover,2015-05-22T14:44:13.619000,love the video ,0,0,"-1,-1,0,-1,-1,-1,0,0,-1"
z13affyr3pbbxv0ur235g3dptufrtb5zl04,Manikencheto Metodiev,2015-05-22T13:13:00.927000,hello i     m from bulgaria,0,0,"-1,-1,-1,-1,-1,-1,-1,0,-1"
z12jutrbiwf4x3mn4224ht3bsn3bwrfqz04,Laighla Owens-Teague,2015-05-22T12:37:59.803000,eminem rap can be easy for a boy but i can do that,0,1,"-1,-1,-1,-1,-1,-1,0,1,1"
LneaDw26bFulIEwMLpMhW9hdZ7Zlfu8GwVEpN5x1LXc,killtheclockhd,,check out our bands page on youtube killtheclockhd   check out some of our original songs including  quot your disguise quot ,1,1,"0,1,-1,-1,-1,-1,0,-1,1"
LneaDw26bFsZ8_-MJ2YdPL4dt9_QKyP6RI_K_Gt7jIM,LaMusician,,could you guys please check out my channel for hiphop beats ,1,1,"-1,1,-1,-1,-1,-1,-1,1,1"
z13wxtdpeznid12et23ogtd4zoyvzbnoz04,Sonny Carter,2015-05-22T11:46:35.988000,i love this song sooooooooooooooo much,0,0,"0,-1,0,-1,-1,-1,-1,0,-1"
LneaDw26bFuKSv_W4OOCnX-bIBR37W0G13MKHZrFVzI,Terry-Lee Mackenney,,everyone come and check out the new gta   gameplay right here    watch v   h m sayho,1,1,"-1,1,-1,-1,-1,-1,-1,1,0"
z13ucdta5ub5djl1d235wndifoybg5lkt,Amie Rutledge,,check out this video on youtube ,1,1,"-1,1,-1,-1,-1,-1,-1,1,-1"
LneaDw26bFtALaOnhQgvfdsxEfR5GGMiiqg8sneY-xg,Drake Gagne,,hey guys i     m    cypher im    years old and rap is my life i recently made my second album desire ep   please take a moment to check out my album on youtube thank you very much for reading every like comment and subscription counts,1,1,"-1,1,-1,-1,-1,-1,-1,1,1"
z13ryrrbkny0czdvv23vizoopmmmgxtax04,Angie Medina,2015-05-22T10:58:24.072000,eminem   love the way you lie   ,0,0,"-1,-1,0,-1,-1,-1,1,0,-1"
LneaDw26bFusJ2z8NldBy-Z5iwzOQ6CPi1ryYyOhzD4,Drake Gagne,,hey guys ready for more    cyphers back check out my video on youtube  new album is out check it out  more music tomorrow thanks for reading,1,1,"-1,1,-1,-1,-1,-1,-1,1,1"
LneaDw26bFtI-0_UfYJ5VmhFKI63wbPsqzmdZkuvXd4,Andrew Guasch,,hey if you guys wouldnt mind   could you check out my boys and my music   we just made a real lyrical song   search dna andrew guasch   i appreciate it  leave some real feedback and keep hip hop alive,1,1,"0,1,-1,-1,-1,-1,-1,0,1"
z13kuhmwfyvkw5fii04chjfr4yfnvrcht5k,Intan  Nadia,2015-05-22T09:38:22.793000,is that girl is megan fox ,0,0,"-1,-1,-1,-1,-1,-1,-1,0,-1"
z12oczujeqz2xn2lq234ijdzurmdynx5m04,Quinn and Mia Channel MattyB101,2015-05-21T22:48:59.766000,so freaking sad   ,0,0,"-1,-1,-1,-1,-1,-1,0,0,-1"
LneaDw26bFuR9smjLJUhkDMS-5WcFp80WGZVHVi9Tsw,Butter Forbes,,hello  i only made one eminem song on my channel  could you guys just put a like on it please  don     t need to subscribe  thanks ,1,1,"0,-1,-1,-1,-1,-1,1,1,1"
LneaDw26bFvgKZJfckgl7OJXXu6v0YtHfhlRTURbhdY,Ractive,,hey guys if you guys can please subscribe to my channel  i     m a young rapper really dedicated i post a video everyday  i post a verse     bars  part of a song everyday to improve i     m doing this for     days  right now i     m on day     i     m doing it for a whole year without missing one day if you guys can please subscribe and follow me on my journey to my dream watch me improve  it really means a lot to me  thank you     i won     t let you down i promise   i     m lyrical i keep it real ,1,1,"0,-1,-1,-1,-1,-1,-1,1,1"
LneaDw26bFu8sZa1D5wQdex0wG1IYwFiZL4s3M0h2X8,M.E.S,,hey its m e s here i     m a young up and coming rapper and i wanna get my music heard i know spam wont get me fame  but at the moment i got no way of getting a little attention so please do me a favour and check out my channel and drop a sub if you enjoy yourself  im just getting started so i really appreciate those who take time to leave constructive criticism i already got     subscribers and      views on my first vid ive been told i have potential,1,1,"-1,1,-1,-1,-1,-1,-1,-1,1"
z12rhdkrvvy3hd42c23whdeavkjdxnimg,viviane trinh,2015-05-21T22:35:35.753000,i like the lyrics but not to music video,0,0,"-1,-1,-1,-1,-1,-1,-1,0,-1"
LneaDw26bFs3BLHRkaxpe2sWBWSCyXU7mlRbxEYSvQg,Greg Fils Aimé,,i hope everyone is in good spirits i     m a hard working student who     s also a passionate singer i look foward to the day when i can make my own music to share but for now i     ve just been doing covers  check out my channel  i     ve done covers of miley cyrus  imagine dragons  lana del rey  drake  macklemore  pink and countless others   subscribe only if you want to  my goal isn     t to become famous but to  inspire fyi this isn     t spamming  everyone has a right to freedom of speech  thanks ,1,1,"-1,1,-1,-1,-1,-1,1,-1,1"
LneaDw26bFsI21zTVPXTHR0k0-oXBY--24NIE1lGPuk,rap classics,,check out my channel for rap and hip hop music,1,1,"-1,1,-1,-1,-1,-1,-1,1,1"
z13zdpqz0qflhrha104cdxir0pbct3v4iys0k,France Silva,2015-05-21T21:54:55.768000,br,0,0,"-1,-1,-1,-1,-1,-1,-1,0,-1"
LneaDw26bFs2opcXPZ0Hnufen7TS94xBoLm5NO5l30U,Adam B,,adam b beats check out my page,1,1,"-1,1,-1,-1,-1,-1,-1,1,-1"
z13qczlqnoqajv4rd04ci5arplmksbi5yq00k,Andrew Willigar,, a rel  nofollow  class  ot hashtag  href  https   plus google com s    awesome   awesome  a   a rel  nofollow  class  ot hashtag  href  https   plus google com s    share   share  a   a rel  nofollow  class  ot hashtag  href  https   plus google com s    rt   rt  a  eminem   love the way you lie ft  rihanna  a href  http   ow ly  zme f  http   ow ly  zme f  a ,1,1,"-1,-1,0,-1,-1,1,1,1,1"
LneaDw26bFsnJbhjejnJC_J6d5sHIH1B9UYVbAUc9KM,M.E.S,,im m e s an aspiring young rapper with high hopes   i know you will not click this link and check out my channel  you just dont want to   well its your choice  in fact you know what dont click,1,1,"-1,1,-1,-1,-1,-1,-1,-1,1"
z130zx3rrzagwzclr23vxjypimviff23m,Huda Salah,2015-05-21T21:34:27.615000,looooved ,0,0,"-1,-1,-1,-1,-1,-1,-1,0,-1"
z12pvhp42ouayd1xx04cgl4a4wu3sxmqnlw0k,SBG | Zombies,2015-05-21T20:37:21.421000,we need to get this to   billion views  ,0,0,"-1,-1,-1,-1,-1,-1,-1,0,-1"
LneaDw26bFtY8pq4RbqsCPRkV04NOObMB3THlsTf9og,superfacoo,,hey  everyone please take a moment to read this  i work my ass off hoping to make it into the music industry but its hard to  get people to hear you when you dont have money for advertisements and exposure i am a young artist who has dreams and goals like everybody else please take    seconds and visit my channel you dont have to like  me  just give me a chance to prove my talent also  please take just   second of your life and thumb this comment up it would be super helpful ,1,1,"-1,-1,-1,-1,-1,-1,-1,-1,1"
z13twpph2vq5zv15k04cixdrfubnxh3oqz40k,Seth Ryan,2015-05-21T20:04:42.844000,amazing,0,0,"-1,-1,-1,-1,-1,-1,0,0,-1"
z13zc5rw3l3vw1fey23rehuylwzfcx5rt04,Seth Ryan,2015-05-21T20:04:36.016000,almost a billion,0,0,"-1,-1,-1,-1,-1,-1,-1,0,-1"
z12ittrwwxexxzwve23rehuylwzfcx5rt04,Seth Ryan,2015-05-21T20:04:26.473000,great song,0,0,"0,-1,-1,-1,-1,-1,0,0,-1"
LneaDw26bFuhuiZ8uX6C-qYLIsOFj9BIWtKWtCz870c,Lizzy Molly,,please check out my video called  quot we love mind master it quot  thanks,1,1,"-1,1,0,-1,-1,-1,-1,1,1"
LneaDw26bFvhyHSmfm28L9EGvDJ-bou6Ze3cVbgCtgU,marion guy,,okay trust me i     m doing a favor  you need to check out this guy named columbus nelson on youtube ,1,1,"-1,1,-1,-1,-1,-1,-1,1,1"
LneaDw26bFsdjmaguMUCSqsUShQZWX4FLU2c58BV1mM,diabeat diaBEAT,,i agree they are just damn spammers  they suck  im trying to do the same and get known  i know the feeling  i will help you out and leave likes and comments on your page  i hope you could do the same and maybe subscribe to me that would be awesome thanks,1,1,"-1,-1,-1,-1,-1,-1,-1,1,1"
LneaDw26bFvA7_ot-Z3kQHP4GTE3g_Zc2fsfdZ4COpI,Adam B,,adam b beats check out my page     ,1,1,"-1,1,-1,-1,-1,-1,-1,1,-1"
LneaDw26bFtdk45hGIs0TDD3NHx1srFG99yWWbEIXG0,Domen Kristan,,check out these lyrics  watch v yuttx  oyqq,1,1,"-1,1,-1,-1,-1,-1,-1,1,-1"
z132g5pqsr3wi3x5s04cerbyxuipctqg0hk,scott boshaw,2015-05-21T19:57:17.180000,i don     t understand this song  i have had the passion for women feel like im losing my mind but i don     t understand the ideas of loving the the way someone lies     ,0,1,"0,-1,-1,-1,-1,-1,1,1,0"
LneaDw26bFuUhekP0nDAiaqnW5sf4OD14dIjY-1o63c,RapStarz Coleman,,subscribe to m please guys,1,1,"-1,-1,-1,-1,-1,-1,-1,1,-1"
z13dfprydrvlvl4u323qy515dzzgtzeej,black tiger,2015-05-22T05:23:38.336000,i love u shakira,0,0,"-1,-1,0,1,-1,-1,0,0,-1"
LneaDw26bFsPpgYyHcGAJk2dyALknpZ1ITQKBmY32HI,Chelsea Cameron,,     please read       hey everyone  i     m a    year old student  who loves to sing   i record and upload covers on my channel  i would love if you could check them out   just give me a chance  you don     t have to thumbs up or subscribe  but you can if you like what your hear   just listen  i     d really appreciate    thank you for your time   ,1,1,"-1,1,0,-1,-1,-1,-1,1,1"
z13zudmjvnayvjjfq232xdtghk33thhtk,Juan Aimar,2015-05-21T18:52:17.472000,anybody else here in      ,0,0,"-1,-1,-1,-1,-1,-1,-1,0,-1"
LneaDw26bFuiTZZU8HrWJPqWfqnrKTtUXy7-rTnPwfU,Lil M,,hi i     m lil m     check out love the way you lie     my live performance and many others    videos and my own lyrics      thanks,1,1,"-1,1,0,-1,-1,-1,1,0,1"
LneaDw26bFuKZRaKv1u8jqanxsDr6RJraSjf2FfE1_Q,AdmiralMusclebeard,,i     m subscribing to you just because your comment was that great ,1,1,"-1,-1,-1,-1,-1,-1,0,1,1"
z134i3ya3xn2cthzj04cef445l21ylwxzmc0k,Smitty Werben Jaggerman Jensen,2015-05-21T18:44:38.982000,i like the mmph version better,0,0,"-1,-1,-1,-1,-1,-1,-1,0,-1"
LneaDw26bFuULuFdET2q7Xmn9oRQXq3oLyk8736meZ0,Kate Hermamn,,terrance   thank you for serving our country  how do i  quot like you quot  or  quot subscribe quot  ,1,1,"-1,-1,-1,-1,-1,-1,-1,1,1"
z13hijmrykjqerofg22ktxgzuw3yhrbgl04,Gergő “Vlog14” Csatornája,2015-05-21T18:34:39.389000,thumbs up if you listen this in      ,0,0,"-1,-1,-1,-1,-1,-1,-1,0,-1"
LneaDw26bFvuJSk9kaYj6_W0OBzf4mgoIFuYUzJMheY,Brandon Thaler,,hey everyone check out my channel leave a like and subscribe please and if there is a song you want me to do post the name in the comments and i will get on to it   thanks,1,1,"0,1,-1,-1,-1,-1,-1,1,1"
LneaDw26bFtRu4tHavOZ4hr-PDVn2oz-9B1QtAfp6pc,david rodriguez,,do you want to make some easy money  check out my page tvcmcadavid weebly   com dont miss out on this opportunity,1,1,"-1,1,-1,-1,-1,-1,1,1,1"
