comment_id,author,date,text,expected_label,model_pred,vectors,signal_strength
z13xtdlovm2hzl05d04ccz1pnvqtezdriqc0k,Uroš Slemenjak,2014-11-07T12:08:13,people  here is a new network like fb   you register also free  the  difference is only that you get paid for sharing  commenting and liking  posts and so one   don t waste your time on fb for sharing and not being  paid   register here to make also money with your everyday posts    https   www tsu co slema   wellcome to everyone    ,1,0,"-1,-1,-1,-1,-1,1,0,0,0",4
z13iupjoosrpzlm5v04cf32q4oqizvsbkdo,Jack Other,2014-08-18T18:05:37,http   www amazon com knight dawn cursed daniel n ebook dp b  mppqhri ref sr     s digital text amp   bie utf  amp   bqid            amp   bsr     amp   bkeywords knight amp tag wattpad        some people are very talented but some are more talented but there is no  sponsor,1,0,"-1,-1,-1,-1,-1,1,0,0,0",4
LneaDw26bFvfudvCyyJZYFnbHLToXau89jeMxKEcKTA,Scott Johnson,,you guys should check out this extraordinary website called zonepa com     you can make money online and start working from home today as i am    i am making over         per month at zonepa com     visit zonepa com and check it out   why does the view disclose the macho lift  why does the letter frame the thundering cause  why does the talk prevent the conscious memory ,1,0,"-1,1,-1,-1,-1,-1,0,0,0",4
LneaDw26bFtnG00TCBv-OKXOFCWEyHF4LFGUJv7VHNc,Scott Johnson,,you guys should check out this extraordinary website called zonepa com     you can make money online and start working from home today as i am    i am making over         per month at zonepa com     visit zonepa com and check it out   why does the answer rehabilitate the blushing limit  the push depreciateds the steel  how does the beautiful selection edit the range ,1,0,"-1,1,-1,-1,-1,-1,0,0,0",4
LneaDw26bFvdj1Xw8Fetm_0WMQpBnvqzJ4yzcj0jXgA,Louis Bryant,,you guys should check out this extraordinary website called zonepa com   you can make money online and start working from home today as i am  i am making over         per month at zonepa com   visit zonepa com and check it out  how does the mammoth waste achieve the shock  how does the limit reduce the delicate minute  how does the meaty scale adapt the oil ,1,0,"-1,1,-1,-1,-1,-1,0,0,0",4
z13yeb25wmevhpg3s22chjtxoszvgxxxl04,funtimekid1199,2014-11-07T14:11:41,http   www twitch tv tareko    follow him on twitch and enter the keyword        and you ll have a chance of winning a really nice and expensive gun  for csgo that you can sell on the steam market,1,0,"-1,-1,-1,-1,-1,1,0,0,0",4
LneaDw26bFuKZRaKv1u8jqanxsDr6RJraSjf2FfE1_Q,AdmiralMusclebeard,,i     m subscribing to you just because your comment was that great ,1,0,"-1,-1,-1,-1,-1,-1,0,0,0",3
LneaDw26bFs2GO5DvyLUXUhG7rNJ-Gb4pMhtnYgCRmY,ryan cooper,,subscribed    btw you have a good style keep it up brother    ,1,0,"-1,-1,-1,-1,-1,-1,0,0,0",3
LneaDw26bFupd-SDZSJybM-YnylZY3yw4Hx0dpG5Ars,deazy99,,i know that maybe no one will read this but please type in  quot deazy   quot  i     m a rapper with a dream  i know you must see like millions of those on here everyday but please check out my music and subscribe if you     d like thank you  i would love nothing more than to have a decent following on youtube from people if anyone reading this could give it a  quot thumbs up quot  because what some might see as just a simple button press could make my dream come true  thank you again for your time  amp  may god bless you,1,0,"-1,1,0,-1,-1,-1,-1,-1,0",3
z13jg1hq5nbadhifc224jptibp2hc511n,JuniorVlogz,2015-03-03T21:02:26.389000,like this comment if you still jam out to this song after   years ,1,0,"0,-1,-1,-1,-1,-1,-1,0,0",3
LneaDw26bFsXWfdCYFbqrDwjflNnbdxcinzjRtW2rzw,FreshX,,share this video   this song can beat psy   gangnam style ,1,0,"0,-1,-1,-1,-1,-1,-1,0,0",3
z13hhxajgrnldjmn523dsjqynsewilbm1,TMCB production (Instrumental Beats),,check out our channel for nice beats  ,1,0,"-1,1,-1,-1,-1,-1,0,0,-1",3
z12hsdhwjqesj54wz04cc5aikwemsrarvak,Ben Romanucci,,im gonna share a little ryhme canibus blows eminem away a quadrillion times especially about the categories of intelligent things in his mind  that he learned and rapped about and forgot before eminem spit his first ryme luv ya linz  e,1,0,"-1,-1,-1,-1,-1,-1,0,0,1",3
LneaDw26bFuaZPTjLG-5OtrrXQgL6TPsWkeKzNnMJ0c,Unbeweavable Co,,for all you ladies out there        check out this link   you     ll find the hottest hairstyles and the latest trends for women   go to this site and you     ll upgrade your hairstyles and fashion senses to a higher level   don     t get left behind          gt    goo gl bxrosr,1,0,"-1,1,-1,-1,-1,-1,0,-1,0",3
LneaDw26bFuM4VU33XXogBzYQDxO-q19BsZLZRAklss,Ractive,,i been working so hard for the past    days to improve i been writing recording mixing performing    bars everyday im doing it for a whole year     days  today i     m on day    today i work so hard now i     m doing   verses everyday to improve i     m going all the way to     please subscribe to my channel  help me build a fan base  watch me improve help me get closer to my dream i     m lyrical and i keep it real i won     t leave you down i promise   please subscribe please like this  commment so people can see,1,0,"-1,-1,-1,-1,-1,-1,0,1,0",3
LneaDw26bFsNko3TEEPMTxWPlFophSSKkSqvjRsENU8,arrgh garry,,my friends wife earns     dollars a month  you can do it do if you want to be a wwhore  you can not get these type of wages for working from home on a pc taking surveys    dont believe that shit just because yahoo and other are taking their money does not mean they are legit   please like this so the msg gets thru to vulnerable  people like eminem used to be ,1,0,"-1,-1,-1,-1,-1,-1,0,1,1",3
z12bjtxbvzu4vpkao04cfhnawsjoybyin4c,ViralVinesHD,2014-08-18T00:25:09.584000,like this comment  guys i just started up a new channel if i can get     subscribers by tonight ill do a     paypal giveaway like this comment so your friends can see it or others and they can also be entered go    ,1,0,"-1,-1,-1,-1,-1,-1,0,0,0",3
z13gvxshio2lcx1fx22oc3jplwmhzrpsz,Hambro,,huh hyuck hyuck im special who     s watching this in      im from australia or something give me attention please im just a rapper with a dream im gonna share this on google plus because im so cool ,1,0,"-1,-1,-1,-1,-1,-1,0,0,0",3
z12vv12yzxuzhnaw104cg3hyboiwyvc4ea0,CypherBrothers,,aye homies check out our remix to    cent your life is on the line we just started our youtube channel and we are all ways working hard  give us some feed back on our latest song on what you guys think if you like show support ,1,0,"0,1,-1,-1,-1,-1,-1,-1,0",3
z12gvlyixpjfwrpme23rxfubjvzkvp42s,Toan732,2014-10-31T02:49:34.017000,ummm    i just hit  k subscribers  i make minecraft videos  help me out by checking me out ,1,0,"-1,-1,-1,-1,1,-1,-1,0,0",3
z12ghvgo3xjyjvouf23tstj5bna5jei0,Ragnarok,2014-08-19T19:53:09.770000,abomination  subscribe if you agree    party here in my channel  cool lights ,1,0,"-1,-1,-1,-1,-1,-1,0,1,0",3
LneaDw26bFuLqTvlvHELy-tdwJHJYoSpv3zRbTj-5SQ,Adela Korman,,  check out my sexy video   ,1,0,"-1,1,-1,-1,-1,-1,0,1,-1",3
z13rs3fimnydzjdu423qudibdzm0sbyjh04,johnlord joaquino,2014-10-10T11:31:33.153000, m subscribers but look at the views its     million wtf  p,1,0,"-1,-1,-1,-1,-1,-1,0,0,0",3
z13jxrajxkydifipt04cjtvboqfhelloucs,Alex Despotovic,2014-11-08T05:52:20.157000,check out my youtube channel for cool beatboxing   ,1,0,"-1,1,-1,-1,-1,-1,0,1,-1",3
LneaDw26bFuiuUSZ-vXu3wz5XEsS6fhI7SHFsSXLcdo,ViperFoe,,wow justin bieber is better  thats why when he buys medication he always shares with his half wited money alfred but sadly enough he is an attention hog with swamp ass and an eating disorder filled with sassy mice  and flaming hot cheetos that he can eat with the power of the samurman ,1,0,"-1,-1,-1,-1,-1,-1,0,0,0",3
LneaDw26bFu1Ru9jx_4ZrghWiGAVmVtFPtTTpL7ihGI,deazy99,,i know that maybe no one will read this but please type in  quot deazy   quot  i     m a rapper with a dream  i know you must see like millions of those on here everyday but please check out my music and subscribe if you     d like thank you  i would love nothing more than to have a decent following on youtube from people if anyone reading this could give it a  quot thumbs up quot  because what some might see as just a simple button press could make my dream come true  thank you again for your time  amp  may god bless you,1,0,"-1,1,0,-1,-1,-1,-1,-1,0",3
LneaDw26bFuYQhgPVcKoJxOS7aSiV7l-Ce25QwQEabw,Josephine Monti,, facebook password hack       facebook pass hack     blogspot com only      working software for hacking any facebook password  it     s free for download and breaks any password in       minutes       virus free  for details and free download please visit facebook pass hack     blogspot com ,1,0,"-1,-1,-1,-1,-1,-1,0,0,0",3
LneaDw26bFsrleSoC9hVAdk8QmJCwfmQ1BuBDhQBQ6E,Wild 'N' Out,,check out eminem   rap god lyric video,1,0,"-1,1,-1,-1,-1,-1,0,0,-1",3
LneaDw26bFt04z-5gd60QQsZAfjRxMsf7yqOomgDuvg,Joden Brett,,all u should go check out j rants vi about eminem,1,0,"-1,1,-1,-1,-1,-1,-1,0,1",3
LneaDw26bFsatnacZXb_S1v2dOV0EyaNuykTxwkPmWg,101Tele,,yo i know nobody will probably even read this    but im gonna type it any way because i hope at least one person will  i     m a rapper with a dream  i know there     s like    k of those in this world  but please check out my music and subscribe  if you want   thanks   i would love nothing more than to have a decent following on youtube    if anyone  reading this could press the  quot thumbs up quot  other people will see it  just a simple button press  could make my dream come true    thank you,1,0,"-1,1,0,-1,-1,-1,-1,-1,0",3
LneaDw26bFs8EyO6vOIKjYpRt-sa-JxqbsTjjcbiPaQ,Adela Korman,,  check out my sexy video   ,1,0,"-1,1,-1,-1,-1,-1,0,1,-1",3
LneaDw26bFtE0-kLDaaiizhZVUyP1tE0FLTPo6TPFPY,Amir bassem,,subscribe me if u love eminem,1,0,"-1,-1,0,-1,-1,-1,0,0,-1",3
LneaDw26bFsgggeU_vbp6eynA9RVJ0qto2OMt6tcgjk,deazy99,,i know that maybe no one will read this but please type in  quot deazy   quot  i     m a rapper with a dream  i know you must see like millions of those on here everyday but please check out my music and subscribe if you     d like thank you  i would love nothing more than to have a decent following on youtube from people if anyone reading this could give it a  quot thumbs up quot  because what some might see as just a simple button press could make my dream come true  thank you again for your time  amp  may god bless you,1,0,"-1,1,0,-1,-1,-1,-1,-1,0",3
z13cu5iyjryvixkyr04cdzniromoclcpc1w,Kikilaronk “Kiki” Loz,2014-08-31T16:39:30.472000,subscribe to me if u think  quot swag quot  is fucking stupid,1,0,"-1,-1,-1,-1,-1,-1,0,0,0",3
LneaDw26bFt7AvG8x15igOZvrWApak5Zh5-PPag9YTs,themagicmangotree,,check out my channel for funny skits  thanks ,1,0,"-1,1,-1,-1,-1,-1,0,1,-1",3
z125tbogfxjjivxv523vwpkyaznetaic,On the Positive,2015-01-01T21:16:37.765000,dear friends please subscribe to my channel i will be very glad to see you virucide    ,1,0,"-1,-1,-1,-1,-1,-1,0,1,0",3
LneaDw26bFspn3Az6aidHV7B4bezpM4wwmxPZdnRcI0,A Way With Words,,check out our cover of this song ,1,0,"0,1,-1,-1,-1,-1,-1,0,-1",3
LneaDw26bFsY5GVSw7Ysrp_qYtM0fQNxxmgXMIejcys,Pedazo Astur,,this guy win dollars sleeping    m m m he loves the planet its full of retards,1,0,"-1,-1,-1,-1,-1,-1,0,0,0",3
LneaDw26bFvAsBvYZLuVc3cJCI65rJQ9A-wZAcukfp0,101Tele,,yo i know nobody will probably even read this    but  imma type it any way because i hope at least one person will  i     m a rapper with a dream  i know there     s like    k of those in this world  but please check out my music and subscribe  if you want   thanks   i would love nothing more than to have a decent following on youtube    if anyone  reading this could press the  quot thumbs up quot  other people will see it  just a simple button press  could make my dream come true    thank you,1,0,"-1,1,0,-1,-1,-1,-1,-1,0",3
LneaDw26bFv2Ps-QqkMShtEbaXEAA7MO4d-ZFRdrrW0,Anthony Konstantinou,,every weekend a new lyric video of eminem here view like subscribe,1,0,"-1,-1,-1,-1,-1,-1,0,0,1",3
LneaDw26bFtEfMdXUYebOl-nweqjHYVYlY80z53Y4DY,Nick Amodei,,this past christmas my dad passed away  to help me cope i picked up a pen and some paper and started to write  little did i know nearly   months ago that it would bring me where i     m at today  over  k subscribers and    k video views  i just wrote and released a song yesterday about a friend of mine who has tried to commit suicide several times  i can     t promise you professionally produced music  but i can promise real lyrics  just click on my picture  thanks  and thumbs up so others may see ,1,0,"0,-1,-1,-1,-1,-1,-1,1,0",3
LneaDw26bFvgKZJfckgl7OJXXu6v0YtHfhlRTURbhdY,Ractive,,hey guys if you guys can please subscribe to my channel  i     m a young rapper really dedicated i post a video everyday  i post a verse     bars  part of a song everyday to improve i     m doing this for     days  right now i     m on day     i     m doing it for a whole year without missing one day if you guys can please subscribe and follow me on my journey to my dream watch me improve  it really means a lot to me  thank you     i won     t let you down i promise   i     m lyrical i keep it real ,1,0,"0,-1,-1,-1,-1,-1,-1,1,0",3
LneaDw26bFs3BLHRkaxpe2sWBWSCyXU7mlRbxEYSvQg,Greg Fils Aimé,,i hope everyone is in good spirits i     m a hard working student who     s also a passionate singer i look foward to the day when i can make my own music to share but for now i     ve just been doing covers  check out my channel  i     ve done covers of miley cyrus  imagine dragons  lana del rey  drake  macklemore  pink and countless others   subscribe only if you want to  my goal isn     t to become famous but to  inspire fyi this isn     t spamming  everyone has a right to freedom of speech  thanks ,1,0,"-1,1,-1,-1,-1,-1,0,-1,0",3
z12nyp2j5zy5dxrxi04cilmypritghhhmyc0k,Por Phizer,2014-10-16T20:10:15.922000,hey guys jaylan here and i just wanted everybody to know if yall can subscribe please that would be great  this is my new gaming channel  have notuploaded yet but i will upload if i hit about    subs thank you  d,1,0,"-1,-1,-1,-1,-1,-1,0,1,0",3
LneaDw26bFsILb1-yJtTNbl7IIOeXIvJxxyU3o-EtR4,Yuliya Meow,,hey guys      before you ignore me  please  give me a chance   my name is yuliya  i make covers  i started getting serious with youtube september of      because thats great challenge to myself  my dream was to become a singer  youtube helps me keep up  if you can please give me a chance and thumbs this comment up so more people can see it  i swear i     ll appreciate it  subscribe please      love you     xoxo  ,1,0,"-1,-1,0,-1,-1,-1,0,-1,0",3
_2viQ_Qnc6-qHJ_u9Yv84vj4yOAPLUL3ZibCc7b-vBI,FAHAD KHAN,2013-07-14T22:06:57.712000,i will never forget this song in my life like this comment of your hearing this song for like a year     ,1,0,"0,-1,-1,-1,-1,-1,-1,1,0",3
z12nippylqvqshgqb04cdbgywx3kcxhgfug0k,Captain Liverpool,2015-03-31T13:56:40.139000,please suscribe i am bored of   subscribers try to get it to    ,1,0,"-1,-1,-1,-1,-1,-1,0,0,0",3
z12ju5uxzvfmv1yzr04cdn2zjvvbfpdjglo0k,Nick M,2014-09-16T03:45:43,https   www reverbnation com slicknick    songs,1,0,"0,-1,-1,-1,-1,1,-1,0,-1",3
_2viQ_Qnc69hCwlRZTPP7JejZgoroMu8egbziE1hSAc,Mini Mus,2013-08-29T12:28:03.233000,wow muslims are really egoistic          of the world population and not in this video or donating   dollar to the poor ones in africa    shame on those terrorist muslims,1,0,"-1,-1,-1,-1,-1,-1,0,0,0",3
z13chfswltzzyhys1234dvkb3r2ien0ld,DirtySouthFlorida3,2014-11-06T22:00:58,subscribe to me i subscribe back     plus i have a nice ass lol,1,0,"-1,-1,-1,-1,-1,-1,0,0,0",3
z124g1oy2wfitb3tw23bw1po2ozhurojq04,LaunchPad Mad,2014-11-07T18:11:56,hello  i m kind of new to youtube  and soon i m soon going to be making  launchpad video s   d i would really appreciate if i got some subs before i  started so that people can spot me easily  i dont really care about hate  comments so dont bother    ,1,0,"-1,-1,-1,-1,-1,-1,0,0,0",3
_2viQ_Qnc6_38op-kBrdA4xwd0KSYefHqdbeuljSgzM,Krystian Konrad Moreński,2013-09-06T09:36:48.076000,part    holy mary  pray for us holy mother of god  pray for us holy virgin of virgins  pray for us mother of christ  pray for us mother of divine grace  pray for us mother most pure  pray for us mother most chaste  pray for us mother inviolate  pray for us mother undefiled  pray for us mother most amiable  pray for us mother most admirable  pray for us mother of good counsel  pray for us mother of our creator  pray for us mother of our redeemer  pray for us ,1,0,"-1,-1,-1,-1,-1,-1,0,0,0",3
_2viQ_Qnc686iGqhAHKEeclAngy8MjvOxAo1hFpatHc,Krystian Konrad Moreński,2013-09-06T09:38:13.854000,part    comforter of the afflicted  pray for us help of christians  pray for us queen of angels  pray for us queen of patriarchs  pray for us queen of prophets  pray for us queen of apostles  pray for us queen of martyrs  pray for us queen of confessors  pray for us queen of virgins  pray for us queen of all saints  pray for us queen conceived without original sin  pray for us queen of the most holy rosary  pray for us queen of the family  pray for us queen of peace  pray for us ,1,0,"-1,-1,-1,-1,-1,-1,0,0,0",3
_2viQ_Qnc68RkAwC42s4YBDdCJYELSb6UiuZri58Kn0,Charanjeet Singh,2013-09-06T12:13:12.642000, quot help the humanity with your sign in to this link with your wholehearted support if you say  quot no quot  to discrimination  united we stand   we will bring the change together   impossible itself says i  m  possible quot   you are the winners of my success cheers to all my loving brothers and sisters    please share this link on facebook to support against discrimination   tinyurl dot com slash mxh y    fear none but god    ,1,0,"-1,-1,-1,-1,-1,-1,0,1,0",3
_2viQ_Qnc6_B7ncS0M0zl0VC4SZ22T1ZO_GNhI1IWTM,Greg Fils Aimé,2013-09-10T23:18:01.455000,i hope everyone is in good spirits i     m a hard working student who     s also a passionate singer i look foward to the day when i can make my own music to share but for now i     ve just been doing covers  check out my channel  i     ve done covers of miley cyrus  imagine dragons  lana del rey  drake  macklemore  pink and countless others   subscribe only if you want to  my goal isn     t to become famous but to  inspire fyi this isn     t spamming  everyone has a right to freedom of speech  thanks ,1,0,"-1,1,-1,-1,-1,-1,0,-1,0",3
z12cehoxozfgg3nok04cjj05xznbgrlpfjo,Elieo Cardiopulmonary,2014-11-08T15:29:52,im sorry for the spam but my name is jenny  i go to high school where  everyone dresses fashionable but for me i don t because i need money to buy  cute clothes  i have low self esteem   i live with my dad  my mom passed  away when i was   so i don t really have a mother figure  i have   brothers  who is older than me  since they are boys they get the attention while i  just be alone  i really want to wear pretty clothes like the girls in my  school and get a boyfriend  i just can t be my self  im very quite and shy  at school because i don t have the confidence in myself to talk to someone   i did have one friend name caroline but she moved away so now im alone  if  you could donate some money to me it would be great  i don t care about  expensive brand ill just shop at walmart because they have pretty clothes   also i wanna get my nails done at a salon   i see alot of girls have these  french tips  i never had my nail did at a salon before i will really  appreciate if i can and get my hair curled too  http   www gofundme com dressprettyonce thanks omg please ,1,0,"-1,-1,-1,-1,-1,1,0,-1,0",3
z121j52qizrzhd2pa04ceht4jpeuzvzgunc0k,Niggly Wiggly,2014-11-10T17:39:10,go to my channel if u want to see a fly getting burned alive,1,0,"-1,-1,-1,-1,-1,-1,0,1,0",3
_2viQ_Qnc6_onwOgxju-DV6WkqHZEOztCXD04EgEFBU,Hidden Love,2013-09-24T14:29:54.072000,hi  check out and share our songs ,1,0,"0,1,-1,-1,-1,-1,-1,0,-1",3
_2viQ_Qnc69D1Jxs1IlkkF0Xzce0uBoJN_OzDHnfmV0,latrell brown,2013-10-01T23:42:30.928000,check out daneja good girl,1,0,"-1,1,-1,-1,-1,-1,0,0,-1",3
z13qhxcb2ybzszosx22rh5hwhmmccpjx404,The Silent Troll Defuser HD,2014-11-13T15:47:27,hey guys can you check my youtube channel i know you hate comments like  this one but i promise if you check my videos it will be entertaining i do  shotgun montages ninja defuse montages and trolling please guys can you  check them out and thanks have a good day       ,1,0,"-1,1,-1,-1,-1,-1,0,-1,0",3
_2viQ_Qnc6_7GI-VeVlj8gEzvkgATIX3jK-7J1kwWEY,Pyles Baxter,2013-10-03T00:21:52.191000, i really can     t comprehend miley cyrus   she actually is a high profile and she tapes herself banging today a video was leeched with her sucking and fucking the video has been posted at the celebrity website under    miley celeb news co uk ,1,0,"-1,-1,-1,-1,-1,-1,0,0,0",3
z12bxv4olmv3j1i2w232y5awruz3i1rva,J STROMMER,2014-08-11T17:32:00,take a break from katie and help me reach     subscribers this month   new  music and free downloads  ,1,0,"-1,-1,-1,-1,-1,-1,0,0,0",3
_2viQ_Qnc6-kUg8jc2n9-Cudm5lEsM-cSzIjF182TJo,Pyles Baxter,2013-10-03T02:25:19.324000,  perhaps you have seen the newest miley cyrus secret video     she     s sucking an old man     s cock    if you wish to see her   check out the celebrity website beneath     miley secret video co uk ,1,0,"-1,1,-1,-1,-1,-1,0,-1,0",3
z123gzjyszflihgih04cdzeblxuifpxzbes,IbbyUchiha,2014-08-15T15:52:40,hey guys  i am a very small youtuber i upload videos nearly every single  day  i once hope to be like shikas so can you please give   mins of your  life to view this channel  and my new video is on how to watch all the  anime for free  and i am pretty sure you wont regret visiting this channel  thank you ,1,0,"-1,-1,-1,-1,-1,-1,0,1,0",3
z12ddjvqypyusrssu22ewddagoagu1k2v,WeMuckAround,2014-08-16T20:59:28,katy perry will u sit on my face please  it would be really awesome and  i ll give you   dollars  ok if you want to do this then please call me and  subscribe to my channel first ok thats good and then u sit on my face and  ill get an erection then you sit more k ,1,0,"-1,-1,-1,-1,-1,-1,0,1,0",3
_2viQ_Qnc69wrsSgR2azuokmk5-WDQVVI2lCV-WqJGA,Hadrien Robalo Marques,2013-10-05T22:31:44.181000,the britishs called that soccer but you know the true word is football and the us foot is called rugby  that works like that in euw   germany  netherland  france  portugal  belgium  spain        just because the britishs don     t agree to be like us because they are unique  that     s the reason why they also refused to have euro    as money,1,0,"-1,-1,-1,-1,-1,-1,0,0,0",3
z12yxpmqktb4zxptp221j3njlmjbtfgmi,VitalXtreme,2014-09-04T03:56:53,yay im the   th commenter                                         if your  crazy please donate bitcoins to me at   fhenqx twqm   v ptayiejnealahzvem,1,0,"-1,-1,-1,-1,-1,-1,0,0,0",3
_2viQ_Qnc68jroUSzJhg6jrxFj86oxZrAtGB_PWbOm4,latrell brown,2013-10-08T18:26:06.234000,check out daneja good girl,1,0,"-1,1,-1,-1,-1,-1,0,0,-1",3
z12zu5v4qlruc11zc04cg5rrnzjehpzwv3g,SergiBeCa Official,2014-09-12T03:39:36,can you check my videos please  don t hate me    give me one oportunity,1,0,"-1,1,-1,-1,-1,-1,0,-1,0",3
z121jvbjakmbehsys04ce5yj1y3hxx0hzsk0k,abdellah chafouai,2014-11-05T16:12:51,discover song http   www linkbucks com acn g,1,0,"0,-1,-1,-1,-1,1,-1,0,-1",3
z12kuncrps35wp1l0220s3t4ym32dtpin04,Aleksaivan Neidert,2014-11-05T15:35:49,psy   gangnam style    m v  http   youtu be  bzkp q  f ,0,1,"-1,-1,-1,-1,-1,1,-1,0,0",3
z121ft552pzpzhiab04cffmwitfii3lr5v40k,Crooked Gaming,2014-11-04T00:00:57,i made a gaming channel  unique right    l angry minecraft ,1,0,"-1,-1,-1,-1,-1,-1,0,0,0",3
_2viQ_Qnc68sxLpsBQ1cPk_LLH91SMsRav51KmhIoQw,Hidden Love,2013-07-30T11:22:57.091000,hi check out and share our songs ,1,0,"0,1,-1,-1,-1,-1,-1,0,-1",3
z122wfnzgt30fhubn04cdn3xfx2mxzngsl40k,Bob Kanowski,2013-11-28T12:33:27,i turned it on mute as soon is i came on i just wanted to check the  views   ,0,1,"-1,1,-1,-1,-1,-1,-1,0,0",3
z13xit5agm2zyh4f523rst2gowmbx5bml,Lone Twistt,2013-11-28T17:34:55, once you have started reading do not stop  if you do not subscribe to me  within one day you and you re entire family will die so if you want to stay  alive subscribe right now ,1,0,"-1,-1,-1,-1,-1,-1,0,0,0",3
_2viQ_Qnc6-G71VMp3dR76dfQTcrRHpiNXJh2jm8V_M,Johnny Rei Vlog,2013-07-18T16:50:26.909000,hi  this is johnny     if you already know my music   thumb this up  because you found it this way  too     if you want to hear original songs completely made by   person  continue reading   i sing  write original music lyrics  amp  play guitar  bass  drums  amp  keyboards  i     m a   man band  my music is completely independent  amp       listener supported  if you want to hear it  amp  if you     re willing to help record new album   click on my name picture   thank you  amp  enjoy the music   wish you awesome day ,1,0,"0,-1,-1,-1,-1,-1,0,-1,0",3
z13etj0bclzfztuwc04cgfvrgmf3fvjor1g,Jose Renteria,2013-11-29T00:22:01,we are an edm apparel company dedicated to bringing you music inspired  designs  our clothing is perfect for any rave or music festival  we have  neon crop tops  tank tops  t shirts  v necks and accessories  follow us on  facebook or on instagraml for free giveaways news and more   visit our site  at oncueapparel,1,0,"-1,-1,-1,-1,-1,-1,0,0,0",3
_2viQ_Qnc69mci30y5muwQXNMaeCmIvZ4ca8l_4zPmA,Johnny Rei Vlog,2013-07-19T11:41:54.923000,nice to meet you   this is johnny     if you already know my music   thumb this up  because you found it this way  too     if you want to hear original songs completely made by   person  continue reading   i sing  write original music lyrics  amp  play guitar  bass  drums  amp  keyboards  i     m a   man band  my music is completely independent  amp       listener supported  if you want to hear it  amp  if you     re willing to help record new album   click on my name picture   enjoy the music   wish you awesome day ,1,0,"0,-1,-1,-1,-1,-1,0,-1,0",3
